Datetime,Text
2022-05-07 14:30:00+00:00,"Today, the best of the Bluegrass is on full display. In the shadow of Twin Spires, Kentuckians will don their hats and fans will cheer as the world’s best Thoroughbreds thunder down the track. It all comes down to the first Saturday in May. Welcome to the 148th @KentuckyDerby. https://t.co/LAFVlSQtts"
2022-05-05 20:31:41+00:00,"Working people who chose to avoid taking on debt should not have to bail out adults who borrowed six figures for an Ivy League master’s degree. Construction workers, police officers, and small business owners should not have to eat the loans of high-earning doctors and lawyers."
2022-05-03 14:11:48+00:00,"Last night’s stunning breach was an attack on the independence of the Supreme Court. By every indication, this was yet another escalation in the radical left’s ongoing campaign to bully and intimidate federal judges and substitute mob rule for the rule of law. https://t.co/wvigWvPqm7"
2022-04-28 20:16:49+00:00,"I was honored to meet today with Sviatlana Tsikhanouskaya, leader of the growing movement for democracy in Belarus. The Belarussian people's brave defiance of Putin's puppet regime in Belarus is an inspiration to the entire free world. They are deserving of our support. https://t.co/gofXWgQUAR"
2022-04-27 22:22:40+00:00,"While the far left has been waging a national anti-police, anti-law-enforcement campaign, violent crime has soared from coast to coast. Cities are under siege.  Until federal, state, and local Democrats get with the program, innocent people will continue to suffer."
2022-04-27 14:10:27+00:00,The Biden Administration’s approach to the border is failing America. They are stumbling through this core governing duty with no plan and backward priorities. Democrats would rather appease radicals with functional open borders than conduct the bare minimum in enforcement.
2022-04-26 14:34:31+00:00,"Heartbroken to learn the Chabad House in Louisville, a center of our thriving Jewish community, was destroyed in a fire on the last day of Passover this weekend. All Kentuckians are standing with and praying for the worshipers recovering from this tragedy."
2022-04-24 02:39:09+00:00,I am deeply saddened to learn of the passing of my friend and former colleague Orrin Hatch. Elaine’s and my prayers are with Orrin’s family and everyone who will miss this remarkable man. My full statement: https://t.co/pFqllyKe1E
2022-04-17 10:00:02+00:00,May you and your family have a blessed and joyful Easter Sunday.
2022-04-13 23:02:42+00:00,Democrats are ending the COVID emergency for illegal immigrants but extending it for American citizens. This White House is using the pandemic as a pretext to shamelessly pick and choose liberal policies to advance. Completely unacceptable. My full statement: https://t.co/p9chA2jj2x
2022-04-12 19:23:06+00:00,"The Biden economy continues to set new terrible records. Inflation just hit its fastest pace in more than 40 years. Food, gas, and housing costs are crushing families. Prices are soaring way faster than workers’ pay growth."
2022-04-10 19:42:16+00:00,The Biden Administration needs to take the shackles off of domestic energy production. World events remind us how important American oil and natural gas production is for our national security and our partners. We can meet our needs and help the Europeans wean off Russian energy. https://t.co/CieX2aRXn7
2022-04-08 17:04:41+00:00,Putin is not going to be deterred just by being called a war criminal. He will be deterred on the battlefield. We need to give Ukraine every single useful weapon they ask for and need to beat the Russians. They believe they can win and we want to help them win. https://t.co/4ekkco6yK0
2022-04-07 21:51:00+00:00,"Tune in now to @FoxNews. I am joining @BretBaier to discuss the Supreme Court, the crisis at the southern border, and emergency aid to Ukraine."
2022-04-06 16:12:12+00:00,"Judge Jackson’s record and testimony suggest exactly the kind of liberal activist that President Biden promised he’d nominate. In case after case, she twisted the law or ignored guidelines to arrive at the policy outcome she wanted. And that outcome was often going soft on crime."
2022-03-31 18:18:35+00:00,The worst inflation in 40 years is fleecing American consumers from the gas pump to the grocery store. Democrats’ policies have prices rising faster than wages. The American people know one month of war in Europe doesn't explain 12 months of rising inflation on Democrats' watch.
2022-03-30 15:18:33+00:00,"I have total confidence in Justice Thomas’s impartiality in every aspect of the work of the Court. 
 
Each of the nine justices should feel free to make every single judicial decision they make with total independence and complete freedom."
2022-03-30 15:18:26+00:00,"Judicial independence is essential to our Republic and integral to the rule of law. The far left’s latest attack, a clumsy and baseless attempt to nullify Justice Thomas’s presence on the Court, is beyond the pale."
2022-03-29 19:31:28+00:00,"Democrats’ massive inflation is hammering working families. It’s badly hurt our entire economy.

But President Biden just proposed a new budget that would dramatically increase liberal spending and slap the biggest tax hikes on American history on top.

They just do not get it."
2022-03-28 21:51:10+00:00,"President Biden's budget reinforces the disconnect between this Administration’s far-left goals and what Americans need. It’s soft on the defense funding we need to outpace Russia and China, heavy on left-wing waste and historic tax hikes."
2022-03-24 20:28:37+00:00,"I went into the Senate’s consideration of Judge Jackson’s nomination with an open mind.
 
But after studying the nominee’s record and watching her performance this week, I cannot and will not support Judge Jackson for a lifetime appointment to our highest Court."
2022-03-23 19:50:28+00:00,I was grieved to learn that our nation has lost former Secretary of State Madeleine Albright. My prayers are with Secretary Albright’s family and all who mourn her loss. My full statement: https://t.co/w9i8vSuQBo
2022-03-23 17:26:10+00:00,"Judge Jackson tried to deflect on key questions by telling Senators that constitutional issues haven’t come up often during her judicial service. Does she actually feel unprepared? If so, she shouldn't be confirmed. If not, then she owes the Senate much more clarity and candor. https://t.co/EEjSMYl1UA"
2022-03-23 15:29:30+00:00,Justices Ginsburg and Breyer had no problem defending the Court and slamming the door on partisan court-packing. Judge Jackson won't follow their lead. She carefully keeps that door open and avoids answering the Committee plainly. I’m afraid that speaks volumes. https://t.co/tYQBUbVcYv
2022-03-21 14:58:32+00:00,"The late Justice Ginsburg and Justice Breyer both publicly opposed court-packing during their tenures. This week, Judge Jackson will be asked if she shares their view on upholding the integrity of the Court. https://t.co/D0orvwCB9S"
2022-03-21 02:05:39+00:00,"I was saddened to learn that Cpl. Jacob Moore of Catlettsburg, Kentucky, was one of four Marines killed during NATO exercises in Norway Friday night. I am incredibly grateful for his service defending our nation’s freedom. My prayers are with his family in this difficult time."
2022-03-20 14:54:46+00:00,Tune in now to @FaceTheNation. I’m joining @margbrennan to discuss urgent support for Ukraine and the upcoming Supreme Court nomination hearing.
2022-03-17 20:17:24+00:00,"Justice Breyer, like the late Justice Ginsburg, is a staunch defender of the Court’s legitimacy and an opponent of far left court-packing plans. This should not be a hard question for his potential replacement. The Senate and the country deserve a clear answer from Judge Jackson. https://t.co/plvoJrpfwh"
2022-03-17 13:22:31+00:00,President Biden needs to step up his game on aid for Ukraine. Their resistance needs more lethal weapon systems that go after not only helicopters but higher-flying planes. We ought to be facilitating this aid right now. https://t.co/dQyFRDYzSk
2022-03-16 22:14:49+00:00,Tune in now to @NewsHour. I’m joining @JudyWoodruff to discuss urgent support for Ukraine and the upcoming Supreme Court nomination hearings.
2022-03-16 16:57:36+00:00,President Zelensky and the people of Ukraine are showing the world incredible bravery and resilience. America cannot stay behind the curve. We must urgently get Ukraine more overdue lethal aid and air defense systems so they can keep up their fight for sovereignty and freedom.
2022-03-15 13:34:55+00:00,Nobody buys Democrats’ efforts to blame 14 months of failed policies on three weeks of crisis in Europe. Inflation and gas prices were skyrocketing and hurting families long before late last month. The White House needs to stop trying to deny their mistakes and start fixing them. https://t.co/rT6GttKS03
2022-03-08 18:16:54+00:00,"I strongly support America stopping purchasing Putin's oil.

We must also recognize that the past year of bad policies from this anti-domestic-energy Administration will make this necessary step more painful than it had to be. Democrats must let Americans produce American energy."
2022-03-03 15:46:38+00:00,I enjoyed meeting Judge Jackson. One crucial Supreme Court qualification is judicial philosophy. The nation needs Justices who uphold the rule of law by applying our laws and Constitution as written. I’ll be studying the Judge’s record and views during the vigorous process ahead.
2022-03-02 22:31:01+00:00,"Tune in now to the @GuyBensonShow. We’ll be discussing energy independence, the Supreme Court, and President Biden’s missed opportunity at the State of the Union last night. https://t.co/HC2JtVXHgB"
2022-03-02 19:30:43+00:00,"A year ago, President Biden hurt American energy independence on Day One by executive order. 

With another stroke of the pen, he could get us back in the production business to meet our own needs and export to our friends in Europe too. https://t.co/IGqrgJInsx"
2022-03-02 14:45:17+00:00,"Tune in now to @FoxNews. I’m joining @DanaPerino and @BillHemmer in studio to discuss President Biden's failure to pivot in his State of Union, @IAGovernor's excellent response, Ukraine, and the Supreme Court."
2022-03-02 03:50:04+00:00,".@IAGovernor has done a great job leading with common sense through the pandemic. She’s backed the blue, faced down Big Labor to open schools, and fought for parents.

Outstanding speech. After a warmed-over D.C. laundry list, Americans got to hear straight talk &amp; real solutions."
2022-03-02 03:28:15+00:00,"President Biden ignored that his agenda has completely flopped for American families: Raging inflation, open borders, crime. The President did his best to try to pick himself up and provide some level of optimism but that’s not what the American people are feeling right now."
2022-03-01 20:31:11+00:00,Tune in now to @FoxNews. I’m joining @marthamaccallum to discuss tonight’s State of the Union and Ukraine.
2022-03-01 16:04:25+00:00,I’m glad the Americans will hear from @IAGovernor this evening. She’s a strong leader who delivers real solutions for the great people of Iowa. I look forward to hearing her reaction to the President’s remarks and her thoughts on how Washington could better serve Middle America.
2022-02-28 23:43:49+00:00,"The President’s job is to seriously meet the growing threats posed by Russia and China. That starts with investing in our national defense. Our adversaries have prioritized military modernization for decades. We need more investment, not less, to strengthen our own capabilities."
2022-02-25 17:58:08+00:00,"When Senator Jim Inhofe retires, the Senate will lose one of its foremost experts on defense policy, and Oklahoma will lose one of its fiercest advocates. I am glad our friend will continue to serve with us through the end of this Congress. My full statement: https://t.co/PCFyVBO7jE"
2022-02-25 15:27:18+00:00,"The Senate must conduct a rigorous, exhaustive review of Judge Jackson’s nomination to the Supreme Court. This is especially crucial as Americans families face major crises that connect directly to our legal system, such as skyrocketing violent crime and open borders."
2022-02-25 15:26:56+00:00,I look forward to meeting with Judge Jackson in person and carefully reviewing her nomination during the vigorous and thorough Senate process that the American people deserve. My full statement: https://t.co/cpUAz1Mcq2
2022-02-24 20:51:32+00:00,"Putin’s initial aggression was just a small foretaste of what this thug had planned for Ukraine. America’s response will be measured carefully by our friends, by our adversaries, and by history itself. We cannot afford to fail this test. My full statement: https://t.co/rNa3IPatxH"
2022-02-22 20:12:55+00:00,"While Washington Democrats fail working Americans, Republican governors are fighting and winning for families. I am thrilled the American people will hear directly from Governor Kim Reynolds of Iowa in the Republican address to the nation. https://t.co/Xd6uEtm1tr"
2022-02-22 16:43:20+00:00,Putin has turned his back on diplomacy in favor of escalation and the invasion of a sovereign country. The world is watching for America’s response. My full statement: https://t.co/QMtFGE1E8D
2022-02-17 21:45:00+00:00,"If Democrats actually wanted to help the American people afford gas, they wouldn’t have spent an entire year waging on American energy.

In one year under President Biden, America went from being a net oil exporter to setting a new record high in oil imports from Russia."
2022-02-17 17:19:49+00:00,"Less than 48 hours after a far-left Black Lives Matter activist tried to literally murder a politician, the radical left bailed their comrade out of jail. It is just jaw-dropping. The innocent people of Louisville deserve better."
2022-02-16 17:28:17+00:00,"Needless school closures. Unscientific child mask mandates. A woke war against merit-based schools and standards.

The far left even opposes basic K-12 transparency. They want parents sidelined and silenced.

Republicans stand with families. The party of parents has your back."
2022-02-15 16:48:54+00:00,"American families are facing the worst inflation in 40 years. The middle 40% of earners have seen their disposable incomes shrink. 

The Democrats who supercharged inflation want working people to trust their political spin over their own pocketbooks. But Americans know better."
2022-02-15 01:00:00+00:00,70% of Americans agree the virus is here to stay &amp; it's time for normalcy. Science tells us kids are at the lowest risk. Classrooms should have been the first places that politicians let get back to normal. But too many Democrat-controlled areas are putting kids and parents last.
2022-02-14 22:07:58+00:00,"Americans who watched the Super Bowl saw rich celebrities having a grand time with hardly a mask in sight. But under many Democrats’ policies, K-12 students who watched that big maskless party on TV last night had to wake up this morning and cover their own faces to go to school."
2022-02-11 20:35:32+00:00,Tolerating lawlessness and anarchy is not compassionate. It doesn’t help vulnerable communities for politicians to passively watch them devolve into war zones. Democrats need to drop the soft-on-crime nonsense and give American families the protection they deserve. https://t.co/UBv6WPZb7m
2022-02-10 21:02:27+00:00,"This all-Democrat government was warned their radical agenda would supercharge inflation and they pushed ahead anyway. Now, rampant inflation and soaring prices are crushing the American people."
2022-02-09 19:02:49+00:00,It is not compassionate to let vulnerable kids grow up in war zones because Democrats feel guilty putting violent criminals behind bars where they belong. Law-abiding citizens across America shouldn't live in fear because liberal public servants won’t do their jobs.
2022-02-09 19:02:42+00:00,Innocent Americans across the country are becoming victims of a violent crime wave. My hometown Louisville set a new all-time murder record last year and averages a carjacking every 42 hours. Democrats have got to quit the radical anti-police rhetoric and soft-on-crime policies.
2022-02-08 16:43:20+00:00,"American workers have been earning pay raises, but the Democrats’ inflation is more than outpacing them. Factoring in inflation, the average American worker has gotten a 2% real pay cut under Democrats’ policies."
2022-02-03 20:31:12+00:00,"Working families can’t afford a Federal Reserve Vice Chair who is itching to raise gas prices, raise energy and heating costs, reduce our energy independence, bankrupt entire industries, and misuse the Fed’s power to kill jobs in Middle America."
2022-02-03 20:30:55+00:00,"The Federal Reserve is supposed to safeguard the American dollar, not enforce a radical agenda the far left can’t get through Congress. But President Biden’s nominee for the number two spot wants our central bank to act like a ‘woke’ super-legislature where citizens get no say."
2022-02-01 17:47:29+00:00,"Democrats' reckless spending has fueled the worst inflation in 40 years. Families are hurting — at the checkout counter, at the gas pump, when they pay their bills. Exactly what bipartisan experts warned would happen if they rammed through their reckless far-left spending."
2022-01-31 22:57:50+00:00,"Kentuckians are resilient. But many are still reeling from the catastrophic tornadoes that hammered Kentucky in mid-December. It’s a long road to recovery, but my office and I are helping Kentuckians every step of the way. https://t.co/nHTqRxfMJM"
2022-01-27 18:31:02+00:00,I congratulate Justice Breyer on nearly three decades of thoughtful and consequential service on the Supreme Court. My full statement following his announcement today: https://t.co/J7z7kvQjCb
2022-01-27 14:41:31+00:00,"Today, on the 77th anniversary of the liberation of the Auschwitz-Birkenau concentration camp, we commemorate International Holocaust Remembrance Day. We must never forget the six million Jews murdered in the Holocaust and always confront antisemitism wherever it takes root."
2022-01-21 15:03:40+00:00,"A warm welcome to the Kentuckians and all Americans who are Marching for Life on a cold day in Washington. Thank you for courageously witnessing to the dignity of every single human life, especially the most vulnerable. https://t.co/ULfxRY5Skl"
2022-01-20 23:00:16+00:00,Tune in now to @FoxNews. I am joining @BretBaier to discuss President Biden’s first year in office and Democrats' failed attempt to destroy the Senate.
2022-01-20 17:20:20+00:00,"President Biden took office one year ago.

He's presided over the worst inflation in 40 years. Historic spikes in murders &amp; illegal border crossings. COVID surges, school closures, &amp; illegal mandates. A failed, fatal retreat from Afghanistan. And far-left attacks on institutions. https://t.co/YtJCjPJrvo"
2022-01-20 03:43:16+00:00,"Tonight, nearly every Senate Democrat wrote in permanent ink that they would shatter the soul of the Senate for short-term power. Fortunately, a bipartisan majority saved the Senate and ensured that millions and millions of Americans’ voices will not be silenced."
2022-01-19 19:00:02+00:00,"Democrats' election takeover bill is not a response to any state law. It is a sweeping, radical power grab that they first drafted in 2019.

Bureaucrats would get new power to police citizens' online speech. The federal government would start directly funding political campaigns."
2022-01-19 18:05:00+00:00,The left's fake panic over voting is collapsing. Less than 0.5% of Americans say this is a top priority. Even the media is pointing out that Georgia’s law is more open than Delaware or New York. And more citizens say voting laws are too loose than say they are too restrictive.
2022-01-18 20:07:17+00:00,"Last week, the same Democrats who’ve been raging against the Senate’s 60-vote threshold used the 60-vote threshold to block Russia sanctions.

Today, they’re back to saying it’s an evil rule.

They've quit even pretending this is principled. They just want total one-party power."
2022-01-17 12:03:54+00:00,"Nearly 60 years since the March on Washington, Dr. Martin Luther King, Jr.’s message echoes as powerfully as it did that day. His legacy inspires us to celebrate and keep building upon the remarkable progress our great nation has made toward becoming a more perfect union."
2022-01-11 21:16:50+00:00,"The current Democratic Leader wants power so badly he's willing to misrepresent his own late predecessor if it helps him get it. Senator Byrd went out of his way to argue against rule-breaking power grabs and protect the Senate’s most central feature, the legislative filibuster. https://t.co/L1m800JJW7"
2022-01-11 13:44:47+00:00,"Washington Democrats’ political agenda is on the rocks, so they’ve set their sights on a new prize: A complete, partisan takeover of the Senate, elections, and America. https://t.co/eTb8IOGc6l"
2022-01-10 22:04:07+00:00,"If Democrats blow up Senate rules, millions of Americans will cease to have a voice in the Senate. Entire states would be shut out.

Top Dems have floated breaking the rules for years now. This isn't about new voting laws. It's about silencing voters who inconvenience Democrats."
2022-01-05 18:52:13+00:00,"No party that would break the Senate can be trusted to seize unprecedented control over all 50 states’ election laws.

The fact that many Democrats are this desperate for a one-party takeover of our democracy proves exactly why they cannot be allowed to do it."
2021-12-29 02:52:12+00:00,Harry Reid was a dedicated public servant and a truly one-of-a-kind U.S Senator. My full statement: https://t.co/loVCu8lVZd
2021-12-25 13:00:00+00:00,"The beauty of Christmas brings light and warmth to the coldest and darkest time of year. This year, let’s hold in our thoughts our fellow Kentuckians and Americans who won’t be enjoying their normal holiday. I hope this holiday brings you health and happiness. Merry Christmas. https://t.co/b1KskZxKOu"
2021-12-23 18:58:37+00:00,"Democrats spent 2021 distracted with unrelated far-left ambitions. As a result, the Biden Administration has America badly short on affordable COVID tests, new treatments, or any actual plan.

Angry speeches about inherited vaccines are not a strategy.

My full statement: https://t.co/sSCg19veVl"
2021-12-22 20:58:04+00:00,Tune in now to @FoxBusiness. I’m joining Larry Kudlow to discuss Washington Democrats’ efforts to try inflating their way out of inflation and grab partisan power over all 50 states’ elections.
2021-12-22 18:56:23+00:00,Tune in now to @FoxNews. I’m joining @MikeEmanuelFox and @SandraSmithFox to discuss Democrats’ efforts to ram through a multi-trillion-dollar reckless taxing and spending spree.
2021-12-22 15:29:34+00:00,The Senate was designed to make it difficult to have radical change in the country unless there are huge majorities on one side or the other. The filibuster prevents extremism. Democrats want to eliminate it so they can fundamentally change the structure of America forever. https://t.co/Z372KzlEqf
2021-12-22 13:31:17+00:00,Tune in now to @hughhewitt. I’ll be discussing Democrats’ failed agenda and what’s next for the Senate in 2022. https://t.co/qwFX3Ex4KU
2021-12-21 16:35:41+00:00,I said the single biggest favor Democrats could do for the country is to abandon their reckless taxing and spending spree. It’s absolutely inappropriate at a time when we’re already fighting inflation. The American people need this bad idea to stay buried. https://t.co/YOLkw1MDN4
2021-12-20 21:01:40+00:00,"Tune in now to the @GuyBensonShow. We’ll be discussing the latest on Democrats’ reckless taxing and spending spree and their efforts to ram through a partisan Washington takeover of elections in all 50 states. 
https://t.co/HC2JtVXHgB"
2021-12-19 16:58:51+00:00,"Elaine and I are extremely sad to learn of the passing of our dear friend, Johnny Isakson. Today, we are united with Johnny’s family in their grief. My full statement: https://t.co/FZc3xwV1pl"
2021-12-17 01:35:10+00:00,The single biggest Christmas present Washington Democrats could give to the American people is to kill their reckless taxing and spending spree. https://t.co/tfUEYv0QhH
2021-12-16 23:18:26+00:00,"The big story of the year is the worst inflation in almost 40yrs. It is a tax on Americans. Families have had to spend $3,500 more than they did last year just to tread water. It is directly attributable to Democrats' multi-trillion-dollar inflationary spending earlier this year. https://t.co/NgwT9Q70qB"
2021-12-16 18:21:00+00:00,"Senate Democrats may not get to spend trillions more inflationary dollars before Christmas after all. So for a sideshow, they’ve switched back to misinformation about voting laws.

They want to break Senate rules to seize partisan power over all 50 states’ elections."
2021-12-16 17:05:28+00:00,"My team and I are working hard to connect Kentuckians with the resources they need to recover.

Our new portal has a full list of services provided by our disaster response agencies:
https://t.co/nHTqRxfMJM"
2021-12-13 21:51:38+00:00,"Tornadoes devastated Kentucky this past weekend. Thousands have lost their homes. More than 60 Kentuckians are confirmed dead. 

Our Commonwealth has suffered its worst storm in generations. But Kentucky is resilient and we are united. https://t.co/g7JfOxTjtz"
