Datetime,Text
2022-12-31 16:20:54+00:00,"Saddened to hear of the passing of Pope Emeritus Benedict XVI, a brilliant scholar and leading light for Catholics the world over. May he rest in peace."
2022-12-30 20:03:21+00:00,Appalling and illegitimate verdict from an illegitimate sham trial. Burma’s long-suffering people deserve a return to democracy and an end to the Tatmadaw’s brutal tyranny. The Biden Administration and Burma’s neighbors need to keep dialing up the pressure on the junta.
2022-12-25 11:00:30+00:00,"I hope this holiday season brings everyone a chance for prayer and family time. Today, I’m thinking especially of the brave servicemembers and Kentuckians in uniform who are giving up time with their families to keep the rest of us safe. Merry Christmas. https://t.co/09akJ1gBFZ"
2022-12-24 15:26:29+00:00,"Continuing our support for Ukraine is morally right, but it is not only that. It is also a direct investment in cold, hard, American interests. https://t.co/zlWoAVz3Kk"
2022-12-15 15:54:57+00:00,"The Biden Administration’s COVID-19 vaccine mandate for our military has hurt readiness and retention. Big win for Senator @MarshaBlackburn, Senate Republicans, and most importantly for the men and women who bravely serve our nation in uniform."
2022-12-07 18:36:23+00:00,"To avoid another December 7th or September 11th, Congress must keep focus on defending America, projecting power, and modernizing our military. The strong bipartisan NDAA named for @JimInhofe is a crucial first step. But our work's not finished. https://t.co/ET8Gdtj3JW"
2022-11-30 18:09:15+00:00,"Homicides and violent crime are exploding. And what are Washington Democrats doing, just this week? Talking about new proposals to defund police departments."
2022-11-28 22:48:25+00:00,"Since President Biden took office, prices have soared by 13.9%. Democrats’ reckless spending has pushed inflation to its highest level since the fallout from the Carter Administration."
2022-11-24 12:00:02+00:00,"Today, families and friends gather to give thanks for the blessings we share as Americans. I'm especially grateful to the men and women in uniform serving away from home to protect and ensure these blessings. I wish you and your family a very Happy Thanksgiving. https://t.co/EAnXHDCfzk"
2022-11-17 16:24:13+00:00,"I’m proud of Senators Thune, Barrasso, Ernst, Capito, and Daines, who were elected to take on critical responsibilities in our Republican Conference. It is the honor of a lifetime to serve alongside my distinguished colleagues as Senate Republican Leader. https://t.co/zZQzQFlhRB"
2022-11-16 20:44:54+00:00,I'm honored that my Republican colleagues have reelected me to lead our outstanding Conference. Our united team is full of energy and ideas. We're going to fight Democrats’ recklessness &amp; promote our commonsense conservative vision to improve families' lives &amp; strengthen America.
2022-11-11 12:03:13+00:00,"Over the past 246 years, millions of brave Americans have joined the ranks of our Armed Forces and sworn to support and defend the Constitution of the United States. Today, to everyone who has served our nation in uniform: thank you, and Happy Veterans Day. https://t.co/k0kQhb193b"
2022-11-03 02:20:45+00:00,"President Biden is desperate to change the subject from inflation, crime, and open borders. Now he's claiming that democracy only works if his party wins.

What nonsense. Americans aren't buying it.

Ask how the last two years have affected your family, and then get out and vote!"
2022-10-30 17:15:59+00:00,Elaine and I are terribly saddened by the passing of our dear friend Honey Alexander. I know the entire Senate joins us in praying for her husband Lamar and the entire Alexander family as they hold tight to cherished memories of Honey in this difficult time. My full statement: https://t.co/VStKPuDUFP
2022-10-28 15:31:05+00:00,Horrified and disgusted by the reports that Paul Pelosi was assaulted in his and Speaker Pelosi's home last night. Grateful to hear that Paul is on track to make a full recovery and that law enforcement including our stellar Capitol Police are on the case.
2022-10-13 16:47:45+00:00,"Democrats have produced staggering 13.5% inflation since President Biden took office. They’ve proven that as long as they have one-party control, they will keep running our economy into the ground. My full statement: https://t.co/cv9KGJ4Rqo"
2022-10-03 01:49:19+00:00,I was deeply saddened to learn this evening that the great Judge Laurence Silberman has passed away. Elaine’s and my prayers tonight are with all the family and friends Larry leaves behind. My full statement: https://t.co/EQpp2c9djV
2022-09-28 17:40:50+00:00,"Democrats wanted one-party control of Washington. They got it. And they used that power to create an economic nightmare for families. Nearly $3 trillion of party-line waste. 13.2% inflation and counting since 2021. A disaster for workers, families, and fixed-income households."
2022-09-27 20:35:44+00:00,"Liberal regulations and red tape make it way too hard to build things, create jobs, and unleash American energy. That’s why Republicans lead on this issue. 

Democrats’ phony fig leaf bill is not real ""permitting reform"" at all. It would actually make the problem even worse."
2022-09-22 15:27:48+00:00,".@GOPLeader and @HouseGOP will bring the people’s priorities back into the people’s House.
 
Less inflation. More law and order. Parents' rights. Border security. American energy.

Imagine — a House that actually fights for American families instead of making their lives harder."
2022-09-20 19:09:33+00:00,"Democrats’ failed policies have unleashed a record-breaking illegal immigration crisis. Our southern border is functionally open. It's not fair, it’s not compassionate to anybody, and it’s not sustainable. https://t.co/ZyLJuXE8Rc"
2022-09-14 21:07:33+00:00,"Senate Democrats just blocked our bill that would have given railway workers a big raise and prevented a crippling strike and supply chain crisis.

If a strike occurs and paralyzes food, fertilizer, and energy shipments nationwide, it will be because Democrats blocked this bill."
2022-09-14 20:10:28+00:00,"Republicans are heading to the floor with a bill to prevent a railway strike that would create total chaos. It would give workers the package that most of the unions have already approved.

President Biden should have already resolved this himself. Democrats must let this pass."
2022-09-14 15:21:18+00:00,Stable prices. Secure borders. Basic public safety. Some of the most basic things any government owes its citizens. The bare minimum. And Democrats can’t deliver them.
2022-09-13 21:12:33+00:00,"I am very sorry to learn of the passing of my friend Judge Ken Starr. He was a brilliant litigator, an impressive leader, and a devoted patriot. https://t.co/Fe440IIddB"
2022-09-13 16:07:55+00:00,"You can’t make it up: Hours after this terrible inflation report, the White House is hosting an “inflation reduction” celebration. Democrats have spent our economy into disaster and now they’re partying while families pay. They could not look more out of touch if they tried."
2022-09-13 16:03:18+00:00,"Yet another monthly inflation report worse than expectations. Worst food and electricity inflation in more than 40 years. Housing and medical costs way up. Democrats’ reckless policies have waged war on working families’ stability, savings, and lifestyles."
2022-09-11 11:16:50+00:00,"Twenty-one years ago, terrorists changed the course of our history forever. But the American values they tried to smash endured. The American spirit they tried to break only grew stronger. Today let us recommit once more: Never again. https://t.co/wgZiBxYf7a"
2022-09-08 17:51:06+00:00,Today all Americans stand with our great friends across the Atlantic in mourning the monumental loss of Her Majesty Queen Elizabeth II. Elaine and I extend our deepest sympathies to the Royal Family and to the people of the United Kingdom and the Commonwealth. https://t.co/gtEoyH4GWj
2022-08-24 16:16:11+00:00,Democrats' student loan socialism is a slap in the face to working Americans who sacrificed to pay their debt or made different career choices to avoid debt. A wildly unfair redistribution of wealth toward higher-earning people. https://t.co/ntyOafgklh
2022-08-16 20:02:10+00:00,"Democrats robbed Americans last year by spending our economy into record inflation. This year, their solution is to do it a second time. The partisan bill President Biden signed into law today means higher taxes, higher energy bills, and aggressive IRS audits."
2022-08-16 17:36:59+00:00,"During my trip to Eastern KY, flood victims told me they are frustrated with FEMA’s confusing disaster aid approval process. I spoke with Director Criswell to ask that FEMA streamline assistance and will closely monitor the situation to ensure this new process is more effective."
2022-08-10 18:00:52+00:00,Only these reckless Washington Democrats could see another month of 8.5% inflation crushing American families and try to spin it as a win for themselves. My full statement: https://t.co/B3tn6wqptt
2022-08-07 21:17:43+00:00,"Americans’ priorities are crystal clear: Inflation, the economy, crime, and the border. But not one Senate Democrat would agree to take one dime out of their Green New Deal nonsense to cut inflation, fight crime, or secure the border. https://t.co/wLOdfpTEd8"
2022-08-07 19:40:02+00:00,"Democrats have proven over and over they simply do not care about middle-class families’ priorities. Only 18% of Americans are happy with this Democrat-run economy.
 
And they just spent hundreds of billions of dollars more of your money to prove it yet again. My full statement: https://t.co/uWA8VCbq7i"
2022-08-05 19:11:52+00:00,"There is no working family in America whose top priorities are doubling the size of the IRS and giving rich people money to buy $80,000 electric cars. Americans want Washington to address inflation, crime, and the border — not another reckless liberal taxing and spending spree."
2022-08-03 22:14:07+00:00,"Tune in now to @FoxNews. I’m joining @BretBaier to discuss Finland and Sweden joining NATO and Democrats’ attempts to pass huge, job-killing tax hikes in the middle of a recession they created."
2022-08-03 20:00:41+00:00,"I’m about to join the @GuyBensonShow to discuss Democrats' reckless taxing and spending spree, strengthening NATO, and supporting Taiwan. Listen here: https://t.co/HC2JtVXHgB"
2022-08-03 17:41:57+00:00,"Democrats want to raise families’ electricity, gas, and heating bills so they can send rich people rebates for buying $80,000 electric cars. New taxes on American oil and gas.

Costly virtue signaling with no meaningful emissions impact as China keeps emitting more and more."
2022-08-02 17:28:27+00:00,"Even the Democrats’ favorite estimate says their so-called inflation bill will take nine years to cut the same amount of inflation that our country added every week in June. 

Nine years of huge tax hikes and big spending to remove literally one week's worth of inflation. A joke."
2022-08-02 15:01:32+00:00,"Thank you to the @kentuckyguard for your extraordinary work to save flood victims in Eastern Kentucky. You’ve been on the ground and in the air since the outset of this emergency, performing daring rescues and rendering aid. I am profoundly grateful for your service to our state."
2022-08-02 02:39:21+00:00,"The world is a better, safer place without the al Qaeda terrorist Ayman al-Zawahiri. I am profoundly grateful to the intelligence and counterterrorism professionals who spent decades hunting this terrorist killer. My full statement: https://t.co/QPPOz89jCq"
2022-08-01 22:00:01+00:00,"In the middle of a recession, Democrats want to raise taxes, kill jobs, and attack American energy. All of this economic genius is brought to you by the same people that said a $1.9 trillion spending spree would not cause inflation right before it did."
2022-08-01 20:18:05+00:00,"Governor Beshear has confirmed that 35 Kentuckians lost their lives amid flash floods. Sadly, I’m told that number will rise. Unthinkable stories continue to come to us out of Eastern Kentucky. I will continue to work closely with local and state leaders to offer further support."
2022-07-29 17:40:22+00:00,"My heart breaks for the Kentucky families mourning the loss of loved ones as flooding continues. Thank you to all first responders working to prevent further tragedy. I'm monitoring this situation and working with federal, state, and local officials to assist in any way possible."
2022-07-29 14:55:30+00:00,Thank you @POTUS for rapidly declaring a Major Disaster in response to Eastern Kentucky’s ongoing flooding. I joined all members of our congressional delegation to support @GovAndyBeshear’s request and speed federal resources to assist search and rescue operations.
2022-07-28 14:09:13+00:00,"My prayers are with the families in Eastern Kentucky facing heavy floods, mudslides, and power outages this week. My team is in close contact with local officials and I’m ready to provide any help I can. Thank you to the first responders who are helping Kentuckians stay safe."
2022-07-27 23:05:39+00:00,"Democrats have already crushed American families with historic inflation.
 
Now they want to pile on giant tax hikes that will hammer workers and kill many thousands of American jobs.
 
First they killed your family's budget. Now they want to kill your job too."
2022-07-26 20:20:16+00:00,Tune in now to @FoxBusiness. I am joining Larry Kudlow to discuss the pain Democrats' reckless agenda is causing the American people and the importance of strengthening NATO by welcoming Sweden and Finland.
2022-07-26 15:02:17+00:00,"You’d think the worst inflation in 40 years would be enough to convince Democrats to change course. Instead, the same people who spent us into inflation want to tax us into recession. Massive new tax hikes at a time when families are struggling just to stand still financially."
2022-07-25 20:23:38+00:00,"First Democrats said their reckless spending wouldn’t cause inflation. Then they said it would be transitory. Then they said it had peaked last year.

Now those same Democrats are insisting we aren’t headed into a recession. 

Draw your own conclusions."
2022-07-21 19:51:37+00:00,"Washington Democrats’ one-party government has performed an amazing feat:
 
In eighteen months, they’ve taken an economy that was ready to soar and spent it into inflation. Now, their latest plans are threatening to tax it into recession."
2022-07-21 15:08:42+00:00,I was sorry to hear that President Biden has tested positive for COVID-19. Wishing him a speedy recovery.
2022-07-20 19:49:42+00:00,"Yesterday, @SenateForeign took an important step toward ratifying Finland and Sweden’s accession to NATO. The Senate must move swiftly to complete its role in this historic process and strengthen the most successful military alliance in the world."
2022-07-20 15:46:05+00:00,"Energy prices are rising faster than at any point since 1980. In the last year, gas prices have risen nearly 60% and natural gas is up nearly 40%.

Democrats have surveyed this scene and decided it’s the perfect time to hike taxes on American energy. What a reckless proposition."
2022-07-19 15:02:41+00:00,"A year ago today, with prices already rising, President Biden said high inflation was, “expected to be temporary.”

Well, last week’s inflation report confirmed on paper what working families have been feeling for a year: President Biden’s prediction was dead wrong."
2022-07-14 21:11:12+00:00,"One clear reason we're suffering from 40-year high inflation: The $1.9 trillion reckless spending this all-Democratic government passed on a party-line basis last year. 

Now, after spending us into inflation, they want to tax us into a recession. https://t.co/B2oZgpOkrE"
2022-07-14 18:56:14+00:00,Tune in now to @FoxNews. I am about to join @marthamaccallum to discuss how the Democrats who spent us into inflation are now trying to tax us into recession.
2022-07-13 15:56:15+00:00,This all-Democrat government has produced yet another absolutely terrible inflation report. Staggeringly bad numbers that represent crushing pain for millions of families. Fueled by the trillions in reckless spending that Democrats rammed through on party lines last year. https://t.co/wfOk5lkGhW
2022-07-12 22:25:11+00:00,"Democrats' tax hike plans would shred President Biden's promise not to hike taxes on the middle class. Nonpartisan experts have proven their plans would hit working families and the middle class.

First Democrats spent us into inflation. Now they want to tax you into recession. https://t.co/WT5iBnipin"
2022-07-12 12:52:23+00:00,First Democrats spent us into inflation. Now they want to tax us into recession.
2022-07-11 21:00:33+00:00,"Democrats have already picked the American people’s pockets once with inflation. Now their solution is to pick your pockets a second time with giant new massive tax hikes?

Democrats spent us into inflation. Now they want to tax us into a recession."
2022-07-08 13:50:49+00:00,Horrified by the assassination of Prime Minister Abe. A remarkable global leader and stalwart friend of the United States. Praying for his family and for the people of Japan.
2022-07-05 19:20:49+00:00,Democrats' inflation already has families paying hundreds of extra dollars every month just to tread water. They turned a booming economy into a struggling economy. Now they're considering doing even more damage and ramming through gigantic tax hikes on party lines. https://t.co/GaheShiH5e
2022-07-04 12:00:03+00:00,"As we gather with our family and friends to give thanks for the many blessings we enjoy as Americans, never forget the men and women who made it all possible. Happy Independence Day and God bless America. https://t.co/I9s4tcOM4P"
2022-07-01 15:56:23+00:00,Woody Williams exemplified the selfless service of the Greatest Generation as both the last surviving Medal of Honor recipient from WWII and as a lifelong advocate for veterans and military families. I was honored to welcome him to Kentucky to help recognize Gold Star families.
2022-06-30 20:07:30+00:00,Let me be perfectly clear: there will be no bipartisan USICA as long as Democrats are pursuing a partisan reconciliation bill.
2022-06-30 15:41:18+00:00,Attacking a core American institution like the Supreme Court from the world stage is below the dignity of the President. President Biden’s attacks on the Court are unmerited and dangerous. My full statement: https://t.co/FA2g4j7e8T
2022-06-28 16:32:38+00:00,"Solitary confinement at the hands of a military junta is only the latest injustice my friend, Daw Aung San Suu Kyi, has endured in the name of democracy in Burma. The United States and the entire free world must continue to stand with the people of Burma against this tyranny."
2022-06-24 14:31:44+00:00,The Supreme Court’s landmark ruling in Dobbs is courageous and correct. This is an historic victory for the Constitution and for the most vulnerable in our society. My full statement: https://t.co/oPTzOYOeAU
2022-06-22 20:35:05+00:00,"President Biden is calling for another ineffective stunt to mask the effects of Democrats’ inflation. The latest bad idea would barely put a dent in the soaring gas prices on his watch.
 
Here’s a better idea: What if Democrats stop waging war on affordable American energy?"
2022-06-19 10:23:47+00:00,Thinking of my dad today. Happy Father’s Day to all the dads in Kentucky and across our great country. https://t.co/DosMyXseJ6
2022-06-16 15:52:37+00:00,"Just a few years back, Republican policies had created the best economy for American workers in a generation. Low inflation, robust growth, record low unemployment. Democrats’ recklessness has produced soaring inflation, slowing growth, and growing risk of a full-on recession."
2022-06-10 13:43:48+00:00,"Another devastating inflation report for American workers and families. Another new 40-year high.
 
Grocery prices off the charts, worst increase since the 1970s. Rent, gas, and electricity all way up.

The Democrats' inflation has handed the average American a 3.9% real pay cut."
2022-06-09 16:01:07+00:00,"Democrats want to stage a spectacle about opposing political violence. But House Democrats, President Biden, and Attorney General Garland are intentionally blocking and ignoring basic steps to prevent political violence and illegal intimidation of the Supreme Court."
2022-06-08 15:06:58+00:00,This morning’s disturbing reports are exactly why the Senate unanimously passed a Supreme Court security bill weeks ago. But House Democrats have inexplicably blocked it. House Democrats need to stop their blockade and pass this uncontroversial bill today. https://t.co/wd8UB5RDvm
2022-06-07 16:56:51+00:00,Gas prices have doubled since this Administration took office. We need an all-American domestic energy strategy. But Democrats have a different plan: Less production and higher prices. And Americans are paying for it every day.
2022-06-07 01:59:41+00:00,"Working families feel Democrats’ inflation every day. Soaring grocery prices. Gas approaching or already above $5. Runaway heating bills last winter and electric bills coming next. Appliances, clothes, and furniture way up.
 
Real wages falling because paychecks can't keep up."
2022-05-30 20:31:43+00:00,This Memorial Day we remember the brave men and women in uniform who laid down their lives in defense for our nation. Let us carry their memory close today and honor their sacrifice.
2022-05-26 21:43:36+00:00,"As summer begins, travel costs from airfare to rental cars are surging. But millions of Americans are struggling to cover basic expenses, let alone vacations.
 
The new normal under Democrats' inflation: Harder to fill the tank. Harder to feed a family. Harder to get by."
2022-05-24 21:57:20+00:00,"Horrified and heartbroken by reports of the disgusting violence directed at innocent schoolkids in Uvalde, Texas. The entire country is praying for the children, families, teachers, and staff and the first responders on the scene."
2022-05-20 16:37:53+00:00,"Today marks 11 straight days of record-breaking gas prices. Getting to work, running errands, and hitting the highway for a modest family vacation all costs 88% more at the pump than it cost when President Biden put his hand on that Bible."
2022-05-19 21:57:30+00:00,Tune in now to @FoxNews. I’m about to join @BretBaier to discuss how Sweden and Finland will strengthen NATO and the Senate’s landslide vote to continue helping Ukraine win this war.
2022-05-19 20:48:40+00:00,It was a pleasure to co-host Prime Minister @SwedishPM and President @niinisto in the Capitol today to discuss how their accession to NATO would further strengthen our strong alliance. I will fully support strengthening NATO with the additions of Finland and Sweden.
2022-05-19 13:23:49+00:00,"As we observe National Police Week, I am thinking especially about the law enforcement officers Kentucky lost in the past year.

America’s law enforcement personnel are always there when we need them most. The least Congress can do is have their backs. https://t.co/EIMOunkFqu"
2022-05-17 22:11:53+00:00,Glad to host @ZinMarAungNUG for a meeting in the Capitol today. We discussed Burma’s struggle for democracy against the repressive military junta and the importance of continued support from the U.S. and friends of freedom around the world. https://t.co/y89QtLpLN3
2022-05-17 14:47:23+00:00,"I am heartbroken by the loss of Calloway County Chief Sheriff’s Deputy Jody Cash, who was killed in the line of duty yesterday. Deputy Cash was a hero who worked every day to keep Kentucky safe. We are all praying for his family and squad members as they mourn this loss."
2022-05-14 23:35:56+00:00,"A delegation of Senate Republicans just left Ukraine after visiting Kyiv and meeting with President Zelenskyy. We saw firsthand the courage, unity, and resolve of the Ukrainian people. My full statement: https://t.co/bsgCMLiZ6M"
2022-05-11 21:57:47+00:00,The baby formula shortages hurting American families are outrageous and unacceptable. The Biden Administration cannot now hide behind the FDA and pretend they’re powerless. The President must get ahold of the situation fast. My full statement: https://t.co/VSzBcAtDJU
2022-05-11 17:19:24+00:00,Gas prices are now the highest they have ever been in American history. Americans are now paying roughly $4.40 per gallon. That’s up about two whole dollars from when President Biden put his hand on the Bible.
2022-05-11 13:11:10+00:00,"This all-Democrat government has managed a unique kind of economic turnaround. They took an economy that was ready to soar last January, turned it around, and drove it into the ground."
2022-05-10 19:36:26+00:00,I got to meet with Ukrainian Ambassador Markarova to discuss Ukraine's brave fight. Our brave friends are nowhere near out of the woods yet. Continued U.S. assistance must move at the speed of relevance to help Ukraine defeat the invaders and win this war. https://t.co/TMgwNh4pyu
2022-05-09 21:36:04+00:00,Trying to scare federal judges into ruling a certain way is far outside the bounds of normal First Amendment speech or protest. It is an attempt to replace the rule of law with the rule of mobs. It is unacceptable that Democrats cannot clearly denounce it.
2022-05-08 12:00:02+00:00,"The greatest thing my mother ever taught me was one word: focus.

She and I both had to have incredible focus while she helped me overcome polio as a child. And today, I consider it the most important word in the English dictionary.

Happy Mother’s Day to all the moms. https://t.co/csydpYpA6a"
