Datetime,Text
2021-05-17 20:49:33+00:00,"I'm a proud, steadfast supporter of Israel. The U.S. should stand closely with our friends.

President Biden must remain strong against the voices within his own party that want to create false equivalence between terrorists attacking Israel and the nation defending itself."
2021-05-14 15:48:38+00:00,Iran is the most active state sponsor of terror in the world. The rockets raining down on Israel bear Iranian fingerprints. So do anti-American &amp; anti-Arab attacks. The Administration must not reward this behavior by reducing sanctions or jumping back into a failed nuclear deal.
2021-05-13 20:47:07+00:00,"When Democrats forced through their partisan “COVID relief"" bill, we said bad policies would slow rehiring and risk inflation.
- April came in about 800,000 new jobs below expectations

- Unemployment actually inched back up

- The biggest reported inflation jump in over a decade https://t.co/AQt8SQVbTH"
2021-05-13 18:29:42+00:00,"Democrats’ S. 1 is a partisan effort to take over our elections: Partisan control of the FEC. Partisan rules for states. Public funds sent to partisan campaigns. 
 
There is nothing bipartisan about it. S. 1 would shatter confidence in our democracy. https://t.co/YRfMBCXPXo"
2021-05-13 17:11:06+00:00,"As we observe National Police Week, I had the honor of welcoming members of Kentucky’s Fraternal Order of Police to the Capitol. Standing with law enforcement isn’t something we do one week a year. We need to back the blue all year round. https://t.co/DTYvPaIR0U"
2021-05-12 23:11:51+00:00,"Appreciated meeting today with Foreign Minister @MarisePayne of Australia. We discussed our nations’ efforts to meet shared challenges, from China’s aggression to democracy in Burma and counterterrorism in Afghanistan. It was a good conversation with a great ally. https://t.co/Ien9Lv3sKD"
2021-05-12 22:09:50+00:00,"Tune in now: I'm joining @BretBaier on @FoxNews to discuss the prospects for a real, bipartisan infrastructure bill and why Democrats' plan for a partisan takeover of our democracy failed in committee yesterday."
2021-05-12 18:10:41+00:00,I had a productive meeting at the White House with President Biden and congressional leaders. There is a bipartisan desire to get an outcome on infrastructure. It will take a bipartisan process to get one. https://t.co/TAyE4D6uzM
2021-05-12 15:21:13+00:00,"Israel must know that their friends and allies in the United States stand with them.

We support Israel’s right to peace and security. We support their goal of restoring deterrence. The Administration must not relax our efforts to hold terrorists and their supporters to account."
2021-05-11 21:28:01+00:00,Democrats’ election takeover bill would literally hand public money to political campaigns. I proposed an amendment to instead send that money to fight the opioid epidemic and fentanyl that kill Americans. Democrats blocked it and voted to send the cash to politicians instead. https://t.co/2oQsHVPaU0
2021-05-11 15:12:47+00:00,"Democrats want to rewrite the rules of our elections and restrict Americans’ free speech on a purely partisan basis.

Hard to imagine anything that would shatter public confidence in our democracy more dramatically than a transparent partisan power grab. https://t.co/bjrCh4tFeW"
2021-05-11 00:52:18+00:00,Vaccines are available nationwide. We have millions of unfilled job openings. It is not fair to keep taxing working Americans to continue paying an extra federal bonus to folks who continue to stay home. And it’s holding back our nation’s recovery.
2021-05-10 22:02:55+00:00,"Democrats’ partisan power-grab “election reform” bill is not about voting rights. It’s about letting Washington Democrats control the terms of political debate and all 50 states’ election laws.

Republicans will expose this attempted D.C. takeover in tomorrow’s hearing. https://t.co/Qv2FoAQEJK"
2021-05-01 17:00:01+00:00,".@RepAndyBarr and I introduced bipartisan legislation after last year’s @KentuckyDerby to preserve our Commonwealth's signature racing industry.

Now, Thoroughbred racing is well-positioned for the future. https://t.co/62WHO9DymH"
2021-05-01 12:00:01+00:00,"As Kentuckians, Thoroughbred racing is practically in our bones. It’s who we are. We find our state’s unique history on the track and in the stables. Today, the best of the Bluegrass is on full display at the 147th running of the @KentuckyDerby. https://t.co/7MQSvmGkG7"
2021-04-30 20:54:10+00:00,"A number of Senate Republicans wrote President Biden’s @USEdGov today opposing a new proposal to skew civics and U.S. history toward activist indoctrination that is designed to push Americans apart. Our kids deserve the best. 

Read our letter: https://t.co/1Mxr0LFVkp"
2021-04-30 16:08:06+00:00,"President Biden hasn’t tried to do anything remotely moderate. He ran as a moderate, but everything he's recommended is far left. 
 
Think of it as the Biden bait-and-switch. Bernie Sanders is really happy. https://t.co/uEsDSF7Q6z"
2021-04-30 13:11:10+00:00,"This Administration wants to raise taxes to nudge families toward the kinds of jobs Democrats want Americans to have, in the industries they want to exist, using the kinds of childcare they endorse. These plans aren’t about creating options; they’re imposing a vision."
2021-04-30 00:50:31+00:00,".@SenatorTimScott is a brave, courageous, and inspirational leader. If you want to see the future, watch his great speech from last night. He laid out what the Republican Party today and tomorrow is going to look like. https://t.co/VYjr8uyv4C"
2021-04-29 19:00:34+00:00,Tune in to @FoxNews. I am joining @marthamaccallum to discuss the contrast between President Biden’s Joint Address and Senator Tim Scott’s Republican response.
2021-04-29 17:13:57+00:00,"Last night, President Biden talked about unity and togetherness. But he delivered a multi-trillion-dollar shopping list that was not even intended to earn bipartisan buy-in. A lengthy liberal daydream that would force American families’ lives into Washington Democrats’ mold."
2021-04-29 02:43:58+00:00,I am so glad the nation heard @SenatorTimScott's outstanding Republican response to President Biden’s address. Republicans stand for the principles and policies that unite Americans and expand opportunity for working families. Not radical agendas designed to push us apart.
2021-04-27 01:23:21+00:00,"Republicans have responded to Democrats’ “infrastructure” bill with a smart proposal to meet real needs.
 
Roads. Bridges. Ports. Airports. Waterways. Broadband.
 
Are Democrats ready to work together? Or was “infrastructure” just wrapping paper for more gifts to the far left?"
2021-04-26 21:59:12+00:00,"As a polio victim myself, I fully understand the significance of vaccines. After decades of research, polio vaccine trials began on this day in 1954. 

Now, we developed multiple COVID vaccines in under a year. We all need to receive this modern medical miracle. https://t.co/9l0nz70CMd"
2021-04-22 19:41:03+00:00,.@SenatorTimScott is not just one of the strongest leaders in the Senate. He is one of the most inspiring and unifying leaders in our nation. I'm glad he’ll be delivering the Republican Address following the President’s remarks on Wednesday.
2021-04-22 17:56:01+00:00,"This Administration’s zeal for costly climate policy at home is not matched by our biggest competitors. China’s share of emissions is nearly double ours. The Paris Agreement is largely toothless.

Democrats can kill U.S. jobs &amp; industries with no real impact on global emissions."
2021-04-22 16:47:05+00:00,"Today, Senate Republicans introduced our framework to improve our nation's infrastructure. 

Americans need and deserve bipartisan infrastructure solutions. I hope Democrats will come to the table and work with us on a bipartisan path forward to strengthen our homeland."
2021-04-21 17:02:10+00:00,"The late Justice Ginsburg rejected the discredit concept of court-packing.

“If anything would make the Court appear partisan, it would be that.”

“Nine seems to be a good number.”

Justice Breyer just reaffirmed his own opposition. And the American people agree overwhelmingly."
2021-04-21 15:06:44+00:00,"A major theme of the Biden Administration has been false advertising: 

Last month, it was the multi-trillion-dollar “COVID relief” bill that spent only 1% on vaccines. 

Now it’s a multi-trillion-dollar “infrastructure” plan where roads and bridges are almost a rounding error."
2021-04-20 20:16:46+00:00,"The situation at our southern border: record arrivals of unaccompanied minors.
 
The White House’s response: police the terminology border officials are allowed to use to describe the crisis.
 
Not securing the border. Just woke proofreading, in a parody of left-wing governance."
2021-04-20 17:10:56+00:00,"Foreign fentanyl analogues from China and elsewhere are incredibly poisonous drugs that kill Americans.
 
They're currently classified as illegal controlled substances. But some Democrats want to let that status expire.
 
Absurd. We should make this permanent. It's a no-brainer."
2021-04-20 01:03:31+00:00,"China jails peaceful dissidents, saying “only patriots” should govern Hong Kong.
 
The real patriots are the peaceful activists they have jailed and the hundreds of thousands still carrying the torch for democracy.
 
The free world must have their backs."
2021-04-19 21:13:24+00:00,"Last year, @SenatorTimScott and Republicans tried to pass major legislation that would have expanded body cameras, discouraged chokeholds, increased transparency, and finally made lynching a federal crime.

Democrats filibustered the bill because it wasn’t anti-police enough."
2021-04-17 16:19:56+00:00,"We are returning a generation of heroes to the forefront of our national memory — and the center of our nation’s capital.
 
Thanks to the @WW1CC and all who have made the new National World War I Memorial possible. https://t.co/HnUgwmzULB"
2021-04-15 21:18:44+00:00,"Proud to introduce the CAROL Act today, alongside @SenatorSinema, one of @RepAndyBarr’s friends. This important legislation is a fitting tribute to a wonderful Kentuckian. It embodies Carol’s lifetime of service to others. I look forward to its passage."
2021-04-15 16:39:28+00:00,"Democrats keep showing they don’t care about norms and institutions, only power. The latest example: a bill to pack the Supreme Court and destroy its legitimacy to guarantee the rulings liberals want."
2021-04-14 18:08:49+00:00,"H.R.1 isn’t about justice, equality, or responding to recent state laws. It’s a recycled recipe for a massive Democrat takeover that they’ve been pushing under changing justifications for multiple years. Read the bill."
2021-04-14 17:08:44+00:00,"The Washington Post has given the WH its worst rating, Four Pinocchios, for repeated lies about election law. 
 
Democrats want to create a national controversy over voting regulations. But facts keep getting in their way."
2021-04-13 19:05:29+00:00,Foreign terrorists will not leave the U.S. alone simply because our politicians have grown tired of taking the fight to them. The President needs to explain to the American people how abandoning our partners and retreating in the face of the Taliban will make America safer.
2021-04-13 15:21:59+00:00,"Officer Billy Evans died defending this Capitol, its institutions, and the thousands of people who work here. Today the Senate and the entire country are holding Officer Evans and his family in our thoughts and prayers. His sacrifice will not be forgotten."
2021-04-09 21:24:09+00:00,"This new court-packing commission is not some serious pivot away from Democrats’ political attacks on the Court. It’s just an attempt to clothe those attacks in fake legitimacy.

My full statement: https://t.co/qX639r68M3"
2021-04-09 18:13:06+00:00,"Talk is cheap, but defending our country is not. We can't afford to fail in our constitutional responsibility to provide for the common defense. Both parties should be able to agree that we must maintain America’s edge over China.

Our joint statement: https://t.co/7BHXvBBIvB"
2021-04-08 18:08:52+00:00,"Democrats’ “infrastructure” proposal goes way beyond what working Americans would call infrastructure. It tries to use a bipartisan issue as a Trojan horse for tax hikes and miscellaneous liberal policies. 

We need to tackle infrastructure in a more targeted way. https://t.co/GWlADEG2SD"
2021-04-05 13:04:17+00:00,Our private sector must stop taking cues from the Outrage-Industrial Complex. Americans do not need or want big business to amplify disinformation or react to every manufactured controversy with frantic left-wing signaling. My full statement: https://t.co/3Ck3qW4Mbe
2021-04-04 10:02:28+00:00,May you and your family have a blessed and joyful Easter Sunday.
2021-04-02 20:54:02+00:00,"I am heartbroken that Officer Evans was killed today in the line of duty. On this Good Friday, let's all pray for healing for the surviving officer, comfort for Officer Evans’s family, and for all the officers and families of the United States Capitol Police.
 
My full statement: https://t.co/0ykpCLaoJX"
2021-04-02 18:00:16+00:00,Praying for the United States Capitol Police officers who were attacked at the Capitol. We are still learning what’s taken place. Grateful to all the USCP and first responders who are on the scene.
2021-04-01 22:44:00+00:00,The latest news from Hong Kong only confirms Beijing’s tightening totalitarian grip over the formerly autonomous region. It is essential the Biden Administration work with like-minded partners to impose meaningful international consequences. My full statement: https://t.co/Liz39tDXS8
2021-03-31 22:18:43+00:00,"My advice to the Administration: If you want to do an infrastructure bill, let's do an infrastructure bill.

Before the pandemic, we had the best economy in 50 years. We should not raise taxes under the guise of an infrastructure bill and send our economy in the wrong direction. https://t.co/QFcHmP7GQI"
2021-03-31 21:36:44+00:00,The Administration’s non-infrastructure “infrastructure bill” looks like another Trojan horse for far-left demands. Rolling back Right to Work laws. Imposing the biggest new tax hikes in a generation — killing jobs and slowing wage growth when workers need a fast recovery.
2021-03-31 21:21:53+00:00,"There would be bipartisan support for a serious, targeted infrastructure plan. Unfortunately, less than 6% of this massive White House proposal would go to roads and bridges. It would spend more on electric cars than on roads, bridges, ports, airports, and waterways combined. https://t.co/WjIvBSwpsg"
2021-03-30 17:24:10+00:00,"It’s a modern medical miracle that three safe and effective COVID-19 vaccines were produced in less than one year. Thanks to hardworking Kentuckians at the McKesson facility in Shepherdsville, those vaccines are being distributed all across the country. https://t.co/JZIxcWxJBu"
2021-03-25 18:48:29+00:00,"The border crisis is not just seasonal. CBP is tracking the largest surge in apprehensions in 20 years. Unaccompanied children are piling up in close quarters.
 
It turns out when politicians spend a two-year campaign advertising a porous border and amnesty, people listen."
2021-03-24 17:22:38+00:00,"Democrats’ attempted elections takeover has state and local officials sounding alarms. They say its unworkable provisions would invite total chaos in our elections. Even Democratic officials.

No wonder Democrats want to talk about everything except what's actually in their bill. https://t.co/8IL3M1Z1Ie"
2021-03-24 14:57:49+00:00,"Democrats' H.R. 1 would leave elections more vulnerable to cheating, send taxpayer dollars to subsidize campaigns, and would turn the bipartisan Federal Election Commission into a Democrat-controlled partisan body.

It’s not about protecting voting. It’s about rigging the system. https://t.co/POrUh2bq9H"
2021-03-24 13:44:22+00:00,Tune in now to @FoxNews: I am joining @DanaPerino and @BillHemmer to discuss the crisis at our southern border and the Democrats' plan for a partisan takeover of America’s election systems.
2021-03-23 18:33:48+00:00,H.R. 1 is the Democrats’ plan to take over the American election system and have it run by Washington bureaucrats. Democrats want to force all kinds of unpopular changes on all 50 states because they believe it would benefit their side. https://t.co/ZZZcZ77PHM
2021-03-23 16:27:39+00:00,"Senate Democrats just spent the last four years using the legislative filibuster and talking constantly about how important it was.

Their reversals aren’t about principle. It’s just raw power. And their excuses insult the intelligence of the American people."
2021-03-22 16:09:50+00:00,"A key purpose of the Senate was to ensure all parts of the country have a voice.
 
Leaders from New York and California want to break the Senate’s rules on legislation because they want to steamroll the interests of Kentucky and Middle America.
 
https://t.co/Tek5MhZCVx"
2021-03-21 19:29:15+00:00,"Secretary Mayorkas testified “the border is secure and the border is not open.”

So either @fema has been deployed just to admire a situation going smoothly... or the Biden Administration is not being straight with the American people."
2021-03-19 19:45:43+00:00,"The science on getting kids back in school is crystal clear. Every day the Biden Administration does not urge schools to reopen safely right now with simple precautions, the most vulnerable kids pay the price."
2021-03-18 16:16:04+00:00,The Administration claims their top priority is to beat this virus and end the pandemic. But their nominee to run @HHSGov is woefully unqualified. California AG Xavier Becerra is a partisan politician with no expertise in healthcare.
2021-03-18 12:41:38+00:00,"If Democrats break the Senate rules and kill the filibuster by a 50-50 vote, they will regret it. The pendulum would swing both ways, and it would swing hard. https://t.co/x2EM4EgTIc"
2021-03-17 21:30:59+00:00,"My definition of a crisis is when you send the Federal Emergency Management Agency, which only goes to emergencies, down to the border. 

This is a crisis. The Administration created it, and they own it. https://t.co/mDxERtkDjK"
2021-03-17 19:09:33+00:00,"Eliminating the legislative filibuster is not in the best interest of the country, no matter which party is in control.

Anyone who really understands the Senate knows that steamrolling the rules wouldn't fast-track policymaking. Everything would grind to a halt."
2021-03-17 18:58:42+00:00,"Top Democrats’ drive to break Senate rules is shamelessly hypocritical. Just two years ago, they called the filibuster an essential part of the Senate that should never go away. 

Apparently their only principle is that they want Democrats to have all the power, all the time. https://t.co/FPzKemNSWU"
2021-03-17 15:35:28+00:00,Tune in now to @FoxNews. I am joining @HARRISFAULKNER to discuss Democrats’ border crisis and the importance of preserving Senate rules on legislation.
2021-03-16 15:59:54+00:00,Breaking Senate rules to kill the filibuster would not open up an express lane to liberal change. It would not open up an express lane for the Biden presidency to speed into the history books. The Senate would function more like a hundred-car pile-up. Nothing moving.
2021-03-15 21:16:50+00:00,I'm glad @SecBlinken and @SecDef are engaging with key Asian allies Japan and South Korea this week. We need to work together to defend against threats from China and North Korea and stand up for democracy in Burma in the face of military dictatorship.
2021-03-15 20:53:48+00:00,"Why did President Biden tell Americans to wait until July 4th to gather in ways that cities, states, and the CDC approve right now?

Why did he present a million vaccines per day as a personal “Mission Accomplished” moment when it’s simply the pace Democrats inherited in January?"
2021-03-15 20:53:39+00:00,"On Thursday, President Biden spoke in a heartfelt way about grief and loss. But his vision for the road ahead missed the mark. His proclamations broke with Dr. Fauci and his own CDC and ignored what Americans are already doing now. It was like a speech for an alternate universe."
2021-03-12 20:31:54+00:00,"House Democrats' H.R. 1 is a partisan assault on elections. It directly targets political speech and would centralize control of elections in all 50 states in Washington Democrats’ hands. 

A dramatic one-party power grab over the way Americans vote. https://t.co/ObjBkEnobS"
2021-03-12 01:49:54+00:00,"In 2020, Senate Republicans led Congress to pass five historic bipartisan bills. 

Because of that, the American people have been marching toward victory. Democrats just want to sprint to the front of that parade and claim the credit."
2021-03-12 01:42:44+00:00,"Our country has endured one of the most painful years in memory. But the dark times have spotlighted the best of America. 
 
This year’s recovery will ride an already turning tide. Not because of a Democrats’ latest partisan bill, but because of the resilience of our people. https://t.co/2JC1V8ic30"
2021-03-10 22:54:43+00:00,"Last Congress, Sen. Schumer and Democrats used the filibuster frequently. And I respected the institution more than any short-term advantage we might have achieved if we’d eliminated it. 
 
Majorities come and go, but the essence of the Senate stays. https://t.co/AbUmsKf6R5"
2021-03-10 20:49:19+00:00,"President Biden's spending bill is a classic example of big Democratic overreach in the name of COVID relief. It manages to spend only ~1% on vaccinations and less than 9% on the entire health fight. 

This is by far one of the worst pieces of legislation I've seen in the Senate. https://t.co/lhU3wPm2kI"
2021-03-10 18:37:47+00:00,"The Administration is flailing and failing on our southern border. The number of unaccompanied children has tripled in two weeks. 

The White House keeps saying “Now is not the time to come.” So there will be a good time in the future to break federal law and come illegally?"
2021-03-10 16:14:41+00:00,"I’ve voted for several of President Biden’s nominees. But his choices to lead Interior and the EPA appear eager to restart the left’s war on domestic energy. Kentuckians know that when radical policies are on the table, it means their jobs and pocketbooks are on the menu."
2021-03-09 22:38:38+00:00,"House Democrats’ attempt to forcibly rewrite 50 states’ election laws would weaken voter I.D., mass legalize ballot harvesting, and let a partisan FEC poke around in more of citizens' political speech.

No wonder the only thing bipartisan about the bill was the vote against it."
2021-03-08 18:43:28+00:00,Senator Blunt has tackled so much important work for Missouri and our country and has been an enormous asset to all his colleagues. I’m very sorry he’ll be stepping away but am glad the country has two more years to keep benefitting from his talent. My full statement: https://t.co/Q3HN53yaT5
2021-03-06 18:42:28+00:00,"Instead of working together to fight COVID-19, Democrats decided to exploit the crisis by jamming through unrelated liberal policies they couldn’t pass honestly. A colossal missed opportunity for the American people. My full statement: https://t.co/p321zYjGjU"
2021-03-06 04:36:10+00:00,"Democrats said they’d exploit COVID to “restructure things to fit our vision.”

Sure enough: Only 9% of their bill for the entire health fight. Only 1% for vaccines. All this borrowed money for a parade of unrelated policies that even left-wing experts say are badly targeted."
2021-03-05 14:36:22+00:00,"We're already set to come roaring back — not due to this liberal spending spree. Democrats inherited a tide that was already turning.

We could have worked together to do something smart &amp; bipartisan to finish this fight ASAP.

Democrats decided to do something else."
2021-03-04 17:15:20+00:00,I am continuing to monitor severe flooding across Kentucky. Yesterday I spoke with leaders in some of the hardest-hit counties. My staff and I are ready to do our part to get federal assistance to these communities. https://t.co/51otsqeSzp
2021-03-03 20:01:08+00:00,"TUNE IN NOW: I'm joining @marthamaccallum to discuss the urgent priorities Senate Republicans are focused on -- reopening schools, helping workers, and getting more Americans vaccinated -- and the liberal wish-list Democrats are pushing instead."
2021-03-03 18:23:18+00:00,"What the American people need are fast-acting plans to open schools now, get laid-off Americans into jobs, and finish the fight against COVID-19.
 
The Democrats’ plan doesn’t focus on that. It manages to spend ~$2T while leaving the most urgent things on the cutting room floor. https://t.co/6UyBLBZPsH"
2021-03-02 23:07:12+00:00,It was my honor to get to thank some of the @kentuckyguard who answered the call to help protect the Capitol. Your Congress and your country appreciate all you’ve done. https://t.co/I09FN45AjW
2021-03-02 16:33:48+00:00,"Less than 9% of Democrats' spending plan would go to directly fight COVID-19. Less than 1% to vaccinations. 

This isn’t a recipe to safely reopen America. It’s what Democrats promised almost a year ago: Taking advantage of the crisis to check off unrelated liberal policies."
2021-03-01 22:11:02+00:00,"Only 1% of the Democrats’ partisan bill goes to vaccines. Less than 9% to the entire health effort. It backs the Big Labor myth that schools can’t reopen safely right now — yet only a small fraction of its K-12 money would go out this year.

Liberal ideology, not families' needs."
