Datetime,Text
2023-01-01 15:00:31+00:00,Happy New Year! https://t.co/Z6Nub1THWm
2022-12-30 21:18:46+00:00,"I thank Idaho law enforcement for their commitment to bringing justice to the perpetrator of this senseless act of violence, &amp; their integrity in conducting their investigation in a careful manner despite immense amounts of public pressure. May justice be served quickly."
2022-12-30 21:18:46+00:00,"It is welcome news a suspect is in custody related to the murder of Idaho students Kaylee, Madison, Xana &amp; Ethan. I continue to pray for their families &amp; friends following this unthinkable tragedy."
2022-12-28 15:00:00+00:00,Happy Pledge of Allegiance Day! This pledge reminds us of the freedom the American flag represents and ideals this country was built upon. https://t.co/oDNJUn0qM2
2022-12-25 17:00:00+00:00,"I wish you a very merry Christmas, a happy New Year and may God bless you and your family. https://t.co/SpGF8DR5dB"
2022-12-21 13:59:59+00:00,"House Ways and Means Democrats' decision to release President Trump’s confidential tax information sets a dangerous precedent, and undermines confidence in both our tax laws and legislature. Read my full statement here: https://t.co/Jcg4OPmdrw"
2022-12-21 13:59:59+00:00,"Taxpayers have a fundamental right to the certainty that their tax and financial information is protected, remains confidential and will not be commandeered to target political enemies or serve other partisan political aims."
2022-12-16 15:27:05+00:00,"This year’s NDAA supports Idaho’s military personnel and industries by advocating for the Idaho Air National Guard, funding military technologies developed in Idaho and protecting our servicemembers from draconian COVID vaccine mandates. https://t.co/MBRfbRNcmS"
2022-12-15 19:23:56+00:00,"On this day in 1791, the first 10 Amendments to the U.S. Constitution were ratified by the states. This Bill of Rights guarantees the rights of Americans, limited government, popular sovereignty and the rule of law. Today, we celebrate the document that protects those freedoms. https://t.co/e62Sb1yROe"
2022-12-15 15:42:02+00:00,"The Administration has failed to defend U.S. business and economic interests in international tax negotiations. It's time for them to consult Congress in a meaningful, bipartisan way to protect America's interests. https://t.co/ThbAQIlofH"
2022-12-14 19:33:59+00:00,"Under President Biden’s COVID vaccine mandate, approximately 3,400 troops have been reprimanded or unfairly discharged based solely on vaccination status.  These servicemembers should immediately have their records cleared and be reinstated. https://t.co/j4HHzJWSfe"
2022-12-13 21:09:18+00:00,"Today marks the 386th birthday of the @USNationalGuard. Since 1636, these selfless men &amp; women in all 50 states, each territory &amp; DC have lived up to their motto, “Always Ready, Always There.” Thank you especially to our Idaho guardsmen for your continued service. https://t.co/nLnANSJPwm"
2022-12-12 20:34:29+00:00,"This #MilitaryMonday, I honor U.S. Air Force Veteran Marvin Barnes. Barnes served in the @usairforce for 20 years and achieved the rank of Master Sergeant. Thank you for your service! 

Read more on my website: https://t.co/0G24QRAn7p https://t.co/O4tKbrieQz"
2022-12-09 21:16:02+00:00,"Cementing lasting peace in the Middle East remains one of the greatest challenges of our time. The alliance between Israel and the U.S. continues to serve as a cornerstone of progress and stability in the region. Read more:
https://t.co/ekmBTy9sgd"
2022-12-08 18:58:01+00:00,"This is the first step in ending harmful mandates on our servicemembers. We must not let up in repealing these penalties and reinstating all servicemembers unfairly discharged.
https://t.co/EoqnKhHyWE"
2022-12-08 13:46:42+00:00,"Uniform financial data readability will improve government transparency and accountability. 
https://t.co/31OK6BKiNR"
2022-12-07 21:44:25+00:00,.@SenatorShaheen and I introduced the Bring Our Heroes Home Act to help bring them home. https://t.co/IQGkIJMUjH
2022-12-07 21:44:18+00:00,"America’s servicemembers, past &amp; present, have shown incredible sacrifice &amp; dedication to defending our freedom. We owe it to our nation’s heroes &amp; their families to cut the bureaucratic red tape &amp; continue the effort to identify &amp; recover those who have not yet made it home."
2022-12-07 16:24:14+00:00,"81 years later, the nation remembers #PearlHarbor. “December 7, 1941—a date which will live in infamy” - President Franklin Roosevelt. https://t.co/mK0GPbHmvj"
2022-12-06 21:43:18+00:00,Washington needs to take steps to address the harmful effects of inflation by tackling our ballooning debt crisis and the unsustainable mandatory spending that will undermine Idaho’s success. https://t.co/4uaDqOte1N
2022-12-05 16:42:42+00:00,"We need pro-American energy proposals that help enhance U.S. energy independence. Now is the time to develop and tap into the resources here at home, not diminish them. https://t.co/IILgnc8iAw"
2022-12-02 22:47:18+00:00,"Congress must learn from the past and preserve pro-growth tax reforms to help reignite our economy, rather than continue down a path of more unsustainable taxing and spending. https://t.co/UPJjm74HRL"
2022-12-02 21:01:10+00:00,"Too many Idaho veterans and servicemembers face barriers to the care and services they need, and the recent changes affecting the TRICARE retail pharmacy network are deeply concerning. Read more ⬇️
 
https://t.co/3XpIRwmtcd"
2022-11-26 16:00:00+00:00,"Small Business Saturday is an opportunity for us to celebrate Idaho’s entrepreneurs and more than 176,000 small businesses. This holiday season, support your local communities and #ShopSmall. https://t.co/vptayGEnUC"
2022-11-24 16:00:00+00:00,"From my family to yours, have a wonderful Thanksgiving. https://t.co/k1pG8rBEcM"
2022-11-17 22:02:53+00:00,"Nuclear energy is good for jobs, good for the economy, good for our air, and it is a great source of base-load clean energy. The Idaho National Laboratory (INL) continues to lead the way in driving innovation across the industry. Read more:
https://t.co/LudxDzezhL"
2022-11-14 22:09:33+00:00,"I am praying for the victims of the tragic event involving University of Idaho students, as well as their families and the surrounding Moscow community."
2022-11-14 20:26:11+00:00,"This #MilitaryMonday, I honor Army Veteran Eric Bolich.  Bolich served in the @USArmy for 20 years. Thank you for your service! 

Read more on my website here: https://t.co/TrgSwDRNK2 https://t.co/zVJWVD0MuX"
2022-11-11 18:27:33+00:00,"Our right as Americans to self-governance, carried out through voting, has been secured by the bravery, sacrifice and strength of the extraordinary Americans we honor on Veterans Day. Read more ⬇️

https://t.co/ryDGzN1ODG"
2022-11-11 16:05:31+00:00,"In honor of the 116,000 veterans who call Idaho home, join me in thanking the brave men and women who have served this country. America’s veterans have put their lives on the line to defend our freedom and liberty, and for that we owe them a debt that can never be repaid. https://t.co/etxw2AfENz"
2022-11-10 14:56:25+00:00,"This Administration’s reckless spending has caused eleven consecutive months of inflation above 7%. Taxpayers are getting throttled by high grocery prices, high energy prices, and now high interest rates that will make it even more difficult for Americans to obtain credit. https://t.co/G6B11Mqdft"
2022-11-08 16:09:32+00:00,Today is #ElectionDay. Find your voting location here: https://t.co/f58WofYkNN https://t.co/8HTmlPiCsz
2022-11-05 18:42:31+00:00,"I presented the Spirit of Idaho Award to K9 Officer Vulcan, whose contributions to law enforcement in North Idaho are immeasurable. By locating drugs that could have been missed by human officers, K9 Vulcan has stopped illicit substances from making it to the streets. https://t.co/w8WZFFfheR"
2022-11-04 22:19:33+00:00,"Earlier this year, Hayley Slaughter donated her kidney to Candice Martin, an active member of the U.S. Army. It is an honor to present Hayley with the Spirit of Freedom Award to recognize her outstanding example of selflessness and empathy.

https://t.co/fbGF1rgkXE https://t.co/HQfysSjWFY"
2022-11-01 20:53:30+00:00,"Thank you to all the parents, spouses, kids and loved ones of our brave servicemembers for your ongoing support and sacrifice. Happy Military Family Month! https://t.co/D8h6xZvI0n"
2022-10-29 21:33:11+00:00,The students and faculty with the Seed Potato Germplasm Program at @uidaho are doing great work to help Idaho potato growers combat the onset and spread of disease among their crops. I was grateful for the opportunity to see their lab during my campus visit. https://t.co/VacJOSt2lY
2022-10-29 15:41:23+00:00,"This week, I visited @uidaho’s ICCU Arena. This facility is an excellent example of public-private partnership at work and does an incredible job highlighting Idaho’s forests and timber products. https://t.co/4yUZe1DMFJ"
2022-10-28 21:40:37+00:00,"Thanks to the efforts of the Idaho Animal Rescue Network, hundreds of animals each year are given a new lease on life. I am proud to present them the Spirit of Idaho Award for their continued efforts to provide safe and happy homes for Idaho pets. https://t.co/Y2SyezyBpA https://t.co/QAHbIb09g6"
2022-10-28 19:33:58+00:00,"Tomorrow, October 29, is @DEAHQ’s #TakeBackDay. From 10AM - 2PM you can visit a collection site and discard unused and expired medications from your home. This can help prevent misuse and addiction from ever starting. Find a location near you: https://t.co/OlOkPITRVP"
2022-10-28 15:49:57+00:00,Americans and Canadians alike cross the border each day for commerce and employment. Keeping in place highly-restrictive hours at the Porthill Port of Entry is devastating to Idaho communities along the border. https://t.co/qmN69q8fDj
2022-10-28 13:39:00+00:00,The EMS personnel who serve Idaho communities do so with steadfast dedication. These men and women work each day to provide critical care when needed most. https://t.co/HVsNxzMPlq
2022-10-28 13:38:59+00:00,Today we recognize and thank the first responders who keep our communities safe. https://t.co/WYZfkwGClh
2022-10-27 19:15:09+00:00,"I have fought to protect parents’ rights to be actively involved in their children’s education; this includes parents who have concerns about curriculum and putting politics in the classroom. Read more ⬇️
https://t.co/TX0pXZAUak"
2022-10-27 13:42:48+00:00,"Theodore Roosevelt said, “A good navy is not a provocation to war. It is the surest guaranty of peace.” The greatness of the U.S. Navy is unmatched around the globe, and today we take a moment to honor its servicemembers. https://t.co/V3624n1zsd"
2022-10-26 22:36:09+00:00,"I had the distinct pleasure to participate in the beam signing ceremony commemorating the new @IdaHumanRights education center. The center will be named in honor of Gov. Phil Batt, a friend &amp; mentor of mine who has built an incredible legacy promoting human rights in Idaho. https://t.co/vLrAnxG5LA"
2022-10-25 20:53:51+00:00,"It was an honor to receive the Friend of Agriculture Award yesterday from the @IDFarmBureau. I am proud to support policies that protect Idaho’s farmers and ranchers, and I will continue to advocate for measures that grow this crucial industry. https://t.co/TWcLvaSTMX"
2022-10-24 16:51:49+00:00,"The IRS’s massive, roughly $80 billion budget boost merits increased oversight. There's no excuse for not addressing existing deficiencies, and we’re asking the GAO for an update on previously-identified problems and recommendations it made to the agency. https://t.co/dQxZgmQNvs"
2022-10-21 19:53:24+00:00,"Drug traffickers are trying everything they can to get illicit drugs into our country.  Parents, make sure you are checking your kids’ candy and do not allow them to eat anything until you have inspected it. 
https://t.co/EBEZJn0AfO"
2022-10-21 16:01:40+00:00,"Americans continue to feel the pain of inflation in many aspects of their daily lives, and these adjustments for next year are cold comfort for those who suffer now.” https://t.co/ydvCeQ1vJl"
2022-10-21 16:01:39+00:00,"These larger-than-expected, statutorily mandated adjustments-put in place for individual taxpayers as part of the 1981 Reagan tax reform-are yet another troubling sign of the magnitude of the inflation stoked by the Administration through its partisan economic &amp; spending designs."
2022-10-20 16:31:10+00:00,"Join me in Twin Falls and Hagerman tomorrow for two special events. 
https://t.co/XtkxZ8aycG"
2022-10-19 15:43:42+00:00,"The dedication &amp; hard work of the exceptional Idahoans involved in Idaho’s EMS are invaluable. EMS personnel fill multiple roles and work long hours to provide needed help when emergencies happen at any hour of the day or night. Read more⬇️
https://t.co/ryxL52rNtT"
2022-10-14 16:14:35+00:00,"We are also grateful to the hard-working Idahoans in law enforcement who put their lives on the line to keep our communities safe. And, our thoughts are with those who have lost a family member or loved one to a drug overdose."
2022-10-14 16:14:34+00:00,The Biden Administration’s lenient border policies have clearly sent a dangerous message. @SenatorRisch and I will continue to push the Biden Administration to secure our borders and back Idaho law enforcement. Read More ⬇️ https://t.co/s1WImmz1oc
2022-10-13 18:35:48+00:00,"Dane Partridge, a U.S. veteran and Idahoan, died while fighting to defend Ukraine’s independence from Russian control. I offer sincere condolences to his family, friends and loved ones during this undoubtedly difficult time."
2022-10-13 16:49:06+00:00,"Before the pandemic, Republican policies led to low inflation, low unemployment and robust growth. Now, the economic mismanagement by this administration has led to seven consecutive months of inflation above 8% and families dipping into savings just to afford basic necessities. https://t.co/p8H7QYqXsu"
2022-10-13 15:41:19+00:00,"The food at home index is up 13% from last year, with the inflation cost of groceries near the highest levels in FOUR decades. The Biden Administration’s reckless spending policies have Idahoans and all Americans dipping into savings just to afford their everyday meals. https://t.co/M6ijCTFFYI"
2022-10-12 20:51:07+00:00,"The IRS was given a nearly $80 billion funding boost devoted disproportionately to enforcement. With so few resources dedicated to oversight, we're asking how American taxpayers will have needed visibility into how this massive funding boost will be used.  https://t.co/VOWpFE8htA"
2022-10-12 15:57:34+00:00,"Today’s inflation data signals more inflationary pressures are in the pipeline for Americans. The Administration took an economy rebounding from the pandemic, injected trillions of dollars in reckless spending and now American families are paying the price.https://t.co/oTWl0m1ZO4"
2022-10-10 13:00:00+00:00,"This #MilitaryMonday, I honor U.S. Marine Corps Veteran Mark Knapp.  Knapp served in our nation’s military for four years in the @USMC on active duty and in the Reserve. Thank you for your service! 
Read more on my website here: 
https://t.co/TrgSwDRfUu https://t.co/KRrU6i781P"
2022-10-06 19:54:59+00:00,The Biden Administration must secure our border immediately.
2022-10-06 19:54:59+00:00,"Fentanyl seizures at our southern border increased 203% in July, &amp; the drug has been a primary driver in the rise in drug crimes in Idaho. Porous border policies have given drug cartels easy access to unsuspecting victims, leaving a wake of death &amp; violence in our communities. https://t.co/7qvgiDBO8O"
2022-10-06 19:54:57+00:00,"The U.S. has reached record-breaking illegal border crossings, leading to a lethal influx of fentanyl and drug trafficking hitting communities across Idaho and our country. https://t.co/NpVsfLx3Hi"
2022-10-03 22:13:32+00:00,"Children deserve an education free from harmful social ideologies, and the federal government should not provide any funding to schools that deny parents the right to access crucial information about their child’s wellbeing.  Read more:
https://t.co/KKZgCNJaIv"
2022-09-29 20:22:36+00:00,Further spending will only worsen and prolong inflationary pressures on the American people.
2022-09-29 20:22:36+00:00,"Widespread inflation is not under control, and Americans are struggling to make ends meet as everyday essentials are becoming less affordable.  This Continuing Resolution does not extend into the next Congress, and creates a pathway for lame-duck, progressive wish-list spending."
2022-09-27 14:39:37+00:00,"I lead Republican colleagues from Congress’s tax panels in calling on the IRS to extend the COVID-19 related penalty deadline, as taxpayers continue to face frustrating IRS customer service challenges. Read more: https://t.co/uQWVYtd79E"
2022-09-24 12:00:01+00:00,Happy National Hunting &amp; Fishing Day! Hunting and fishing are integral to the conservation and management of wildlife and part of the cultural fabric that binds Idahoans to the land and environment we love. https://t.co/zbQcRDOzlM
2022-09-20 19:46:56+00:00,"Idaho is one of the 21 states where agents have seized “rainbow fentanyl”. Just one brightly-colored, candy-like pill can be deadly. Be vigilant in looking out for your children and neighbors, and call 911 if you find a colored pill or powdered substance. 
https://t.co/ujOdsX9vGQ"
2022-09-17 14:47:32+00:00,"The U.S. Constitution promises Americans basic principles of individual rights and freedoms, limited government and a representative government. No matter our country’s current challenges, I remain deeply proud to be part of a nation that prioritizes life, liberty and freedom. https://t.co/5snT0BY3dN"
2022-09-16 17:08:08+00:00,"In honor of National POW/MIA Recognition Day, I join in raising awareness about the more than 81,500 American servicemembers--including 360 Idahoans--who remain missing from past conflicts. My prayers are with their families as the challenging work continues to bring them home. https://t.co/psEJQSlOzd"
2022-09-16 14:58:46+00:00,"Homes are more than just physical structures. It is critical that we make the American dream of homeownership as attainable for as many Idahoans as possible, which will continue to foster the economic success of the nation. Read more⬇️ https://t.co/NUc28AOGNa"
2022-09-15 22:53:08+00:00,"We should be getting inflation under control by unleashing American energy, cutting the red tape of burdensome regulations and stopping unrestrained government spending."
2022-09-15 22:48:23+00:00,"Read more on my website ⬇️

https://t.co/r4U0f7DNFB"
2022-09-15 22:48:22+00:00,"Mortgage rates have more than doubled from last year and are at the highest point since the 2008 financial crisis. As the Fed continues to consider higher interest rates to tamp down inflationary pressures, mortgage rates are poised to go even higher. https://t.co/SSLTUnSVsC"
2022-09-15 13:39:06+00:00,"Two years ago, the Abraham Accords Peace Agreement took a significant step in bringing our world closer together. The U.S. must continue to be a conduit for additional countries normalizing relationships with Israel as we broaden further opportunities for peace in the Middle East https://t.co/az2qV163QK"
2022-09-14 16:52:33+00:00,"The Administration’s drug price-setting program poses serious risks for patients, frontline health care providers, small businesses, and American pharmaceutical innovation. I raised these important concerns and questions for federal health agencies: https://t.co/f1Q6pywpMU"
2022-09-13 17:38:50+00:00,"Senate Republicans look to protect Americans earning less than $400k from IRS audits
https://t.co/gThxJqWXvl"
2022-09-13 16:14:30+00:00,"While the White House celebrates the mislabeled ‘Inflation Reduction Act,' economic data show that food costs rose 11.4% over the past year, the largest 12-month increase since May 1979. Inflation is not under control and Americans are paying far too much for goods and services. https://t.co/jn5p7Hmspj"
2022-09-12 20:27:42+00:00,"Democrats recently gave $80 billion to the IRS for increased enforcement. I’ve introduced legislation to protect small businesses and Americans earning less than $400,000 from being targeted by increased audits. Read more: https://t.co/lj6YXWFlMk"
2022-09-12 17:08:51+00:00,"This #MilitaryMonday, I honor Army Veteran Jesse Coyne.  Coyne served in our nation’s military in the @USArmyReserve and @USArmy, and achieved the rank of Second Lieutenant. Thank you for your service, 2LT Coyne! 
Read more on my website here: https://t.co/TrgSwDRfUu https://t.co/t8MEZI3Kj1"
2022-09-12 12:31:30+00:00,This raises serious privacy concerns and the payment processing networks should not play an end-run game around Congress to police and target lawful businesses.
2022-09-12 12:31:30+00:00,Categorizing firearm retailers under a separate merchant code is a dangerous step toward using the payment system to monitor and track politically disfavored industries.  https://t.co/yOS3EcedTO
2022-09-11 14:05:41+00:00,#NeverForget https://t.co/ZvGlfjQxEf
2022-09-09 17:06:54+00:00,"Nonpartisan experts have confirmed that at least tens of billions of dollars in projected revenue from increased IRS enforcement will come from those making less than $400,000 per year. Small businesses should be very concerned with a supersized IRS. https://t.co/L9A0wlCPrM"
2022-09-08 18:57:15+00:00,"In the international arena, Her Majesty Queen Elizabeth II represented the United Kingdom with honor and distinction—her leadership spanning many years and generations of world events. I offer my sincerest condolences to the members of the Royal Family and the people of the UK."
2022-09-06 20:21:13+00:00,"It also pays tribute to the extraordinary services of Japanese Americans. I am grateful for Karen’s strength and patriotism, and her kindness in telling me the stories of her family. Painful stories of the past like hers help inspire a better future. https://t.co/boqc4zOcFO"
2022-09-06 20:21:10+00:00,"The Minidoka National Historic Site is a reminder of injustices that can never be repeated, and tells the painful yet resilient story of our nation’s Japanese American community during World War II. https://t.co/7qHfissw7R"
2022-09-06 20:21:08+00:00,This year marks the 80th anniversary of the opening of the historic Minidoka War Relocation Center in Jerome County. Karen is a survivor of the camp and recently showed me the barracks where she lived with her family for a period of time. https://t.co/YpwDYdYiEq
2022-09-05 11:00:03+00:00,"“No man needs sympathy because he has to work, because he has a burden to carry. Far and away, the best prize that life offers is the chance to work hard at work worth doing.” ― Theodore Roosevelt
Wishing you a happy and safe Labor Day! https://t.co/G0h94u6ou4"
2022-09-01 18:13:11+00:00,I’m contacting the USPS to demand a detailed plan for completing construction and opening a new post office facility immediately. https://t.co/mIANaG9cDu
2022-09-01 18:13:10+00:00,Residents of Deary have to travel 12 miles just to get their daily mail while they wait on unnecessary construction delays of a new post office. I met with Mayor Johnson to discuss residents’ and the city’s frustrations at the currently-halted construction of the new building. https://t.co/PUeYxvU2OG
2022-08-31 20:46:47+00:00,"Inflation in farm country translates into higher food costs for consumers at the retail level. All Idahoans are feeling the pinch of record high inflation and rapid price increases.
https://t.co/wrDpdl7tgt"
2022-08-31 19:47:54+00:00,The Lewiston Airport will soon host flights of larger commercial aircraft. The new flights will encourage more travel to bring added business to the community and region. I was pleased to visit the airport earlier this week to celebrate this exciting news! https://t.co/Gup7EVgQ9w
2022-08-31 18:28:01+00:00,Thank you to Canyon County Sheriff Kieran Donahue for meeting with me and sharing more about the growing struggles law enforcement face when trying to combat the influence of illicit drugs such as fentanyl in our communities. https://t.co/wd6gA2uN8r
2022-08-30 18:00:34+00:00,I was given this plaque with a special message to share from Jerome Veteran Neal Biggs. Let us take these words to heart as we honor the sacrifices of all our servicemembers and their dedication to the people and ideals of the United States of America. https://t.co/D7kkzTs6ET
2022-08-29 17:16:01+00:00,"Make no mistake: American taxpayers of all income levels should brace for more audits, investigations and tax enforcement under the massive new IRS funding increase. Taxpayers deserve better services, not broken promises. https://t.co/GCAba4XIuk"
2022-08-29 16:18:31+00:00,"The price of everything on a farm has increased, from a 21% increase for bailing twine and a 43% increase for pivot tires to as much as a 118% increase in fertilizer.  Trillions of dollars of debt-financed spending is driving record inflation. https://t.co/lSdeCBtSxv"
2022-08-26 20:30:57+00:00,"I applaud Forrest for seeing a need in his community and taking the initiative to fill that need. He embodies the Spirit of Idaho with his selfless and enterprising example.
https://t.co/li9h25Aedn"
2022-08-26 18:08:02+00:00,"Happy #NationalDogDay! We are grateful for the pets that bring us joy and companionship at home and, sometimes, even in the office! https://t.co/DyjoDzUrKP"
2022-08-26 13:56:07+00:00,I enjoyed my visit at Mountainland Supply in Idaho Falls.  Employee-owned companies like these are excellent job creators that generate positive economic activity in the local community. https://t.co/KUO4OfiEj9
