Datetime,Text
2021-07-08 23:13:47+00:00,Congressional support for an agreement at the OECD will hinge on protecting American workers and the U.S. tax base. @RepKevinBrady and I relayed our concerns with the global tax negotiations to Treasury Secretary Yellen today. https://t.co/4es9Uf2ygd
2021-07-08 16:38:16+00:00,"Thank you to Wood River Fire and Rescue volunteers for dedicating their time and expertise to save lives, whether it's people or man's best friend. I am so grateful for their selfless service and dedication to keeping Idaho families, their loved ones and property safe."
2021-07-04 16:01:11+00:00,"Today as we celebrate the 245th anniversary of the birth of our nation, we can also remember those who have made the ultimate sacrifice in defense of our freedoms, equality and self-government. Have a safe and wonderful #IndependenceDay! https://t.co/tDsc3J4y5p"
2021-07-03 17:20:34+00:00,"131 years ago today, the U.S. Congress approved an Idaho State Constitution and President Benjamin Harrison signed a bill into law granting Idaho statehood. Happy birthday to the greatest state in the Union! https://t.co/z9hRZLAc2L"
2021-07-02 17:03:21+00:00,"If you plan on enjoying Independence Day festivities outdoors with friends and loved ones this upcoming weekend, please remember to be mindful of your surroundings and remain vigilant about fire safety. Have fun, stay safe and don't be the spark. https://t.co/y3UjCJyE2I"
2021-07-01 23:58:45+00:00,"The CBO says, under current law, U.S. debt will hit 106% of the size of the economy by 2031--the highest in our history. Hiking deficits even more now brings us into unchartered waters. https://t.co/kUPExJiwFz"
2021-07-01 17:02:58+00:00,"The American dream is rooted in the Declaration of Independence adopted on July 4, 1776, establishing our self-govt. I shared a column on the creation of our great nation and our duty as inheritors of that legacy which stands as an example to the world. https://t.co/OLiiGdccPT https://t.co/BaxSTC3KUF"
2021-06-30 21:33:15+00:00,"In the midst of an unprecedented heatwave, Idaho is at the top of the list when it comes to wildfire risk. Please help protect our state by taking precautionary steps to reduce the risk of catastrophic wildfires. https://t.co/oKR2vczxwx
 
More info below: https://t.co/uDCu6P64P6"
2021-06-30 20:10:16+00:00,"As a staunch supporter of efforts to address wildfires &amp; ensure communities have access to the tools, resources &amp; authority to actively prevent fire devastation, the Administration must do more to ensure Idahoans have a seat at the table when it comes to wildfire mgmt &amp; response."
2021-06-30 20:10:16+00:00,Combating wildfires is not a partisan issue. I was very disappointed to learn that President Biden failed to invite the Governors of Idaho and Montana to a meeting with other Governors of states facing severe wildfire seasons. https://t.co/xbDswf0Vi6
2021-06-30 15:04:29+00:00,The Idaho community lost a true hero in 2019 when Keawe Michael Pestana lost his life in efforts to save his three young cousins from drowning in the Salmon River near Riggins. He has been named a #CarnegieHero posthumously for his selfless actions. https://t.co/vt7ml1ggHi
2021-06-28 18:50:16+00:00,"This kind of intense heat is particularly dangerous for the most vulnerable like the elderly and those without access to air conditioning. Remember to stay cool, remain hydrated, reduce your time outdoors, practice water safety and do not leave children and pets unattended."
2021-06-27 01:24:51+00:00,"Today, Navy Fireman 2nd Class Carl Bradley returned to rest in Shelley. 80 years ago, he left to serve his country. He was killed in action aboard the USS Oklahoma in Pearl Harbor on December 7, 1941, &amp; his remains found earlier this year. May we remember his eternal sacrifice. https://t.co/5Un8g8JpQV"
2021-06-26 19:38:14+00:00,Overly burdensome federal taxes on the Veterinary Medicine Loan Repayment Program limit the reach of its programs/benefits. This bill would allow more vets the opportunity to practice in underserved communities where their services are in critical need.
2021-06-26 19:38:14+00:00,"As Ranking Member of @SenFinance, I introduced the Veterinarian Medicine Loan Enhancement Act with @SenStabenow to address the veterinarian shortage in rural regions, ensuring ranchers and farmers have access to care for livestock. https://t.co/OJQF2I2nMR"
2021-06-25 16:42:02+00:00,"I joined a resolution designating June 2021 as National #DairyMonth, highlighting the important role of dairy products &amp; farmers. Idaho is one of the top dairy producing states, as the industry supports 48K jobs in the state and nearly 3M nationwide.  https://t.co/uxIRnX01Ny https://t.co/K3sVJEzLWu"
2021-06-24 22:21:21+00:00,"Today, the Senate overwhelmingly passed the Growing Climate Solutions Act, which I co-sponsored. This legislation would break down barriers to allow farmers, ranchers and foresters to get compensated for reducing their environmental footprint. https://t.co/IYrcIAyzNR"
2021-06-24 18:43:36+00:00,"#ICYMI, I shared a column this week on the lessons-learned from the expansion of telehealth and other flexibilities during the pandemic to make sensible changes that can better enable Idahoans’ access to quality care going forward. https://t.co/WorrDHcqS7 https://t.co/xRKRuf9Se6"
2021-06-23 18:55:41+00:00,"The @librarycongress is hosting the first ever online open house for educators 06/30 &amp; 08/06--a great opportunity for Idaho educators interested in learning more about what the LoC has to offer directly from the experts who work there, &amp; all from the comfort of your own home."
2021-06-23 00:12:28+00:00,Privacy breaches are harmful and this violation does immense damage to taxpayer trust in the IRS. https://t.co/GKdOcGBBHb
2021-06-22 21:23:52+00:00,"Reducing the prices of prescription drugs for Americans remains a priority. The Lower Costs, More Cures Act is a comprehensive, market-based approach to leveraging competition, flexibility and transparency to bring affordable drugs to patients without stifling innovation. #LCMCA"
2021-06-22 21:23:51+00:00,"I reintroduced the Lower Costs, More Cures Act with @SenatorBurr, which aims to lower prescription drug prices, bring greater transparency to the prescription drug industry and encourage American ingenuity in the development of new treatments and cures. https://t.co/Gy6Sl120ZC https://t.co/4ZKr0pjH7V"
2021-06-22 19:56:26+00:00,"Once Americans find out what makes up the partisan #corruptpoliticiansact, more than two thirds won't support the passage of this blatantly unconstitutional voting ""reform"". https://t.co/hp9eCjpzkl"
2021-06-22 19:56:26+00:00,"Democrats keep promoting all the different aspects of their partisan election reform legislation. But according to a @honestelections poll, only 29% of voters know anything about what’s in S.1. When they find out what’s in it, only 28% support the Democrats’ power grab."
2021-06-22 17:14:02+00:00,"The apparent massive leak of more than 15 years of legally protected, personal taxpayer information from the Internal Revenue Service (IRS) to the media outlet ProPublica is deeply concerning. https://t.co/GKdOcGBBHb"
2021-06-22 15:54:56+00:00,"S.1 would force states like Idaho to abandon its voter ID laws. According to an @honestelections poll, 77% of voters support voter IDs."
2021-06-22 00:05:59+00:00,"The judiciary is not an unelected legislative body; rather, the men and women who serve on the federal bench are charged to enforce and interpret the law before them. I will fight all attempts to undermine the integrity of the federal judiciary."
2021-06-22 00:05:59+00:00,"I penned an Op-Ed sharing my concerns about court packing, which would lead to more partisan infiltration for generations, erode public trust, &amp; present greater, volatile challenges in fairly &amp; constitutionally settling our most pressing judicial cases. https://t.co/A1t0TFxfrE"
2021-06-21 21:02:10+00:00,I’ve asked the GAO to review the IRS’s data security procedures and identify any shortcomings in order to prevent any violation of Americans’ privacy from happening again. https://t.co/pWADEgSpGq
2021-06-21 20:10:51+00:00,"The federal government should not use taxpayer dollars to spend on political campaigns, forcing Americans to fund candidates they don’t agree with. https://t.co/yGmqTERH8D"
2021-06-21 19:46:03+00:00,"I support enacting meaningful reforms to protect the integrity of our elections.  But, I will not support S.1 and a federal government power-grab of state election laws."
2021-06-21 19:20:12+00:00,"S.1 would force states like Idaho to abandon any form of voter identification, infringe on freedom of speech by requiring private citizens’ political donations to be published, and would legalize ballot harvesting. https://t.co/t8PYmJDI43"
2021-06-21 18:58:12+00:00,"The Democrats’ patently unconstitutional voting legislation, S.1, is a partisan power grab that would circumvent our entire elections process and stifle freedom of speech. The legislation is simply a massive federal overreach. https://t.co/EIqbX3eY3n"
2021-06-17 18:47:40+00:00,"This tax incentive is a great step toward our goal of fortifying our supply chains, strengthening national security and boosting economic competitiveness."
2021-06-17 18:47:40+00:00,I've introduced the FABS Act to strengthen U.S. semiconductor supply chains by leveraging federal gov’t incentives to bolster American companies and bring chip and semiconductor manufacturing back home. https://t.co/QR6Gwq6rfh https://t.co/f8IGd3PUcd
2021-06-17 01:11:58+00:00,"I remain skeptical about the Administration’s aggressive SHIELD proposal, and I’m concerned this policy could drive companies to avoid doing business in the United States, with the real cost being less U.S. investment and fewer jobs. https://t.co/RN9v7onesv"
2021-06-16 18:04:09+00:00,"The majority of Americans have shown they are concerned with the Administration's out-of-control spending policies. With U.S. inflation at its highest point in 13 years, it’s clear we must promote commonsense policies to ensure inflation does not become a long-term problem."
2021-06-16 16:35:00+00:00,"The Administration's mandatory financial-info reporting regime, sold under the guise of trying to close the tax gap, pulls almost all taxpayers into a surveillance dragnet. The era of big data should not be viewed as an opportunity for big brother. https://t.co/aHC1M6AEMC"
2021-06-16 16:35:00+00:00,"I am also concerned with the Administration’s budget proposals to expand IRS reporting requirements, particularly in light of a recent IRS data leak of private taxpayer information."
2021-06-16 16:31:49+00:00,"The Administration’s proposals to increase spending, hit Americans with higher taxes and strangle the economy with regulations and red tape is not a path to prosperity. https://t.co/h7VGhdJoHf"
2021-06-15 21:33:57+00:00,"Proud to once again introduce the Hearing Protection Act, which will benefit Idaho’s sportswomen and men by ensuring they have access to adequate hearing protection needed while hunting and participating in other recreational shooting sports. https://t.co/b84cBfwZWl https://t.co/t0bBLgRZgu"
2021-06-15 18:00:14+00:00,"This is not the first time confidential taxpayer information has been disclosed or misused. Unless those responsible for recent apparent disclosures at IRS are punished as directed by law, ordinary Americans will fall victim to further politicized and criminal disclosures."
2021-06-15 16:38:42+00:00,"The stigma around receiving mental health treatment can be higher in rural areas compared to others. At a Senate Finance Committee hearing, I asked witnesses about these challenges and what steps we can take to combat stigmas. https://t.co/mxJMIKdkiR"
2021-06-15 14:44:40+00:00,I am confident we can tackle challenges facing mental health care delivery while upholding core principles of fiscal responsibility and program integrity.
2021-06-15 14:44:39+00:00,"The COVID-19 pandemic has highlighted—and exacerbated—mental and behavioral health challenges.  While many are returning to their pre-pandemic lives, we shouldn't be content to allow our mental health care delivery system to revert to pre-pandemic ways. https://t.co/zARZXI385B https://t.co/GipkjIphLV"
2021-06-14 22:22:41+00:00,Field Marshal Till has been an instrumental force in representing veterans and supporting their needs through various @DAVHQ projects. I cannot thank him enough for all he has done and continues to do in service to this country and in support of his fellow veterans.
2021-06-14 22:22:40+00:00,"Today, on #MilitaryMonday, we honor @USNavy veteran Charles “Charlie” Titus Till, who served in the Navy from 1965-1971 during the height of the Cold War. Today, he is an invaluable member of @DAVHQ, where his 29 years of service have earned him the unique title of Field Marshal. https://t.co/m3UeOU9sf0"
2021-06-14 20:16:16+00:00,"Wherever the American flag is flown, it stands as a beacon of freedom, justice, and democracy. Today, on the 224th #FlagDay, we honor our flag, what it stands for, and those who have sacrificed their lives in the defense of the liberties and values that we all hold dear. https://t.co/G2dcm0pc5n"
2021-06-14 18:42:57+00:00,"Unless the perpetrators are found, ordinary Americans will fall victim to these politicized and criminal disclosures, and trust in the IRS and our tax system will continue to erode."
2021-06-14 18:42:57+00:00,I joined my colleagues @LeaderMcConnell and @ChuckGrassley in demanding the DOJ find those responsible for the disclosure of private taxpayer information and ensure they are punished as directed by law. https://t.co/HoEUsH6Cmd
2021-06-14 17:36:38+00:00,"Paying one’s taxes is a civic duty, and that duty requires taxpayers to disclose to the IRS deeply personal financial information. But those compelled disclosures should not, and do not, make that financial information public. https://t.co/aN2bVplD3w"
2021-06-14 16:37:36+00:00,"Since 1775, the @USArmy has safeguarded this nation &amp; defended our values. We owe our soldiers &amp; Army civilians a great debt of gratitude for the sacrifices they have made to guarantee our freedom. Today, we thank them for 246 years of unwavering &amp; selfless service. #ArmyBDay https://t.co/AbvErGQ9Q1"
2021-06-12 00:21:24+00:00,This leak of personal financial information constitutes a serious breach of privacy and is a criminal violation of our tax laws. Americans must be assured their confidential financial data is not at risk and the IRS can be trusted with safeguarding information.
2021-06-12 00:21:24+00:00,"I led Finance Committee Republicans in demanding an investigation into the apparent massive, illegal release of confidential taxpayer information. https://t.co/lGTYHOKXAW"
2021-06-11 19:43:32+00:00,"The American people widely disapproved of the agreement, &amp; Congress was never consulted on ways to strengthen our nation’s side of the deal, which gave the Iranian regime a green light to continue its nuclear arms race &amp; financial support of violent activities across the globe."
2021-06-11 19:43:31+00:00,The 2015 Joint Comprehensive Plan of Action (JCPOA) was poorly-negotiated and failed to permanently end Iran’s nuclear program or address its malign influence and terrorist proxies in the Middle East.
2021-06-11 19:43:31+00:00,"I joined @SenRonJohnson and others in introducing the Iran Nuclear Treaty Act, which will provide a constitutional check on any renewed nuclear deal with Iran. Congress must be able to provide advice and consent on any similar agreements. https://t.co/9NCpF7BUmp"
2021-06-11 17:14:41+00:00,Criminal abuse of taxpayer-funded programs intended to help Americans is offensive and destructive. We must do more to deter criminals from abusing taxpayer-funded unemployment assistance to ensure taxpayer funds reach Americans truly in need of assistance.
2021-06-11 17:14:40+00:00,"I introduced a bill to help prevent fraud in COVID unemployment programs, recover fraudulently paid benefits and provide relief for taxpayers and victims of unemployment fraud. https://t.co/xsWN8Q0GFb"
2021-06-11 17:14:39+00:00,Fraudsters and criminals may have stolen as much as half – HALF – of all COVID-related unemployment benefits.  https://t.co/qip9mpfLSn
2021-06-11 13:44:59+00:00,"I share the goal of getting safe, effective vaccines to as many people as quickly as possible, but we must do so in a way that would not undermine American democracy &amp; ingenuity. https://t.co/08t12CEQSC"
2021-06-10 17:53:24+00:00,"I cannot thank the @VFWHQ and its Auxiliary enough for their service to this nation and continued commitment to helping veterans, servicemembers and their families."
2021-06-10 17:53:24+00:00,"Through legislation such as the Major Richard Star Act, which I co-led w/ @SenatorTester to provide combat-injured veterans w/ less than 20 years of military service their full benefits, and other efforts, I will continue to find innovative ways to support the veteran community."
2021-06-10 17:53:23+00:00,"Proud to speak today at the Joint Opening Ceremony for Idaho's Veterans of Foreign Wars State Convention about the importance of the @VFWHQ, and to speak to my efforts to ensure our nation’s veterans have the best care and support they can possibly have. https://t.co/ublNZPhDAC"
2021-06-10 15:17:14+00:00,"Yet, the HHS Budget Request discussed today raises serious concerns, as it proposes no meaningful policies to contain unsustainable spending growth. We must find common ground to advance consensus-driven policies on many health care issues, from telehealth to value-based care."
2021-06-10 15:17:14+00:00,".@HHSgov and its sub-agencies need to build upon previous years’ efforts to ensure safe access to crucial health care services, in areas such as telehealth expansion and partnering with private-sector innovators on vaccine production and distribution. https://t.co/K8YBs6QXDP"
2021-06-10 14:41:45+00:00,"Reports say HALF of total unemployment funds have been potentially stolen. I introduced legislation to strengthen fraud protections and ensure Idahoan and American taxpayer dollars are not wrongly paid out to criminals. 
https://t.co/dCWelLaz3R"
2021-06-10 14:12:36+00:00,"This is the largest year-over-year increase in prices since the Great Recession, and massive stimulus spending is a contributing factor. Proposals for further federal spending, coupled with job-killing tax hikes, are not the remedy for economic recovery."
2021-06-10 00:22:19+00:00,"Violating confidentiality, as seems to be the case with leaks to ProPublica, does great damage to taxpayers’ confidence in the IRS and the tax system. https://t.co/py5UfHkzoK"
2021-06-10 00:22:18+00:00,"Our tax system relies to a great extent on voluntary compliance, and the vast majority of Americans are compliant."
2021-06-09 14:03:42+00:00,The President’s IRS budget calls for new changes that raise significant privacy concerns. Most Americans won’t support giving direct access to private financial information to any government agency. https://t.co/xPiZ6hRpDq
2021-06-09 14:03:08+00:00,"The trade bill I successfully secured in final passage, &amp; the broader USICA bill will help stand up our efforts in pushing back against China and helping Idaho’s hardworking farmers, manufacturers, fishers, high tech microchip innovators, and families compete globally."
2021-06-09 14:03:08+00:00,"This bipartisan, Senate-wide effort ensures the United States is positioned to compete on a fair playing field globally, especially with China. https://t.co/lM38hn6Vbk"
2021-06-09 10:08:05+00:00,The information we got in the ProPublica circumstance is just evidence of why Americans are going to be very concerned about giving the IRS direct access to their financial data. https://t.co/MTgv5kBuEa
2021-06-09 00:31:54+00:00,Americans are fed up with unwarranted data collection.  This proposal to literally increase the IRS’s ability to violate privacy and access private financial information of individuals is greatly concerning. https://t.co/W6ve9rihVe
2021-06-09 00:31:53+00:00,The President’s budget calls for a new change in the law allowing the IRS to have near universal continuous reporting of Americans’ financial account information.
2021-06-08 19:55:56+00:00,Watch my full exchange with Commissioner Rettig here: https://t.co/tLajog9E6C
2021-06-08 19:55:56+00:00,The @IRSnews needs to provide thorough and clear details regarding its recent “tax gap” estimates.  Knowing this information will allow Congress to better assist in getting those taxes collected. https://t.co/Sv3HDs3tcL
2021-06-08 15:22:58+00:00,"The key issue for the IRS, and for those of us who oversee it, is to strike the appropriate balance between rigorous enforcement of the tax laws and heavy-handed, stifling intrusiveness. Read my full statement at today’s @SenFinance hearing here: https://t.co/CDEFFqJmgr"
2021-06-03 17:56:13+00:00,"Many Japanese Americans were incarcerated during WWII, including in Idaho. Today, the Minidoka National Historic Park preserves the experience the Nisei faced during incarceration. They deserve our respect &amp; admiration for their commitment to this nation. https://t.co/QJvnXwJcD8"
2021-06-01 20:52:37+00:00,The recently completed Idaho Gold Star Families Memorial stands as a lasting place for all Americans to remember fallen servicemembers and the great sacrifice of the families who stood with them and will always love them.
2021-06-01 20:52:36+00:00,"This Memorial Day weekend, we not only paid tribute to the service &amp; sacrifice of Americans lost in service, but also celebrated the completion of the Pocatello Gold Star Families Memorial, honoring military families’ exceptional commitment to this nation. https://t.co/t83I1SVNpk"
2021-05-31 14:09:10+00:00,Our brave men and women in uniform are what makes our state and our country great. To all of our military members and their families: God bless you and thank you for your service.
2021-05-31 14:09:10+00:00,"On Memorial Day, we honor the American heroes who have served our nation proudly and made the ultimate sacrifice safeguarding the freedoms we all hold dear. My prayers remain with our fallen heroes, veterans, those currently serving and their families. https://t.co/R67gDvU2ee"
2021-05-28 20:40:35+00:00,"At a time when the U.S. should be maximizing economic growth and providing an environment for job creation to reach pre-pandemic levels, the Administration is putting forth proposals that will do the opposite."
2021-05-28 20:40:34+00:00,The President’s proposals to hit Americans with higher taxes and strangle the economy with regulations and red tape is not a path to prosperity.
2021-05-28 20:40:34+00:00,I continue to disagree with the Administration’s bids to pay for budget-busting spending with job-killing tax hikes. This colossal $6 trillion proposal includes tax increases that will inevitably hurt all Americans and businesses. https://t.co/s1GFkRGais
2021-05-27 21:54:25+00:00,I appreciate the ability that @RonWyden and I have to work together in a bipartisan fashion to build legislation that levels the playing field for American consumers and companies against China. https://t.co/spJyQ4peYP
2021-05-27 21:54:04+00:00,"The Senate voted to adopt the Trade Act of 2021, a bipartisan trade package that will help stand up our efforts in pushing back against China in the most critical arenas that we face – trade and our economy. https://t.co/W2aiv2yPTY"
2021-05-27 15:58:38+00:00,"Finding workers is one of the biggest roadblocks to returning to a strong economy. Expanded UI is no longer needed, and we’re also seeing huge amounts of fraud in the programs. It’s time to get America back to work. https://t.co/FZCpmWVA3C https://t.co/r2S86K0AUp"
2021-05-26 20:53:58+00:00,"Our good faith, bipartisan effort among various stakeholders and Members of Congress on The Trade Act of 2021 yields critical outcomes that will advance our strategic, economic and human rights interests regarding China, and it deserves a vote. https://t.co/np7JHEPnHA"
2021-05-26 19:43:15+00:00,"There's bipartisan agreement we shouldn't pick energy tax winners and losers, but most members on my side of the dais can't support a bill that eliminates all fossil fuel provisions and prevents bipartisan technologies from qualifying. https://t.co/LifP3wFTMh"
2021-05-26 15:37:43+00:00,I applaud the Administration and @USTradeRep @AmbassadorTai for taking action under #USMCA’s enforcement mechanisms to ensure Canada’s dairy commitment compliance.
2021-05-26 15:37:43+00:00,"The #USMCA isn’t a list of empty promises and hopeful wishes. It’s a binding Trade Agreement signed by all parties, and it is critical Canada comply with its dairy market access commitments. https://t.co/yiv4qSKion"
2021-05-26 12:44:01+00:00,"It must not become the case that once Congress approves a trade agreement, the Administration can simply alter or withdraw rights or obligations under a congressionally-approved trade agreement. Doing so only hurts Americans, and helps China &amp; Russia. https://t.co/DxPCWuWuwK"
2021-05-26 01:41:52+00:00,"Russia and China are a threat to American innovation. If we must stand together and waive the IP rights of Americans, the least we can do is insist that China and Russia not be allowed to take hard-earned U.S. technology.

https://t.co/eC0c31X6JP"
2021-05-25 20:16:05+00:00,Thanks to the @IDTechCouncil for allowing me to recognize the tremendous clinical research being done in Idaho. Their powerful group of experts recently showcased this incredible work and how it benefits Idaho’s citizens. https://t.co/b4TUmj3out
