Datetime,Text
2021-10-05 17:27:16+00:00,"Are you an Idaho high school junior/senior interested in pursuing a career in public service? If so, I encourage you to apply for the United States Senate Youth Program (#USSYP), which provides America’s future leaders with hands-on experience of the American political process. https://t.co/9GzkYsyMKa"
2021-10-04 16:57:46+00:00,Senator @RonWyden and I are working together on bipartisan legislation to address many of the behavioral health care challenges currently faced by millions of Americans. #MentalIllnessAwarenessWeek https://t.co/X331GmYnBv
2021-10-04 16:57:46+00:00,"This week is Mental Illness Awareness Week. Far too often, people across the country struggle to access timely, quality mental health care and substance use disorder services, &amp; the COVID-19 pandemic has exacerbated unmet behavioral health care needs. #MentalIllnessAwarenessWeek https://t.co/ZCl9pPv6CB"
2021-10-01 22:20:33+00:00,"The deadline to apply for a spring 2022 internship in one of my Idaho or Washington, D.C., offices is October 15—just two weeks from today! Read more and apply via my website: https://t.co/sVusgsnhbT"
2021-10-01 18:58:02+00:00,"I applaud @GovernorLittle, CBP, Idaho law enforcement and others bringing light to this issue and working to find commonsense solutions to the challenges we face with regard to the surge in opioids and fentanyl arriving at the southern border."
2021-10-01 18:58:01+00:00,"With CBP reporting 1.5M illegal bordering crossings during FY21, the Biden Admin must commit resources necessary to secure and strengthen our nation’s border enforcement, not implement policies incentivizing illegal migration by rewarding illegal entry. https://t.co/sqpLgSdR7d"
2021-09-30 16:38:44+00:00,"In response to the harmful tax penalties for married couples included in the Democrats’ reckless tax-and-spending spree, I joined colleagues in urging Senator Schumer &amp; Senator Wyden to remove any proposals that would discourage marriage. https://t.co/Y07bZGcdvM https://t.co/l3urJ8G3Wu"
2021-09-29 21:01:14+00:00,"The Senate unanimously agreed to a Resolution I introduced highlighting the important role of forensic science professionals in the investigation, prosecution &amp; conviction of crimes, as well as exoneration of the innocent. https://t.co/bySIjNXquG https://t.co/rvR3plHnOx"
2021-09-29 17:12:17+00:00,"My column this week highlights how the Biden Admin's planned IRS reporting scheme would turn every American’s local bank, credit union &amp; payment provider into an IRS agent, monitoring &amp; reporting on deposits &amp; withdrawals made in private accounts. https://t.co/mEKmOzV7VJ"
2021-09-28 16:34:40+00:00,"The haphazard withdrawal from Afghanistan, based on an arbitrary timeline, was a failure of presidential leadership. This legislation will address outstanding issues related to the Biden Administration’s rushed and disastrous withdrawal from Afghanistan. https://t.co/0oHnzRVG2p"
2021-09-27 22:57:09+00:00,My statement regarding the Senate’s action on two Continuing Resolution proposals: https://t.co/N8efHcvV7S
2021-09-26 15:44:58+00:00,"On #GoldStarMothersDay, we acknowledge each family who has lost a son or daughter during war. We honor the legacies of the brave individuals who gave their lives in defense of this nation, and the families they left behind. We are forever in their debt. https://t.co/DF4j2fvvbm"
2021-09-24 17:16:58+00:00,"This analysis shows that less than 1/3 of all Americans will benefit from Democrats’ tax plans, with more than 2/3s experiencing no benefit or facing immediate tax hikes. The middle class and small businesses in particular will be getting very little—except for more taxes. https://t.co/eOFhX2mFYG"
2021-09-24 17:16:57+00:00,"A new analysis by the non-partisan @jctgov shows how few taxpayers will meaningfully benefit from the bill recently approved by the House Ways and Means Committee, and that taxpayers across all income levels will face a tax increase under the bill. https://t.co/m6KvTFiKnr"
2021-09-23 21:13:24+00:00,"#ICYMI, @SenatorRisch &amp; I shared a column on the Dems’ reckless tax-and-spending legislation, detailing the dangers of their unprecedented, far-reaching and highly disruptive legislation, and how we cannot tax and spend our way into a stronger economy. https://t.co/18A7iy895S"
2021-09-23 19:07:25+00:00,"As @LeaderMcConnell said today, “Our Democratic colleagues have about a month.  Plenty of time to do their job as a unified government and protect the full faith and credit of the United States.”  https://t.co/7lhrQHxmOJ"
2021-09-23 19:07:25+00:00,"Democrats should use their tools and act by themselves, like they’re doing with their reckless tax and spending spree, to raise the debt limit and avoid default."
2021-09-23 17:10:51+00:00,"Our southern border has seen a 317% increase in migrant encounters compared to last August, which has led to an increase in human trafficking and drug smuggling. The Biden Administration must do more to combat this critical national security issue. https://t.co/ij8Z5BJLfQ"
2021-09-22 21:04:22+00:00,"For more than a decade, I have introduced legislation to compensate downwinders, and, sadly, we are losing many to old age and cancer. Congress must pass this critical bill while there is still time to assist those still with us. https://t.co/ULTdnNYEWY"
2021-09-22 21:04:21+00:00,"Today I introduced the Radiation Exposure Compensation Act (RECA) with @SenatorLujan, a bipartisan bill designed to expand eligibility under the RECA program to those who have suffered from cancers related to fallout from above-ground nuclear weapons testing in the 50s &amp; 60s. https://t.co/Jr4jJVhLFw"
2021-09-22 18:06:31+00:00,Suicide affects people across the globe. #SuicidePreventionMonth is an opportunity to raise awareness and reduce the stigma around seeking help. Please reach out to resources like the Idaho Suicide Prevention Hotline if you are in need of assistance.
2021-09-21 20:13:58+00:00,"The Democrats’ partisan $3.5T reckless tax-and-spending spree will likely stunt our economic recovery, further impede labor markets &amp; punish low- and middle-income workers w/ higher prices for everyday goods &amp; services. https://t.co/7343WUx5SX"
2021-09-21 18:39:33+00:00,"Democrats are proposing trillions of dollars in job-killing tax hikes that will hurt the middle class and help China. 

Tune in as I speak live on the Senate Floor at 4:15PM ET to discuss this out-of-control socialist spending agenda."
2021-09-21 14:42:25+00:00,"My heartfelt condolences to her sons Kenneth and David, her daughter Marilyn, her many grandchildren, and her friends and loved ones during this difficult time. She will be greatly missed."
2021-09-21 14:42:25+00:00,"U.S. Sen. Jim McClure owed much of his success to their partnership of over 60 yrs. Louise was a loving mother, a faithful friend, and a respected community leader. Her selflessness and enormous contributions to the arts has left an indelible mark on our state"
2021-09-21 14:42:24+00:00,"With the passing of Louise McClure, Idaho has lost one of its very best. I was privileged to call her a friend, and blessed to have worked with several generations of McClures. She was a devoted public servant and an inspiration to many. https://t.co/m5ly9urSOQ"
2021-09-20 17:18:23+00:00,"I have introduced legislation to push back on IRS overreach, and will continue to fight against this abuse of power. https://t.co/cReiYkriMa https://t.co/dsRKILJhwg"
2021-09-20 16:15:10+00:00,Democrats continue to push for a reporting scheme where financial intermediaries report to the IRS on customer deposits and withdrawals. This would be a huge violation of all Americans’ privacy. https://t.co/oVXa7sl9l2
2021-09-18 18:03:20+00:00,"Happy 74th birthday to the @USAirForce! God bless the dedicated Airmen who have served and continue to serve in defense of this nation. Thank you to all our Airmen, especially Idaho’s own @366FW Gunfighters, for your unwavering commitment to keep America safe. https://t.co/qVuh1wssRf"
2021-09-18 16:03:52+00:00,"Thank you to the members of the POW*MIA Awareness Rally Corp. of Pocatello, Idaho, and other similar groups for your unwavering commitment to keeping the need to bring all missing American servicemembers home at the forefront of our national focus. https://t.co/gyzlUHlFWj"
2021-09-17 22:41:46+00:00,"In honor of National POW/MIA Recognition Day, I honor the American servicemembers missing in action, prisoners of war, and their family and loved ones. #POWMIARecognitionDay https://t.co/joeLjw7htl"
2021-09-17 15:26:04+00:00,"In honor of #ConstitutionDay, my recent column outlined the magnitude of the U.S. Constitution, which promises Americans basic principles of individual rights &amp; freedoms, limited gov't, rule of law, sovereignty, separation of powers &amp; representative gov't. https://t.co/msCvg1CK01 https://t.co/oy0hxcwnxI"
2021-09-16 22:58:28+00:00,More Americans are coming to the realization the Second Amendment empowers law-abiding men and women alike to exercise their constitutional rights.
2021-09-16 17:35:15+00:00,It is fitting to posthumously award these heroic women and men for their valiant efforts to evacuate innocent American civilians and Afghan allies from the country.  They will never be forgotten. https://t.co/OBZH8sMZg1
2021-09-16 17:35:14+00:00,"I joined a bipartisan group of Senate colleagues to introduce a bill to award Congressional Gold Medals to the 13 American servicemembers killed during the heinous terrorist attacks in Kabul, Afghanistan, on August 26, 2021. https://t.co/K4oGTsg7tG"
2021-09-15 21:51:57+00:00,"These tax hikes would place U.S. companies at a severe competitive disadvantage to Chinese companies, meaning less domestic innovation, fewer American jobs, and increased reliance on foreign countries for critical technologies."
2021-09-15 21:51:56+00:00,Democrats’ crippling tax hikes would make the United States have the highest combined corporate rate among developed countries. https://t.co/sDO8sensoq
2021-09-15 21:51:55+00:00,"Democrats’ proposed tax increases would overwhelmingly apply to U.S.-based businesses, not their foreign competitors, enabling China to gain the global edge on jobs, investment &amp; innovation. https://t.co/WCSa1QYPor"
2021-09-14 21:42:41+00:00,We must make every effort to protect American taxpayers from further abuse. Glad to join my friend @SenJohnThune in introducing this bill.
2021-09-14 16:27:30+00:00,"I introduced the Tax Gap Reform and Internal Revenue Service (IRS) Enforcement Act with @WaysandMeansGOP leader @RepKevinBrady, legislation that places important guardrails around IRS funding to protect taxpayers’ rights and privacy. https://t.co/iP0mdfQzsr"
2021-09-14 16:27:29+00:00,"In light of proposals to massively expand the IRS, w/ unprecedented amounts of mandatory funding, &amp; the IRS’s continued abuses of taxpayer rights &amp; privacy, any additional IRS funding &amp; monitoring of Americans’ private finances must have guardrails to help protect against abuses. https://t.co/l0sVaYP92p"
2021-09-13 23:33:15+00:00,"I plan to reintroduce legislation to amend the Radiation Exposure Control Act, or RECA, to provide compensation for victims from Idaho who were affected by the radioactive fallout generated by those tests."
2021-09-13 23:33:14+00:00,"This past Saturday, Tona Henderson of Emmett, Idaho, led a rally to help memorialize and remember “downwinders”, which refers to victims of radiation exposure generated from Cold War-era above-ground nuclear arms tests. https://t.co/DnsFrp3pTj"
2021-09-13 21:16:02+00:00,"And, analysis performed by the non-partisan JCT shows increasing the corporate tax burden would disproportionately harm U.S. workers, retirees and small businesses. https://t.co/m6KvTFAlM1"
2021-09-13 21:16:01+00:00,A report by @ShopFloorNAM shows 1 million jobs and $107 billion in GDP would be lost in the first two years after raising the tax gap to 25%.  House Democrats have proposed hiking it to 26.5%. Read more: https://t.co/m5jXaWtFwT
2021-09-13 17:01:28+00:00,"Thanks to the efforts of LCpl Bill Klobas’ daughter, Casey Byington, &amp; the contributions of others, LCpl Klobas was formally pinned with his Purple Heart medal in Pocatello, on June 18, 2021. Thank you, Bill, for your unwavering commitment to this nation. https://t.co/LQJ6GdkMXv"
2021-09-13 17:01:28+00:00,"He was immediately medevaced &amp; treated for his injuries. But despite his injuries &amp; meeting the criteria for the Purple Heart, LCpl Klobas did not receive the award until 52 years after his injury because TBIs were not initially recognized for consideration of a Purple Heart. https://t.co/3VsUKuYfO7"
2021-09-13 17:01:26+00:00,"On this #MilitaryMonday, I honor veteran Lance Corporal (LCpl) Bill Klobas, who served in the @USMC in 1968 &amp; 1969 with India Company 3rd Battalion, 7th Marines. During his service, LCpl Klobas was injured by friendly fire due to a miscommunication for artillery support. https://t.co/RAP1RcTxjC"
2021-09-10 20:04:50+00:00,"I’ve introduced legislation with @SenatorBurr to reduce the price of Rx drugs and make all health care services more affordable and accessible. Market-based competition, innovation and transparency are what we need, not bureaucratic standards.  https://t.co/gSLf3hV5Qr"
2021-09-10 18:53:17+00:00,"Under the guise of negotiation, the government would be empowered to set a maximum fair price for drugs and apply bureaucratic standards that determine the value that cures and therapies bring to American lives. https://t.co/hlV15QujIQ"
2021-09-10 18:53:16+00:00,Democrats are proposing sweeping government price controls on our nation’s health care innovators as part of their reckless tax + spending spree. https://t.co/PVghF5gdgz
2021-09-09 23:11:32+00:00,My statement on the Biden Administration’s new federal COVID-19 mandates. https://t.co/aZgi7D42G9
2021-09-09 22:24:46+00:00,"As if this proposal could not be worse, the data provided to the IRS would have almost no value in fighting tax evasion. The era of big data should not be viewed as an opportunity for big brother.  https://t.co/Py8M2foCBQ"
2021-09-09 21:24:28+00:00,Privacy concerns at the IRS have only been recently amplified by a leak of thousands of private taxpayers’ information out of the IRS. https://t.co/HjPkgG9M7I
2021-09-09 20:49:37+00:00,"The requirement pulls law-abiding Americans into a dragnet, exposing sensitive data to future breaches, burdening financial institutions, and encouraging the growth of shadow banking. This is a huge violation of the privacy of all Americans.  https://t.co/sAOaNlNUV5"
2021-09-09 20:17:23+00:00,"This time-draining burden disregards banking privacy in order to squeeze more resources out of responsible Americans and entrepreneurs. I offered an amendment to block the provision, which Democrats rejected. https://t.co/3T6rIl5vKd"
2021-09-09 18:55:03+00:00,The Director of the ATF must have an established commitment to protect Americans’ constitutional rights. The withdrawal of David Chipman's nomination is welcome news for those who support the right to bear arms enshrined in our Constitution.
2021-09-09 16:31:31+00:00,"Democrats want to nearly double the IRS’s budget, without increasing its accountability. The proposal also calls for a mandatory financial-information reporting regime, under which financial institutions would become agents of the IRS. https://t.co/bwgYJOhvqY"
2021-09-08 23:18:37+00:00,"A supersized capital gains tax hike would be a powerful disincentive to small businesses, savers and retirees, and entrepreneurs and innovators who power our economy, and harm all Americans regardless of their financial circumstances or goals. https://t.co/ICzWbSRsQW"
2021-09-08 16:59:38+00:00,"Members of both parties have long agreed on a key tool to encourage these goals for all Americans, specifically, a lower tax rate on long-term capital gains. https://t.co/kHsRyJvsjq"
2021-09-08 16:59:27+00:00,"For decades, Republicans and Democrats have recognized the importance of encouraging people to save for their future goals, including starting a business, saving for retirement, achieving financial independence, or buying a home or a car."
2021-09-07 21:26:51+00:00,The step-up in basis is not a loophole and has intentionally been part of the tax code for decades. https://t.co/nGxcWVkkdr
2021-09-07 17:55:47+00:00,"ICYMI, my friend @ChuckGrassley had a great piece in the WSJ last month. The Democrats’ proposed double-death tax would suffocate economic growth, job creation and capital formation needed to improve productivity and reduce inflation. https://t.co/G7w2DaElDQ"
2021-09-07 15:50:10+00:00,"Failure to hold a full, open markup will further erode the American people’s trust in the Senate as an open and effective institution, substituting a secretive process behind closed doors for a productive public dialogue."
2021-09-03 17:31:45+00:00,The Biden Administration is using the negotiations at the OECD to compel Congress to make aggressive U.S. tax law changes undermining Congress’s authority.
2021-09-03 17:31:45+00:00,I sent a letter with @WaysandMeansGOP Ranking Member @RepKevinBrady to our Dem counterparts outlining concerns w/ the approach the Biden Admin has taken in international tax negotiations at the Organisation for Economic Co-operation and Development (OECD). https://t.co/abokuBz2e9
2021-09-02 22:31:58+00:00,"ICYMI: In my column this week, I highlighted securing resources for Idaho crime victims and victims across the country through the Victims of Crime Act (VOCA) Fix to Sustain the Crime Victims Fund Act of 2021, or VOCA Fix Act, &amp; other legislative actions. https://t.co/1ata2CL2ai https://t.co/fyZEVXHbgm"
2021-09-01 20:52:58+00:00,Yesterday’s reports on the financial status of various Medicare and Social Security trust funds once again identify unsustainable benefit promises in Medicare and Social Security programs. Read my statement on the reports here: https://t.co/Qvhc9WIKAW
2021-09-01 14:57:27+00:00,I joined @SenatorHassan in sending a bipartisan letter urging the @DeptVetAffairs to swiftly develop &amp; conduct outreach to veterans of the Global War on Terrorism--especially those who served in Afghanistan--providing them with mental health resources. https://t.co/lglLi8vALo
2021-09-01 14:57:26+00:00,"As Americans, we have a duty to care for our nation's veterans, who have served in Afghanistan and across the globe, who gave everything they have to defend our freedom. With the recent events in Afghanistan, we must ensure they have the support they need here at home."
2021-09-01 14:16:36+00:00,"Programs like Medicare Advantage have successfully shown that diverse, high-quality plans, not government one-size-fits-all health coverage, work best for patients. Proposals to make cuts to the program would harm the very people it's intended to help: https://t.co/gy9qApV3R0"
2021-08-31 21:03:42+00:00,"Idahoan Kory Puderbaugh has done it again, earning his second silver medal with the @usawchrugby team at the #TokyoParalympics (his first medal was in 2016). Congratulations on the tremendous win, Kory! We're proud of all you have achieved!"
2021-08-31 20:27:29+00:00,Congrats to Idahoan Kate Shoemaker on reaching the podium for the first time at the #TokyoParalympics! Kate helped #USAParaDressage earn bronze and its first-ever medal at the #Paralympics. Way to represent the Gem State well on the big stage!
2021-08-31 16:50:07+00:00,"The sacrifices made by our servicemembers over the last 20 years cannot be understated.  They have served with valor, distinction and honor."
2021-08-31 16:50:07+00:00,"I offer my thanks to both diplomatic and military personnel charged with an impossible mission in this limited amount of time, and continue to pray for the families and friends of the 13 brave servicemembers we lost in this endeavor."
2021-08-31 16:50:06+00:00,The Administration’s string of colossal failures regarding this withdrawal must be brought to light.  It is imperative Congress conduct oversight of our withdrawal from Afghanistan and ensure full accountability. https://t.co/BNfqcFHY4D
2021-08-31 16:50:06+00:00,"America’s longest war has now concluded.  With the news the United States officially completed its mission in Afghanistan, many questions remain about the poor execution of our withdrawal in the region. https://t.co/FjYfQhD5SP"
2021-08-30 20:48:49+00:00,"My prayers are w/ the family &amp; loved ones of the 13 U.S. servicemembers killed in last week’s terrorist attacks, &amp; with all the other heroes who have gone above &amp; beyond the call of duty to protect Americans &amp; our allies. Their selfless service &amp; sacrifice will not be forgotten."
2021-08-26 20:10:55+00:00,"The President must do more to secure the lives of Americans and our allies in Afghanistan, no matter how long it takes. We cannot allow terrorists to dictate the terms when it comes to the safety of Americans. Arbitrary deadlines do not matter when so many lives are at stake."
2021-08-26 03:26:35+00:00,"It’s not just farms and ranches – it’s small businesses, too. Read to see how some small business owners could be wiped out by a higher capital-gains rate: https://t.co/HuWPHnaIXR"
2021-08-26 01:36:08+00:00,"A study conducted by the Family Business Estate Tax Coalition estimates that repealing the stepped-up basis provision could kill 800,000 jobs over the course of a decade and could lower wages of U.S. workers by $32 for every $100 raised. https://t.co/y5MWghNea6"
2021-08-25 22:19:32+00:00,"Worse, the Democrats’ plan would tax these businesses on simple inflation, sticking them with the bill for reckless inflationary tax-and-spend policies enacted by politicians in Washington. https://t.co/uY8jWbyBID"
2021-08-25 21:10:04+00:00,"Democrats want to create a double death tax by eliminating the benefit of this step-up in tax basis, including for small businesses, farms and ranches passed down from one generation to the next at death. My friend @SenJohnThune explains it well: https://t.co/wV0cooJKhV"
2021-08-25 21:10:03+00:00,"Today, family businesses passed down at death are subject only to estate tax and not an additional income tax.  Instead, a business’s tax basis is increased or “stepped up” to fair market value, sparing the next generation a large capital gains tax bill."
2021-08-25 00:05:28+00:00,I recently spoke with @HolmesJosh about some of the international tax policies in the Democrats’ reckless tax and spending proposal. Listen to our discussion here: https://t.co/peeazvOdpq
2021-08-24 19:33:00+00:00,"According to data reported in @taxnotes, top tech companies are estimated to have brought back a “whopping $59.8 billion into the United States in 2020 because of the TCJA. (2/2)"
2021-08-24 19:32:59+00:00,The Tax Cuts &amp; Jobs Act (TCJA) international tax provisions are working—tech companies are bringing profits back to the US in record numbers. (1/2)
2021-08-24 17:17:50+00:00,"For veterans impacted by the news of the last few weeks, please reach out if you need help. The Veterans Crisis Line is 1-800-273-8255. Please check in on your veteran friends, family &amp; neighbors. Let them know their service is valued and not forgotten. https://t.co/64OS0oN2Gg"
2021-08-24 01:07:21+00:00,The Administration’s int'l tax proposal seems designed to re-ignite the job-crushing inversions and foreign acquisitions of American companies that the Obama Administration faced. There's no reason to tax our businesses into moving abroad. https://t.co/mA1K8Y6gon
2021-08-24 01:07:20+00:00,". @WaysandMeansGOP Ranking Member @RepKevinBrady and I have consistently said the Administration should not surrender jobs, growth, or tax revenues to other countries in order to advance a partisan tax increase agenda at home. https://t.co/91zACqtxfo"
2021-08-23 21:03:20+00:00,"They fail to acknowledge that the tax increases in their plan will rocket the United States back into the outlier position it once occupied compared to peer nations.  Once again, we will have the highest tax rates of the developed world, or at least very near the top."
2021-08-23 21:03:19+00:00,"The Democrats’ tax plan would reverse the smart policies the Tax Cuts and Jobs Act adopted, once again raising the relative cost of doing business in America and punishing American businesses selling their products or services overseas. https://t.co/mCvVA7CCuy"
2021-08-23 02:48:48+00:00,"Regardless of the merits and drawbacks of the decision to withdraw from Afghanistan, the United States has a responsibility to those who are now at risk because of that decision and its execution by this administration. https://t.co/kIMyuE3gv4"
2021-08-23 02:48:47+00:00,"Now that the Taliban have taken over the majority of Afghanistan’s urban centers, many Americans and vulnerable Afghans are trapped without the ability to leave the country."
2021-08-22 19:07:48+00:00,"The President says he’s not going to raise taxes on anyone making more than $400,000 a year. The reality is a corporate tax is born primarily through workers, their wages and their benefits. https://t.co/Qr53SPcngh"
2021-08-20 23:45:10+00:00,"The reckless tax and spending spree recently proposed by the Democrats creates a double death tax by eliminating the benefit of the step-up in tax basis that accrues to small businesses, farms, and ranches passed down from one generation to the next at death. https://t.co/JQoirngPot"
