Datetime,Text
2022-03-10 16:35:03+00:00,"Congress must bring more pressure against Russia. I’ve introduced legislation that reflects a bipartisan, bicameral agreement to ban the import of energy products from Russia, and to suspend permanent normal trade relations with Russia and Belarus. https://t.co/Mic8PzD8i4"
2022-03-10 14:37:08+00:00,"The Administration’s reckless spending and misguided energy policies have led to record-breaking inflation. While Russian aggression and necessary responses are sure to push prices even higher, skyrocketing inflation has been more than a year in the making. https://t.co/ZtjswHKHxt"
2022-03-09 20:33:51+00:00,"Energy independence is a matter of national and economic security.  Now is the time to develop and tap into the resources here at home, not diminish them. https://t.co/P2EEgwudYh"
2022-03-08 16:35:49+00:00,Energy independence is a matter of national and economic security. Fed efforts to develop regulations that limit U.S. energy producers’ access to credit and capital are unprecedented and alarming.
2022-03-07 19:43:16+00:00,The Senate's passage of the Health Care for Burn Pits Veterans Act is a critical step toward ensuring our veterans have access to the services and care they have earned. https://t.co/FTHXjEn21q
2022-03-07 15:07:08+00:00,"This private-sector-driven initiative will help to drastically lower insulin costs for Idahoans, which is even more vital during this time of high inflation and economic uncertainty."
2022-03-07 15:07:07+00:00,"I commend @bluecrossidaho and Civica for taking steps to cut costs for these life-saving drugs through free-market competition and American manufacturing, delivering affordable access to insulin in communities across Idaho and the rest of the nation. https://t.co/WcOhNKY0AS"
2022-03-06 19:02:38+00:00,"My column addresses the 2022 tax filing season, which is shaping up to be a frustrating mess. The IRS must use its existing authorities to immediately provide targeted, temporary relief to taxpayers and reduce backlogs. https://t.co/8tPTCmIY4O"
2022-03-05 16:51:37+00:00,"As global demand for energy continues to increase, we can address the harmful effects of inflation and continue to crack down on Russia by supporting and increasing America’s energy independence."
2022-03-05 16:51:36+00:00,"W/ the Russia-Ukraine war at the forefront, I asked Fed Chair Powell if he expects strains on the oil or energy markets to increase inflation, given Russia’s role as a major oil and gas exporter. He indicated the short term impact would be great, adding to inflationary pressures. https://t.co/1SWj5WfH2Q"
2022-03-04 18:08:54+00:00,"On behalf of all Idahoans, congrats to Dani Aravich, Jesse Keefe, Jake Adicoff &amp; Josh Sweeney on representing the U.S. at the 2022 #WinterParalympics. We're wishing nothing but the best for each of you, and will be cheering you on each step of the way. https://t.co/ArwbfXUjuD"
2022-03-04 16:18:42+00:00,"169 years ago today, President Lincoln signed congressional action that would create the Idaho territory. Happy #IdahoDay as we commemorate the occasion and celebrate our state's rich history and bright future. https://t.co/YaTBuoEhe9"
2022-03-03 22:30:37+00:00,"The notion that we should use our fed regulatory authorities to decide which industries are optimal &amp; restrict those we don’t like from having access to capital is alarming. This mimics the Obama-era Operation Choke Point, which I have fought for years.  https://t.co/5Vrk7t9QuA"
2022-03-03 22:30:36+00:00,"I asked Federal Reserve Acting Chair Jerome Powell if he believes the Federal Reserve should pursue standards in its supervisory capacity to stop or restrict so-called “sub-optimal industries” from having access to capital. He responded by simply stating, “No, I do not”. https://t.co/TOfGUMJB07"
2022-03-03 19:01:20+00:00,"Putin miscalculated the will of Ukrainians to fight for their own freedom, &amp; the support from NATO countries &amp; other parts of the world against Russia’s barbaric actions. We must continue to support efforts to deter Russia’s aggression &amp; support the resilient Ukrainian people. https://t.co/tn3s4VT8M0"
2022-03-03 17:44:30+00:00,"Sarah Bloom Raskin continues to evade important questions raised by several members on the Banking Committee, and the Committee should not be compelled to move forward with considering her nomination until she has adequately addressed those outstanding concerns."
2022-03-03 16:43:13+00:00,"While inflation continues to hammer Americans’ pocketbooks, it is also contributing to our skyrocketing federal debt that will burden future generations. More reckless spending will only add fuel to the fire.  https://t.co/EET1pMf1IN"
2022-03-02 21:11:12+00:00,"The Biden Administration wants $30B more for COVID relief, amid major concerns over the accounting of existing relief funds. Americans needs answers on the allocation of funds before considering additional COVID relief. https://t.co/xv4p6GUoiJ"
2022-03-02 17:41:11+00:00,"Due to a scheduling conflict, I can no longer attend this event, but I encourage you to watch to understand the urgent need to move forward on this legislative path to provide support for Ukraine’s ability to defend itself, while imposing real costs on Russia for its actions."
2022-03-02 15:07:17+00:00,"At 2:00PM ET, I’ll be joining @SenatorRisch &amp; Republican colleagues to discuss the Never Yielding Europe’s Territory (NYET) Act, which imposes immediate, massive economic consequences to Russia’s economy and supports Ukraine. You can watch live on CSPAN or the @SenateGOP channel."
2022-03-02 03:26:14+00:00,My statement following President Joe Biden’s State of the Union Address. https://t.co/pOGOa6HTQp
2022-03-01 17:28:06+00:00,"I co-sponsored the Senate Resolution designating today as Yellowstone National Park Day and detailing how the region was set aside to preserve and protect the vast wildlands in Idaho, Wyoming and Montana. #Yellowstone150"
2022-03-01 17:28:05+00:00,"Today is Yellowstone National Park Day, honoring the 150th anniversary one of our nation’s crown jewels and first national park. I will continue to support policies that protect ecological health and facilitate the sustainable use of our public lands area for generations to come https://t.co/r4BkZQ5W4T"
2022-02-28 21:39:31+00:00,This technical fix for the SRS extension in the IIJA will ensure stability for counties who receive payments under the program. SRS is essential for rural counties across Idaho and the West.
2022-02-25 23:34:41+00:00,It was an honor to meet with the outstanding young Idahoans who have been nominated to our prestigious military academies. I thank each of them for their commitment to service and look forward to seeing them achieve great things throughout their careers. https://t.co/kPJQnZoV3b
2022-02-25 20:38:24+00:00,My statement regarding President Joe Biden’s nomination of Ketanji Brown Jackson to serve as Associate Justice of the United States Supreme Court. https://t.co/3KdqUizbKC
2022-02-24 20:54:25+00:00,Congress must pass the #NYETAct now.
2022-02-24 19:19:17+00:00,My statement regarding the Russian invasion of Ukraine: https://t.co/3PrAF7G8MU
2022-02-23 20:37:41+00:00,"While Idaho has taken major steps to encourage economic growth, rising inflation from the Biden Admin's excessive spending continues to be problematic. Moody’s Analytics estimates inflation costs the average U.S. household $276 per month. https://t.co/ByFxXhwX5x"
2022-02-21 16:56:01+00:00,"""The name of American, which belongs to you, in your national capacity, must always exalt the just pride of patriotism...""

― George Washington's Farewell Address to the people of the United States

Happy #PresidentsDay. https://t.co/zlG8i2c5fH"
2022-02-19 21:32:58+00:00,"80 years ago today, more than 120,000 Japanese Americans were unjustly incarcerated around the country, including in Idaho. We must continue to learn from the grievous mistakes of our past and remain vigilant in our efforts to support fundamental freedoms. #DayofRemembrance https://t.co/1OYL04DpYa"
2022-02-19 17:16:17+00:00,Idahoans should not be forced to pay the toll of giving up their most personal information--biometric data--or return to the era of a paper-driven bureaucracy where information moves slow and is inaccurate.
2022-02-19 17:16:16+00:00,"#ICYMI, my recent column highlights the Finance Committee’s oversight efforts to prevent the IRS from collecting invasive private information from taxpayers. https://t.co/opVu14Ym3i"
2022-02-18 19:29:20+00:00,The United States will not stand idly by and allow Russia’s malign activities to continue against Ukraine.
2022-02-18 01:05:37+00:00,"Theron belongs to a member of my staff, and today was his first day"
2022-02-18 00:58:41+00:00,"Welcome to the Crapo staff, Theron! https://t.co/9I4bfL8WsA"
2022-02-17 22:28:59+00:00,The 2022 tax filing season is shaping up to be the most challenging and frustrating in decades. The IRS can—and should—do more to help taxpayers. https://t.co/RdmzWFjSsk
2022-02-17 17:00:20+00:00,"A mask mandate on Idaho toddlers &amp; children participating in Head Start programs is the latest example of an unreasonable one-size-fits-all, heavy-handed bureaucratic intrusion by the federal gov't. Parents deserve a say in the health of their children. https://t.co/LyXYwzRrWE"
2022-02-16 23:02:44+00:00,"Americans are painfully aware that inflation has soared to 7.5%, the highest rate since 1982. This is clearly a result of excessive overspending, and more spending and tax hikes will only make things worse. https://t.co/gAWApkrijQ"
2022-02-16 16:01:27+00:00,Right now I'm leading my fellow Senate Republican colleagues in a news conference to discuss sky-high inflation. https://t.co/6sw2SW2hCN
2022-02-16 14:32:10+00:00,Tune in today at 11:00AM ET as I lead Senate Republican colleagues in a news conference to discuss record-high inflation.
2022-02-15 23:01:15+00:00,"I met with the Idaho Association of Counties to discuss various natural resource issues. Idaho is home to large swaths of federal land, and I continue to work on policies to provide fiscal stability to local governments across the state. https://t.co/epSsnxQP2E"
2022-02-15 21:08:16+00:00,"As inflation continues to hammer Americans’ wallets, it also increases deficits and debt, and acts like a stealth tax on households and businesses. We’re asking the CBO for information on inflation’s harmful effects on the federal budget. https://t.co/DQWVo7OddU"
2022-02-15 20:10:13+00:00,The United States Capitol Building and Senate Office Buildings belong to the American people. It's past time we reopen these historic buildings to the public to facilitate participation in the legislative process fundamental to our republic. https://t.co/nsXgPV38wM https://t.co/jnPv8zLIhj
2022-02-15 16:30:05+00:00,"We have the opportunity to better support children, their families, and their providers, by enhancing mental health outcomes. This must be achieved with bipartisan and fiscally responsible solutions. Watch my statement at a hearing on youth mental health: https://t.co/0Lm3i1kUrI"
2022-02-14 22:17:26+00:00,"Thank you, SFC Browning, for your service to this country. Your bravery, selflessness and courage cannot be commended enough. Idahoans and Americans across the nation are proud of you and your efforts to uphold the ideals of freedom. Read more: https://t.co/TrgSwDRNK2"
2022-02-14 22:17:25+00:00,"SFC Browning was deployed to Iraq and Afghanistan on separate occasions, where he operated on the front lines as a 13F Forward Observer, working to find enemy positions and call in support, and also advised his Battalion Commander on fire support options and assets. https://t.co/rRrn3ljfsH"
2022-02-14 22:17:24+00:00,"On this #MilitaryMonday I honor Army National Guard Sergeant First Class Sam Browning, who has served valiantly as a member of Idaho National Guard and the Army Reserve 1016th out of Pocatello. https://t.co/Iek0IQ225E"
2022-02-14 18:43:01+00:00,"With her 11th career Olympic goal today, Idaho’s @HilaryKnight has become the third leading scorer in U.S. Olympics Women’s Hockey history. Congrats @USAHockey on the big win! We’ll all be rooting for you in the gold medal game."
2022-02-12 18:08:35+00:00,"LCMCA would cap out-of-pocket spending for all Medicare Part D enrollees, alleviating catastrophic burdens for millions of seniors; make insulin more affordable; allow seniors to better manage annual out-of-pocket spending &amp; advance dozens of other pro-patient policy solutions. https://t.co/2KjlJoitAE"
2022-02-12 18:08:34+00:00,"As inflation soars, Congress must seek out solutions that reduce consumer costs while spurring a strong economic recovery. My column this week highlights the Lower Costs, More Cures Act, which I introduced to improve prescription drug affordability. https://t.co/ylvyeIVK0S"
2022-02-10 21:42:00+00:00,Americans should not be forced to pay the toll of giving up their most personal information--biometric data--or return to the era of a paper-driven bureaucracy.  https://t.co/en7ohgRMrM
2022-02-10 20:44:05+00:00,This tax filing season is widely expected to be one of the most challenging in recent memory. The IRS should use its existing authority to provide maximum relief to taxpayers during this frustrating time.  https://t.co/IX6MuIloQn
2022-02-10 20:23:22+00:00,"The LCMCA is a comprehensive, market-based approach to leveraging competition, flexibility and transparency to bring affordable drugs to patients without stifling innovative growth and research."
2022-02-10 20:23:10+00:00,"Instead of pursuing socialist price fixing legislation, my colleagues should instead consider supporting the Lower Costs, More Cures Act (LCMCA). https://t.co/EdyvGU2G4M"
2022-02-10 19:44:12+00:00,"Anti-Semitic actions and behavior are wholly unacceptable. 
https://t.co/Uvte648x9H"
2022-02-10 14:21:47+00:00,"Inflation continues to accelerate, hitting highs not seen in 40 years. Americans are paying more for everything, and wages aren’t keeping up. Unnecessary deficit spending contributed to this stealth tax, and more reckless spending will add fuel to this inflation fire. https://t.co/EcLkddTcyg"
2022-02-08 22:52:01+00:00,"Today, I met with Canyon Co. Sheriff Kieran Donahue &amp; Bonneville Co. Sheriff Sam Hulse to discuss how we can better support Idaho law enforcement at the federal level &amp; address issues affecting the law enforcement community. Thank you for your service, Sheriffs Donahue &amp; Hulse. https://t.co/vi9XcUaXs5"
2022-02-08 16:21:48+00:00,Congress has the opportunity to address the serious mental health challenges Americans face. Consensus-driven and fiscally responsible policies will drive better outcomes for everyone on this important issue. My statement at a hearing on youth mental health is below: https://t.co/loWvJSjDJW
2022-02-08 15:31:56+00:00,The IRS should be focused on protecting taxpayers’ data and preventing fraud – not exposing them to unnecessary facial recognition or bank reporting requirements. https://t.co/5McWbYm76G
2022-02-08 15:31:56+00:00,"We need to know what verification tools the IRS plans on transitioning to, and what data security measures are in place to protect individuals’ privacy when they create or access accounts online."
2022-02-07 20:29:20+00:00,"We all have a responsibility to ourselves and future generations to preserve, protect and enhance our natural environment. Allowing work to move forward in responsibly cleaning up mines that negatively affect the environment is critical to that endeavor. https://t.co/ttiUXIDIVV"
2022-02-07 20:29:20+00:00,"Introduced the Good Samaritan Remediation of Abandoned Hardrock Mines Act w/ @SenatorRisch, @MartinHeinrich &amp; others to remove bureaucratic hurdles hindering the efforts of “Good Samaritans” groups to clean up &amp; improve water quality in &amp; around abandoned hardrock mines."
2022-02-07 16:56:43+00:00,ICYMI: Congress should close the book on the failed Book Minimum Tax https://t.co/W4DFBjje9U
2022-02-05 21:31:44+00:00,"This raises serious concerns regarding confidential taxpayer information and fundamental civil liberties. I've asked the IRS for more information, and will be following this closely."
2022-02-04 18:11:26+00:00,"Best of luck to the Idahoans and all American athletes suiting up for @TeamUSA at the #WinterOlympics2022. I'll be praying for our athletes' success and safety while competing under the shadow of the Chinese Communist Party.

We'll be rooting for you every step of the way!"
2022-02-03 20:01:32+00:00,This raises a host of serious concerns regarding taxpayers’ privacy and civil liberties. Read here to see a full list of questions and concerns Senate Republicans are raising: https://t.co/69WtIuAKST
2022-02-03 20:01:31+00:00,The Internal Revenue Service (IRS) announced a major expanded collaboration with a private company that would require taxpayers to submit intrusive identity verification measures to access basic IRS online services.
2022-02-02 17:53:51+00:00,"I support a robust market for clean fuels and transportation that makes adoption of EVs and other innovative technologies more affordable and attainable, but we should not undermine the foundation of what makes our markets so successful. https://t.co/jN429pxGnk"
2022-02-02 17:53:51+00:00,The electric vehicle (EV) tax credit provisions in the Build Back Better Act would limit consumer choice; discriminate against right-to-work states and those who choose not to unionize; subsidize luxury vehicle purchases by the rich; and hamstring our global competitiveness. https://t.co/kFFyxIVSFo
2022-02-02 16:20:41+00:00,"A book minimum tax would overwhelmingly hit American manufacturers and supply chains, as well as undercut critical research and development and investment in renewable energy and emerging technologies. Now is not the time to resurrect this harmful policy. https://t.co/7FXzxrAZpw"
2022-02-01 21:42:51+00:00,She also shared the results of the 2018 investigation conducted by an outside law firm. https://t.co/SMhQC6yID0
2022-02-01 21:42:29+00:00,FDIC Chairman Jelena McWilliams issued a response to my letter requesting an update on the steps the FDIC has taken to address concerns regarding Operation Chokepoint.  https://t.co/d0bYN3w7Fn
2022-01-31 18:31:38+00:00,Idahoans and all Americans are experiencing inflation’s sting – especially those in lower income brackets.
2022-01-28 16:06:29+00:00,"PCE inflation has taken off under Biden, from 1.4% at the beginning of the last year to December’s 5.8%.  Runaway inflation continues to hit Americans in their pocketbooks and in store aisles. https://t.co/ij0pHi0v1d"
2022-01-28 16:06:28+00:00,"Prices for goods and services are rising at the fastest pace in decades.  According to data released today, inflation in the personal consumption expenditures (PCE) price index was 5.8% on a year-over-year basis in December, well above the Federal Reserve’s 2% target."
2022-01-27 21:39:49+00:00,I’ve joined congressional sponsors of RECA Amendments and leading advocates to continue the push for Congress to strengthen RECA.  Time is running out for those still with us. The U.S. must act now to ensure downwinders are eligible to receive the compensation they deserve. https://t.co/Cb2mHaGUqw
2022-01-27 21:39:48+00:00,"Today, the National Day of Remembrance for Downwinders, is an important day to remember the far too many innocent victims lost to cancer-related deaths from radiation exposure due to above-ground nuclear weapons testing. https://t.co/LqpYN7r15O"
2022-01-27 17:00:24+00:00,"On Holocaust Remembrance Day, we remember and honor the six million Jewish victims of the Holocaust, as well as the millions of other victims of Nazi hatred programs. #NeverForget https://t.co/cpkb8p3GPH"
2022-01-26 22:30:39+00:00,They should put aside these bureaucratic plans in favor of bipartisan solutions to drive down spending at the pharmacy counter and the doctor’s office. https://t.co/l8prYx47hI
2022-01-26 22:30:38+00:00,"By continuing to push for their budget-breaking tax-and-spending package, Democratic leaders have prioritized partisan politics over the needs of American families. https://t.co/KJcF3dTduq"
2022-01-25 22:08:22+00:00,".@SenatorTimScott’s FDIC Board Governance Reform Act, of which I am a co-sponsor, is designed to better insulate the agency from political interference, and will help preserve the FDIC’s storied history as an independent federal bank regulator."
2022-01-25 22:08:22+00:00,Actions taken by CFPB Director Rohit Chopra and Martin Gruenberg undercut the integrity of the FDIC. https://t.co/ejhXCGBR7N
2022-01-25 18:55:10+00:00,"Unnecessary deficit spending contributed to the high and persistent inflation Idahoans are experiencing, and additional spending will only make it worse."
2022-01-25 17:06:23+00:00,"The EV tax proposals in Democrats’ “Build Back Better” bill would:
  - Limit consumer choice ✅ 
  - Discriminate against workers who don’t unionize ✅ 
  - Subsidize luxury vehicle purchases for the wealthy ✅ 
  - Hurt American global competitiveness ✅ https://t.co/GhbDZkQ1Oz"
2022-01-24 21:01:08+00:00,"During the Obama era, federal agencies engaged in “Operation Choke Point"".  I sent a letter to FDIC Chairman McWilliams requesting transparency on steps taken to address concerns about it and related 2018 investigation. https://t.co/RAjvgMiIzI"
2022-01-23 18:56:37+00:00,"I will continue to advocate for responsible, proven fiscal policies, and to fight against misguided proposals that do nothing to address Americans’ immediate concerns with rising inflation and our recovery from the pandemic. https://t.co/ExWlNDA6zl"
2022-01-23 18:56:36+00:00,"As Ranking Member of @SenFinance, I’ve used every opportunity to shed light on the job-killing tax hikes, overspending, and government overreach being pursued by Democratic Leadership. https://t.co/jenayMcjvY"
2022-01-22 18:48:41+00:00,"Additionally, at the urging of the Idaho Congressional Delegation, @SBAgov approved the Idaho Hispanic Foundation (IHF) for a Community Navigator Pilot Program grant, which provides funding to support entrepreneurial activities in traditionally underserved areas of Idaho."
2022-01-22 18:48:40+00:00,"Rural states like Idaho depend on the Secure Rural Schools (SRS) Act to help compensate counties for large tracts of tax-exempt federal lands. On behalf of Idahoans in the 117th Congress, I helped secure a three-year reauthorization of the SRS program through FY2023. https://t.co/ZDqZ2LokvB"
2022-01-21 14:48:47+00:00,"And, following President Biden's haphazard withdrawal of U.S. troops from Afghanistan, I worked to secure evacuations from the country and pressed for continued oversight of the repercussions of this hasty withdrawal. https://t.co/z1p47T3pCp"
2022-01-21 14:48:46+00:00,"The FY2022 NDAA also authorized funds for critical projects in Idaho at Mountain Home Air Force Base, Gowen Field and @INL."
2022-01-21 14:48:46+00:00,"We owe so much to the brave servicemembers willing to sacrifice so much for our freedom. Last year, I helped secure passage of the FY22 NDAA, which was signed into law in December. It included a 2.7% pay raise for military servicemembers. https://t.co/HWqCNh7K2R"
2022-01-20 19:18:57+00:00,"#ICYMI my recent column highlights work on behalf of Idahoans in 2021, including efforts to help Idaho producers compete on the global stage through actions such as Senate passage of the Trade Act of 2021. https://t.co/67SFM2tIoa https://t.co/0RSQqAji4I"
2022-01-20 18:15:44+00:00,"Please be mindful of recent tax scams targeting Idahoans. If you have questions about your state tax returns or potential liabilities, call the Idaho Tax Commission directly. https://t.co/Su0OkfzxDX"
2022-01-20 16:15:47+00:00,"Rather than pursuing such partisan proposals, we should work together to address the myriad challenges facing Americans, including health care access, affordability and innovation. https://t.co/hU7SUVniAC"
2022-01-20 16:15:46+00:00,"In particular, the “Build Back Better” bill includes a number of problematic drug pricing provisions that risk undermining biomedical innovation, exacerbating inflationary pressures, imposing payment cuts on frontline health care providers, and compromising U.S. global leadership"
2022-01-20 16:15:46+00:00,"In spite of the many struggles Americans currently face, from skyrocketing inflation to combatting COVID-19, Democratic leaders continue to push reckless tax-and-spend proposals that risk worsening the problems at hand and creating new ones."
2022-01-20 01:51:07+00:00,Read more or watch my full remarks here: https://t.co/vhRHGELSuc
2022-01-20 01:51:06+00:00,Eliminating or weakening the legislative filibuster would destroy the intentional design of the Senate to be the world’s most deliberative body.  I urge my colleagues to reject this unfounded assault on the Senate filibuster. https://t.co/xBcVbWmMHR
2022-01-14 18:13:40+00:00,Parents concerned about their child’s education are not domestic terrorists.
2022-01-14 18:13:39+00:00,I joined @SenatorTimScott and colleagues on a letter demanding Secretary Cardona explain his &amp; his staff’s role in the solicitation &amp; creation of the letter calling parents domestic terrorists for exercising constitutionally protected freedoms of speech. https://t.co/FdQ6km3pPh
2022-01-13 22:15:58+00:00,"Today, the Supreme Court rightfully blocked the Administration's unconstitutional vaccine mandate on private businesses. A one-size-fits-all federal mandate on vaccines and private business practices is not a reasonable solution now, or ever."
