Datetime,Text
2023-01-02 22:12:51+00:00,This trend can be reversed if we make the right investments in our security. #WickerReport
2023-01-02 22:12:50+00:00,"Years of underinvestment have severely hurt our military readiness and ability to prevent conflict. As a result, China has grown more aggressive and the world has become more dangerous. 
 https://t.co/Z67juFEltG"
2023-01-01 16:15:00+00:00,Happy New Year! https://t.co/ogyiHdKBSE
2022-12-30 23:15:00+00:00,Our military is not ready to deter a two-front war. The best thing we can do is build up our force and strive for “peace through strength.” https://t.co/IpBlJqXEIP
2022-12-30 19:18:26+00:00,Projects like these are the primary reason I have made supporting infrastructure one of my top priorities in Congress.
2022-12-30 19:18:26+00:00,"This grant funding will have a lasting effect for people and businesses all along the Gulf Coast. Widening I-10 from four to six lanes will help to remove a major bottleneck and reduce delays, while additional improvements along the route will help keep all drivers safer."
2022-12-30 19:18:25+00:00,"Great news for Mississippians who live along the I-10 corridor - @USDOT is awarding $60M in bipartisan infrastructure law funding to widen I-10 between Long Beach and Diamondhead. 
https://t.co/O451ZkxGnZ"
2022-12-30 15:45:00+00:00,"This year’s NDAA ended @POTUS’ unnecessary vaccine mandate, and I was glad to vote for it. Republicans fought for months secure this victory."
2022-12-29 22:30:00+00:00,"On the ground, in the sea, and in the air, we need a strong national defense to protect our national interests. https://t.co/ROH4MKOE5F"
2022-12-29 15:30:00+00:00,"Congress needs to roll back special carve-outs for Big Tech, as I sought to do with legislation when I led @SenateCommerce. #WickerReport  

https://t.co/FL9gEjxn5Q"
2022-12-29 00:00:31+00:00,"Congress has an obligation to act on behalf of the American people and bring transparency and accountability to public platforms. #WickerReport   

https://t.co/hOjKMHNThl"
2022-12-28 19:15:00+00:00,"It was great to see DDG-125 #USSJackLucas underway for the first time earlier this month. These ships are essential to our fleet. 

https://t.co/botw5h7doT"
2022-12-28 15:30:00+00:00,"We live in a big country where people hold a wide range of views and convictions. This diversity makes it all the more vital that we protect free speech. #WickerReport

 https://t.co/nBcyym6EN3"
2022-12-27 23:30:00+00:00,"Much of the rot at Big Tech companies comes from the sheer lack of viewpoint diversity among their staff. These companies are overwhelmingly left-wing. #WickerReport  

https://t.co/FL9gEjxn5Q"
2022-12-27 20:45:00+00:00,Taiwan is living proof of a thriving democracy in East Asia. We need to sell them the systems they need now to repel a potential attack from China. https://t.co/yHZnfJoHZa
2022-12-27 15:30:30+00:00,"We should be grateful that new leadership is lifting the hood on Twitter, but Congress needs to follow up with wider investigations. Americans deserve to know the full extent of tech bias and corruption that is impacting our country. #WickerReport  

https://t.co/hOjKMHNThl"
2022-12-27 01:45:00+00:00,"The explosive revelations in the Twitter Files show the enormous power that a handful of liberal tech executives have over our public discourse. #WickerReport  

https://t.co/nBcyym6EN3"
2022-12-27 00:00:31+00:00,"Jesse Brown of Hattiesburg became the first African-American naval aviator in American military history. His life is the subject of the 2022 film “Devotion,” which is playing in theaters across the country. #MississippiMonday 

📸: @librarycongress https://t.co/x6Sn5CyhT2"
2022-12-26 20:08:08+00:00,"The release of the Twitter Files will go down as a defining moment in the history of Big Tech. These internal files confirm Twitter’s long history of bias against conservatives.  #WickerReport

https://t.co/hOjKMHNThl"
2022-12-25 16:15:30+00:00,"“For unto us a child is born, unto us a son is given.” -Isaiah 9:6 

Wishing you and your family a very Merry Christmas! https://t.co/fSrd9zipPP"
2022-12-24 20:30:00+00:00,"As Mississippians brace for a colder holiday season, make sure to check @NWS’s tips for Cold Weather Safety. 

https://t.co/RjzOIjfkXW"
2022-12-24 16:15:00+00:00,Merry Christmas Eve! https://t.co/pKOzQgTzlL
2022-12-24 00:15:00+00:00,"TikTok is a threat to national security. It has no place on government devices. 

https://t.co/kIzAPlfJJo"
2022-12-23 21:30:00+00:00,"We are headed towards the most expensive Christmas on record. 

https://t.co/40Gn8g6Jih"
2022-12-23 17:45:00+00:00,"It takes a long time to build a Navy, and our fleet needs to be overwhelmingly strong. https://t.co/77Y6iRYgB6"
2022-12-23 15:15:00+00:00,"This is the busiest time of year to travel, so make sure to plan ahead. 

https://t.co/jIoyne02Do"
2022-12-23 02:15:00+00:00,"The amount of fentanyl in the U.S. has increased as the border crisis worsened.  

We need to secure the border and keep Americans safe. 

https://t.co/WL86LQlSW1"
2022-12-22 23:30:00+00:00,"Holiday essentials have gotten more expensive this year. 

These are the highest costs in a generation. 

https://t.co/7vFc4tM6py"
2022-12-22 20:45:00+00:00,"With Russia and China growing more aggressive, we are now living in the most dangerous time since the height of the Cold War. It is vital that we maintain our military edge to prevent conflict. #WickerReport   https://t.co/yoxfflKgJM"
2022-12-22 17:15:00+00:00,"Make sure your family is prepared for the winter weather this Christmas.  

The @NWS is forecasting freezing conditions for many Mississippians.

https://t.co/yZBAMLjYSQ"
2022-12-22 14:30:00+00:00,"Conservatives successfully blocked parts of the left’s social agenda in this year’s NDAA. I will continue to fight against the President’s woke liberal policies, which only weaken our military. #WickerReport   

https://t.co/yoxfflsFlc"
2022-12-22 02:30:00+00:00,"Illegal immigration is already at all-time high. 

Ending Title 42 will only endanger more Americans.

https://t.co/sjOr03q1HG"
2022-12-22 00:00:00+00:00,"President Biden’s student loan plan is in trouble because there’s no legal backing.  

It’s a giveaway that shifts the burden to American taxpayers. 

https://t.co/X5fP8hQzLE"
2022-12-21 22:10:57+00:00,"The Bay St. Louis Police Department laid to rest their fallen officers Sgt. Steven Robin and Officer Branden Estorffe. These public servants selflessly lost their lives in the line of duty.

We owe them a debt of gratitude that can never be repaid. https://t.co/WmCNue6Vpp"
2022-12-21 21:15:00+00:00,"The NDAA will repeal @POTUS’ pointless COVID vaccine mandate, which has forced thousands to leave the military prematurely. He has continued to defend this mandate even as our military faces the worst manpower shortage in 50 years. #WickerReport   https://t.co/X5A2KRdqdz"
2022-12-21 20:00:23+00:00,"President Biden’s inflation has a direct cost for American families. 

It will come home to roost this holiday season. 

https://t.co/yxW54ew1Tf"
2022-12-21 16:23:19+00:00,".@SenSchumer's stall tactics have created needless delays for military construction projects and kept our troops from receiving a pay raise on time. #WickerReport  

https://t.co/yoxfflsFlc"
2022-12-20 22:57:23+00:00,See my full statement on the year-end funding bill here ⤵️ https://t.co/nAW0NI06dG
2022-12-20 22:57:23+00:00,"This legislation fully funds our NDAA while cutting the President’s proposed increase in domestic spending by 50%. It represents the best possible opportunity to end this budget stalemate, avoid a CR, and get our military men and women the resources they need to win."
2022-12-20 22:57:23+00:00,Every day we operate under a continuing resolution destroys our military readiness and deterrence and costs our service members hundreds of millions in lost capacity and overruns.
2022-12-20 22:57:22+00:00,"The harsh reality is that, as China and Russia build up their militaries, the U.S. will not be prepared to prevent warfare unless we make the right investments in our national defense."
2022-12-20 17:27:14+00:00,"The original NDAA passed out of committee in June. This delay was reckless and irresponsible. #WickerReport  

https://t.co/X5A2KQWnbz"
2022-12-20 15:04:24+00:00,"Happy Anniversary to my fantastic, smart, and beautiful wife, Gayle! After 47 years of marriage, she continues to be my soulmate. I am truly blessed! https://t.co/XcdzFfEL6w"
2022-12-20 03:00:02+00:00,"A surge in fentanyl remains one of the deadliest consequences of our open southern border. This crisis is a true sign of the times.  

https://t.co/8WAkqEzyEv"
2022-12-20 01:45:00+00:00,"Last week I met with Chief the Air Force Reserve, General Healy. I look forward to working together next Congress to ensure that our airmen have the resources they need to deter our adversaries. https://t.co/DReJQTCFLq"
2022-12-20 00:00:01+00:00,Congratulations to @SouthernMissFB for their win in this year’s Lending Tree Bowl! It was a great weekend to be a Mississippian!  #MississippiMonday https://t.co/FGIa5KSXi0
2022-12-19 22:15:00+00:00,"Flooding regularly puts American lives and property at risk, resulting in billions of dollars in economic losses each year. With this legislation signed into law, dam control managers can get the data they need to improve dam safety and protect Americans. https://t.co/DN3FzoqlC8"
2022-12-19 20:38:03+00:00,"Our military service members can breathe a little easier now that the annual defense bill has finally passed. The final package is a win for our military, but it should never have taken so long to approve. #WickerReport 

https://t.co/yoxfflKgJM"
2022-12-18 23:45:00+00:00,"If the President had a real solution, our border would not still be broken.

https://t.co/zTVm91dZlh"
2022-12-18 19:30:00+00:00,"I appreciate @USNavyCNO coming by to discuss priorities for the Navy. We are in the most dangerous period since the height of the Cold War, and we need a fleet that can be a strong deterrent. https://t.co/eoYAkP6Mol"
2022-12-18 16:15:00+00:00,Mexico’s plan to phase out the use of genetically modified corn is unsupported by science and is a breach of our trade agreements. This week I joined my colleagues in urging USTR Katherine Tai and Agriculture Secretary Tom Vilsack to take stronger action. https://t.co/s93KvYE7XY
2022-12-18 00:30:00+00:00,Thank you @USAfricaCommand commander Gen. Michael Langley for meeting with me this week. We had a productive discussion about how to respond to growing Chinese and Russian influence on the continent. https://t.co/z2p3gd0M3e
2022-12-17 21:15:00+00:00,"American families are concerned about their future.
President Biden’s economy is to blame.

https://t.co/6dJAZbae20"
2022-12-17 18:30:00+00:00,"On National Wreaths Across America Day, we remember our fallen, honor those who serve, and continue teaching the next generation about the sacrifices made for our liberty. https://t.co/ZnOCrEfxtF"
2022-12-17 15:45:00+00:00,"Recent crises have shown the urgent need to improve our drinking water, wastewater, and stormwater infrastructure, and this legislation includes provisions that would have a measurable impact. I am hoping @POTUS will sign this bill into law without delay.
https://t.co/6CPdkFX01F"
2022-12-16 17:45:00+00:00,"""The border crisis has never been worse. And Biden seems fine with it.” 

https://t.co/Bgk033nXfo"
2022-12-16 16:15:00+00:00,"Amphibious warships are an essential component to our force structure, and that won't change for the foreseeable future. The @USNavy and @DeptofDefense will need additional resources to ramp up production sooner rather than later as we work to deter China. https://t.co/DUmTcQW2r9"
2022-12-16 14:30:00+00:00,"With new GOP leadership, Big Tech is sure to receive more scrutiny in Washington. I look forward to working alongside the new House Republican majority to hold its leaders accountable to the American people. #WickerReport https://t.co/9hiURVVtFt"
2022-12-15 21:28:49+00:00,President Biden has a border that is out of control.
2022-12-15 19:30:00+00:00,"Democrats’ indifference to the corrosive power of Big Tech has dominated the last two years. Every time Republicans proposed ideas to rein in Big Tech companies, Democrat leaders opposed us. #WickerReport  https://t.co/9hiURVVtFt"
2022-12-15 14:30:00+00:00,"Democrats have shown little to no interest in taking serious steps to protect speech online. It's time to rein in Big Tech. #TwitterFiles #WickerReport 

https://t.co/9hiURVVtFt"
2022-12-15 02:15:00+00:00,"Thank you to @SECNAV for meeting with me this week. We had a productive conversation about how we can plan for the future fleet.  

I will always fight for a strong @USNavy. https://t.co/AGKc8L0F6X"
2022-12-15 00:35:00+00:00,"Inflation near a 40-year high is no reason for a victory lap, @POTUS.  

https://t.co/gAhFDVRZOo"
2022-12-14 22:29:13+00:00,"In fact, @WashPost has since verified that the 22,000 emails that served as the basis of the story are fully authentic. #WickerReport #TwitterFiles"
2022-12-14 22:29:13+00:00,My questioning of Big Tech executives in 2020 revealed that no company had direct evidence that the Hunter Biden story was misinformation when it was suppressed. https://t.co/HOEZrLfFsn
2022-12-14 20:53:07+00:00,We owe a debt of gratitude to our law enforcement officers who keep us safe every day.
2022-12-14 20:53:06+00:00,Gayle and I join officers across the Gulf Coast who have come out in full force to show their support for Bay St. Louis police officers Sergeant Steven Robin and Branden Estorffe. These public servants selflessly lost their lives in the line of duty today. https://t.co/psZOhMAogH
2022-12-14 16:37:24+00:00,"Prices are up 13.8% since President Biden took office. 

Inflation is still crushing the American people.

https://t.co/vRWez6N1XH"
2022-12-14 14:30:00+00:00,"In light of the #TwitterFiles, I am calling on Congress to renew its investigations of Big Tech. Congress needs to make sure this corruption is fully exposed and prevented in the future. #WickerReport 
https://t.co/9hiURVVtFt"
2022-12-13 19:30:00+00:00,"Twitter acted dishonestly when it silenced the Hunter Biden laptop story in 2020.  

In fact, the reporting revealed enormous sums of money going from corrupt foreign executives to Hunter Biden in an apparent attempt to influence his father. #TwitterFiles https://t.co/qcBEahc1md"
2022-12-13 16:15:00+00:00,"With new leadership in charge of Twitter, some of the social media giant’s most blatant attacks on free speech are finally coming to light. #TwitterFiles #WickerReport 

https://t.co/9hiURVDSNV"
2022-12-13 14:55:03+00:00,"Gayle and I are heartsick for the Leach family and the entire Mississippi State community.

Today is a reminder to hold our loved ones closer and cherish the time we have with them. 

Our state will not be the same without @Coach_Leach."
2022-12-13 02:45:00+00:00,"Millions of Americans are behind on their bills. 

Unleashing American energy could lower costs and provide relief. https://t.co/Yo6i6JPFB1"
2022-12-13 00:35:28+00:00,"Featuring train rides, Santa, and a live Nativity scene, the event was named “Best Holiday Attraction” by Mississippi Magazine this year. #MississippiMonday"
2022-12-13 00:35:28+00:00,"Every November and December, Downtown Columbia turns into a winter wonderland with “Experience Columbia.” Their 14-story-tall tree took a year to complete, and the unique ice-skating rink includes live music and light shows. 

📸: Experience Columbia MS https://t.co/NKo97nrLff"
2022-12-12 22:52:28+00:00,Conservatives who felt that Twitter was covering up the truth simply to help Joe Biden are vindicated by revelations in the #TwitterFiles.
2022-12-11 22:30:00+00:00,"Energy prices are still 40% higher than before @POTUS took office.  

Americans continue to pay for this Administration’s bad policy. https://t.co/JHTwGU6fbO"
2022-12-11 16:45:00+00:00,"Good luck to our #MissMississippi Emmie Perkins as she goes to the Miss America competition. Your state is behind you! 

https://t.co/TrkuAOHAh2"
2022-12-10 23:15:00+00:00,".@POTUS has continued to force his radical environmental, social, and governance policies on the American economy. I recently joined my colleagues in a letter urging him to evaluate the full costs of this agenda. 

https://t.co/l0rZsz55Ak"
2022-12-10 19:30:00+00:00,".@POTUS’ reckless spending has a real cost, but he refuses to face it. 

https://t.co/ZOSPwJeNrk"
2022-12-10 18:17:07+00:00,"Happy birthday, Mississippi!

On this day 205 years ago, Mississippi was recognized as the 20th state. https://t.co/4E6e1jRROh"
2022-12-10 16:15:00+00:00,"Last week, I met with Mississippi Band of Choctaw Indians Chief Cyrus Ben. I was glad for the opportunity to visit and discuss legislation affecting the Tribe. https://t.co/hbiluBBrAX"
2022-12-09 22:39:09+00:00,"Immediately after taking office, @POTUS started a war on energy that has made us weaker. 

The @SenateGOP will continue pushing for policies that make us stronger. https://t.co/b6FaEGV309"
2022-12-09 01:45:00+00:00,I appreciate UK Defense Secretary @BWallaceMP for visiting this week. We stand with our British allies against tyrants who threaten freedom across the globe. https://t.co/erTBDDl6Eq
2022-12-09 00:00:02+00:00,"The students at VWSD produced incredible ornaments featuring Mississippi’s rich history.  

Last week, my staff and I decorated two Christmas trees in my Washington office with their creations. 

See more about their designs here: https://t.co/S0TqOBRVm2 https://t.co/4EHQFYDacO"
2022-12-08 22:30:00+00:00,"This CHIPS and Science Act is a major step forward in protecting the fruits of American ingenuity. It bans participation in so-called “foreign talent recruitment programs” hosted by adversarial nations, which are ripe for espionage. 

#WickerReport   

https://t.co/PwUBBKKiN5"
2022-12-08 20:50:14+00:00,Their recent article in @ForeignAffairs highlights how red tape is hindering our partners from being able to produce and obtain equipment they need on the battlefield.
2022-12-08 20:50:12+00:00,"I was pleased to recognize the work of two @msstate  professors, Dr. Banerjee and Dr. Tkach, at yesterday’s @HelsinkiComm hearing. https://t.co/alXs1DZBBO"
2022-12-08 19:44:22+00:00,"My statement on this year’s national defense bill⤵️️
https://t.co/Ww5f5j0CY8"
2022-12-08 19:44:22+00:00,"As China and Russia race forward with their own military buildups, our only response can be to show we are serious about our own defense programs. I will continue fighting to ensure our force is laser-focused on protecting our freedoms."
2022-12-08 16:15:00+00:00,"The situation at our broken southern border is a humanitarian crisis that must be investigated. 

https://t.co/FhnnTdl5hP"
2022-12-08 14:30:00+00:00,"Beijing’s shameless record of theft over years has allowed them to leapfrog forward in many technologies without spending on research. The CHIPS and Science Act includes tough measures that I authored to protect American research. 

#WickerReport  

https://t.co/YWDx5ewWVy"
2022-12-08 02:30:00+00:00,"The Biden Administration continues to prove they care little for securing our southern border.  

https://t.co/hrMm57XAtf"
2022-12-08 01:00:01+00:00,I am proud to count @RoyBlunt among my lifelong friends. His absence will leave a vacuum in the halls of Congress. https://t.co/V7QfBomw88
2022-12-07 23:45:00+00:00,"On this day 81 years ago, our country forever changed when Japan struck Pearl Harbor. Let us take today to remember the heroes who gave their lives for our country that day and the days since. 

https://t.co/ioqtp1rI58"
2022-12-07 22:00:00+00:00,".@JimInhofe has never wavered in his advocacy for peace through strength, &amp; @SenShelby is a gifted legislator and Southern gentleman. It was an honor to speak about these titans of the Senate who have given so much to our national defense.
  https://t.co/gTkvJ7KOA2"
2022-12-07 20:26:42+00:00,"Recently, Mississippi’s researchers heard firsthand how to accelerate their projects that use artificial intelligence, robotics, and advanced communications. #WickerReport"
2022-12-07 20:26:41+00:00,".@NSF is giving extra support to help researchers move their ideas from the lab to the marketplace. 

https://t.co/amYsUNKOYO"
2022-12-07 18:38:16+00:00,"Officer McKeithen was a model public servant who dedicated his life to protecting and serving his country. I am pleased to join other members of the Mississippi Congressional Delegation to honor his life and rename the Biloxi post office in his honor.

https://t.co/32LxH3XNXm"
2022-12-07 18:06:00+00:00,"Vladimir Putin and his cronies will stop at nothing to accomplish their objectives, including employing mercenaries like the Wagner Group. The U.S. should call this shadow army what it is: a foreign terrorist group.  

https://t.co/j1S349npn6"
2022-12-07 14:30:00+00:00,"China has become notorious for stealing American research and trade secrets. Members of both political parties recognize that this theft cannot continue. Both government and industry have a vital part to play in protecting American research. #WickerReport 
https://t.co/amYsUO2pQm"
2022-12-06 22:13:00+00:00,"I greatly enjoyed speaking at
@reaganinstitute’s annual #RNDF this weekend. 

We are living in the most dangerous time since the height of the Cold War, and it is imperative that we adopt President Reagan’s approach of #PeaceThroughStrength to defend freedom and deter tyrants. https://t.co/crUaJFWAyk"
2022-12-06 21:15:00+00:00,"Antisemitism is a scourge that must be eliminated wherever it exists. I joined @SenatorLankford, @SenJackyRosen, and more than 100 other legislators who are calling for a national strategy to tackle this challenge. 

https://t.co/x8vYEmjuLm"
2022-12-06 20:15:00+00:00,"The watchwords for Biden’s economy are uncertainty and upheaval. 

It’s a recipe for catastrophe. 

https://t.co/rthu1ypJxm"
2022-12-06 19:30:00+00:00,"Last month, I helped coordinate a gathering of over 350 researchers, students, and administrators on the campus of Mississippi State University. The insights gained from this event will benefit Mississippi STEM students for years to come. #WickerReport 

https://t.co/amYsUO2pQm"
2022-12-06 17:42:51+00:00,"Energy prices remain high across the board. This Administration’s policies are not helping. It’s time to unleash American energy.  

https://t.co/AzGonyhwP9"
2022-12-06 14:30:00+00:00,"As we work to stay ahead of China, Mississippi has a key role to play in charting the future. I am committed to making sure Mississippi’s groundbreaking ideas receive the support and protection they need. #WickerReport 

https://t.co/YWDx5ewWVy"
2022-12-06 00:30:00+00:00,.@NatlParkServGPS just designated Pascagoula as an American World War II Heritage City for their historic role in supporting the war effort. Today the shipyard at Ingalls continues to turn out ships that are essential to our @USNavy and @USCG fleet. #MississippiMonday https://t.co/gwyWicu51q
2022-12-05 22:30:39+00:00,"Today America is still the best place on earth to create new technology, but China is working hard to surpass us so that they can become the world’s leading superpower. We cannot let this happen. #WickerReport 

https://t.co/amYsUO2pQm"
2022-12-05 14:27:00+00:00,"The Chinese Communist Party’s continued violent crackdown on peaceful protesters will have grave consequences. I joined @SenHydeSmith on a letter to @AmbQinGang warning him of this reality. 

https://t.co/Gq9TfUhnw9"
2022-12-04 22:08:37+00:00,"Congratulations to the @MSFarmBureau for 100 years of service to Mississippi’s rural communities! 

I was glad to join you today to celebrate and present the senate resolution @SenHydeSmith and I sponsored. 

Here’s to another 100 years! https://t.co/JFVmN19Dxn"
2022-12-04 16:27:00+00:00,"Fentanyl is killing Americans every day, and it is a direct consequence of our open border. New Republican leadership in Congress will work to hold the Biden administration to account. 

https://t.co/skU0n04Z4L"
2022-12-03 22:30:00+00:00,"The overwhelming majority of Americans want to see President Biden secure the border. It’s bewildering why he hasn’t made it a priority. 

https://t.co/zhkYM3VyAS"
2022-12-03 15:40:25+00:00,"The #TwitterFiles are confirming more details of what we already know. 

Twitter had no basis to suppress the Hunter Biden laptop story, but they did it anyway."
2022-12-03 15:25:00+00:00,"American ingenuity will always win the day.  

The B-21 Raider Jet will bring untold speed, precision, and power to America’s arsenal. 

https://t.co/KFCUfQgVyi"
2022-12-02 23:15:00+00:00,"President Biden’s energy policy is out of sync with reality. Winter is on its way, and our power system is at risk. 

https://t.co/NjlTCbbLKG"
2022-12-02 21:05:30+00:00,"I will join @ReaganInstitute’s #RNDF tomorrow to talk about the urgent need to shore up our defense industrial base with Undersecretaries Alan Estevez and Bill LaPlante, @USNavyCNO, and @LockheedMartin‘s Jim Taiclet. Learn more here: 

https://t.co/3qc6j0Cgib"
2022-12-02 01:45:00+00:00,".@POTUS’s economic policy has predictable results. 

The CBO says more inflation, slower growth, and bigger deficits are on their way. 

https://t.co/okikP3k3ck"
2022-12-01 22:38:04+00:00,"Another destroyer made by the fine shipbuilders at @WeAreHII will soon join our fleet. Congratulations on the delivery of the new USS Lenah Sutcliffe Higbee! 

https://t.co/c28G7jI2AR"
2022-12-01 18:54:04+00:00,See more about our legislation here. https://t.co/ohGipkjh59
