Datetime,Text
2022-02-27 00:08:41+00:00,Washington state’s culture of innovation relies on gifted STEM teachers like Ms. Fry and Ms. Greenberg. I’m grateful to each for their expertise and pleased to see them receive national recognition. (2/2)
2022-02-27 00:08:40+00:00,Congratulations to Julie Fry of Roosevelt Elementary in Yakima and Allison Greenberg of Woodside Elementary in Bothell for receiving the National Science Foundation’s Presidential Awards for Excellence in Mathematics and Science Teaching! 🌱 🔬 (1/2) https://t.co/SkBAQc1Llw
2022-02-24 16:58:28+00:00,"My thoughts are with the people of Ukraine and the thousands of Ukrainian-Americans in Washington state. If you need help, please reach out to my office at (206) 220-6400 or casework@cantwell.senate.gov"
2022-02-24 16:58:28+00:00,"In the face of this reckless aggression, we must stand together with our NATO allies and respond with unequivocal and unified action."
2022-02-24 16:58:27+00:00,"Ukraine is a proud and sovereign nation. Vladimir Putin ignored Ukrainians decision to live in a democracy and be free. Instead, Putin chose war. His invasion of Ukraine marks another very dark moment in the history of Europe."
2022-02-22 22:18:29+00:00,"If bipartisan legislation is enacted, athletes representing the United States internationally in 50 Olympic and Paralympic sports will also receive equal pay and benefits, regardless of gender."
2022-02-22 22:18:28+00:00,"The U.S. Women's National Soccer team stood together in their lawsuit just as they do on the pitch, and won a significant victory for gender equality in sports."
2022-02-14 16:46:43+00:00,I urge my colleagues to take up this bipartisan compromise quickly so we can get these protections in place now. (3/3) https://t.co/D1TXJAf8M0
2022-02-14 16:46:43+00:00,"This bill is also a major step forward in protecting our Tribal communities. Indigenous women and children will be better protected against sexual assault, child abuse, stalking and sex trafficking that occurs on Tribal lands. (2/3)"
2022-02-14 16:46:42+00:00,"We are righting the wrong of letting the Violence Against Women Act lapse. This bipartisan bill strengthens protections for women and children by providing more resources for survivors no matter where they live, where they work or who they are victimized by. (1/3)"
2022-02-13 00:36:16+00:00,"It is great to have an experienced Pacific Northwest voice on the Federal Maritime Commission to help sort out supply chain issues, support American exporters, and to help keep ports and freight moving."
2022-02-12 20:06:43+00:00,"$71 million is headed to WA state over the next 5 years to build out necessary electric vehicle recharging infrastructure. With our clean &amp; affordable energy system, local EV owners can reduce their carbon footprint and save $11,000 by fueling their cars with ⚡️ instead of gas. https://t.co/Frf7VTNgvh"
2022-02-11 21:14:04+00:00,https://t.co/vXkJOIruAj
2022-02-11 21:14:03+00:00,"Once high-skilled jobs leave a community, it’s not easy to get them back. Supporting aerospace manufacturing employers during an unprecedented aviation industry slowdown is not only the right thing to do, it's the best way to keep local economies diverse and thriving.⬇️"
2022-02-10 22:54:30+00:00,"That’s especially true in Washington state where our clean and affordable energy system means local EV owners can save around $11,000 by fueling their cars with electricity instead of gasoline while greatly reducing their carbon footprint. (3/3)"
2022-02-10 22:54:30+00:00,"Not only are electric vehicles the answer to spiking pump prices and our overdependence on oil, they are essential to addressing the looming climate crisis. (2/3)"
2022-02-10 22:54:30+00:00,"Pivoting to electric vehicles is a smart play, but America will be stuck in park until we build out the necessary recharging infrastructure.⚡️🔋 (1/3) https://t.co/3kNMhx0LYC"
2022-02-09 18:51:31+00:00,"I'm looking forward to even more improvements in the coming years, thanks to $22 billion in Amtrak funding passed as part of the Bipartisan Infrastructure Law. (2/2)"
2022-02-09 18:51:30+00:00,"Amtrak's historic Empire Builder is getting a facelift with today's debut of two new locomotives. Rail passengers will enjoy cleaner, more reliable service with the state-of-the-art ALC-42 locomotives in place.🚆(1/2)"
2022-02-07 18:56:34+00:00,"These funds are critical to helping meet the ridership demands of our workforce, reduce the congestion returning as we rebound from the pandemic, and transition to zero-emission bus fleets. (2/2)"
2022-02-07 18:56:33+00:00,Public transit funding from the Bipartisan Infrastructure Law is finally getting to communities where it’s needed and not a moment too soon. This $138 million is just the beginning of the $1.79 billion our state’s transit agencies will receive. (1/2)
2022-02-06 18:47:58+00:00,"Our local AAPI-owned businesses are integral to communities across Washington, both as employers &amp; part of the vibrant cultural fabric of our state. We must ensure that AAPI-owned restaurants receive the support they need to make it through the pandemic. https://t.co/HijW2wL5nV"
2022-02-06 00:07:37+00:00,Max Vekich has decades of experience on the docks as a longshoreman and as a civic leader. His voice will be an important one in addressing supply chain issues at our busiest seaports around the United States.
2022-02-05 16:02:38+00:00,https://t.co/rZibwhHDmF
2022-02-05 00:25:31+00:00,"Good luck to our Washington state athletes competing in the 2022 #WinterOlympics! Tacoma’s Corinne Stoddard⛸️, Bellevue’s Eunice Lee⛸️, Edmonds' Jean-Luc Baker⛸️, Redmond’s Katie Hensien⛷️, Winthrop’s Novie McCabe⛷️, and Edmonds' Sean Beighton🥌 #GoTeamUSA"
2022-02-03 19:58:49+00:00,The alleged fraud has serious consequences. I want to make sure that consumers in Washington state have confidence to go get these tests. We need a strong FTC pursuing these cases about fraudulent activity to protect consumer health during a pandemic. (2/2)
2022-02-03 19:58:48+00:00,"Since the onset of the pandemic, consumers across the country have been victimized by a range of scams related to COVID-19, including fake COVID-19 tests, bogus cures, price gouging &amp; phishing scams. These are more than just an annoyance – they put lives at risk. (1/2) https://t.co/HYkfPf1Huu"
2022-02-02 02:57:41+00:00,My thoughts are with my dear friend and colleague Senator Luján and his family. May he have a full and speedy recovery. We hope to have his voice and continued leadership back in the Senate soon.
2022-02-01 19:00:22+00:00,"As we celebrate #BlackHistoryMonth, we acknowledge the tremendous contributions of Black Americans and we must recommit to fighting racial inequities and ensuring equality for all."
2022-02-01 14:33:42+00:00,"Happy #LunarNewYear to everyone celebrating in Washington state and around the world today! Wishing all a new year of hope, prosperity, and good health.🐯 https://t.co/tNcknogCe2"
2022-01-30 17:00:46+00:00,I visited Sumas this week to speak with local residents &amp; business owners on how Whatcom Co. is recovering from historic flooding. We need to make sure federal money can assist in public works repairs &amp; also look at the solutions to prevent this level of flooding in the future.
2022-01-30 00:25:03+00:00,We want to support many more restaurants by securing a second round for the Restaurant Revitalization Fund. It's imperative that we take care of our economy and the mainstay of small businesses in many communities that are these restaurants. https://t.co/C99JWAOEbR
2022-01-29 17:23:01+00:00,"This assistance will help get these communities back on their feet by getting buildings, roads, bridges and the infrastructure that was damaged rebuilt. We are so appreciative of FEMA's work and continued support. (2/2)"
2022-01-29 17:23:01+00:00,"Help is finally on the way for Whatcom, Skagit, and Lewis counties, Tribal communities and several other counties that were gravely impacted by the floods. (1/2) https://t.co/8x5VUhhZ90"
2022-01-28 21:10:52+00:00,This week I heard from restaurant owners across Washington state about the challenges their businesses have faced throughout the pandemic. We want to take their stories back to Washington D.C. to fight even harder for an additional round of restaurant funding. https://t.co/J9eVhw6aTk
2022-01-27 15:21:55+00:00,"We pledge to never forget the atrocities of the past, and we honor the memories of those who spoke out, those who suffered, and those who died. #NeverAgain #InternationalHolocaustRemebranceDay"
2022-01-27 15:21:54+00:00,"On International Holocaust Remembrance Day, #WeRemember the six million Jewish victims who were systematically murdered by the Nazis and the millions of other victims of Nazism. https://t.co/RWdb70mPl2"
2022-01-27 01:48:11+00:00,This is an opportunity to add diversity to our highest court and I look forward to considering President Biden’s nominee. (2/2)
2022-01-27 01:48:10+00:00,I thank Justice Stephen Breyer for his years of service on the Supreme Court. His opinions in support of the Affordable Care Act and abortion rights have helped Americans access the health care they need. (1/2)
2022-01-26 01:11:22+00:00,We want to take today's information back to DC and fight even harder to get a 2nd round of funding because we need our local communities to have these great businesses &amp; we need these resources to help stabilize restaurants across the US &amp; the State of Washington. (2/2)
2022-01-26 01:10:59+00:00,"Today, I held a virtual round table with restaurant owners from across Washington state to discuss the impacts of the ongoing COVID-19 pandemic and the need to replenish the Restaurant Revitalization Fund. (1/2) https://t.co/E1j6bO0fvl"
2022-01-25 16:52:05+00:00,I urge the Administration to swiftly reinstate the Alaska Roadless Rule to help protect the more than 9 million acres of National Forest System lands in the Tongass National Forest in Alaska. #ProtectTheTongass https://t.co/tIS2BRBZz8
2022-01-24 23:58:31+00:00,"I strongly support restoring #RoadlessRule protections in the #Tongass National Forest in Alaska to support regional economic growth, boost outdoor recreation opportunities, protect irreplaceable wildlife habitat, provide enduring climate benefits, &amp; uphold Indigenous rights. https://t.co/eYMwnCkQ4w"
2022-01-24 23:35:07+00:00,"We look forward to working together on this issue and broader efforts to improve federal forest policy, fight climate change, &amp; uphold our responsibilities to Indigenous communities. (2/2) https://t.co/XhYqNsSwJe"
2022-01-24 23:35:06+00:00,"Today, I sent a letter to @SecVilsack in support of reinstating safeguards for the more than 9 million acres of National Forest System lands in the Tongass National Forest in Alaska. #ProtectTheTongass #RoadlessRule (1/2) https://t.co/IWLHxMtDYG"
2022-01-22 18:03:50+00:00,"The right to essential reproductive health care like abortion cannot depend on the state you happen to be in. We must pass the Women’s Health Protection Act to defend patients’ access to essential reproductive health care, no matter where they live. (3/3)"
2022-01-22 18:03:50+00:00,"Today, once again, there is an effort to overturn Roe v. Wade. We cannot allow decades of progress to be rolled back on access to essential reproductive health care choices. (2/3)"
2022-01-22 18:03:50+00:00,"In 1973, the Supreme Court decided the Constitution protects our right to privacy and thus the choice to have a safe and legal abortion without excessive government restrictions. 49 years later, the majority of Americans support Roe v. Wade. #Roe49 (1/3)"
2022-01-19 22:32:35+00:00,"Our democracy is under threat, and people are trying to undermine the credibility of our elections. What we need to do now is to protect our democracy. We need to pass the John Lewis Voting Rights Act."
2022-01-19 00:32:09+00:00,"We need to protect our democracy. We need to pass the John Lewis Voting Rights Act. When I was escorted back into this chamber on January 6th, all I could think about was my father and my uncle who fought in World War II to protect these rights, to uphold our democracy. https://t.co/d1fqkCdDD3"
2022-01-18 23:47:42+00:00,What we need to do now is to protect our democracy and pass the John Lewis Voting Rights Act. Let's vote to get this done. Let's move forward to show our country we believe in voting rights in the United States Senate. https://t.co/fLd2NZKcnJ
2022-01-17 15:36:15+00:00,"We must pass legislation that ensures all aspects of the 1965 law are enforced, because without the right to vote in free and fair elections, there is no guarantee of all the other rights that we fight for. (3/3)"
2022-01-17 15:36:14+00:00,"He understood the power of peaceful demonstration and the importance of laws that ensure every American is treated fairly. Today, once again, there is an effort to suppress the votes of millions of Americans. (2/3)"
2022-01-17 15:36:14+00:00,"Today we celebrate the vision, strength, and teachings of Dr. Martin Luther King, Jr. Dr. King's leadership inspired a nation to fight for civil liberties for Black Americans. (1/3) https://t.co/qCKfLVUnQp"
2022-01-17 01:02:34+00:00,The science is undeniable. The Earth is warmer and the climate has changed.  We must take action by passing Build Back Better — which would be the largest investment in mitigating and adapting to climate change in our nation’s history. https://t.co/CbWlqxgV73
2022-01-16 18:00:47+00:00,"This $2.3 million grant will ensure all Anacortes homes and businesses have access to high-speed broadband, bringing service to 1,815 homes &amp; supporting economic investment, particularly for the Port of Anacortes and development along Fidalgo Bay. https://t.co/MrQSlFCFdJ"
2022-01-15 20:51:50+00:00,"And would spur construction of more resilient infrastructure, and speed the transition to a clean energy future. (4/4)"
2022-01-15 20:51:49+00:00,"Build Back Better would be the largest investment in mitigating and adapting to climate change in our nation’s history, providing funds for game-changing actions to slash our nation’s greenhouse gas emissions in half over the next decade. (3/4)"
2022-01-15 20:51:49+00:00,"Before things get worse, we must double down on both slowing climate change and ensuring that our people and economies have the tools needed to adapt to its impacts, including more frequent and intense weather disasters. (2/4)"
2022-01-15 20:51:49+00:00,"The science is undeniable. The Earth is warmer and the climate has changed; NOAA and NASA have documented that, globally, the past eight years were the hottest in modern record keeping, continuing a trend that began 45 years ago. (1/4)"
2022-01-15 17:23:27+00:00,"In Washington state, we know how vital bridges are to connecting communities and improving freight mobility, and we know how important it is they are properly maintained in order to keep people and goods moving. (2/2)"
2022-01-15 17:23:26+00:00,"With over 400 of Washington‘s bridges classified as structurally deficient, I’m glad to see this $605 million in much-needed funding from the Bipartisan Infrastructure Law going to Washington so we can improve our bridge infrastructure. (1/2)
https://t.co/zLzlHnukSw"
2022-01-14 19:32:22+00:00,“My infrastructure law includes a total of $40 billion in funding for bridge improvements. $12.5 billion of that is going to replace the most economically significant bridges in the country. These are bridges like…the I-5 Columbia River Crossing connecting WA and OR.“ - @POTUS
2022-01-13 17:07:54+00:00,He is highly qualified and his dedication to the rule of law will be an asset to the court and all those who come before him. (2/2)
2022-01-13 17:07:54+00:00,I applaud the confirmation of Gabriel Sanchez to the Ninth Circuit Court of Appeals. Sanchez brings with him nearly two decades of legal experience from working on criminal justice reform to labor protections for farmworkers. (1/2)https://t.co/pyYnIJ2IPE
2022-01-12 23:30:43+00:00,Mr. Davidson understands these issues and will help us ensure that America is better connected by delivering broadband deployment as quickly as possible to unserved and underserved communities &amp; making our grid more secure.
2022-01-12 23:30:24+00:00,I’m glad the Senate has confirmed Alan Davidson to serve as Administrator for the National Telecommunications &amp; Information Administration. Nothing could be more important to upgrading the US infrastructure than deploying fiber &amp; getting broadband to American homes. https://t.co/x2RK1NChkK
2022-01-12 20:11:42+00:00,Protecting our country from voter suppression is critically important to our democracy.  I support allowing a simple majority in the Senate to vote to protect our voting rights.
2022-01-11 16:24:00+00:00,Build Back Better would provide significant funding for better climate and weather models and the biggest one-time investment in NOAA’s supercomputing infrastructure ever.
2022-01-11 16:24:00+00:00,"Last year the US had of 20 separate billion-dollar weather disasters – the second highest on record. Extreme weather events are costing our country too many lives &amp; too much money to not be investing in climate change mitigation and adaptation, &amp; weather forecasting technology.🧵"
2022-01-11 00:24:02+00:00,There are 5 days left to sign up for 2022 health coverage in Washington state! Coverage starts on February 1st. Learn about options to #GetCovered ➡️ https://t.co/KYHefMiRzt
2022-01-09 18:06:56+00:00,"Relief has arrived for residents and business owners impacted by flooding and other weather-related events in November of last year. Whether you are uninsured, or underinsured, you can apply online at https://t.co/aPLQeylOdK or by calling 800-621-3362 https://t.co/6H6YfTSUkq"
2022-01-08 21:34:49+00:00,"The COVID crisis has made it clear –broadband is a necessity for every American home and family. The major investments we’ve made in broadband is a start, but we need better information about areas that lack connectivity  to help close this gap. https://t.co/Wnla7X636q"
2022-01-07 19:32:09+00:00,Disaster aid is now available for those affected by the historic Nov. floods that impacted Northwest Washington communities &amp; Tribal nations. Apply online at https://t.co/aPLQeylOdK or call 800-621-3362⬇️ https://t.co/diqjwL7XNk
2022-01-06 21:58:11+00:00,“They fought for us to have a government where you didn’t have to get escorted by the military to do your job.”
2022-01-06 21:58:10+00:00,"“The hallmark of our country has been free and fair elections. We were being escorted back in that night by the military, and I just kept thinking of my father and my uncle who both served in World War II, and I thought of all the things they fought for.” https://t.co/KeV4IAI9xd"
2022-01-06 20:38:08+00:00,"I appreciate President Biden’s approval of this assistance, which will help those affected get back on their feet through temporary housing, helping repair damaged homes and replace lost property, unemployment insurance, and childcare assistance."
2022-01-06 20:38:07+00:00,"NW WA communities &amp; Tribal nations are still reeling from the impacts of the historic Nov floods that decimated homes, farms &amp; livelihoods in the Nooksack River valley &amp; beyond, as well as flooding &amp; mudslides on the Peninsula that cut off communities from the rest of our state🧵 https://t.co/d0VKRM7YtI"
2022-01-05 23:43:39+00:00,Our health care workers are working tirelessly to administer vaccines to help keep us safe from COVID-19. Go to https://t.co/hrFejpaAHr to book your vaccine or booster appointment today.
2022-01-01 18:52:27+00:00,"Wishing all Washingtonians a safe and happy New Year! As we reflect back on a challenging year and look forward to 2022, I hope the coming year brings you health and happiness. https://t.co/jRFyossBK3"
2021-12-30 23:09:34+00:00,"…expand its fleet of zero-emission buses &amp; bring new bus rapid transit lines from downtown Seattle to Burien, the International District to Rainier Valley, &amp; Totem Lake to Eastgate. (2/2)"
2021-12-30 23:09:34+00:00,"As King County continues to grow, it’s vital our transit system is able to keep up. This $395.6 million in federal funding will support Metro’s plans to increase service in 2022… (1/2) https://t.co/gIu7qaQWQU"
2021-12-29 03:46:10+00:00,My full statement on the passing of former Senate Majority Leader Harry Reid. My heart goes out to Landra and his family. https://t.co/st1EEQ8Utv
2021-12-28 19:40:05+00:00,"It will allow East Marginal Way to handle heavy truck traffic between port terminals, SoDo railyards and businesses, and I-5, reducing congestion in SoDo while providing a direct connection to the newly renovated Terminal 5 via the lower West Seattle Bridge. (2/2)"
2021-12-28 19:40:04+00:00,"With East Marginal Way greatly deteriorated and congested both by freight traffic and residents impacted by the closure of the West Seattle Bridge, this project will give this critical freight corridor a much-needed facelift. (1/2)"
2021-12-27 19:42:32+00:00,"This investment, combined with historical investments we are making in salmon recovery through the bipartisan infrastructure package, will help turn the tide on Puget Sound recovery to benefit our people, our economy and our wildlife. (2/2)"
2021-12-27 19:42:31+00:00,"This $34 million investment in Puget Sound recovery grants will support projects to stop stormwater pollution, improve water quality, restore habitat and make real progress toward recovering our salmon and orca populations. (1/2) https://t.co/c7C15XxZGt"
2021-12-25 18:03:27+00:00,Merry Christmas to everyone celebrating in Washington and across the country. Wishing you a safe and joyful holiday season! https://t.co/qG6nMDbWty
2021-12-23 22:15:26+00:00,"Washington airports are continuing to grow, and getting much-needed infrastructure dollars to help secure future capacity is important. https://t.co/t74WmDrIjF"
2021-12-22 18:56:37+00:00,Welcome to Wishkah – the first hybrid-electric ferry &amp; newest addition to the @wsferries fleet!
2021-12-21 17:34:12+00:00,This important investment in the Port of Ilwaco’s seafood processing wharf bulkhead will support hundreds of jobs in the region that depend upon reliable port access to support sustainable fisheries and seafood processing. (2/2)
2021-12-21 17:34:11+00:00,"Ilwaco is one of the most seafood-dependent coastal economies in the United States, &amp; this project will help make Pacific Country seafood businesses more resilient to extreme weather, sea level rise and earthquakes. (1/2) https://t.co/3xLc86H4DD"
2021-12-21 00:58:14+00:00,"This is critical to helping move freight in Tacoma, and will help keep Washington’s $37 billion maritime economy growing. (2/2)"
2021-12-21 00:58:14+00:00,"Everywhere in the country dock space is the issue for ports, and that is true here in Tacoma too. This investment in the Port of Tacoma will expand dock space, ease congestion, &amp; improve efficiency by providing access to an additional 24.5 acres of container storage space. (1/2) https://t.co/8EmZ3lIceT"
2021-12-19 20:30:01+00:00,https://t.co/UZQOTNjtmh
2021-12-16 23:46:28+00:00,"I want to congratulate Charles F. Sams III on his historic role as National Park Director. As a member of the Confederated Tribes of the Umatilla Indian Reservation, Mr. Sams will be the first Tribal member to serve in this position."
2021-12-13 18:05:19+00:00,"DEADLINE TODAY, 4:59 PM PT — @USDOT is accepting applications for the 3rd round of Aviation Manufacturing Jobs Protection Program. More information here⬇️ https://t.co/7tOWFboKAT"
2021-12-13 01:29:11+00:00,"Cross-laminated timber will be used to build next generation, sustainable, affordable housing. I’m proud to have worked with Mayor Rankin to support the Darrington Wood Innovation Center, and I will continue working to support Washington’s innovative mass timber industry."
2021-12-12 19:53:14+00:00,Sustainable aviation fuels are essential to the continued growth of the aviation sector and the jobs the industry supports across Washington state. This grant will enable WSU to leverage their leadership in agriculture research to diversify our nation’s fuels sources.
2021-12-11 23:22:46+00:00,"Advertisers and publishers, including struggling local news outlets all over the country, may have faced unfair competition by Facebook, impacting their revenues and ability to compete online. https://t.co/NeEijZYuWT"
2021-12-11 18:06:49+00:00,"This week, I invited DOJ officials to come to Washington to bring focus to the crisis of missing and murdered Indigenous people. Washington state has one of the highest numbers of #MMIP. We must do more to protect and support Native communities. https://t.co/5lS2UH6UpG"
2021-12-10 23:01:59+00:00,"The right to essential reproductive health care like abortion cannot depend on the state you happen to be in. The Senate must do its job &amp; pass the Women’s Health Protection Act to defend patients’ access to essential reproductive health care, no matter where they live."
2021-12-10 19:43:36+00:00,A thorough investigation by the FTC and other enforcement agencies is paramount because members of the public and businesses are entitled to know the facts regarding Facebook’s conduct as they make their decisions about using the platform. (3/3)
2021-12-10 19:43:36+00:00,"Recent revelations and public documentation suggest that Facebook may have misled its advertising customers and the public about its processes for ensuring brand safety and about the reach of its advertisements, both core aspects of Facebook’s business model. (2/3)"
