Datetime,Text
2022-08-03 00:22:14+00:00,"This legislation also specifically authorizes funding to expand the VA Richland Outpatient Clinic, giving Tri-Cities area veterans more primary care, mental health, and specialty care options. (2/2)"
2022-08-03 00:22:14+00:00,"The PACT Act will help over 124,000 post-9/11 veterans living in Washington state get care if they were exposed to toxins. (1/2)

https://t.co/TMHJU5ay6O"
2022-08-01 20:31:12+00:00,"America's future isn't guaranteed. We have to earn it -- and in an information age, we must reinforce our technology ecosystem. This money will attract and incentivize the development of chips, the key technology that we want to lead the world in.
https://t.co/BYSUZaLISO"
2022-07-20 21:51:50+00:00,"Seattle’s own @burkemuseum of Natural History and Culture was awarded a 2022 National Medal for Museum and Library Service.🏅The PNW is lucky to have this incredible facility where visitors of all ages can learn about Indigenous cultures, fossils, plants &amp; so much more.🌱🔬"
2022-07-20 19:11:27+00:00,An overwhelming majority of Americans believe birth control should remain legal and accessible. I will continue to defend women’s right to privacy and choice in light of these attacks. (2/2)
2022-07-20 19:11:26+00:00,"The right to access birth control has ensured life-changing social and economic freedom for women, but far-right politicians &amp; judges across the country are trying to weaken or overturn this precedent – one that should be long past settled. (1/2) https://t.co/XUL1TD3tpf"
2022-07-20 01:47:57+00:00,"Let's show the world that American innovation is here to stay, it's the top of the game, and we can compete with anyone given the right investments in STEM, job training, and education. (2/2)"
2022-07-20 01:47:27+00:00,"Innovation is in the DNA of Americans. If we want to create the economy of the future, we need to invest in the R&amp;D of today. (1/2) https://t.co/itahVJd02g"
2022-07-17 17:03:23+00:00,"Patients need certainty that they can receive care in states where abortion is protected and health care officials need certainty that they can continue to provide the full range of reproductive health care services, regardless of where their patient travels from. (2/2)"
2022-07-17 17:03:22+00:00,We already know more patients are traveling to Washington state to receive reproductive health care – Planned Parenthood in Spokane has reported a 60% increase in patients from Idaho. (1/2) https://t.co/DkYGku0Ukq
2022-07-16 14:48:04+00:00,https://t.co/HRteGZ06ra
2022-07-16 14:48:04+00:00,"I was honored to attend the Fry Creek Pump Station groundbreaking last week in Aberdeen. This is a critical first step in the Aberdeen-Hoquiam Flood Protection Project that will help us protect more than 5,000 different properties, business owners &amp; individuals from flood damage."
2022-07-15 23:13:15+00:00,"Yesterday, the GOP blocked our efforts to pass the Freedom to Travel for Health Care Act. Watch @SenCortezMasto and I discuss the chilling effect this will have on providers and their anxiety over people targeting them for seeing patients traveling from anti-choice states. https://t.co/YBzZV9ZYCQ"
2022-07-14 17:56:59+00:00,"Abortion providers in Washington state are already seeing increases in patients traveling from other states. We must protect our health care delivery system so providers can continue to serve patients, regardless of where the patient is traveling from. https://t.co/iQzX34P0c4"
2022-07-13 19:56:17+00:00,"The Freedom to Travel for Health Care Act clarifies that it’s illegal for anti-choice states to penalize or prosecute providers offering services in states where reproductive health care is legal, or limit travel for patients to receive abortion services in those states. (2/2)"
2022-07-13 19:56:16+00:00,Health care providers and patients are concerned that they could be targeted or prosecuted for providing or seeking care in states where the right to abortion is protected. (1/2) https://t.co/6FwZIwJ05N
2022-07-12 20:12:35+00:00,Congratulations to Odle Middle School in Bellevue for taking first place in the National Science Bowl final! Our future looks bright with these students as the next generation of technology and science leaders.🏆  #NSB2022 @TheBSD405 @DOE_SC_NSB
2022-07-12 18:54:15+00:00,"✅$11 million in ATP grants have been awarded to @iflyspokane Terminal Renovation and Expansion project (TREX). This will allow the airport to accommodate growing passenger traffic, add gate capacity, and expand economic opportunities for Spokane. https://t.co/ylysBpiV28"
2022-07-11 15:55:39+00:00,"We must stand up to these states and get clarity from the Department of Justice that those who practice medicine in Washington can continue to provide the full range of health care services, regardless of where patients are traveling from."
2022-07-11 15:55:38+00:00,Planned Parenthood in Spokane has already seen a 60% increase in patients seeking reproductive health care from Idaho. Providers &amp; patients are worried about the possibility of being prosecuted for providing or seeking care in a state where the right to abortion is protected.🧵 https://t.co/zM4pR1cxUS
2022-07-10 15:14:46+00:00,Pharmacy Benefit Managers have created too much concentration of power and not enough transparency in prescription drug pricing. Passing my Pharmacy Benefit Manager Transparency Act will direct the FTC to rein in unfair and deceptive practices to create a fair market. https://t.co/UVhdI87lO8
2022-07-09 18:30:29+00:00,"As more patients travel to receive abortion care in other states, we must protect our health care delivery system. Providers need certainty so they can continue providing reproductive health care without concern that someone from another state is going to try to prosecute them."
2022-07-09 18:30:28+00:00,"13 states have already passed trigger laws heavily restricting or banning abortion, some of which have already gone into effect now that Roe has been overruled &amp; 13 more states could act quickly to pass similar bans.🧵 https://t.co/Kqj2DF8FEV"
2022-07-08 19:37:24+00:00,"PMBs have created too much concentration of power and not enough transparency, The Pharmacy Benefit Transparency Act will require PMBs to report to the FTC so they can call out unfair and deceptive practices. (4/4)"
2022-07-08 19:37:24+00:00,"PBM’s affect all consumers, and not just on insulin pricing, but also for those who are most vulnerable in our society who are being forced into paying unreasonable co-pays and prices for their medications (3/4)"
2022-07-08 19:37:24+00:00,"Everybody knows that drug pricing is way too high, partly because only three Pharmacy Benefit Manager (PBM) companies now control about 80% of the market. (2/4)"
2022-07-08 19:37:22+00:00,I was in Seattle to talk with local pharmacists and community stakeholders on the urgent need for legislation to lower prescription drug costs. My bipartisan Pharmacy Benefit Manager Transparency Act will help lower costs for many consumers. https://t.co/nqQ91mfgDW
2022-07-08 18:38:55+00:00,"As our airports are seeing a pre-pandemic level of passenger demand, it’s important that we continue to invest in our airport infrastructure to prepare for future growth. (2/2)"
2022-07-08 18:38:55+00:00,"Modern, resilient and sustainable airports strengthen our supply chain, help our U.S. businesses compete in a global economy, and get our consumers where they need to go. (1/2) https://t.co/5ecEM8jdEb"
2022-07-06 23:20:34+00:00,"Modern, resilient, &amp; sustainable airports will help strengthen our supply chain, help our U.S. businesses compete in a global economy, and get our consumers where they need to go. (2/2)"
2022-07-06 23:20:34+00:00,I'm proud to support @iflyspokane’s application for an Airport Terminal Program grant &amp; hope that @USDOT will act soon on this investment request. (1/2) https://t.co/63su73rfjL
2022-07-06 20:43:49+00:00,"We need to provide certainty so healthcare providers can provide the full range of healthcare services, regardless of where a patient comes from. (5/5)"
2022-07-06 20:43:48+00:00,"3. What more can the federal government do to provide legal protection for healthcare workers in pro-choice states? 

4. What does the DOJ plan to do to protect providers in pro-choice states from prosecution and bounty enforcers? (4/5)"
2022-07-06 20:43:48+00:00,"1. Are WA patients and providers protected from penalties in other states? 

2. What restrictive abortion-related laws put healthcare workers in pro-choice states at risk? (3/5)"
2022-07-06 20:43:48+00:00,"Yesterday, I sent a letter to U.S. Attorney General Merrick Garland to ask for clarity on protecting our healthcare providers from the laws of these restrictive states. The DOJ must provide clarity on the following issues: (2/5)"
2022-07-04 22:57:54+00:00,"This Independence Day, I was honored to speak at the 37th Annual Naturalization Ceremony @seattlecenter. The U.S. is a country built by immigrants, and the contributions of immigrant communities in Washington state and across the U.S. are extraordinary. https://t.co/9xWO2oP1i2"
2022-07-03 17:17:30+00:00,"Women, and all individuals, need strong, enforceable rights to protect their most sensitive health data, especially regarding their personal and private reproductive or sexual health information. This legislation does that, and I am glad to support it. https://t.co/lXGlitk2qp"
2022-07-02 19:58:02+00:00,"The Cascades service is a critical connector along the I-5 corridor, providing a convenient transportation option for a region that is home nearly 10 million people and generates $600 billion in economic output. (2/2)"
2022-07-02 19:58:01+00:00,"I want to thank Amtrak for working with the state and local partners to restore service to Vancouver, BC. (1/2)
https://t.co/yyInrWxvyx"
2022-07-01 17:01:57+00:00,"And with the impacts of climate change coming faster and harsher than ever, Congress must double down on investing in clean energy solutions that will overwhelm the special interests keeping hazardous and uneconomical polluting facilities online. (4/4)"
2022-07-01 17:01:57+00:00,Congress needs to look for every tool possible to correct this situation before its used to dismantle other long-standing rights and protections. (3/4)
2022-07-01 17:01:57+00:00,"The court’s use of the flawed ‘major questions’ doctrine to handcuff EPA also opens the door to overturning a wide range of worker protections, consumer rights, and environmental safeguards. (2/4)"
2022-07-01 17:01:57+00:00,"I’m disappointed that the Court chose to overturn decades of deference to agencies and the public rulemaking process that ensures balanced, science-based decisions. (1/4) https://t.co/kUoGGtFBgI"
2022-06-30 16:46:16+00:00,"As we move forward as a country, it is more important than ever to have justices that respect and uphold our Constitution. Our Supreme Court is strengthened when it reflects and represents all Americans. (3/3)"
2022-06-30 16:46:15+00:00,"In the wake of the Dobbs decision, millions of Americans are looking to the court to protect their Constitutional right to privacy. When I met with Judge Jackson earlier this year, I was assured by her commitment to protecting this right. (2/3)"
2022-06-30 16:46:15+00:00,"Today, we recognize the historic swearing in of Justice Ketanji Brown Jackson, the first Black woman to serve on the Supreme Court of the United States. (1/3)"
2022-06-26 16:15:17+00:00,"The government should stay out of your bedroom. The government should stay out of the health care decisions you make with your doctor and your family. This is an intrusion on your privacy -- and no place for the government. 
https://t.co/04mETbj1oR"
2022-06-25 15:40:15+00:00,"…and closing the boyfriend loophole so any domestic violence abuser cannot possess or purchase a firearm. These are important steps, but it is just a start. We have more work to do to keep our kids and our citizens safe from gun violence. (2/2)"
2022-06-25 15:40:14+00:00,"This new law includes meaningful steps that will save lives, including creating grants to help states implement crisis intervention programs like red flag laws, enhancing background checks for individuals under 21… (1/2)"
2022-06-24 16:01:52+00:00,"As we face attempts to shut down vital health services, now more than ever we need to give our support to the patients who depend on them and the medical professionals who provide them. (10/10)"
2022-06-24 16:01:52+00:00,I’m calling on all Americans who believe in this right to exercise their voice and their vote. Every legislative tool and initiative process should be considered. (9/10)
2022-06-24 16:01:52+00:00,"I am hopeful that Americans will respond, as we always have when our rights are taken away. The 70% of Americans who agree must have their voices heard on the constitutional right to privacy. (8/10)"
2022-06-24 16:01:52+00:00,"Americans could now be criminalized for exercising their personal right of if and when to start a family, and be at risk of suffering life-altering pregnancy complications or death — and their doctors and nurses could be thrown in jail. (7/10)"
2022-06-24 16:01:51+00:00,"Mainstream Americans have counted on this right, depended on this right, exercised this right, and now several justices on the Supreme Court are going back on their word and upending settled law to take this right away. (6/10)"
2022-06-24 16:01:51+00:00,We know that 70% of Americans did not want to see Roe v. Wade overturned. They want these rights upheld. (5/10)
2022-06-24 16:01:51+00:00,"That’s why, as one step, I co-sponsored the My Body, My Data Act, which would give Americans strong, enforceable rights to protect their most sensitive health information. (4/10)"
2022-06-24 16:01:50+00:00,Some of our state’s biggest employers could be asked to give personal reproductive data to states that criminalize abortion. (3/10)
2022-06-24 16:01:50+00:00,"Despite decades of Republican Supreme Court nominees coming before the Judiciary Committee and saying that they believe Roe v. Wade is settled law, they have taken a sledgehammer to the right to privacy. (2/10)"
2022-06-24 16:01:50+00:00,This is a sad and tragic day in America. Millions of Americans are losing their rights to control their own bodies and their own healthcare. (1/10)
2022-06-23 20:03:03+00:00,"Today marks the 50th anniversary of Title IX. I can think of no more appropriate way to pay tribute to its legacy than to pass our bipartisan bill ensuring that men and women on Team USA receive equal compensation, benefits and medical care. https://t.co/y5qvKXEeb0"
2022-06-21 22:13:27+00:00,We’ve had 50 years of Republican nominees coming before the committee and saying that they believe this is settled law -- now foisting on the American public an invasion of their rights to privacy.
2022-06-21 22:13:26+00:00,"The people of Washington have voted to make Roe v. Wade the law of our state, because that is what the people of my state believe. https://t.co/pFbXB1KEj7"
2022-06-17 21:03:43+00:00,Consumers are paying too much at the pump. Why would you not want to give the Federal Trade Commission the ability to make sure that these markets are properly policed for unfair and deceptive practices? https://t.co/eYKl3Ip8g9
2022-06-16 23:24:46+00:00,"@POTUS Our bill will ensure that our farmers can get their products to the global marketplace, and will provide the Federal Maritime Commission the tools it needs to crack down on exorbitant fees that hike up shipping costs. (2/2)"
2022-06-16 23:23:59+00:00,"Today marks a significant step forward in our effort to lower costs facing consumers. With @POTUS’s signature, the Ocean Shipping Reform Act will level the playing field between big international shipping lines and American businesses &amp; consumers. (1/2) https://t.co/JWTUMT5TXQ"
2022-06-16 21:27:11+00:00,"From the record-breaking crowds at Lumen Field, to the Northwest’s many exuberant watch parties at bars and restaurants, to our indoor and outdoor recreational leagues for all ages, visiting fans will get to experience one of the world’s thriving soccer cultures."
2022-06-16 21:27:10+00:00,"Hosting the 2026 World Cup is a historic achievement for the Northwest, a once-in-a-lifetime experience for local soccer fans, and terrific news for our tourism economy. Soccer fans from around the world should be excited too."
2022-06-16 16:50:24+00:00,"Semiconductors underpin nearly every aspect of our national &amp; economic security, yet we are short on the amount of chips produced in the United States. Our over-reliance on vulnerable global supply chains is an economic &amp; national security risk. That is why we need to pass USICA. https://t.co/05HW5BSOGS"
2022-06-16 00:39:41+00:00,"Today, we recognize the 10th anniversary of DACA and the 17,500 WA recipients who are working, attending school and investing in their communities. Our diversity builds a stronger economy and a better society. We must move forward on a path to citizenship for these young people."
2022-06-15 18:16:28+00:00,"Grants may also be used to support project planning and design, a key need for local communities and Tribes that are working on developing new habitat restoration solutions from the ground up. (3/3)"
2022-06-15 18:16:27+00:00,"These NOAA grants will support state, local and Tribal projects to remove barriers such as small culverts, dikes, deadbeat dams and other blockages that prevent fish from accessing spawning grounds. (2/3)"
2022-06-15 18:16:26+00:00,The Bipartisan Infrastructure Law will deliver $77 million in competitive grants for projects to open up fish migration pathways and boost salmon survival. (1/3) https://t.co/ScE3os6cOq
2022-06-14 15:04:40+00:00,Elevated pump prices are driving inflation &amp; wreaking havoc on American households and their budgets. My Transportation Fuel Market Transparency Act will shine a light on the mysterious middle of gas markets &amp; go after any bad actors that are exploiting consumers. https://t.co/21QMJl74pH
2022-06-13 16:53:15+00:00,"Your right to essential health care like abortion cannot depend on the state you happen to be in. The federal government must act now to protect Americans’ rights to essential reproductive health care, no matter where they live. https://t.co/ObesVeGzzU"
2022-06-12 21:17:23+00:00,Gun safety measures like red flag laws and more background checks for those under 21 are important measures to support. I look forward to reviewing the full text of this proposal and working to improve gun safety at the federal level.
2022-06-11 17:26:25+00:00,Drivers in Washington and all across the country are struggling with record breaking gas prices. That’s why I’m fighting to pass my Transportation Fuel Market Transparency Act to ensure gas and diesel prices are fair and drivers are not paying any more than they have to. https://t.co/BgNLT2jbxA
2022-06-09 21:32:11+00:00,"What is the federal government doing to prepare to help Americans if Roe is overturned? We must have plans in place, otherwise some states are going to have a brain drain because people aren’t going to want to live and work in a state where their rights aren’t protected."
2022-06-09 20:25:37+00:00,"With this shot in the arm to our outdoor economy, we will help secure more jobs in communities throughout the state and ensure Washingtonians will be able to enjoy these priceless assets for decades to come.🌲"
2022-06-09 20:25:37+00:00,"This investment in 26 projects across Washington state’s forests &amp; public lands will improve access to our world-renowned parks, forests, historic sites &amp; trails. Our public lands are major economic drivers – more than 200,000 jobs hinge on their maintenance and preservation.🧵"
2022-06-08 21:41:09+00:00,"This #WorldOceansDay, we must recommit to doing our part to keep our oceans healthy and sustainable. I’m proud to be fighting for legislation to protect Washington state’s coastal ecosystems and economies🌊 https://t.co/laCnIHDAoc"
2022-06-08 17:54:02+00:00,"I’m proud to join @PattyMurray, @SenWarren &amp; my other Senate Colleagues in a letter urging President Biden to issue an executive order to direct the federal government to defend Americans’ fundamental reproductive rights, including the right to abortion. https://t.co/Fp16TkegXV"
2022-06-08 15:29:31+00:00,"@SecYellen “I think this is a national security issue, as well as an economic issue, and I think USICA is a very important bill that I would very much like to see passed.” (2/2)"
2022-06-08 15:29:15+00:00,"@SecYellen agrees, “It is very important, I think, to pass USICA and make investments in semiconductors that will keep the United States in the lead in this critically important industry, and to make sure we have the capacity to produce advanced chips at home.” (1/2) https://t.co/X6Oo8a70pC"
2022-06-06 22:21:54+00:00,"Today and every day, we honor and remember the brave heroes who served on #DDay. We owe our freedom to their sacrifices and those of their families. https://t.co/FLtBwYyzdP"
2022-06-05 20:32:48+00:00,"Dedicated forecasters at @NWSSpokane are constantly evaluating weather conditions to keep us safe. With better forecasting tools, more meteorologists can provide real time data and information to help protect firefighters and our communities."
2022-06-04 16:04:06+00:00,"Happy #PrideMonth! From Stonewall to marriage equality, the LGBTQ+ community has made countless advances in the fight for equality. LGBTQ+ rights are human rights. I’m proud to stand with LGBTQ+ Americans and will continue fighting for legislation to protect the LGBTQ+ community. https://t.co/WU0V5t7DX2"
2022-06-03 17:33:47+00:00,The Senate must pass common sense measures to combat gun violence such as background checks and red flag laws. #WearOrange (2/2)
2022-06-03 17:33:46+00:00,"Today is National #GunViolenceAwarenessDay

Far too many Americans have lost a loved one to gun violence. It’s long past time for action. (1/2)"
2022-06-02 22:24:07+00:00,We owe it to our firefighters to make sure that they have the best data about changing winds that affect fire conditions. The Fire Ready Nation Act will provide precious resources for @NOAA to help our firefighters with better forecasting tools. https://t.co/gU8LnX1YLk
2022-05-30 17:11:17+00:00,"My thoughts  today are also with the military families and
friends who have lost a loved one in the line of duty. Our nation is made stronger
by their resilience, commitment and dedication. (3/3)"
2022-05-30 17:11:17+00:00,"On Memorial Day, we take this day to reflect on the promises we’ve made to all who have put on the uniform. (2/3)"
2022-05-30 17:11:16+00:00,"Today, we pay tribute to the brave service members who have made the ultimate sacrifice defending our country. From our nation’s earliest days, the best among us have always answered the call to serve. (1/3) https://t.co/L1X88RyYqZ"
2022-05-24 23:49:38+00:00,The majority of Americans support common sense measures to combat gun violence such as background checks and red flag laws. I call on my colleagues to finally come together to pass legislation that will save lives. (2/2)
2022-05-24 23:49:37+00:00,"Today 14 children and a teacher tragically lost their lives in yet another preventable mass shooting. Far too many Americans have experienced the pain of losing a loved one to gun violence.

It's long past time for action. (1/2)"
2022-05-23 20:09:41+00:00,This $38.68 million in airport infrastructure funding will play a vital role in maintaining Washington state’s airport conditions and increasing passenger capacity. These grants will help ensure that our airports grow in tandem with the regions they serve. https://t.co/9LO1Ur30OM
2022-05-22 19:22:16+00:00,"70% of Americans do not want to see Roe v. Wade overturned. Republicans must be held accountable - ask them a plain and simple question. Do you stand for a nationwide ban on abortion? If they do, then America does not stand with them. https://t.co/FKkcGAls8J"
2022-05-21 18:09:11+00:00,"This $150,000 in airport infrastructure funding for Pearson Field Airport will play a vital role in ensuring that Pearson can grow in tandem with the regions they serve. This investment in our airport infrastructure is crucial to prepare for future growth. https://t.co/MDVoHSvcdq"
2022-05-20 15:16:00+00:00,"As we continue our pandemic recovery, more Washingtonians are taking to the skies and showing just how crucial it is to make investments now in our airport infrastructure to prepare for future growth. https://t.co/HUfxs11OcL"
2022-05-20 00:00:33+00:00,I’m deeply disappointed that more of my Republican colleagues didn’t vote for this bill. (2/2)
2022-05-20 00:00:33+00:00,Thousands of restaurants and bars in the State of Washington — and across the country — have been desperately waiting for the Restaurant Revitalization Fund to be replenished so that they can get the help they were promised. (1/2)
2022-05-19 21:23:42+00:00,The Supreme Court set off a political earthquake across the U.S. with a draft release of what could be a ban on abortion. Millions of Americans have since marched in their communities to protect reproductive rights. We won’t go back to an era where women are second class citizens https://t.co/JEgjGmzDTN
2022-05-17 21:58:02+00:00,"No one should face discrimination simply because of who they are. On this International Day Against Homophobia, Transphobia, and Biphobia, I’m proud to stand with the LGBTQ+ community in the fight for worldwide equality. #IDAHOBIT2022"
