Datetime,Text
2021-08-16 22:19:29+00:00,"If you have loved ones stranded in Kabul, please email my office with all applicable information at EVAC@wicker.senate.gov. My staff and I are doing everything we can to get this information to the appropriate people as quickly as possible."
2021-08-16 22:18:52+00:00,President Biden must follow through on his promise to devote all available resources toward getting these people out as quickly as possible.
2021-08-16 22:18:51+00:00,".@POTUS can attempt to blame others for his failure, but the reality is that his decisions have trapped American citizens, Afghan allies, and their families in Afghanistan with few options for escape."
2021-08-16 19:50:00+00:00,"If you are a Mississippian who has loved ones stranded in Kabul, please also email my office with all applicable information at EVAC@wicker.senate.gov. My staff and I are doing everything we can to get this information to the appropriate people as quickly as possible."
2021-08-16 19:50:00+00:00,American citizens and visa holders seeking to return from Afghanistan must complete the Repatriation Assistance Request for each traveler in their group. Information on how to complete this form is on the @USEmbassyKabul website here ⤵️ https://t.co/pIGZdobVXI
2021-08-16 14:55:44+00:00,"The bipartisan infrastructure proposal will expand broadband &amp; flood control for Mississippi communities. 

This bill devotes $100M to broadband deployment &amp; will fund flood control &amp; waterway projects throughout the state. #WickerReport
 
https://t.co/DiYhn2HRyl"
2021-08-16 00:50:10+00:00,See my full statement on the current situation in Afghanistan here ⤵️ https://t.co/MxIHRYD4UI
2021-08-16 00:50:10+00:00,My staff and I are making every effort to provide assistance to people who are attempting to evacuate or who are seeking information about friends and coworkers who are in danger.
2021-08-16 00:50:09+00:00,This self-inflicted humiliation is a disaster for Afghan families and will have long-term ramifications for American leadership in the world.
2021-08-16 00:50:09+00:00,What we are seeing unfold in Afghanistan amounts to the most shameful and cowardly betrayal of friends by an American president in my memory. President Biden's ill-advised and clumsy withdrawal has done irreparable damage to our international standing and our security.
2021-08-15 22:11:13+00:00,"Stories of heroism in the U.S. Coast Guard are part of the service’s legacy. What often goes unreported, however, is the woeful lack of resources supporting the Coast Guard’s missions.

I'm fighting to make this right for the @USCG. 

https://t.co/kENxDsyJl2"
2021-08-15 17:07:19+00:00,"Mississippi is set to receive nearly $4.5B in infrastructure funding over the next five years.
 
This is great news for our ports, airports, railway, broadband, and other forms of hard infrastructure that will have a positive economic impact on our state.

https://t.co/9B9z2w35A7"
2021-08-13 19:58:49+00:00,The U.S. cannot abandon the forces we trained and the people we protected for the past 20 years. Kabul will fall without the U.S. military. We should continue to provide close air support to Afghan security forces. https://t.co/Eqpy6w7fFN
2021-08-13 19:29:50+00:00,"Firefighters are on the front lines when it comes to keeping Mississippians safe.

@SenHydeSmith and I announced several local fire departments will receive $1.8M worth of grants to enhance their response capabilities and improve safety.

https://t.co/xtUI0VTR6q"
2021-08-13 16:30:00+00:00,".@POTUS continues to turn a blind eye to the border crisis.

We are experiencing an unprecedented wave of undocumented migrants, thousands of whom have confirmed cases of COVID-19.

America cannot tolerate lawless migration to our country.

https://t.co/mTU6M8BQN0"
2021-08-13 16:10:15+00:00,"Mississippi’s telehealth programs and community health centers are always working to facilitate access to health care for underserved populations.
 
#NationalHealthCenterWeek recognizes these contributions in our state and across the country."
2021-08-12 21:00:01+00:00,"Great news for Mississippi -- @DeltaFuelCo is establishing corporate headquarters in Natchez! This $2.75 million investment will bring 54 jobs and contribute to the growth of the Adams County community.

https://t.co/4S4UjXgPEm"
2021-08-12 20:00:00+00:00,"In July alone, Customs and Border Protection likely recorded over 210,000 apprehensions -- only a snapshot of the situation, as many others are crossing our borders undetected.

The President must act to secure our border.

https://t.co/TjEjvbXRBT"
2021-08-12 19:55:30+00:00,"From Day 1, @POTUS has worked to restrict American energy production.

Now as gas prices rise, he’s asking OPEC countries to pick up the slack.

President Biden would rather rely on foreign oil than unleash America’s energy potential.

https://t.co/XrTWBtScvV"
2021-08-12 15:59:32+00:00,"This week the Senate passed a resolution designating August as National Catfish Month!

Farm-raised catfish is wholesome, delicious, and already accounts for more than 50% of the U.S. aquaculture industry.

https://t.co/D1KDTjsjCa"
2021-08-11 22:00:00+00:00,"Not even six months after @POTUS’ arbitrarily withdrew U.S. forces from Afghanistan, the country appears to be on the verge of collapse. This rush has left America’s partners in the country at risk.

https://t.co/Dy0CjVi9j9"
2021-08-11 20:13:07+00:00,"This is a big move for diplomacy between Arab nations and Israel. 
 
Before the #AbrahamAccords, this visit would never have happened. I look forward to continued cooperation in the region."
2021-08-11 19:21:27+00:00,"The @washingtonpost editorial board is right: Vladimir Putin is wiping out what remains of Russia’s civil society and he must be held accountable. 

@POTUS must keep pressure on Russia and impose the sanctions that are overdue. #FreeNavalny

https://t.co/koIGSdCTlI"
2021-08-11 17:43:53+00:00,".@POTUS’s policies are pushing us toward an inflationary spiral – further eroding family savings and driving up the cost of living.

Republicans will continue to hold the line against more reckless taxing and spending from Democrats.

https://t.co/NzzcpyClbw"
2021-08-11 14:00:00+00:00,"Democrats’ $3.5 trillion tax-and-spend spree will not only increase the size of the federal government, but it sets a dangerous precedent for our children and grandchildren. 

It is reckless and irresponsible."
2021-08-11 13:00:02+00:00,".@POTUS has abandoned the border. ICE has released 50,000 migrants into the country without court dates.

Most will likely disappear into the country for good. #WickerReport

https://t.co/y5hbt68vAT"
2021-08-11 12:09:17+00:00,"I will say it clearly and for the record: My Democratic colleagues have teed up a reckless tax-and-spending spree that our country does not need, and cannot afford.

As the budget process moves forward, I will continue to stand with @SenateGOP against this dangerous proposal."
2021-08-11 03:22:46+00:00,"This follows a letter I led with @Sen_JoeManchin to Senate leadership expressing our support for the Hyde Amendment, which has been included in annual appropriations bills on a bipartisan basis since 1976. https://t.co/Czt3jxej8h"
2021-08-11 03:22:46+00:00,The Senate just voted 50-49 to support @SenatorLankford's amendment to protect taxpayer dollars from funding abortion!
2021-08-11 00:10:02+00:00,"Tonight I will offer an amendment to Senate Democrats' budget resolution that would direct Congress to provide the funds necessary to restore the #IronDome.

I hope my friends on both sides of the aisle will stand with me in support of Israel."
2021-08-11 00:10:02+00:00,".@DeptofDefense has already pledged to replenish Israel's #IronDome missile defense system after it defended against more than 4,000 rockets from terrorist groups in Gaza this May. But Congress has not provided the funds to do so."
2021-08-10 22:27:12+00:00,"It is disappointing the Senate could not come to an agreement to fund necessary defense infrastructure.

These provisions have wide support from our defense leaders, and I know for a fact that many of my Democratic colleagues agree they are necessary."
2021-08-10 22:00:00+00:00,"Democrats are teeing up a reckless tax-and-spending spree that our country does not need, and cannot afford. https://t.co/VxhKNIHOVx"
2021-08-10 21:10:00+00:00,"Democrats are considering an amnesty measure – in the midst of the worst border crisis in recent memory – without giving a thought to improving border security.

The left, along with @POTUS, continue to turn a blind eye to the border crisis. https://t.co/76kUiNgLhK"
2021-08-10 20:06:26+00:00,"As Democrats continue their rush toward a $3.5 trillion reckless tax and spending spree, @SenateGOP is working to ensure the needs of our nation’s military are not overlooked, but our efforts have been blocked at every turn.

https://t.co/JPvkb0esRE"
2021-08-10 19:13:45+00:00,"Democrats’ budget proposal includes provisions that will damage the economy.

It threatens the successful Trump tax cuts, includes tax hikes on job creators, and billions in wasteful giveaways to green corporations.

This slew of spending that would only heat up inflation. https://t.co/soAbXlSvPy"
2021-08-10 14:06:03+00:00,"Illegal border crossings have increased every month under @POTUS. They are on track to reach 1.8 MILLION this year. 

This Administration has failed to solve this crisis. #WickerReport 

https://t.co/y5hbt68vAT"
2021-08-09 21:30:00+00:00,"Congratulations to the 78th @SECNAV, Carlos Del Toro. 

It is important for our @USNavy to have a strong leader in place. I look forward to working with him! https://t.co/pVlK9XbzGM"
2021-08-09 20:23:42+00:00,"The people of Belarus deserve a functioning democracy that protects the human rights of all residents.

I am glad to join @SenatorShaheen to launch the Free Belarus Caucus. The U.S. Senate stands with the Belarusian people in their fight for freedom.

https://t.co/CzF5hiKvdI"
2021-08-09 18:01:37+00:00,"Congratulations to #TeamUSA! The 2021 Tokyo Olympics concluded with the United States on top both in medal count and gold medal count.

To all of our athletes, you should be very proud of your accomplishments!

https://t.co/F886N9T2KG"
2021-08-09 15:45:00+00:00,".@POTUS bears a duty to protect our borders, and he is clearly failing. Our country is in the midst of one of the worst border crises in recent memory. #WickerReport 

https://t.co/y5hbt68vAT"
2021-08-09 15:19:38+00:00,"Thank you, @Tsihanouskaya. The Free Belarus Caucus will continue advocating for freedom and free and fair elections in Belarus. Belarusians deserve a government that protects their human rights."
2021-08-08 23:58:58+00:00,"The bipartisan infrastructure package is far from perfect, but I believe it will do a great service for the United States and for Mississippi. https://t.co/SYgllTtvTq"
2021-08-08 22:00:01+00:00,I appreciated @MartyMakary of @JohnsHopkins coming by my office to discuss the latest COVID-19 guidance. https://t.co/VZyUXBIcLJ
2021-08-08 18:00:01+00:00,".@USMBDA has been a lifeline for many minority business owners. I am pleased my fellow cosponsors of the MBDA Act supported my provisions to help expand MBDA resources -- bringing tremendous value in creating jobs &amp; promoting entrepreneurship!

https://t.co/zBvyOORWMQ"
2021-08-08 00:25:58+00:00,"I am glad to work alongside @SenShelby &amp; @JimInhofe to advance resources for urgently needed defense infrastructure. 

Investing in U.S. shipbuilding and repair yards is especially critical to expanding our @USNavy &amp; @USCG fleets to meet global threats."
2021-08-05 18:07:03+00:00,"This is a great step forward for the I-14 interstate project that would connect Mississippi to the rest of the South.

I was glad to cosponsor Senator @tedcruz’s amendment to add the designation to the infrastructure legislation now pending on the floor.

https://t.co/x9yUWMLL8a"
2021-08-05 15:42:38+00:00,"Republicans &amp; Democrats agree that state &amp; local governments should be able to use unspent COVID-19 relief for their infrastructure needs.

But @POTUS is blocking @JohnCornyn’s bipartisan amendment to allow the change. I’m glad to join him in this fight.

https://t.co/U11QIBgONx"
2021-08-05 15:19:40+00:00,".@LynnFitchAG made history when she submitted written arguments to SCOTUS. 228 members of Congress joined my amicus brief supporting our state’s statute to #protecttheunborn.

Let’s hope SCOTUS treats our arguments with the seriousness they deserve.

https://t.co/iNnuzYZNca"
2021-08-05 14:06:56+00:00,"The uptick in malicious cyberattacks from China and Russia cannot go unchallenged. #WickerReport

https://t.co/g871ExYMAK"
2021-08-04 19:00:00+00:00,"The Senate has advanced legislation that would provide a big boost to our @USNavy fleet.

Congress should work with all deliberate speed to complete appropriations before the fiscal year ends.

The effects of another defense CR would be far too costly.

https://t.co/qsSE396BlA"
2021-08-04 18:00:41+00:00,"231 years ago today, the U.S. Coast Guard was born. Since then, our nation has entrusted @USCG to protect life &amp; property across our inland waterways and on the high seas. Now, it is the most capable and versatile Coast Guard in the world. 

Thank you for your decades of service! https://t.co/nuGvWUkUMD"
2021-08-04 15:00:00+00:00,"Only seven countries allow elective abortions after 20 weeks of pregnancy -- including China, North Korea, and the United States.

Our inclusion in such an unseemly group is unsettling.

https://t.co/iNnuzYZNca"
2021-08-04 14:00:02+00:00,"The U.S. must strike back against cyber attackers.

Our Armed Forces are unmatched in war capabilities, but our generals have warned we are behind when it comes to cyber defense.

We can't afford to remain vulnerable to lawless hackers who wish to harm us.
https://t.co/g871ExYMAK"
2021-08-03 22:45:00+00:00,Congratulations to Mississippi’s 2021 HBCU Scholars on your incredible achievement. I am proud of these students and their leadership!
2021-08-03 20:45:04+00:00,"Mississippi’s own Brittney Reese has won a Silver Medal in the Women’s Long Jump!

Well done, Brittney -- you have made your country proud! #Olympics 

https://t.co/XjEFSZZeTh"
2021-08-03 16:48:09+00:00,"Mississippi has taken center stage in a growing nationwide push to #protecttheunborn. Since Mississippi enacted its new law in 2018, Texas, Missouri, &amp; Indiana have passed a wave of #prolife bills. Now, states are linking arms to defend them in court.

https://t.co/iNnuzYZNca"
2021-08-03 14:04:00+00:00,"Following a @Sentecommerce hearing assessing the Colonial Pipeline attack, I co-authored a letter to @CommerceGov urging them to grow our cybersecurity workforce.

https://t.co/g871ExYMAK"
2021-08-02 22:47:45+00:00,"I appreciate @USACEHQ &amp; @DeptVetAffairs for their work to meet the urgent need for repairs to the Natchez National Cemetery. 

A $9.1M emergency contract award will help to guarantee the long-term stability of the bluffs. https://t.co/ddyrEVSBCm"
2021-08-02 21:10:09+00:00,"Lukashenko will go to any lengths to stifle free speech , even a brazen kidnapping attempt beyond Belarus’s borders. Glad to see that Poland has offered a safe haven for Olympic athlete Krystsina Tsimanouskaya. #Olympics 
https://t.co/Sd4nHZMkTI"
2021-08-02 18:16:23+00:00,"A challenge to Roe vs. Wade is long overdue.

After half a century of overreach, it is time for the Supreme Court to admit that it has been wrong to overrule the states on abortion.

https://t.co/iNnuzYZNca"
2021-08-02 16:50:55+00:00,"In May, a direct cyberattack on the Colonial Pipeline exposed severe risks to our energy supply. Gas shortages rippled across the Southeast.

It is critical that these infrastructure assets be protected against future attacks. #WickerReport 

https://t.co/g871ExYMAK"
2021-08-01 20:22:40+00:00,"Today is Gold Star Children’s Day - a day that recognizes children who lost parents in the line of duty. I encourage all Americans to come together in support of those who carry on the legacy of their parents who paid the ultimate price for our country.
https://t.co/LsdmpVAClQ"
2021-08-01 18:02:31+00:00,"Inflation is rising, which means the cost of everyday goods is increasing.
 
Mississippians – and all Americans – are left to pay the price.
 
Even so, Democrats are doubling down on their failing economic policies."
2021-08-01 15:47:23+00:00,"Mississippi attorney general @LynnFitchAG made history last week when she submitted written arguments to the U.S. Supreme Court.

She deserves high praise for taking the right stand and mounting a forceful defense of Mississippi’s 15-week abortion ban.

https://t.co/iNnuzYZNca"
2021-07-30 20:32:31+00:00,"Federal regulations should not become overly burdensome for Mississippi farmers and small business owners.

I’m working to codify the Trump Administration’s rules, which recognizes state control over local waters.

https://t.co/9lq969onp6"
2021-07-30 19:04:33+00:00,"This week, Congress passed legislation that would help fulfill America’s promise to Afghan interpreters by providing necessary resources to evacuate them and streamline approvals for those caught in limbo in the Special Immigrant Visa program.

https://t.co/u7CvrEDhEj"
2021-07-30 17:37:09+00:00,"It was a pleasure to welcome @Mayorgene and the City of Ridgeland to discuss transportation, business development, and increasing connectivity to our HBCUs!"
2021-07-30 15:58:07+00:00,"Afghan interpreters risked their lives to support the U.S. mission in Afghanistan.

Our country owes them a debt of gratitude, and I’m glad to see them safe on U.S. soil.

https://t.co/2bclnCqlOp"
2021-07-29 19:44:15+00:00,"These athletes work for too many years and make too many sacrifices to be subjected to unfair, inflexible protocols."
2021-07-29 19:44:15+00:00,".@samkendricks has been shut out of competing in the #TokyoOlympics after a positive COVID-19 test Thursday.
It is almost certainly a false positive, as confirmed by a later test.

This is an injustice."
2021-07-29 17:54:31+00:00,"Mississippi is at the forefront of the fight for life, and I am glad to lead the charge in Congress on behalf of the unborn.

My colleagues and I are urging SCOTUS to correct decades of injustice and protect life in the womb.

https://t.co/nzOPe7euNR"
2021-07-28 23:25:32+00:00,See my statement on the Bipartisan Infrastructure Deal here @SenateCommerce ⤵️https://t.co/CaxXPx0w51
2021-07-28 23:25:31+00:00,"I have long been a strong supporter of investing in our core infrastructure, but I am unable to support this agreement in its current form. Yet again, Senators are being asked to move forward on a bill that we have not had an opportunity to read."
2021-07-28 18:28:41+00:00,"Good to hear that the Senate passed @reptrentkelly’s bill to rename a Tupelo post office after Mississippi native and Vietnam War veteran, Colonel Carlyle “Smitty” Harris!

This renaming will honor Colonel Harris’s military service and sacrifice.

https://t.co/AHYSsUdhXv"
2021-07-28 17:08:33+00:00,"Residents of the South Delta have been crying out to #FinishthePumps.

Tracy Harden’s testimony reflects the reality many Mississippians face. I’m thankful she was able to share her story with Congress."
2021-07-28 15:06:07+00:00,"Completing the Yazoo Backwater Pumps will not only protect residents but also be a win for wildlife and the environment.

I am working to ensure this project moves forward. #WickerReport #FinishthePumps

https://t.co/BmndjuhMHl"
2021-07-27 15:09:54+00:00,"He was a solid conservative who understood that you could stand your ground and get things done, too.
 
He will be sorely missed."
2021-07-27 15:09:53+00:00,"Above all, Mike lived his faith. I will especially remember his eloquent prayers before meals and at Prayer Breakfast.
 
As a senator, Mike was smart, kind, and a strong advocate for his beloved state and nation."
2021-07-27 15:09:53+00:00,"Gayle and I are deeply saddened by the loss of our friend, Senator Mike Enzi of Wyoming. Our heart breaks for Diana, his wife, and his children and grandchildren, with whom he hoped to spend more time in retirement."
2021-07-27 13:40:26+00:00,"Flood control is long overdue in the South Delta of Mississippi. 

Congress approved backwater pumps for the Yazoo Basin in 1941, yet 80 years of government delay have kept the project from moving forward. #WickerReport 

https://t.co/BmndjuhMHl"
2021-07-26 19:16:00+00:00,"Flooding in the Mississippi Delta is a serious problem.

But the Yazoo Backwater Pumps have not been completed despite the overwhelming support. 

The impact of the delay has been devastating for the region. I’m working to push this project forward. #FinishthePumps https://t.co/BhhDMASGp0"
2021-07-26 18:12:33+00:00,".@POTUS’ solution to the consequences of his reckless spending is to tell you inflation doesn’t matter.

But Mississippians are feeling the impact of #Bidenflation every time they visit the store, go to the gas pump, or check their 401ks.

https://t.co/PIMLUz0dkk"
2021-07-26 14:31:30+00:00,"Providing flood control to the Mississippi Delta is a matter of urgent need &amp; basic fairness.

Across the river in Arkansas &amp; Louisiana, communities enjoy modern flood control systems. But Mississippi’s pumps have been held up for decades. #WickerReport

https://t.co/BmndjuhMHl"
2021-07-25 18:03:53+00:00,I enjoyed meeting this week with members of the Madison County Board of Supervisors to discuss their ongoing transportation projects. These investments in infrastructure will greatly impact residents. https://t.co/IfpxbHlsIj
2021-07-25 17:34:22+00:00,"Day 3 of the #22pushups challenge with the Youth Group at First Baptist Church in Tupelo.

If you or a loved one is a veteran struggling with thoughts of suicide, reach out for help. 

Check out: https://t.co/JexMou7OeW https://t.co/2Dx1aglniZ"
2021-07-25 01:12:29+00:00,"Completed Day 2 of the #22pushups challenge in Pontotoc with the Pontotoc County Sheriff’s Deputies, City Police, and Police Chief. 

If you or a loved one is a veteran struggling with thoughts of suicide, reach out for help. 

Check out: https://t.co/CABcoWdl70 https://t.co/eJ762WDPKv"
2021-07-24 18:00:01+00:00,"Congratulations to Mary Milton – the recipient of @TheRealANCOR’s 2021 Mississippi Direct Support Professional of the Year Award!

At the height of the pandemic, she gave her residents the experience of dining out from the safety of their home.

https://t.co/pOWexOvygB"
2021-07-24 14:00:00+00:00,"There are many resources available for veterans struggling with thoughts of suicide. Visit https://t.co/ECrmXNegzn or call the National Suicide Prevention Lifeline at 1-800-273-TALK (8255).

These services are free, confidential, &amp; available 24 hours a day, seven days a week."
2021-07-24 00:25:52+00:00,"A big thank you to @RepTrentKelly, @RobynTannehill, and Sheriff Clark from Neshoba County for joining me."
2021-07-24 00:16:24+00:00,"I encourage everyone to take the #22Pushups challenge &amp; share the resources that are available to help. Together we can help to reduce veteran suicide.

Learn more: https://t.co/CABcoWdl70"
2021-07-24 00:14:44+00:00,"Great to be in @neshoba_ms for the Neshoba County Fair!
 
I challenged those around me to do #22Pushups to bring attention to veteran suicide and the resources available to help. https://t.co/6vp3Mstv8B"
2021-07-23 23:49:48+00:00,"Looking forward to cheering on all of the Mississippians competing in Tokyo.

Tune in now on NBC to watch the opening ceremony!

https://t.co/vPGMjlg90v"
2021-07-22 21:13:26+00:00,My full statement on this year's National Defense Authorization Act ⤵️ https://t.co/Z0R1RRM4Tn
2021-07-22 21:13:26+00:00,"I am especially heartened to see the bipartisan backing for an increase in funding for the @USNavy over and above the President’s budget request.

It is important that we make the investments necessary to retain our competitive edge and deter future conflict."
2021-07-22 21:13:26+00:00,".@SASCGOP &amp; @SASCDems advanced a strong, bipartisan proposal to support our nation’s military service members and to enhance our national security.

I appreciate @SenJackReed and @JimInhofe for their work on this legislation."
2021-07-22 19:00:58+00:00,"America stands for freedom.

I am disappointed in the weak response from @POTUS and @StateDept as the Cuban people cry out for help. #Cuba #Libertad

https://t.co/gOOKnkOpeO"
2021-07-22 18:03:52+00:00,"If you or a loved one is a veteran who is struggling with thoughts of suicide, please reach out and get help.

@DeptVetAffairs has resources available online and over the phone. 

Check them out here ⤵️
https://t.co/CABcoWdl70"
2021-07-22 18:03:51+00:00,"Too many veterans die each day from suicide. But this epidemic is often overlooked.

I welcome everyone to join me this Friday @ 6:30PM at the Pavilion on Founders Square in @neshoba_ms for the #22pushups challenge.

Together we’ll raise awareness for suicide prevention."
2021-07-22 13:18:52+00:00,"It is a pleasure to welcome Tracy Harden of Rolling Fork, Mississippi – a vocal advocate for the Yazoo Backwater Pump Project – to Washington. Her testimony at today’s @EPWGOP hearing will provide insight into the devastating impact of flooding on Mississippians. #FinishthePumps https://t.co/jQHJpjHqyh"
2021-07-22 13:00:02+00:00,"The Hyde Amendment has prevented taxpayer funding for abortions for over 40 years.

Last week, the House of Representatives advanced a federal funding bill that left it out.

I sent a letter with @Sen_JoeManchin urging @SenateApprops to #ProtectHyde.

https://t.co/Czt3jwWHJH"
