Datetime,Text
2023-01-01 01:37:03+00:00,"Wishing all Washingtonians a safe and happy New Year! As we reflect on this past year and look forward to 2023, I hope the new year brings health and happiness to everyone. https://t.co/hFnvRngc7f"
2022-12-30 06:53:34+00:00,2/ Celebrating the Dawgs in San Antonio. https://t.co/kWrcB2wDLX
2022-12-30 06:52:58+00:00,"1/ San Antonio’s landmark Tower of the Americas, lit up in Husky purple. Great game, Dawgs! #PurpleReign https://t.co/2RPVgoXY4d"
2022-12-30 02:41:58+00:00,Excited to be cheering on the Huskies at the Alamo Bowl tonight. Go Dawgs!
2022-12-27 20:28:27+00:00,"2/ Many airlines fail to adequately communicate with consumers during flight cancellations. Consumers deserve strong protections, including an updated consumer refund rule."
2022-12-27 20:28:27+00:00,1/ The problems at Southwest Airlines over the last several days go beyond weather. The Committee will be looking into the causes of these disruptions and its impact to consumers.
2022-12-26 20:49:48+00:00,"2/ These two grants help the residents of Pacific County take needed action now, while planning for future climate impacts."
2022-12-26 20:49:47+00:00,"1/ Communities around Willapa Bay have stepped up to save their shorelines, pioneering coastal erosion solutions like cobble berms. Matching community know-how with targeted grant funds is the smart way to face the climate crisis. https://t.co/4r4wIyaFW1"
2022-12-25 20:20:39+00:00,Merry Christmas to everyone celebrating in Washington and across the country. Wishing you a joyful and peaceful holiday season! https://t.co/XP0wBnGzKH
2022-12-22 01:26:39+00:00,"Tonight President Zelenskyy spoke to the American spirit. Our two nations share the values of freedom, democracy, and independence. Washingtonians and Americans stand with Ukraine."
2022-12-19 21:53:02+00:00,"2/ This will help the port continue to support and grow good paying jobs and boost Washington state’s $53.7 billion export economy, ensuring the Port of Tacoma and Seaport Alliance remain a top competitor in the global trade market."
2022-12-19 21:53:02+00:00,"1/ This is a big economic win for the Port of Tacoma and the entire South Puget Sound. Deepening the Blair waterway will ensure that the Port of Tacoma is competitive and has the ability to host the new, larger container ships of the future. https://t.co/qjlrqbrY0R"
2022-12-19 01:36:21+00:00,Warmest wishes to all Washingtonians and all those around the world who are celebrating the first night of #Hanukkah. Chag Sameach! https://t.co/phPRByOBQO
2022-12-16 19:55:49+00:00,"4/ These projects help recover salmon stocks important to Southern resident orcas, coastal ecosystems and our economy by supporting commercial, recreational, and Tribal fishing communities. https://t.co/xv1Pfdb9hg"
2022-12-16 19:55:48+00:00,"3/ From the Skagit and Snohomish rivers in Northwest Washington to the Washougal River in Southwest Washington, the Yakima River and Columbia River basins in Central Washington to the Hoquiam River on the Olympic Peninsula."
2022-12-16 19:55:48+00:00,2/ Barriers like obsolete dams and impassable culverts block salmon from migrating to their spawning grounds across the state —
2022-12-16 19:55:47+00:00,"These first projects from the NOAA’s Restoring Fish Passage Through Barrier Removal Program will support 10 projects in Washington aimed at jumpstarting salmon recovery by removing salmon-blocking culverts and other stream obstructions. 
https://t.co/nPHNhEUG8D"
2022-12-14 21:50:04+00:00,"2/ The Equal Pay for Team USA Act requires the U.S. Olympic Committee and the governing bodies to provide the same pay, medical care, and coverage of expenses to U.S. athletes regardless of gender – or risk decertification."
2022-12-14 21:50:03+00:00,"1/ By passing the Equal Pay for Team USA Act out of the Senate, we’re sending a message to all the young girls who dream of a future in sports – you will get equal pay for your success. I will continue to push the House to get this finally passed into law🇺🇸 https://t.co/uUkKbNsLPZ"
2022-12-14 17:30:17+00:00,The successful completion of the Artemis I mission lays the groundwork for our next step – landing a woman and a person of color on the Moon for the first time in history. It also shows that WA remains an industry leader with 42 companies contributing to the Artemis program. https://t.co/n3KvnALELZ
2022-12-13 23:27:08+00:00,2/ I was proud to support the Respect for Marriage Act to safeguard the rights of loving couples across the country.
2022-12-13 23:27:07+00:00,"1/ With President Biden’s signature – a couple married in Washington state will never have to worry that their legal bond could be dissolved if they move to another state, or have their federal benefits taken away by an overreaching Supreme Court decision."
2022-12-07 16:42:22+00:00,"2/ These low-interest loans can help these small businesses pay their bills and retain valued employees as revenues get back to normal. We have to continue to improve the Highway 2 corridor and opportunities for businesses. 

Apply HERE: https://t.co/tvjvo5BjHI"
2022-12-07 16:42:21+00:00,"1/ Highway 2 closed seven different times during the Bolt Creek Fire, cutting local businesses off from suppliers &amp; customers. 
 
If your business was affected, the Small Business Administration is accepting applications for low-interest Economic Injury Disaster Loans. Apply⬇️ https://t.co/dFALqUQhDU"
2022-12-04 19:03:27+00:00,"Good luck to the @WSUEverett Rocket Team, the @CentralWashU Wildcat Rocket Club, and the @CamasHighSchool Rocketry Club – the only universities and high school in Washington state selected to compete in NASA’s @StudentLaunch rocket competition! https://t.co/rCfsqBnBhK"
2022-12-03 20:41:38+00:00,"Congrats to @WWUAthletics Women’s Soccer on making the #D2WSOC national championship! And what a thrill to compete for the national title in Washington state. Bring it home, Viks! I’ll be tuning in at 3:00 PM PT to cheer you on. @WWU_WSoccer"
2022-12-02 22:32:13+00:00,"2/ Over the next 5 years, even more investments are headed our way to tackle mega projects, expand transit &amp; get freight moving faster through the state."
2022-12-02 22:32:13+00:00,"1/ In the 12 months since the Biden Infrastructure Law passed, $3.7 billion has been put to work in communities across Washington state. ⬇️https://t.co/1fzk03NNrc?"
2022-11-30 01:55:52+00:00,"2/ Passage of the Respect for Marriage Act means that a couple married in Washington state will never have to worry that their legal bond could be dissolved if they move to another state, or have their federal benefits taken away by an overreaching Supreme Court decision."
2022-11-30 01:55:51+00:00,"1/ At a time when the extreme right is threatening our most private choices, this was a vote for love and for liberty. This historic bill safeguards the rights of loving couples across the country. ⬇️ https://t.co/LzO2EgGj2o"
2022-11-29 22:20:37+00:00,Congrats to the @USMNT for advancing to the Men’s World Cup round of 16! #USMNT #USA
2022-11-27 21:50:47+00:00,"2/ Too many stores could be closed, harming consumers &amp; workers. And many communities would potentially become food deserts."
2022-11-27 21:50:46+00:00,1/ I recently alerted the @FTC to the significant and disproportionate risk the pending Kroger/Albertsons merger would have on Washington state ⬇️ https://t.co/Dxy8yJWlVZ
2022-11-25 20:25:46+00:00,"2/ The longer the disaster declaration process &amp; funding takes, the greater impact on our fishermen who are already facing incredibly difficult decisions that could include closing their businesses or filing for bankruptcy this year. https://t.co/4xPIRRmtgD"
2022-11-25 20:25:45+00:00,"Our fishermen need support, now. That’s why I sent a letter requesting the @CommerceGov to declare a federal fishery disaster for the ‘22-‘23 Bering Sea snow crab, the ‘22-‘23 Bristol Bay red king crab, &amp; the ‘21-‘22 Bristol Bay red king crab fisheries🦀 https://t.co/D4Ty8r2DrO"
2022-11-24 18:37:10+00:00,"Wishing all Washingtonians a happy and safe Thanksgiving! No matter where you are or how you’re celebrating — I hope your day is filled with gratitude, holiday cheer, &amp; great food! https://t.co/xUyv8qMl4m"
2022-11-22 22:25:15+00:00,"The successful Artemis I launch shows that Washington state remains an aerospace industry leader, with workers at 42 companies from seven different countries contributing materials and components to the Artemis missions. https://t.co/SbZ70dzucM"
2022-11-21 18:20:39+00:00,Looking forward to celebrating the @SpokesmanReview women of the year tonight! https://t.co/YGbOQ3kco6
2022-11-20 21:21:03+00:00,"2/ My heart is with the LGBTQ+ community, those who tragically passed, and their families. We must stand up against this pattern of senseless hate against LGBTQ+ Americans."
2022-11-20 21:21:02+00:00,1/ The news out of Colorado Springs is devastating. The majority of Americans support common sense gun safety laws. It’s past time for my colleagues to come together to pass legislation to help protect our communities.
2022-11-19 20:00:06+00:00,3/ This is just the beginning – more dollars and more transformative projects are on the way that will help revitalize our state’s infrastructure and supply chains for the 21st century. https://t.co/PNbSkPwq75
2022-11-19 20:00:05+00:00,"2/ From investments in battery manufacturing in Moses Lake to increasing internet access for Washington state Tribal and rural communities, these investments will support thousands of new good paying jobs."
2022-11-19 20:00:05+00:00,"1/ This week marks the one-year anniversary of President Biden’s Bipartisan Infrastructure Law. The $3.7 billion from the BIL that has come to Washington state has jump-started critical projects to improve our water, our air, and our economy. https://t.co/cZoJYaJwKa"
2022-11-18 20:22:01+00:00,2/ The American people want this legislation passed and we need to make sure that these rights are protected for generations to come. https://t.co/G0PgOst6Iq
2022-11-18 20:22:01+00:00,1/ The protections included in the Respect for Marriage Act are long overdue. Same-sex and interracial couples deserve the assurance that their marriage will be recognized &amp; that they will continue to enjoy the freedoms and privileges that are afforded to other couples.⬇️
2022-11-17 00:16:55+00:00,5/ We need to make sure that these rights are protected for generations to come. The American people want this legislation passed.
2022-11-17 00:16:39+00:00,4/ Same-sex and interracial couples deserve the assurance that their marriage will be recognized &amp; that they will continue to enjoy the freedom and privileges that are afforded to other couples.
2022-11-17 00:16:26+00:00,"3/ Marriage equality has been protected under Washington state law for a decade. It has been protected by the Supreme Court for seven years, and yet here in the Senate, there are some that don't believe we need to take further protections."
2022-11-17 00:16:12+00:00,"2/ I understand some of my colleagues do not see a need for passing this legislation, but I would ask them to stand in the shoes of someone in a marriage that is in danger of being dissolved overnight by a court decision."
2022-11-17 00:15:47+00:00,"1/ Today, I spoke on the floor in support of the Respect for Marriage Act. These are strong protections that are long overdue. https://t.co/19ldLnfHZX"
2022-11-16 21:35:15+00:00,"The Polar Star – the U.S.’s only operational heavy icebreaker – is headed to Antarctica to support Operation Deep Freeze. Thank you to the @USCG crew members serving on the Polar Star, and thank you to their families. Seattle is proud to be your homeport!⚓️"
2022-11-16 18:18:55+00:00,"2/ Today’s success is key to inspiring the next generation of STEM workers and to maintaining U.S. leadership in space, which is why we fought to authorize NASA and Artemis in the recently passed CHIPS &amp; Science Act. https://t.co/OpnzbjPl4d"
2022-11-16 18:18:55+00:00,"Today’s launch lays the groundwork for landing a woman &amp; a person of color on the Moon for the first time in history. It also shows that WA state remains an aerospace leader, with workers at 42 companies from 7 different counties contributing components for the Artemis missions. https://t.co/tpkeu0YVIk"
2022-11-15 21:22:58+00:00,Congrats to Julio Rodriguez – what a player and what a season! You set rookie records and helped the Mariners end the playoff drought.
2022-11-15 16:59:07+00:00,"3/ Over the next five years, even more investments are headed our way to tackle mega projects, expand transit, and get freight moving faster through the state. See more 👇https://t.co/RDT0cId2eF"
2022-11-15 16:59:07+00:00,"2/ The money has launched nearly 500 local projects. These projects will repair crumbling roads and bridges, help buses run on time &amp; eliminate freight bottlenecks to lower shipping costs."
2022-11-15 16:59:06+00:00,"1/ This is a once-in-a-generation investment in infrastructure and it couldn’t have come at a more crucial time. In the 12 months since the BIL was passed, $3.7 billion has been put to work in communities across Washington state.🏗️🚧 https://t.co/GGzYKjh7yP"
2022-11-14 19:27:07+00:00,5/ We therefore urge the @FTC to commit to a thorough investigation of this transaction and take these facts into account when determining whether to approve it.
2022-11-14 19:27:07+00:00,"4/ More than ever, access to convenient, competitive grocery retail is critical for lower costs and better nutrition. Consumers are hurt as consolidation dominates the retail landscape and workers lose their jobs as transactions reduce the number of competing outlets."
2022-11-14 19:27:07+00:00,"3/ Consumers across Washington benefit from the number of these stores and what they provide in price competition, convenience, high-quality nutritional access &amp; pharmacy services. We fear that WA is at a disproportionate risk of losing stores as a result of the proposed merger."
2022-11-14 19:27:06+00:00,"2/ The merger poses a specific and disproportionate threat to Washington consumers, workers, and underserved communities. We are concerned about the negative impact the merger could have on both consumers &amp; the large workforce employed by these two companies."
2022-11-14 19:27:06+00:00,"1/ I sent a letter with @PattyMurray to the @FTC to express my concerns about the pending acquisition of Albertsons Companies, Inc. by the Kroger Company. Together, the 337 Albertsons &amp; Kroger locations in Washington represent 21.5% of the state’s total grocery stores. https://t.co/nuPz0isx3q"
2022-11-11 17:14:59+00:00,"4/ We owe our freedoms to their sacrifices and those of their families, and we are so grateful to the hundreds of thousands of veterans that are the heart of our communities throughout Washington state."
2022-11-11 17:14:58+00:00,"3/ The PACT Act also authorizes funding to expand the VA Richland Outpatient Clinic so veterans in the Tri-Cities area have greater access to primary care, mental health care, and specialty care options."
2022-11-11 17:14:58+00:00,"2/ Our veterans stood by us – now we must continue to stand by them. That’s why I was proud to help pass the PACT Act, which will help over 124,000 post 9/11 veterans living in Washington state get the care they need if they were exposed to toxins."
2022-11-11 17:14:57+00:00,"1/ On #VeteransDay, we give thanks to all those who have served in the U.S. Armed Forces. We have a responsibility to ensure that all veterans receive the housing, health care, education &amp; economic opportunities they have earned and so greatly deserve."
2022-11-11 01:46:38+00:00,"2/ These critical funds will go to: 

$25.5 million➡️Port of Grays Harbor
$17 million➡️Port of Seattle
$11 million➡️Swinomish Indian Tribal Community
$9.2 million➡️Port of Olympia
$8.6 million➡️Port of Port Angeles https://t.co/ZXZxAu2c0t"
2022-11-11 01:46:37+00:00,1/ I’m proud to have secured $71.4 million in Port Infrastructure Development Program grants to boost Washington state’s maritime economy and invest in our supply chain.🏗️🚢 https://t.co/fFVPcbasYy
2022-11-09 17:38:08+00:00,"My colleagues @RepDelBene, @RepKimSchrier &amp; I sent a letter to the U.S. Forest Service calling for the agency to begin post-burn treatment in the Bolt Creek Fire area. This is critical to preventing harm to local communities, WA state, and commerce throughout the PNW &amp; the nation https://t.co/qDAmfb8xc7"
2022-11-09 00:03:17+00:00,"I am heartbroken to hear that a student tragically lost their life in yet another school shooting. My thoughts are with the students, families, and faculty of Ingraham High School. We are continuing to monitor the situation as we hear more from local authorities."
2022-11-08 17:13:29+00:00,"5/ Our country has been the bedrock for democracies around the world, but let’s not forget what is great about a democracy. The power rests with the people – and when you have an election, it’s the people who have spoken🇺🇸 #ElectionDay"
2022-11-08 17:13:29+00:00,"4/ If you ARE registered to vote AND you haven’t voted yet AND you need an online replacement ballot go HERE. Just be sure to return your ballot to a drop box or local voting center by 8:00 PM!  
 
https://t.co/FBx0jFXCLx"
2022-11-08 17:11:49+00:00,"3/ If you are NOT already registered to vote – you CAN register and vote IN PERSON at your local voting center by 8:00 pm TODAY⬇️

https://t.co/DnYLrO0X2P"
2022-11-08 17:11:48+00:00,"2/ Go HERE to check your voter registration status⬇️
https://t.co/FBx0jFXCLx"
2022-11-08 17:11:48+00:00,"1/ It’s #ElectionDay across America!🇺🇸 Washingtonians, make sure to return your ballot to a drop box or your local voting center by no later than 8:00 PM PT TONIGHT. 

Go HERE to locate your local drop box or voting center ⬇️
https://t.co/DnYLrO0X2P"
2022-11-07 19:50:18+00:00,"The Bolt Creek Fire burned 14,000 acres along Highway 2, which is a critical corridor for everyone in Washington. We must make major investments to mitigate the impacts of future weather events to our communities, culture, and the economy of the PNW. https://t.co/HXQRJKCkkq"
2022-11-07 16:01:47+00:00,https://t.co/e8HcFvzqay
2022-11-07 16:01:47+00:00,"2/ This data will make it easier to identify the source of inflated gas prices on the West Coast. I am deeply concerned that today’s disproportionately high pump prices in California, Nevada, Oregon, and Washington cannot be fully explained by supply and demand fundamentals."
2022-11-07 16:01:46+00:00,"1/ High fuel prices are driving inflation, burdening our economies, &amp; are transferring millions of dollars from family budgets to oil company profits. That’s why I sent a letter to the @EIAgov calling on the agency to expand the EIA’s collection of petroleum market data. https://t.co/idLhWRZMG1"
2022-11-05 15:42:34+00:00,"Last week, I joined my colleagues in calling for increased federal funding for Hanford to help ensure safe and effective cleanup of the site. This is a top priority for Washingtonians, the communities surrounding DOE’s Hanford site, and regional Tribes. https://t.co/GJAnI4FCTF"
2022-11-04 18:16:13+00:00,"2/ This investment will help provide a healthier Puget Sound for our people, our economy and our salmon."
2022-11-04 18:16:12+00:00,"1/ $36 million from the EPA National Estuary Program is coming to Puget Sound! 

With this investment, the state, Tribes, and others will work to stop stormwater pollution, improve water quality, restore habitat and help the recovery of our salmon and orca populations. https://t.co/j8lgx4cewY"
2022-11-03 20:39:42+00:00,"3/ Others are working to protect salmon and critical fisheries from warming water temperatures and drought, while other Tribes are simply trying to find ways to adapt to their changing lands and waters."
2022-11-03 20:39:42+00:00,2/ Washington state Tribes are located in the eye of the climate change storm. Some Tribes need to relocate buildings and homes now because of sea-level rise and the threat of tsunamis.
2022-11-03 20:39:41+00:00,"1/ This over $10.7 million federal investment will help Tribes and Tribal organizations in Washington state mitigate the impacts of sea level rise, drought, and climate-related threats to their communities and way of life.

https://t.co/8eHhmtHrHX"
2022-10-31 21:58:14+00:00,2/ Early detection is key to fighting breast cancer – we must protect access to affordable health care &amp; increase access to preventative cancer screenings.
2022-10-31 21:58:13+00:00,1/ As we near the end of #BreastCancerAwarenessMonth – it’s important to note that breast cancer is one of the most frequently diagnosed cancers among women in the United States.
2022-10-28 22:50:09+00:00,Today I joined @RepDerekKilmer in Shelton to discuss how the RECOMPETE Act will bring critical investments to rural communities.👷‍♀️✅ https://t.co/wIOr7znb0b
2022-10-28 20:01:53+00:00,"I'm appalled by the brutal attack on Paul Pelosi.

It is a relief to hear that he is expected to make a full recovery. I wish him and Speaker Pelosi well as he recuperates."
2022-10-24 20:17:37+00:00,Happy #Diwali to those celebrating the festival of lights in Washington state and around the world today! https://t.co/0rr0owbJBr
2022-10-20 19:29:13+00:00,We were happy to have @SecretaryPete in Washington state to see firsthand how the $1 billion secured in the Bipartisan Infrastructure Law to remove culverts and fish blockages is helping to restore our critical salmon populations. https://t.co/sZCooyZMsr
2022-10-19 17:03:51+00:00,"2/ These two cutting-edge companies will not only use domestically sourced materials to make electric vehicles more affordable, they will be creating hundreds of high paying jobs that will help transform Moses Lake into an epicenter of clean energy manufacturing."
2022-10-19 17:03:50+00:00,1/ The historic investments Congress made over the past two years are helping solve the next generation battery storage technology challenges right here in Washington. ⬇️🔋⚡️https://t.co/1ajX20Htej
2022-10-17 15:17:51+00:00,I was in Port Townsend to visit the Point Hudson breakwater replacement project. I was proud to support the $7 million @US_EDA grant that is being used to help repair such a vital asset to the maritime community. https://t.co/QAbzwqDvy2
2022-10-16 06:28:54+00:00,Epic pitching battle. #Mariners not on top this year. But boy does their future look bright. ⚾️
2022-10-14 22:33:20+00:00,"2/ We want to bring the supply chain back to the U.S. — with our great research institutions like #WSU, we can usher in the next phase of innovation here in the United States."
2022-10-14 22:33:18+00:00,"This week at @WSUVoiland, I saw firsthand how @WSU is leading the way in the research &amp; application of hydrogen as an alternative fuel source. @WSUhydrogen https://t.co/6UBjh9d6BD"
2022-10-13 20:47:40+00:00,2/ I will continue to work in the Senate to uphold the integrity of the Social Security program.
2022-10-13 20:47:40+00:00,1/ I applaud this effort to give seniors and people with disabilities more financial stability. The cost of living increase is welcome relief to the millions of Americans who rely on Social Security and Supplemental Income benefits.
2022-10-11 20:48:40+00:00,"Thank you to the staff and students at Olympic High School for having me in class last week! Access to STEM education is critical for all students – keep up the incredible work in aviation, robotics, drones, and so much more! @CentralKitsap"
2022-10-10 21:31:49+00:00,"Today we celebrate #IndigenousPeoplesDay to honor Native Americans as the first inhabitants of our country, and to commemorate Native culture, the history of Native peoples, and to acknowledge the immense injustices Indigenous people have faced."
2022-10-09 00:41:22+00:00,What a comeback! This team never quits! Oct 8th — what a great day for @Mariners history!
2022-10-08 19:14:28+00:00,I was thrilled to join this year's GeekWire Summit to talk about how we’re boosting the future of U.S. innovation with the bipartisan CHIPS &amp; Science Act! #2022GWSummit
2022-10-08 02:00:10+00:00,Let’s go M’s! Off to a great start! #SeaUsRise
2022-10-07 18:59:45+00:00,Go Mariners! #SeaUsRise
2022-10-06 17:48:43+00:00,"WATCH LIVE: Sen. Cantwell, joins Secretary Buttigieg, Sen. Murray, and Rep. Schrier in Wenatchee to tour the Apple Capital Loop Project ⬇️https://t.co/GfCYnPQn0M"
2022-10-06 17:33:15+00:00,"Welcome to the PNW, @SecretaryPete! 🍎"
2022-10-06 15:37:48+00:00,"2/ Salmon travel hundreds of miles to spawn, only to be blocked by barriers within a few miles of pristine habitat. Simply put, culverts are wiping out salmon on the one-yard line."
2022-10-06 15:37:47+00:00,"1/ This new program will provide $1 billion over five years to help communities nationwide modernize culverts on local roads, railways, and other transportation infrastructure that currently block fish from vital spawning grounds. https://t.co/95BBHMCzID"
2022-10-06 00:33:40+00:00,"2/ Sports organizations have a responsibility to protect athletes — but NWSL and U.S. Soccer leaders chose to protect abusive coaches instead. This must change, and Congress expects the NWSL to implement the report’s recommendations immediately."
2022-10-06 00:33:40+00:00,"1/ I’m horrified by the culture of abuse and sexual misconduct in women’s professional soccer, and its roots in coaching at the youth and college levels.
https://t.co/xdxQlqu76F"
