Datetime,Text
2021-09-19 15:56:20+00:00,"I am proud to have recommended Judge Estudillo to President Biden. His strong character &amp; respect for the rule of law, a sense of justice, fairness, humility, empathy, capacity for compassion &amp; understanding would be a benefit to the court and all the parties that come before him"
2021-09-18 20:52:49+00:00,"The ongoing COVID-19 pandemic made it clear that local reporters and newsrooms are essential for providing accurate information &amp; keeping the public well informed. Local newspapers, TV &amp; radio have been hit hard by the pandemic &amp; they deserve our help. https://t.co/OfNpKliVVM"
2021-09-18 18:09:53+00:00,"It’s up to all of us to continue her legacy in standing up for voting rights, LGBTQ+ rights, protections against pay discrimination, protecting the rights for those with mental disabilities, and the right to reproductive healthcare and abortion. (2/2)"
2021-09-18 18:09:53+00:00,"One year ago today we lost a real hero. A fierce warrior against gender discrimination, Justice Ginsburg touched the hearts of so many Americans. (1/2)"
2021-09-16 16:24:11+00:00,G’mar Chatima Tova to all those in the State of Washington and around the world observing #YomKippur https://t.co/kX1D9FaF1r
2021-09-15 18:55:40+00:00,Happy #HispanicHeritageMonth! This month we celebrate the heritage of Hispanic communities and the countless contributions of Latinx Americans to our state and to our country.
2021-09-15 18:55:38+00:00,¡Feliz #MesDeLaHerenciaHispana! Este mes celebramos la herencia y las contribuciones innumerables de las comunidades latinas e hispanoamericanas en nuestro estado y en nuestro país. https://t.co/oCkFfwCnGX
2021-09-14 22:56:53+00:00,The science has been clear all along — I will continue to fight for protections for the future of Bristol Bay and the salmon that depend on it.
2021-09-14 21:36:20+00:00,"I know his strong character &amp; respect for the rule of law, sense of justice, fairness, humility, empathy, capacity for compassion, &amp; understanding would be a benefit to the court &amp; all the parties that come before him. (2/2)"
2021-09-14 21:36:19+00:00,"Today, the Senate confirmed Judge Estudillo to the U.S. District Court for the Western District of WA. Judge Estudillo is a great example of the successes &amp; contributions that many immigrant families make to our great nation &amp; I was proud to recommend him to President Biden (1/2) https://t.co/CDfmXGWja2"
2021-09-14 16:21:52+00:00,"COVID caused major slowdowns in the aviation supply chain and manufacturers had to lay off thousands of workers. With aviation manufacturing not targeted to recover until 2022 at the earliest, this funding will help in hiring back workers &amp; staving off more layoffs. (2/2)"
2021-09-14 16:21:51+00:00,"This is good news for aviation supply chain manufacturers in Washington. In Washington state, an estimated 2,280 jobs will be protected as a result of this aviation protection program, from small machine shops to larger suppliers of aircraft components. (1/2) https://t.co/QANnKBTZG4"
2021-09-13 22:24:10+00:00,I am glad President Biden is visiting Boise to better understand the severity of the wildfires plaguing the West and his willingness to help us secure the resources our heroic firefighters and frontline communities need right now. (3/3)
2021-09-13 22:24:10+00:00,"…and monitoring technologies, forest management efforts like mechanical thinning, controlled burns, &amp; hazardous fuels reduction, &amp; hardening our electricity &amp; telecommunications networks to ensure they don’t go down when people need them most. (2/3)"
2021-09-11 17:51:27+00:00,https://t.co/BYid5wM58e
2021-09-10 18:28:43+00:00,...that’s why I will continue to fight for a federal privacy and data security law that protects consumers and creates certainty for businesses. (2/2)
2021-09-10 18:28:42+00:00,"It’s long past time that the FTC have the tools it needs to keep pace with the online marketplace and those who would undermine it. Creating a privacy bureau is an important step in protecting consumers, but the work is just beginning... (1/2) https://t.co/93SwVApKI5"
2021-09-09 22:05:23+00:00,"...to prevent this colossal, toxic and historic threat to Bristol Bay salmon. I will continue to fight to finalize these proposed permanent protections to protect the future of Bristol Bay salmon and the future generations of fishermen who depend on it. (2/2)"
2021-09-09 22:05:23+00:00,The science has been clear all along that the Pebble Mine would destroy Bristol Bay and the wild salmon that depend on it. Salmon depend on clean water and a healthy environment and I applaud the Administration’s use of the Clean Water Act… (1/2)
2021-09-08 21:19:05+00:00,The impacts of climate change are real and are being felt in communities across the country. We are already seeing the huge costs of climate change &amp; unless we act now they will only continue to grow. https://t.co/7MeI49meiJ
2021-09-08 18:42:41+00:00,"Native women face a persistent pay gap. Even in 2021, Native women make about 60 cents for every dollar paid to men. Today and everyday — women deserve equal pay for equal work. It is time we ensure #EqualPay #NativeWomensEqualPayDay https://t.co/kttwtd24fz"
2021-09-07 22:36:20+00:00,Congratulations to Washington’s own Katie Holloway &amp; the U.S. Women’s Sitting Volleyball Team for winning gold at the Paralympic Games! #TeamUSA #TokyoParalympics @usavolleyball @ksholloway
2021-09-07 18:05:40+00:00,"Shanah Tovah to everyone in the State of Washington and around the world celebrating #RoshHashanah! Here’s to a sweet, healthier, and prosperous new year. https://t.co/609YNKUBLg"
2021-09-06 16:09:07+00:00,"Today is a reminder that we must continue to fight for workers’ rights, raise the minimum wage, increase access to funding for minority and women owned businesses, and advocate for more job-training and veteran employment programs. (2/2)"
2021-09-06 16:09:06+00:00,"On Labor Day, we stop to reflect and honor the hard-working Americans who serve as the backbone of our economy. (1/2) https://t.co/FgPCXZIxqV"
2021-09-02 19:34:37+00:00,It’s urgent that Congress pass the Women’s Health Protection Act to codify reproductive rights in federal law. (2/2)
2021-09-02 19:34:37+00:00,"The Texas abortion ban is an assault on women’s health care, including basic reproductive rights. I will continue to fight to protect the right to reproductive health care, including legal abortion, no matter where a woman resides. (1/2)"
2021-09-01 20:27:47+00:00,Congratulations to Paralympian and Washington native Susannah Scaroni on winning gold in the Women’s 5000M T54 and bronze in the Women’s 800M T54! #TeamUSA #TokyoParalympics
2021-09-01 02:42:54+00:00,Congratulations to Brad Snyder and Spokane’s own Greg Billington for winning gold in the Men’s PTVI Triathlon! #TeamUSA #TokyoParalympics
2021-08-31 20:56:59+00:00,Congratulations to Washington’s own Jaleen Roberts on winning silver in the women’s long jump T37 at the Tokyo Paralympics! #TeamUSA #TokyoParalympics
2021-08-30 19:08:28+00:00,Electrifying transportation and spurring the adoption of clean buses will ensure that our transportation system can continue to move people to where they need to be while also tackling the looming climate crisis.
2021-08-28 02:44:47+00:00,https://t.co/7wpPEtwvaE
2021-08-25 01:04:26+00:00,"At the @PortofSeattle: 

We know that trade is the backbone of our economy, but we also know that we need to do everything we can to reduce emissions and move forward. https://t.co/UStTmZmCXg"
2021-08-23 21:25:53+00:00,The @seattlestorm visited the White House today to be honored for their 2020 #WNBA Championship! Congratulations to all of the athletes for their hard work! #TakeCover
2021-08-23 17:14:00+00:00,"The Port of Longview and Cowlitz County have the assets in place, but need continued support. We’re trying to convey how much this infrastructure boosts job growth in Southwest Washington and across the U.S. https://t.co/seAwIYQj9G"
2021-08-22 18:04:27+00:00,The West Seattle Bridge is a critical part of our city. I’m thankful for @Pollytrott and @USDOT for visiting -- We want everybody to know how essential repairing the West Seattle Bridge is to our nation because it’s a corridor of trade. https://t.co/5NCKCYUPhS
2021-08-20 17:56:00+00:00,"You can also find Afghanistan-related resources from the U.S. Department of State here: https://t.co/yOpqID9JaE 
 
To reach the U.S. Department of State directly, you can call 1-888-407-4747 (U.S.) or 1-202-501-4444 (overseas) or email them at KabulACS@state.gov (2/2)"
2021-08-20 17:55:59+00:00,If Americans or Afghan partners need help please reach out to my office at 206-220-6400 or casework@cantwell.senate.gov (1/2)
2021-08-20 16:40:55+00:00,"Yesterday, I met with the Port of Longview, labor, and economic development leaders to discuss the importance of the Infrastructure Investment and Jobs Act and the Industrial Rail Corridor Expansion to the economic growth of SW WA. https://t.co/pddL40pDIj"
2021-08-19 19:08:17+00:00,"Yesterday, at @PortofSeattle w/ @USDOT Dep. Sec. @Pollytrott: 

We need to address emissions from cargo ships, trucks, trains, &amp; smaller vessels. That is why we fought so hard for the $2.25 billion that is in the infrastructure bill in the Port Infrastructure Dev. Program. https://t.co/yjDXeuuBTD"
2021-08-16 01:09:16+00:00,The $381 million in this bill for Sound Transit and additional money for transit agencies will help deal with the continued funding shortfall that Sound Transit has faced since the beginning of the COVID pandemic. Getting further into Snohomish County is a must.
2021-08-15 16:20:29+00:00,🚨Today is the last day to sign up for health insurance through @WAplanfinder ! Visit https://t.co/vKcm71gb7c to compare plans &amp; request assistance before the special enrollment period ends. #GetCovered
2021-08-11 19:25:53+00:00,"There’s more work to do, but between the budget resolution and the infrastructure package, we are on our way to a stronger economy and more jobs. (2/2)"
2021-08-11 19:25:53+00:00,"The budget framework we passed will help make Washingtonians’ lives better by making historic investments in affordable housing, child care, education, and the fight against climate change. (1/2)"
2021-08-11 18:45:22+00:00,"This bill is going to create thousands of jobs all across the State of Washington, &amp; it will allow us to better compete in the global economy while also improving people’s quality of life. (4/4)"
2021-08-11 18:45:22+00:00,And we’re authorizing funding for the removal &amp; replacement of culverts so we can work to restore the salmon runs that are so important to the Pacific Northwest. (3/4)
2021-08-11 18:45:22+00:00,We’re authorizing funding for megaprojects so we can complete those crucial multimodal projects that are too expensive for states to handle on their own. We’re authorizing at-grade rail crossing replacement because they’re safety &amp; congestion hazards in the northwest. (2/4)
2021-08-11 18:45:22+00:00,"We’ve been blessed by growth &amp; trade, but if we don’t make the infrastructure investments our economy won’t be able to keep up. For the first time ever, we’re authorizing 3 major investments that have to be made now if we are going to be able to keep pace. (1/4) https://t.co/ayPURd6Iir"
2021-08-11 02:11:29+00:00,"She fostered cooperation and consensus, and raised up everyone around her to make sure future generations may fish. I send my condolences to Lorraine’s family and friends, her colleagues, and the Swinomish Tribal Community. (3/3)"
2021-08-11 02:11:26+00:00,"For more than 4 decades, Lorraine worked tirelessly to preserve the health of our environment &amp; recover Pacific salmon populations PNW Tribes rely on. As the Chairperson of the NW Indian Fisheries Commission, she was a leading light for Tribes throughout the region. (2/3)"
2021-08-11 02:11:26+00:00,I am deeply saddened to learn of the passing of Lorraine Loomis. Lorraine dedicated her life to protecting and advancing Tribal Treaty Rights. (1/3)
2021-08-11 01:46:41+00:00,"The $381 million in this bill for Sound Transit &amp; additional money for transit agencies will help deal with the continued funding shortfall that they have faced since the beginning of the COVID pandemic. Getting further into Snohomish County is a must.
https://t.co/9oyeA7ZP0P"
2021-08-10 00:56:17+00:00,https://t.co/Dr7uNgolD7
2021-08-09 20:38:35+00:00,"🚨Good news! The special enrollment period for health insurance is now open through August 15th. Washingtonians can visit @WAplanfinder at https://t.co/vKcm71xMvM to compare plans, request assistance, and #GetCovered"
2021-08-08 18:31:30+00:00,Growing minority businesses is a priority. Making the Minority Business Development Agency and its programs permanent — and doubling its budget — will provide the support needed to give business owners the capacity they need to create new jobs. https://t.co/rOMfwHMBGg
2021-08-07 21:14:14+00:00,"Today, on Purple Heart Day, we honor the bravery and courage of our fellow Americans who made the ultimate sacrifice in order to protect the United States and all it stands for. https://t.co/iEGfYaLgfC"
2021-08-07 18:38:12+00:00,"Good luck to Bellingham’s @JakeBillRiley in today’s Men’s Olympic Marathon! #TeamUSA 
https://t.co/AJhWtQeW5i"
2021-08-07 00:04:32+00:00,"For Washington's economy to grow more jobs, it is essential to get needed infrastructure investments in our rail, highways, airports, and at-grade crossings. This bill will do that. https://t.co/w0iTkQVlKd"
2021-08-06 22:10:06+00:00,"On the 56th anniversary of the #VotingRightsAct, we must redouble our efforts to protect access to the ballot box for millions of Americans. It’s time to restore the Voting Rights Act and pass the John Lewis Voting Rights Advancement Act &amp; the For the People Act. #VRA56 https://t.co/8gROYdsVYF"
2021-08-05 21:00:49+00:00,Congratulations to Washington’s @nevin_harrison on your gold medal performance in the Women’s single 200m Canoe Sprint!🥇#TeamUSA https://t.co/YXu9a9X2R2
2021-08-04 21:54:14+00:00,"Today, the United States Coast Guard commemorates 231 years of service to our nation. Today and every day we pay tribute to those who have faithfully served in the @USCG. 
https://t.co/oa1bYLu1Vv"
2021-08-04 16:53:53+00:00,"Local news is essential. It makes our communities – and our country – stronger by asking important questions, providing accurate facts, and countering misinformation &amp; disinformation. https://t.co/p2y6hnBHYW"
2021-08-03 22:30:37+00:00,The current border closure policy is now asking them to give up the very community that they have struggled to sustain. I join @PattyMurray &amp; @RepDelBene in urging @SecMayorkas to act swiftly and to save Point Roberts from further injury. (2/2)
2021-08-03 22:30:36+00:00,"Over the course of the COVID-19 pandemic, the residents of Point Roberts have been asked to forego their family, their friends, and in far too many cases, their livelihoods. (1/2) https://t.co/EY3eChdP2c"
2021-08-03 20:28:15+00:00,...we are more than ready for these two grants to help us understand more artificial intelligence applications.  The UW will work in the area of complex systems to improve fields like manufacturing and WSU will work on improvements in farming. (2/2)
2021-08-03 20:28:15+00:00,The State of Washington is already a leader in artificial intelligence. From the University of Washington’s Tech Policy Lab that studies the grand challenges around artificial intelligence to Washington State University’s work in precision agriculture… (1/2)
2021-07-30 22:34:34+00:00,https://t.co/KuWkry4ylQ
2021-07-30 16:45:53+00:00,"56 years ago today, #Medicare and #Medicaid were signed into law. Over 100 million Americans, including millions of Washingtonians rely on these vital programs for affordable healthcare. We need to protect these critical programs and improve them."
2021-07-29 19:37:37+00:00,The COVID-19 pandemic made it crystal clear that local reporters and newsrooms are essential to keeping the public informed and safe. We have to protect these vital parts of our communities. https://t.co/j4ZjmMUxaz
2021-07-28 01:09:20+00:00,Congratulations to Washington’s @ChilesJordan and the USA Women’s Artistic Team on their historic performance!
2021-07-27 21:01:05+00:00,"I had the pleasure of working with Mike Enzi on several health care, tax policy, and workforce issues in the Senate. My heart goes out to his family and to the people that worked with him so closely."
2021-07-27 20:24:05+00:00,https://t.co/81rE09EJn7
2021-07-27 20:24:05+00:00,"At its core, local news is about holding the powerful accountable. The strength of our democracy is based in truth and transparency and local newsrooms are on the ground in our communities asking the critical questions, countering misinformation, and telling our stories."
2021-07-27 00:07:05+00:00,They will vigorously enforce federal law and our Constitutional rights. I encourage my colleagues in the Senate to support their confirmations. (2/2)
2021-07-27 00:07:05+00:00,I applaud President Biden's nominations of the first African American U.S. Attorney for the Western District of Washington and the first female U.S. Attorney for the Eastern District of Washington. Vanessa Waldref and Nick Brown are both highly-qualified. (1/2)
2021-07-23 15:28:41+00:00,"The strength of our democracy is based in truth and transparency, and local newsrooms are on the ground in our communities asking the critical questions, countering misinformation, and telling our stories. We have to protect these vital parts of our communities. (2/3)"
2021-07-23 15:28:41+00:00,"The COVID-19 pandemic made it crystal clear that local reporters and newsrooms are essential to keeping the public informed and safe, but their importance spans well beyond health emergencies. At its core, local news is about holding the powerful accountable. (1/3)"
2021-07-18 01:12:34+00:00,Congress must pass legislation to provide a path to citizenship and use reconciliation if necessary. (2/2)
2021-07-18 01:12:33+00:00,"Every day, Dreamers contribute to our state and country, serving as health care professionals, teachers, members of the military, and in many other fields. They should not have to live in fear for their future. (1/2)"
2021-07-17 15:45:29+00:00,Restoring the Voting Rights Act and protecting access to the ballot box for millions of Americans is the right thing to do and the right way to honor his memory. (2/2)
2021-07-17 15:45:28+00:00,"One year ago today, we lost a civil rights icon. John Lewis inspired people across generations. He called on us to find our courage and stand up for what is just and right, even in the face of great adversity. (1/2) https://t.co/IMEl7ktgKh"
2021-07-16 18:57:36+00:00,"Affordable housing is a crisis in the United States of America, and it’s a crisis in our state."
2021-07-15 20:36:42+00:00,I urge my colleagues to support these nominees when they come before the full Senate. (2/2)
2021-07-15 20:36:42+00:00,"Judge Estudillo, Tana Lin and Lauren King are all highly-qualified nominees that reflect the diversity we need on our federal bench. I am glad to see that all of these nominees were voted out of the Judiciary Committee. (1/2)"
2021-07-13 20:24:49+00:00,Voting is fundamental to our democracy. American’s voting rights must be protected. We must pass new federal laws to protect our Constitutional rights now.
2021-07-09 23:31:45+00:00,Congrats to the Tacoma MBDA for this $2 million grant to help support minority-owned businesses.
2021-07-08 20:02:13+00:00,We should have a 50% increase in the affordable housing tax credit at the national level as part of an infrastructure bill so we can address that crisis and build more affordable housing. (2/2)
2021-07-08 20:02:13+00:00,"When Congress returns next week to talk about infrastructure, we want affordable housing to be on the table. (1/2)
https://t.co/Xnp2OQ3Twr"
2021-07-04 20:33:16+00:00,https://t.co/TMPKuWO2Vl
2021-07-02 23:50:04+00:00,https://t.co/4Mr3QqPwCT
2021-07-02 00:08:16+00:00,"Affordable housing is a crisis in the United States of America, and a crisis in our state.
https://t.co/P5y7Sgf0vI"
2021-07-01 23:07:16+00:00,My statement on the Supreme Court decision on Arizona election laws: https://t.co/p6DQir1Bj6
2021-06-28 23:14:04+00:00,"52 years ago, the #Stonewall uprising brought the LGBTQ+ community together in the struggle for equality. No one should fear being the target of violence because of who they love. Today we commend LGBTQ+ bravery, solidarity &amp; resiliency. https://t.co/8d2WQTf6OK"
2021-06-28 22:21:55+00:00,My Statement on the PNW #heatwave #wawx https://t.co/axP8FRfooh
2021-06-23 17:05:43+00:00,It’s time for us to work together to empower more women athletes and ensure that women are treated equally within the sports arena. (2/2)
2021-06-22 22:47:30+00:00,The heart of this debate is whether we're going to fight to make sure that the federal government does its job on constitutional rights. This is about whether we do our job in upholding these constitutional rights when certain states don't do that. #ForThePeopleAct https://t.co/UGZlUo4Lim
2021-06-20 15:18:52+00:00,Happy #FathersDay to all the dads in Washington and across the country! We appreciate you! https://t.co/LG4zixYF9q
2021-06-19 16:07:05+00:00,"Juneteenth is an opportunity for Americans to reflect on the history of slavery and its impact on the United States. We have taken the important step to recognize Juneteenth as a federal holiday, and we recommit ourselves to ending racial injustice wherever we find it."
2021-06-18 16:53:29+00:00,"This includes over three million people in Washington State with pre-existing conditions. Now, we must continue the fight to ensure all Americans have access to high-quality, affordable health care."
2021-06-18 16:53:28+00:00,The Supreme Court's 7-2 decision to uphold the Affordable Care Act will finally give millions of families the certainty that their health care won't be taken away while the country continues to recover from the COVID-19 pandemic.
2021-06-17 19:48:31+00:00,"Today, we have finally recognized Juneteenth as a federal holiday. This day is an opportunity for Americans to reflect on the history of slavery and its impact on the United States. This is an important step, and we must continue to fight for racial justice."
2021-06-17 18:36:30+00:00,"This bill preserves some of Washington's most pristine lands, our last growth timber stands &amp; critical salmon habitat. Protecting these special places also ensures Washingtonians can continue to do what they love best - getting outdoors, &amp; seeing these amazing surroundings (2/2)"
2021-06-17 18:36:30+00:00,"The Wild Olympics Wilderness and Wild Scenic River Act would designate over 126,000 acres of Olympic National Forests as wilderness, as well as protect 464 miles of river on the Olympic Peninsula. (1/2) https://t.co/YxhNWwt3E5"
2021-06-15 15:03:18+00:00,"Aerospace is so important to the State of Washington and the U.S. economy. It supports more than 1.2 million good paying, highly-skilled American jobs across our country and it is vital to our future to have a level playing field. (2/2)"
2021-06-15 15:03:18+00:00,"Securing a level playing field for aerospace jobs is a big deal in the Pacific Northwest. Everyone should strive to play by market rules, not distort the market and let the best product win. (1/2)"
2021-06-14 23:42:23+00:00,"Expanding capacity at Seattle’s Terminal 5 to handle the largest, newest cargo ships is critical to keeping our ports competitive in the global economy. (2/2)"
2021-06-14 23:42:22+00:00,"Farmers, manufacturers, and other exporters from Washington state to the Midwest depend on the Ports of Seattle and Tacoma to quickly move their products to buyers in Asia and beyond. (1/2)"
2021-06-14 21:44:02+00:00,"Whether it’s moving people safely, delivering freight on time, or addressing environmental needs, this legislation is a down payment to thrive &amp; compete in the innovation economy (2/2)"
2021-06-14 21:44:02+00:00,"With the economy rebounding, it’s imperative that our long delayed transportation needs are addressed. (1/2) https://t.co/NV94rcBGd5"
2021-06-14 17:57:25+00:00,"Today, the U.S. Army commemorates 246 years in service of our nation. Today and every day we pay tribute to those who have faithfully served in the U.S. Army.  @JBLM_PAO  @I_Corps"
2021-06-12 21:05:04+00:00,Today we mourn those who lost their lives at Pulse 5 years ago. Far too many Americans have lost their lives to gun violence. It’s time that we act and support legislation to end gun violence and make our communities safer for everyone. #RememberPulse https://t.co/vuRFxZljUb
2021-06-12 17:15:12+00:00,"The salmon runs, carbon storage, and tourism appeal that the Tongass currently provides will always be more valuable to Pacific Northwest communities than any subsidized logging projects. (2/2)"
2021-06-09 00:50:15+00:00,This bipartisan vote is a huge boost to our innovation ecosystem that will help us keep pace with our competitors.
2021-06-09 00:50:14+00:00,"America is at our best when we are innovating, competing and exploring. Today’s Senate vote is a major step towards building the R&amp;D capacity we need to seize the promise of an Information Age."
2021-06-08 21:17:18+00:00,Every American deserves equal pay for equal work. The Paycheck Fairness Act will help end pay discrimination &amp; pay secrecy in the workplace and make it easier to fight for fair pay. It’s time for the Senate to end pay discrimination by passing this important legislation #EqualPay
