Datetime,Text
2022-06-09 02:03:48+00:00,"U.S. Army Rangers bravely wore the uniform of this great nation and participated in some of the most important battles of WWII. 78 years after D-Day, I’m proud @POTUS signed into law my bipartisan legislation to finally award these Veterans with a Congressional Gold Medal."
2022-06-08 15:44:31+00:00,"In Illinois, requiring a Firearm Owners Identification card to legally own a firearm is one way we're helping prevent firearms from falling into the wrong hands—but gun violence cannot be solved by a single state.

@RepBobbyRush and I have a bill to enact this law nationwide."
2022-06-08 00:17:13+00:00,"If Republicans have their way, doctors who are working in states where abortion—or even management of a miscarriage or ectopic pregnancy—is outlawed could be threatened with prison for daring to save a patient’s life.

This is anything but pro-life."
2022-06-07 22:23:16+00:00,"From laying the railroads that connect our country from sea to shining sea, to starting businesses big and small, immigrants from all over the world have helped build our nation.

This #ImmigrantHeritageMonth, let's celebrate all of the stories that make our country so unique."
2022-06-07 19:27:11+00:00,It was great to catch up with Deputy VA Secretary Donald Remy today. I appreciate all the good work he’s doing to support our nation’s Veterans and I was glad to speak with him about how we can make sure we’re meeting their needs.
2022-06-07 16:25:43+00:00,"I carried an M16 and M4 in the military, so let me be clear:

High-powered rifles designed for our troops to engage an enemy with accurate, lethal fire at a velocity of 3,000 feet per second have no place on our streets.

I fully support an assault weapons ban."
2022-06-06 19:37:15+00:00,"Illinois is uniquely positioned for companies looking to expand manufacturing in the U.S. I look forward to working together to bolster trade and support good-paying, local jobs in the agriculture and tech sectors while better protecting our nation from supply chain disruptions."
2022-06-06 19:37:14+00:00,"Last week, I was pleased to lead a congressional delegation to visit Taiwan and South Korea—two partners that are vitally important to Illinois’s economy—to help develop economic relationships and partnerships throughout the region. Thank you for having me. https://t.co/ihJVEINe1H"
2022-06-06 17:12:52+00:00,"78 years ago, our brave troops stormed the beaches of Normandy and changed the course of history. If not for them, we might not have the free world we know today. 

Their bravery, sacrifices and heroism will never be forgotten. https://t.co/8fIGCOrQUY"
2022-06-06 13:30:45+00:00,"At a time when Big Oil refiners are profiting off the backs of hardworking Americans, I am pleased that President Biden's @EPA is taking action to diversify fuel options at the pump and get our Renewable Fuels Standard back on the right track. https://t.co/Jd4Q2x2HHu"
2022-06-06 01:40:40+00:00,No school should be better known for the blood that was shed in its classrooms than the curriculum that is taught there. We need to reinstate the assault weapons ban. Raise the age to buy firearms to 21. Mandate a federal red flag program nationwide. Now.
2022-06-05 16:06:49+00:00,"As we mark #WorldEnvironmentDay, I'm proud of what my Drinking Water and Wastewater Infrastructure Act and the Bipartisan Infrastructure Law are doing here in America. By removing lead pipes and delivering cleaner water, we're paving the way towards environmental justice for all."
2022-06-04 16:29:29+00:00,"In the U.S., corporations manufacture and market semi-automatic rifles modeled on the M4 Carbine.

The firearm industry is profiteering off the entirely *legal* sales that equip killers to transform our communities into a warzone."
2022-06-03 18:02:36+00:00,"This Gun Violence Awareness Day, I #WearOrange for every victim of our nation's seemingly endless cycle of gun violence—from Buffalo, to Uvalde, to Tulsa, to Chicago and beyond.

Enough was enough a very long time ago. https://t.co/iD7FBWXmXN"
2022-06-03 14:56:44+00:00,"How can it be ""too soon to talk about politics"" when we're already too late to stop shootings in Buffalo, Uvalde, Tulsa, Pittston, Los Angeles, Chicago, Racine and Ames?

It's never too soon for the GOP to help us prevent the next tragedy in America."
2022-06-02 23:39:41+00:00,"5.56 millimeters. 3,000 feet per second.

While it makes sense to equip our troops in combat with lethal high-powered rifles, they should never be used against innocent babies in our schools.

I’m ready to vote to reinstate our assault weapons ban. Is your Senator?"
2022-06-02 21:00:49+00:00,"Exxon Mobil doubled profits from last year.
Chevron saw its highest quarterly profit in 10 years.
Shell saw its highest quarterly profit ever.

Big Oil has no problem getting rich off working families.

I have a bill to prevent this abuse and protect working Americans."
2022-06-02 17:00:08+00:00,"Tulsa, Oklahoma.
Pittston, Pennsylvania.
Chicago, Illinois.
Los Angeles, California.

Within the last 24 hours, each city was struck by gun violence.

Enough. Every American should be able to visit a hospital, go to a grocery store or learn in school without fear of gun violence."
2022-06-01 21:53:55+00:00,"Domestic terrorism, white supremacy and gun violence are some of the deadliest threats facing America's families—and Republicans blocked legislation to try to address it. Why?

If you’re not willing to act to protect the innocent, you surely don't belong in the U.S. Senate."
2022-06-01 20:07:17+00:00,"Not only are Cronobacter infections in infants often deadly, they’re also underreported—as Minnesota is the only state that requires them to be reported.

I’m calling on @CDCgov to begin tracking these infections nationwide so we save babies' lives. ⬇️ https://t.co/On0tIHjvUx"
2022-06-01 18:50:54+00:00,https://t.co/zpFecDXGzo
2022-06-01 16:20:08+00:00,"Happy Pride Month!!!🏳️‍🌈🏳️‍⚧️
 
In our classrooms, in our military and everywhere in between, LGBTQ+ Americans deserve to live their truth and have their rights protected—no matter where they live or who they love."
2022-05-31 16:02:23+00:00,"NEWS: In light of China's recent provocation, I introduced a bipartisan bill to help Taiwan develop its military defenses and provide it with the tools it needs to protect itself from any unwarranted attack. I remain committed to supporting this important strategic partner."
2022-05-30 13:43:55+00:00,"This Memorial Day, I hope you will join me in not just thinking of all those warriors who sacrificed for the nation they loved, but to honor the sacrifices of our fallen heroes by acting in service of others. https://t.co/acOUcvfB91"
2022-05-29 23:01:47+00:00,"It is long past time we hold the makers of AR-15s and weapons of war accountable.

We need to eliminate liability shields for manufacturers and the FTC needs to launch an investigation into their aggressive marketing so we can protect our kids and prevent future tragedies."
2022-05-29 23:01:47+00:00,"Just days before the Uvalde massacre, the manufacturer of the 18-year-old shooter’s weapon of choice literally posted an ad of a child holding an AR-15. That’s not a coincidence.

The firearm industry is purposefully marketing to the next teen shooter.
https://t.co/pUaQLVzvWI"
2022-05-29 18:26:52+00:00,"Suspend the filibuster to pass commonsense gun safety reforms. Time and again, we've done it on things that matter.

But the right of our babies to not be torn apart by weapons of war is not worthy of that? https://t.co/iPe4CnEmt7"
2022-05-29 00:41:20+00:00,"Let's show the nation that we value children's lives more than an arcane Senate procedure rule.

Let's do what adults are supposed to do: let's protect our kids.

Let's do our jobs."
2022-05-28 00:19:26+00:00,https://t.co/tyv0TsQAxJ
2022-05-28 00:19:25+00:00,https://t.co/xMJd7HgdfS
2022-05-28 00:19:25+00:00,https://t.co/VOCS802A59
2022-05-28 00:19:24+00:00,https://t.co/aUnxNfvTDg
2022-05-28 00:19:24+00:00,https://t.co/Z8SoJ7wRjI
2022-05-28 00:19:24+00:00,https://t.co/76HPKUlBS9
2022-05-28 00:19:23+00:00,https://t.co/bs0aTbIGV5
2022-05-28 00:19:23+00:00,https://t.co/3auaVGlaJf
2022-05-28 00:19:22+00:00,https://t.co/fDu7FQUHdA
2022-05-28 00:19:22+00:00,"A thread: Every single one of these heart-wrenching stories is preventable. We don't have to live like this.

Senate Republicans, when will it be enough?
https://t.co/Ok3cIii2se"
2022-05-27 20:05:14+00:00,Republicans care more about a pay day from the gun lobby than they do dead babies. Enough. https://t.co/QqpZopHxFr
2022-05-26 23:15:53+00:00,"When the assault weapons ban was allowed to expire, the number of mass shooting deaths tripled—tripled.

We know that the ban works and we need to reinstate it."
2022-05-26 21:17:53+00:00,"NEWS: After passing the House last week, Senator Cornyn and my bipartisan Public Safety Officer Support Act swiftly passed out of @JudiciaryDems—bringing us closer to providing so many grieving families with the acknowledgement and support they need after such tragic losses."
2022-05-26 20:26:29+00:00,"Climate change threatens our national security, our troops' safety and military readiness. Today, I'm proud to introduce a bill to help @DeptofDefense transition to clean energy by giving it the tools it needs to meet its energy resilience goals. https://t.co/LPSP1DFuSd"
2022-05-26 19:13:43+00:00,"I wish I didn't have places to buy ballistic protective backpacks for my daughters bookmarked, but I do.

Losing your child is a hell I wouldn't wish on my worst enemy.

And we know how to stop these attacks—heck, the rest of the world has.

Suspend the filibuster for our babies."
2022-05-26 18:17:25+00:00,"Buffalo.
El Paso.
Pittsburgh.

White supremacists and other domestic extremists have terrorized far too many communities.

By blocking the Domestic Terrorism Prevention Act, Republicans are doing nothing to stop future tragedies committed by radicalized, home-grown terrorists."
2022-05-26 16:05:21+00:00,NEWS: @FTC Chair Khan is swiftly taking action after I called for a wide-ranging inquiry into the infant formula industry. I was glad to speak to her this week and look forward to reviewing the findings so we can develop legislative fixes to help ensure this doesn't happen again.
2022-05-26 13:53:15+00:00,"Let's be clear: you are not ""pro-life"" if you choose to do *absolutely nothing* to save children from gun violence, save Black and Brown moms from the maternal mortality crisis and save Americans from domestic terrorism or ANY OTHER FORM of preventable crises."
2022-05-26 01:24:31+00:00,"I ask my Republican colleagues, when will children's lives matter more than your check from the gun lobby? When? https://t.co/TdjLjUTU7P"
2022-05-25 22:33:53+00:00,"Black lives matter. Now and always.

It's long past time we pass the George Floyd Justice in Policing Act to help uproot systemic racism, prevent future tragedies and truly bring us closer to equal protection under the law for all Americans."
2022-05-25 22:33:52+00:00,"George Floyd’s death was a tragedy—but horrifyingly, it's not an anomaly.

It’s on each of us lucky enough to still be here today to use every breath we have to bring about the justice he was robbed of two years ago—and to ensure that no one else is robbed of that justice again."
2022-05-25 22:33:52+00:00,"On this day two years ago, George Floyd was murdered by a police officer who had taken the oath to protect and serve.

For about nine minutes—a father, a son, a brother was forced to beg for his life until he couldn’t beg any longer. https://t.co/UbVm9i37Rw"
2022-05-25 20:43:32+00:00,"In the face of yet another moment of unimaginable grief, it is time the Senate shows the nation that we value children’s lives more than an arcane procedural rule. It is time to do our jobs and act to protect our children from senseless gun violence. https://t.co/2u2ld419CS"
2022-05-25 20:09:30+00:00,"If “the only thing that stops a bad guy with a gun is a good guy with a gun,” then how did yesterday happen?

We can do better—for our kids and our country."
2022-05-25 18:49:19+00:00,"19 children and 2 teachers. Nearly a decade after 26 were killed at Sandy Hook.

Nowhere else in the world are families forced to face this kind of loss in the name in ""freedom.""

How many more kids will get gunned down before Republicans act?

Enough. We can prevent this."
2022-05-25 01:30:08+00:00,We know there will be another and another and another attack if we do nothing. And we know who is preventing action. The Senate should immediately—at a 50-vote threshold—vote on commonsense gun safety reforms that the American people have demanded for too long.
2022-05-24 21:54:07+00:00,"Every parent's nightmare. I’m heartbroken for these families and angry as hell at Republicans' shameless inaction to save the lives of innocent children.

For every victim of this tragedy, enough has to be enough."
2022-05-24 18:28:39+00:00,"While @SenateDems stand up for women and reproductive freedom, MAGA Republicans are scheming to take rights away from millions of Americans for the first time in our nation’s history. It’s unforgivable.
https://t.co/eQVR6qPMmL"
2022-05-24 14:16:46+00:00,"As a founding co-chair of the Senate’s first-ever @EJusticeCaucus, I'm proud @POTUS’s admin has made environmental justice a real priority. This week will highlight historic EJ initiatives—from Justice40 to the Bipartisan Infrastructure Law, we're making progress at long last."
2022-05-24 01:05:26+00:00,"This is the strong American leadership we need. @POTUS's Indo-Pacific Economic Framework will help strengthen our economy, support Illinois farmers and ranchers and signal we'll work with our friends in the region to counter China's influence. https://t.co/i5BlaoxAHF"
2022-05-23 22:23:36+00:00,"I applaud @POTUS for swiftly signing into law the Access to Baby Formula Act, which I helped introduce. This law will help ensure WIC can immediately respond to our nation's infant formula shortage so families don’t go without the food they need.
https://t.co/fzBhZECmvJ"
2022-05-22 22:24:06+00:00,"Working families shouldn't have to worry about affording the medicine or gas they need to get by.

Insulin costs should be capped at $35/month.

Big Oil shouldn't price gouge hardworking Americans at the pump.

Democrats are working to make lower costs a reality."
2022-05-22 16:31:08+00:00,"Successfully leading the Delano Grape Strike in 1965, Larry Itliong helped empower California farm workers to protest against low wages, poor working conditions and much more. May we continue to expand worker protections everywhere. #APAHM https://t.co/7f77OVUxMq"
2022-05-22 15:11:32+00:00,"I don’t want my daughters to have to grow up in a country that won’t protect them from gun violence. I'm proud to re-introduce this legislation again with @RepBobbyRush to help prevent firearms from falling into the wrong hands.
https://t.co/NrSqEca2DX"
2022-05-21 21:22:17+00:00,"The rain couldn’t stop us from celebrating all of the accomplishments of @HarperCollege’s graduates today. I was honored to deliver this year’s commencement address, and I can’t wait to see the impact the Class of 2022 makes in their communities. https://t.co/pQanHXKdoZ"
2022-05-21 15:21:14+00:00,"Every day, servicemembers put on the uniform of our nation to serve and defend our country—both at home and across the globe.

This Armed Forces Day and every day, we owe them a debt of gratitude. https://t.co/EJZ47sgM2d"
2022-05-20 23:04:35+00:00,It was an absolute pleasure to welcome @danieldaekim and other AANHPI activists to my office with @RepAndyKimNJ. Asian Americans are American—and it's up to all of us to speak out and bring about a tomorrow where everyone can achieve the American dream and live free of hate. https://t.co/NauSKtwQpq
2022-05-20 21:20:37+00:00,"🚨NEWS: Today, my colleagues and I are calling on @USGAO to conduct a study into the persistent barriers that Americans with disabilities experience in accessing healthcare *despite* having strong protections to access and receive equitable care under the law. This is overdue. https://t.co/qQjAnZEhND"
2022-05-20 20:06:12+00:00,"Heartbroken by this tragedy—a tragedy that happens far too often in our nation. But we don't have to live like this. We need Republicans to come to the table so we can pass what a wide majority of Americans agree we need: commonsense gun safety reforms.
https://t.co/gSQXErbSge"
2022-05-20 14:19:08+00:00,"One year ago, I was proud to be at President Biden's side as he signed our COVID-19 Hate Crimes Act into law—bipartisan legislation to help stop the anti-Asian hate plaguing our nation and terrorizing the AANHPI community. But our work is far from over. We must do more. https://t.co/wnxcHQVpI8"
2022-05-20 03:12:24+00:00,"Last night, the House took an important step in supporting families like Officer Smith’s by passing the bipartisan Public Safety Officer Support Act I’ve been pushing for. 

Now it’s time for the Senate to get it over the finish line.
https://t.co/fjjfWi90B3"
2022-05-20 02:01:16+00:00,Every Senate Republican—the majority of whom don't have uteruses themselves—voted against protecting Roe v. Wade and your right to decide what happens to your own body.
2022-05-19 22:14:00+00:00,"The resources I voted to pass today will help ensure Ukraine’s territorial sovereignty, its people’s survival and their right to self-governance continues for generations to come."
2022-05-19 22:13:59+00:00,"The human suffering caused by Putin’s unjustified and unjustifiable attack on Ukraine’s sovereign territory demands our continued attention, and that’s why I’m so proud the Senate passed this important bill to help the Ukrainian people today.
https://t.co/3I7ftgE3cb"
2022-05-19 20:07:41+00:00,Making our nation's infant formula shortage a top priority is an important move by @POTUS. We must do everything we can to make sure there is enough formula available in our stores ASAP for families who depend on it—and make sure a shortage like this never happens again.
2022-05-19 19:00:19+00:00,Let’s be clear: nationwide infant formula shortages like the one we’re seeing now can have serious consequences on a child’s growth and development—and it’s unacceptable. Proud to help intro new legislation with @SenBobCasey and my colleagues to ensure this never happens again.
2022-05-19 17:18:03+00:00,Enough with Republican hypocrisy. We need to protect Roe v. Wade and reproductive freedom NOW. https://t.co/KgzeHIgR1A
2022-05-19 15:17:52+00:00,NEWS: My bipartisan Veteran Entrepreneurship Training Act passed out of @SenateSmallBiz to codify @SBAgov's Boots to Business program—providing an opportunity for servicemembers and their spouses to develop entrepreneurship skills.
2022-05-19 14:07:38+00:00,"I’m proud to join my @SenateDems colleagues to reiterate that Democrats are not going to give up when it comes to protecting reproductive rights. No matter what.
https://t.co/ZmcBKix9ks"
2022-05-18 20:21:05+00:00,"That moment crystalized the power of America for me. Just the fact that our guys were taking orders from a woman—an Asian American woman—shows the power of America and our diversity.

We're all American, we respect each other and it’s important the rest of the world sees that."
2022-05-18 20:21:05+00:00,"At the time, I was the only woman officer in the unit—and the only Asian American in a command position.

Someone asked one of my guys if they could look at our aircraft, and he said “you gotta go talk to her.”

They asked “who? The little Asian girl?”

""Yeah, she’s the boss.”"
2022-05-18 20:21:05+00:00,"For me, the pivotal realization that the strength of our nation lies in our diversity happened when I was a young platoon leader and First Lieutenant, participating in Operation Brightstar, a NATO training exercise, in Egypt."
2022-05-18 20:21:04+00:00,"Asian American, Native Hawaiian and Pacific Islander stories are American stories. We belong here. https://t.co/KvNjCi5t8y"
2022-05-18 17:05:44+00:00,"Vincent Chin would have turned 67 today. But his life— and too many others—were tragically cut short by anti-Asian hate. On this AAPI Day Against Bullying and Hate, we must build on our work to end the cycle of violence against our fellow Americans.

We are not the ""other."" https://t.co/N6Wby9QvbT"
2022-05-18 16:15:20+00:00,"This year's committee-passed WRDA will boost our economy, protect public health and create jobs through investments in water infrastructure. I look forward to working with my colleagues on both sides of the aisle to get this bill signed into law. https://t.co/zKaveNJpjD https://t.co/73LwyNusQA"
2022-05-18 00:09:28+00:00,Today marks the 68th anniversary of the Supreme Court's unanimous Brown v. Board decision to dismantle racial segregation in schools. It's one of the most important precedents in our legal system—and should always be treated as such.
2022-05-17 21:08:25+00:00,"This International Day Against Homophobia, Transphobia and Biphobia, we're seeing hundreds of hateful anti-LGBTQ+ bills sweep across the nation in an attempt to intimidate kids. It must stop.

To every student and child: no matter who you are or who you love, I am with you."
2022-05-17 16:53:17+00:00,"If you’re a combat Veteran, you can take your DD214 to any local Vet Center to talk to a counselor about how you’re feeling, even if you aren’t enrolled in the VA.

Check eligibility and locations by visiting: https://t.co/8biB5ZelXg"
2022-05-17 16:53:16+00:00,"For Veterans in crisis, you can:
—Call 1-800-273-8255 and press 1
—Visit https://t.co/DJURcn6Y2e
—Text 838255"
2022-05-17 16:53:16+00:00,"My war wounds are obvious, but many of our troops come home with invisible wounds that are no less deserving of high quality care than mine are.

This Mental Health Month; see how you can access free resources below."
2022-05-17 01:28:02+00:00,"NEWS: My bipartisan legislation to end the sale of deadly padded crib bumpers is now law. Thank you @SenRobPortman, @SenBlumenthal and @SenSherrodBrown for your leadership so we could help new parents and prevent needless infant deaths across the nation."
2022-05-16 19:27:39+00:00,"Erika Moritsugu has long been an AANHPI leader and now she's working in the White House as a voice for the community, too. As a Deputy Assistant to @POTUS and AAPI Senior Liaison, she's helping us build on and expand efforts to protect and empower AANHPIs. #APAHM https://t.co/5BeJx2EVyQ"
2022-05-16 14:07:44+00:00,Sending my best and wishing a speedy recovery to my friend @ChrisVanHollen. Looking forward to having you back in the Senate soon!
2022-05-15 17:55:57+00:00,"Absolutely heartbroken thinking of the victims, their loved ones and the entire Buffalo community as our nation struggles to understand this racially-motivated domestic terrorism attack. We must do more to end this kind of senseless violence and prove that hate has no place here."
2022-05-14 18:00:00+00:00,"Folks, it's Clean Air Month. A reminder that every American deserves to breath safe air and live in a community free from environmental injustices, like toxic pollution—regardless of their skin color, income or ZIP code."
2022-05-14 16:49:04+00:00,"This #APAHM and always, let us never forget the unwavering courage of Fred Korematsu who challenged the mass internment of Japanese Americans during WWII. By passing my Korematsu-Takai Civil Liberties Protection Act, we could honor his work &amp; help ensure this never happens again. https://t.co/XAr9Yn0BPD"
2022-05-14 14:00:00+00:00,It's long past time we cap the monthly cost of insulin at $35 to help working families save money and save lives.
2022-05-13 18:27:49+00:00,"Over 50 Attorneys General support my Public Safety Officer Support Act to treat police officers and first responders who die by suicide as line-of-duty deaths.

Anything less diminishes their service and sacrifice. It's time to get this done.
https://t.co/p6p0CmCCYd"
2022-05-13 16:34:05+00:00,"It’s time for Congress to empower the @FTC to crack down on corporations that are exploiting global crises to rip off hardworking Americans in grocery stores, pharmacies and at the pump. 

Proud to help introduce @SenWarren's bill to help prevent this. https://t.co/RwvhzhHqSY"
2022-05-13 15:10:14+00:00,Our nation's infant formula shortage is alarming. I'm asking the @FTC to immediately conduct a study into the business practices and market conditions that led to this. We need to figure out what went wrong so we can work to ensure it doesn't happen again. https://t.co/zFMrauTMCb
2022-05-13 00:15:43+00:00,Our troops deserve access to the best technology possible—and 3D printing and bioindustrial manufacturing can provide big advantages to helping them do their jobs. Proud to introduce a new bipartisan bill to help expand advanced manufacturing for DoD. https://t.co/dT03SnanWt
2022-05-12 22:19:25+00:00,"Patsy Mink's legacy is unparalleled. As the first woman of color elected to Congress, a co-author of Title IX and an unwavering advocate for women's rights, the barriers she shattered helped build a brighter, more inclusive tomorrow for future generations. #APAHM https://t.co/gsWZWaZ3pp"
2022-05-12 20:24:58+00:00,"Today our nation surpassed a grim, heartbreaking milestone—one million of our fellow Americans have been taken by this deadly pandemic.
 
My heart is with the families whose lives have been changed forever.
 
Please get vaccinated, get boosted and help us save lives."
