Datetime,Text
2021-12-15 23:27:38+00:00,"With this year's NDAA, Congress is sending a clear message that we have our troops’ backs. I’m proud to have worked with my colleagues on both sides of the aisle to advance this bill and glad it includes so many of my provisions to support our military and their families. https://t.co/rAJoDUa6n4"
2021-12-15 22:18:18+00:00,"For 6 months, the expanded Child Tax Credit has been:
 
👉Reducing food insecurity
👉Lifting millions of children out of poverty
👉Helping families pay the bills
 
Without any action, the payments going out today could be the last. We should work to extend the CTC expansion ASAP."
2021-12-15 19:49:00+00:00,"For Latino communities who disproportionately shoulder the burden of environmental injustice and the climate crisis, @POTUS’s #BuildBackBetter Act is an unprecedented chance to tackle these inequalities, create more jobs and build a cleaner planet for all of us. #NoHayPlanetaB"
2021-12-15 15:47:03+00:00,"Nearly 6 million jobs were created in the first 10 months of the Biden-Harris Administration—a record for any new President.

Our economy is rebounding from COVID at record pace under Democrats. And we're just getting started."
2021-12-15 14:09:07+00:00,"🚨TODAY is the last day to #GetCovered under the ACA with a plan that begins with the new year.

Don't wait! Take a moment to visit https://t.co/Exlg5xdc1G and find a plan that works for you and your family."
2021-12-15 02:43:13+00:00,"60 years ago, JFK created the Commission on the Status of Women—sparking important discussions about discrimination against women. Right now, we have an unprecedented opportunity to uplift women and families by passing universal pre-K and much more in @POTUS’s Build Back Better."
2021-12-15 01:42:50+00:00,"Today, I joined my colleagues in a moment of silence for the 800,000 Americans lost to COVID-19. Each of us can do our part to honor their memory and help ensure we don't lose anyone else by getting vaccinated and getting boosted. If you haven't yet, I urge you to do so now. https://t.co/9H6JOWCgBi"
2021-12-14 22:36:25+00:00,"Our nation is in a caregiving crisis—for both patients and caregivers. 

With the #BuildBackBetter Act, we can provide better pay and benefits for caregivers as well as help make sure seniors and those with disabilities can get quality care at home. 

We know that #CareCantWait."
2021-12-14 21:15:31+00:00,"Every year as we mourn the anniversary of the Sandy Hook massacre, I’m flooded with the same shock and anger that I felt that day. Tweeting out thoughts and prayers isn’t good enough. We need to honor the victims with action like passing common sense gun safety measures. https://t.co/qZrOd9sibt"
2021-12-14 19:36:41+00:00,"I’m heartbroken over the losses from this weekend’s deadly tornadoes in Illinois. I was glad to connect with @GovPritzker to discuss Illinois’s rescue and recovery, and I’ll do everything I can to help make sure Illinois has the federal assistance it needs in these efforts."
2021-12-14 16:18:22+00:00,"Congratulations to @GautamR46 on his new role as Director of the White House Office of Presidential Personnel. He is a great pick to help @POTUS find the best people to realize his vision and agenda for working Americans, and I wish him well as he enters this new role."
2021-12-14 01:12:28+00:00,"A heartbreaking display of heroism. I hope Clayton's family finds some comfort knowing he wanted to protect his fellow Illinoisans.
 
May he and all lives lost in this weekend's tragic storms rest peacefully.
https://t.co/J3fgQ8ShyM"
2021-12-13 21:46:01+00:00,There’s no reason that Election Day is not a federal holiday other than Republicans’ fear of giving more people the opportunity to vote.
2021-12-13 20:57:08+00:00,"This is what investing in Americans and their careers looks like. This is the Bipartisan Infrastructure Deal.
https://t.co/cDe3XAfh59"
2021-12-13 16:45:00+00:00,"Science tells us that the best defense against the Omicron variant is our vaccines. If you're not vaccinated, now is the time to get your shot if you can. And if you haven’t gotten boosted, go out and do it today."
2021-12-13 15:01:46+00:00,"For the last 385 years, our @USNationalGuard troops have never failed to answer the call to serve and help our country weather any crisis we may face—including the COVID-19 pandemic. Always proud to have served with this family in the Illinois Army National Guard. Happy birthday!"
2021-12-12 17:47:39+00:00,"By opposing the Build Back Better Act, every Republican is objecting to:

—Universal Pre-K
—Lowering prescription costs
—Extending the expanded Child Tax Credit
—Expanding affordable child care
—Strengthening our care economy

All of which would lower costs for working families."
2021-12-12 02:31:57+00:00,"Republicans love “personal freedoms"" when it aligns with their own personal beliefs, but not when it's in the best interest of a woman making a decision for her body and her future.

Your right to choose when to start a family is yours alone."
2021-12-11 17:13:06+00:00,"A quick reminder as we mark one year since the FDA approved the Pfizer COVID-19 vaccine for emergency use: Vaccines save lives.

Get vaccinated. Get boosted. Let's end this pandemic.

Visit https://t.co/4Hmb8e1pjj to find a shot near you."
2021-12-10 20:41:20+00:00,"For nearly 2 years, the pause on student debt payments has helped hardworking young Americans while boosting our economy.
 
But next month that pause is set to end, although the pandemic hasn't.

The clock is ticking. @POTUS, let's support working families and #CancelStudentDebt."
2021-12-10 18:52:37+00:00,"Outrageous. While Texas women wait around for a challenge to SB8, the damage to their health may already be done.

The Senate must act and codify Roe v. Wade into law."
2021-12-10 17:34:43+00:00,"For 73 years, the UN's Universal Declaration of Human Rights has proclaimed that all humans—no matter where they live—are born free and equal in dignity and rights. On #HumanRightsDay, we recommit to protecting these rights here at home and around the world."
2021-12-10 14:42:18+00:00,"Start the new year covered! There are only ⏰5 days left⏰ to sign up for a healthcare plan under the ACA that begins on January 1, 2022. Visit https://t.co/Exlg5xuNqg."
2021-12-09 22:37:10+00:00,"Bob Dole was a true statesman, a model of the Greatest Generation and my friend. May he rest in peace. https://t.co/xxBalB62EC"
2021-12-09 20:38:28+00:00,Add this to the list of accomplishments by Democrats—unemployment claims dropped lower than at any point in the last 50 years. @POTUS's economic plan is working. https://t.co/qO6BIvy9wA
2021-12-08 21:33:37+00:00,"Replacing lead pipes across Illinois is long overdue, and I'm so proud my provisions in the Bipartisan Infrastructure Deal will help ensure families across our state have access to safe drinking water.
 
https://t.co/4VGxsVV11m"
2021-12-08 19:49:58+00:00,Chicagoans know it well—sitting in traffic is the worst. That's one reason I wrote a provision that's now part of the Bipartisan Infrastructure Deal that will help clear up congestion and get more folks to their destination quicker across the country. https://t.co/mqkt4hj8dS
2021-12-08 18:18:46+00:00,"Every holiday season, we're reminded that it isn't about the presents we get—but the presents we give. And the best present we can give our family is peace of mind that they have access to healthcare in the year to come. Only a week left to #GetCovered👉https://t.co/Exlg5xuNqg."
2021-12-08 16:01:33+00:00,"Reducing food insecurity. Helping working families get the support they need. A profound victory, indeed.

Thanks to Democrats and Democrats alone."
2021-12-07 23:04:43+00:00,"It’s simple: we’re one of the wealthiest nations on the planet. We shouldn’t be among the most fatal for new moms in the developed world, too. The Build Back Better Act would help tackle this maternal health crisis, end racial disparities and save moms' lives."
2021-12-07 20:57:01+00:00,"Today marks 80 years since the horrific attack on Pearl Harbor—a day that will forever live in infamy. On Pearl Harbor Day, we are reminded of the sacrifices made and the brave lives lost in service to our nation. May we live each day in a way that honors their sacrifices. https://t.co/2LoUV3PrnT"
2021-12-07 17:42:33+00:00,Ready to talk about maternal health justice in the @WhiteHouse. Tune in. https://t.co/IJMVD7cVZo
2021-12-07 14:02:47+00:00,Today is Maternal Health Day of Action at the @WhiteHouse! I'm proud to be joining this important summit and moderating a panel of women and providers to shine a light on the systemic challenges facing our maternal care system and why we must pass the Build Back Better Act.
2021-12-06 19:28:27+00:00,"Because of my ASAP Act in the Bipartisan Infrastructure Deal, that's going to change.
https://t.co/SBbEHPRifW"
2021-12-06 17:01:49+00:00,"On this day, the 13th amendment was ratified—abolishing the enslavement of Black Americans.

But 156 years later, racial injustice persists.

In our broken criminal justice system, police brutality, discrimination and beyond.

It's on all of us to bring about systemic change."
2021-12-05 20:19:52+00:00,"He was a Wounded Warrior, true statesman and model of the Greatest Generation who never failed to answer the call to serve. My thoughts are with Bob Dole’s loved ones today, but I know there are many across this great nation—myself included—who will miss him dearly too."
2021-12-05 20:19:52+00:00,"I’ll always remember how that proud Veteran from an earlier generation took the time—during some of the most difficult moments of my life—to interact with us younger Soldiers, helping us recover from both our physical and psychological wounds."
2021-12-05 20:19:51+00:00,"When I was recovering at Walter Reed, Bob Dole was a patient too. He was 81 years old then, and he had his own private room, but he always did his rehab with the rest of us—cracking jokes and sharing stories about his Army days. It was an honor to be able to call him a friend."
2021-12-05 16:00:15+00:00,"She didn't know it then, but Rosa Parks' bravery aboard that bus set into motion the historic Montgomery Bus Boycott that took place 66 years ago today. Let this be a reminder of how one powerful act of peaceful protest can be on our path to true racial justice in America. https://t.co/dsDGb5owce"
2021-12-04 15:32:24+00:00,"Lifting children out of poverty and putting money in the pockets of working families everywhere.

That’s what Democrats did with expanded Child Tax Credit.

And we could extend it with the Build Back Better Act."
2021-12-03 23:43:36+00:00,"Yes it is. And @RepPressley and I have a bill to finally change that and give hopeful parents time to grieve.
https://t.co/9eDmGR8hDC"
2021-12-03 20:01:59+00:00,I had a great discussion with @NorthwesternU's @BuffettInst yesterday today on the importance of environmental justice and how climate change impacts our national security. It was an honor to be your inaugural guest speaker.
2021-12-03 19:18:03+00:00,President Biden's economic agenda for working families did this. Democrats made this possible and the best is only yet to come.😊
2021-12-03 18:25:19+00:00,"Today marks 203 years since the great state of Illinois, the ""Land of Lincoln,"" joined the Union. It's an honor to represent the people of Illinois and I'll keep working hard in the Senate to improve the lives of every Illinoisan—from Chicago to Cairo and everywhere in between. https://t.co/jIqFJwBVfT"
2021-12-03 15:28:23+00:00,"There's so much more to do, but it's a great start towards a tomorrow that lives up to the promises enshrined in the ADA where every person with a disability is able to go to school, to work or even to a grocery store independently and easily.

Disability rights are human rights."
2021-12-03 15:28:22+00:00,"Today is International Day of Persons with Disabilities.

Like many Americans living with disabilities, I too spend a lot of time planning how to get from one place to the next.🧵 https://t.co/hawSrDmyuZ"
2021-12-03 01:15:26+00:00,"If Republicans truly cared about keeping our schools open like they claim they do, they'd work with us to pass common sense gun safety legislation.
https://t.co/qVGZ5QXFY3"
2021-12-02 23:38:43+00:00,BREAKING: Captain Sullenberger—American hero and world-renowned expert in aviation safety—has just been confirmed as our ambassador to @ICAO! Thrilled my colleagues unanimously agreed with me to confirm him and I know he'll work hard to help make our skies and air travel safer.
2021-12-02 19:00:52+00:00,Small business owners can’t afford this cynical and offensive political game to continue. I’m calling on my colleagues from @SmallBizCmteGOP to simply show up and do your jobs so entrepreneurs across our nation can do theirs. Enough is enough. #ConfirmDilawar
2021-12-02 19:00:52+00:00,To hear Syed's vision for @SBAgov as a former job creator and entrepreneur is to understand that every day Republicans fail to do their jobs and block him from serving during this critical time of recovery is a huge missed opportunity for our hardworking small business owners.
2021-12-02 19:00:49+00:00,"Let me repeat: Dilawar Syed is highly qualified to help lead @SBAgov. And yet, in our small businesses' time of need, Republicans refuse to show up for months to stonewall his nomination. Today, I met with Syed to assure him that Democrats won't stop working to confirm him. https://t.co/PtuKXk2DS6"
2021-12-02 16:14:10+00:00,Now is the time to codify Roe v. Wade into law.
2021-12-02 00:38:06+00:00,"Together, we can...
 
Build a stronger care economy.

Support working parents with universal pre-K and child care.

Help ensure all Americans have access to affordable healthcare.

Cut costs for millions of working Americans.

It all starts with three words: Build Back Better."
2021-12-01 20:53:05+00:00,"Rosa Parks changed the course of history when she stayed in her seat and refused to give in to hate and injustice. Today, as we honor her legacy, we're reminded what’s possible when we have the courage to do what’s right. It's on all of us to work for a more just and equal world."
2021-12-01 18:22:51+00:00,It’s always great to see the home team on the Hill. Proud to work with Illinois lawmakers to uplift working families and move Chicagoland—and all of Illinois forward. I especially look forward to seeing the impacts of the Bipartisan Infrastructure Deal across our great state. https://t.co/4Cr2LhNGPw
2021-12-01 16:20:12+00:00,"So long as 37 million people around the world continue to suffer from the AIDS epidemic, this #WorldAIDSDay  is a reminder of how much more we have to do. Today, let’s recommit to improving education, finding a cure and building a world that’s free of stigma and discrimination."
2021-12-01 14:24:59+00:00,"Today, SCOTUS will hear yet another case attempting to strip women of their constitutional right to make their own decisions about their own bodies. We won't stop working to protect this right for every woman across the nation."
2021-11-30 22:03:52+00:00,"28 years ago, Democrats and Republicans put country over party to pass the Brady Handgun Violence Prevention Act into law.

Today, our nation's gun violence epidemic demands this kind of leadership again.

It’s time Republicans join Democrats to expand gun safety and save lives."
2021-11-30 19:32:09+00:00,"Every day, our nation's maternal mortality crisis hurts so many of our women Veterans. With @POTUS signing into law my Protecting Moms Who Served Act, we'll do more to ensure pregnancy complications are not overlooked or ignored, support our military families and save lives. https://t.co/ToTs7an2eD"
2021-11-30 15:38:56+00:00,I’m heading to the White House to join @POTUS as he signs into law my Protecting Moms Who Served Act—long-awaited legislation that will help more of our Veterans access the maternal care they've earned and ensure more moms who served have the chance to raise their babies.
2021-11-29 23:13:04+00:00,"In the final stretch of this year, the best way to protect yourself and your families against the Omicron variant is to get vaccinated.

Visit https://t.co/4Hmb8dJOrL to find a place near you to get your shot."
2021-11-28 20:02:49+00:00,"This Hanukkah, I'm reminded that no matter what dark days America goes through, there is always light ahead. Wishing all those celebrating the Festival of Lights this evening a happy Hanukkah! Chag Sameach! https://t.co/awxPXBpUma"
2021-11-27 19:00:00+00:00,"The Build Back Better Act would help small businesses across the country keep moving forward.

Passing this legislation is not only the right thing to do, but the smart thing to do for working Americans and our economy."
2021-11-27 15:06:28+00:00,"This Saturday is for small businesses!🛍
 
It's a beautiful day to get some holiday shopping done by supporting small businesses across Illinois. #SmallBusinessSaturday https://t.co/8dWMvORreH"
2021-11-26 15:30:00+00:00,"This year’s post-Thanksgiving checklist:
 
💤Sleep in
🍽️Eat leftovers 
✅Make a plan to get you and your family (ages 5+) vaccinated

Visit https://t.co/4Hmb8dJOrL to find a vaccine location near you."
2021-11-25 20:15:42+00:00,"Shots in arms.
Checks in pockets.
Expanded Child Tax Credit.
5.6 million jobs created.
Millions more have healthcare through @POTUS's special enrollment period.
Better roads and bridges.
Cleaner water.
More accessible transit.

This year, there's a lot to thank Democrats for."
2021-11-25 15:00:04+00:00,"Happy Thanksgiving, everyone! Today, I'm counting my blessings.

I'm so thankful for my family and our health. 

I'm thankful to the essential workers who have worked tirelessly throughout this pandemic. 

And I'm thankful for our troops serving across the world who keep us safe."
2021-11-25 00:40:57+00:00,"You may hesitate at the Thanksgiving dinner table tomorrow when reaching for that second or third slice of pumpkin pie—but something you don't need to hesitate doing? Getting your COVID-19 vaccine.

Visit https://t.co/4Hmb8dJOrL now."
2021-11-24 20:31:12+00:00,"Today, justice was served in the courtroom. But the word ""guilty"" cannot bring Ahmaud back and my heart is with his family. No one—no matter their race—should go from a peaceful jog to being chased and killed. America has a long way to go on the path to true justice and equality."
2021-11-24 00:26:26+00:00,"What are Democrats doing with Build Back Better?
 
We're working to help families spend less on child care. Less on pre-K. And less on healthcare and other basic needs.
 
👀That’s the reality we're trying to create with @POTUS' Build Back Better Agenda."
2021-11-23 16:05:22+00:00,"No American should be forced to drink water that’s contaminated with dangerous chemicals that could put their health and the health of their families at risk.

Proud to work with @SenatorCarper to secure provisions in the Bipartisan Infrastructure Deal to help clean up our water."
2021-11-22 16:35:42+00:00,"Child care should not cost more than rent or a mortgage. 

Working parents deserve to have affordable options so they can stay in the workforce while knowing their kids are being taken care of.

With Build Back Better, we can make sure every family can afford child care."
2021-11-22 01:41:40+00:00,"I'm so pleased to announce that 3.5 million vaccine doses will arrive in Indonesia and 1 million vaccine doses will arrive in Thailand by next week. 

I'll keep working closely with @POTUS to help ensure these nations receive the safe, effective vaccine doses they need."
2021-11-22 01:19:42+00:00,"Blue states and red states.

Democrat, Independent and Republican.

Any race, gender identity, zip code or income.

Every American must have equal access to the ballot box, no ifs ands or buts."
2021-11-21 15:15:19+00:00,"Over 16 years ago at Walter Reed, @SenatorDurbin gave me his card and told me to call if there was ever a problem I saw that needed fixing—and, boy did I hold him to it! It's an honor working with you in the Senate to help improve the lives of Illinoisans. Happy birthday! https://t.co/yFKu1Zrx9N"
2021-11-20 16:17:35+00:00,"Happy birthday, @POTUS! 

I hope your day is full of celebrations and a whole lot of ice cream🍦

Looking forward to another year of working together to build back better. https://t.co/8txWIP86Kv"
2021-11-20 15:14:54+00:00,"On #TransDayOfRemembrance, we remember the trans and gender non-conforming Americans who were murdered simply because of who they were. Let's honor them by working to end transgender violence and finally pass the Equality Act so everyone can be their most authentic selves."
2021-11-19 19:10:34+00:00,"Bloom was given a fair chance to prove he could lead @USPS Board. And he failed miserably.

Back in February, I called on @POTUS to fire Bloom and all of DeJoy’s enablers and I commend the President’s leadership in empowering us to turn the page on the Trump-Bloom-DeJoy disaster."
2021-11-19 17:23:51+00:00,"The House passing Build Back Better shows that Democrats are doing everything we can to cut costs for people across the country. Now we need to pass it out of the Senate and have the President sign it into law ASAP.

Because working families deserve to finally get a fair shake."
2021-11-19 01:21:10+00:00,This is straight up modern day McCarthyism.
2021-11-18 23:14:37+00:00,Thanks to Democrats.
2021-11-18 21:00:01+00:00,"Good on @DeptofDefense for working to curb food insecurity within our military, but so much more needs to be done to tackle the root issue of this hunger crisis. We need to go further and establish a basic needs allowance in the FY22 NDAA. https://t.co/RRMlSun7r8"
2021-11-18 20:42:20+00:00,Another way the Bipartisan Infrastructure Deal is helping us build back better? It permanently authorized the @USMBDA to make sure we keep supporting business owners of color. Because recovering better than before means lifting up every single one of us.
2021-11-18 20:17:21+00:00,"Universal pre-K would help ensure millions of children can attend a high-quality preschool and get a good start on their education—no matter how much money their parents make.

That's the promise of the Build Back Better Act."
2021-11-18 17:00:16+00:00,"Infrastructure season has officially arrived, Illinois! Along with Springfield, Dixon and Rockford also received @USDOT funds. That means even more jobs, safer roads and improved accessibility across our great state👷‍♀️🚦👩‍🦽"
2021-11-18 14:16:19+00:00,"Vaccinating your children means protecting them from COVID-19 while also making playgrounds, classrooms and communities safer.

https://t.co/ekXAFpxlhX"
2021-11-18 00:00:01+00:00,"Thousands of our military families face food insecurity because of a flaw in the current law.

I'm working with @RepJimmyPanetta to make sure this year's defense bill finally ends the scourge of military hunger. https://t.co/DcM10CgUuf"
2021-11-17 22:47:11+00:00,"At a time when small businesses are still working hard to recover, Republicans once again refused to show up today to vote on a nominee to help run the Small Business Administration.

Enough. Let's do our jobs and #ConfirmDilawar."
2021-11-17 21:57:07+00:00,"This Education Support Professionals Day, join me in thanking all the support staff—the bus drivers, school nurses, cafeteria workers and more—who make sure our students' needs are met and keep our schools running every day. Your hard work does not go unnoticed. #WeLoveOurESPs"
2021-11-17 19:34:21+00:00,"Illinois borders on one of the largest freshwater sources in the world—and the Bipartisan Infrastructure Deal strengthens the Great Lakes Restoration Initiative to make sure it stays a clean, usable and safe resource for generations to come."
2021-11-17 15:23:10+00:00,"NEWS: My bipartisan Protecting Moms Who Served Act is headed to @POTUS's desk! Once signed into law, it would commission the first-ever comprehensive study of how our nation’s maternal mortality crisis is impacting women Veterans, especially women of color.https://t.co/hvGkAlTcin"
2021-11-17 00:34:23+00:00,"How can you focus on carrying out the mission and defending our democracy if you’re worried about whether or not your kid gets dinner tonight?

We must end our military's hunger crisis.
https://t.co/CSbFU2uzyA"
2021-11-16 23:21:58+00:00,"🚨Earlier this year, @RepSpeier and I introduced bills to expand parental leave and child care access for our military families. Now, we're leading a bipartisan group of 30+ colleagues to urge @SASCDems and @HASCDemocrats to include these lifelines in the final FY22 NDAA."
2021-11-16 21:25:14+00:00,"While Republicans root for higher prices that are hurting so many working families, Democrats are working to:

💊Lower costs of prescription drugs and put money back in Americans’ pockets
🤱🏻Provide affordable child care
👷🏽‍♂️Create good-paying jobs

The values couldn’t be clearer."
2021-11-15 21:31:52+00:00,"Good-paying jobs, safer drinking water, accessible transit stations and infrastructure built to last—signed into law! Once again, Democrats deliver for working Americans."
2021-11-15 21:07:42+00:00,"Proud to be at the White House to watch @POTUS sign the Bipartisan Infrastructure Deal into law to rebuild our roads and bridges, cut commuting times, create good paying jobs, deliver clean drinking water and improve lives.

This is a big deal and Democrats got it done! https://t.co/xJvpLvIOfS"
2021-11-15 17:14:28+00:00,"🚨PSA: Today is the last day for eligible, non-filers to apply for the #ChildTaxCredit that Democrats expanded this year.

Don’t wait! Visit https://t.co/1KaVFXMYIF now to see if you’re eligible."
