Datetime,Text
2023-01-02 20:45:52+00:00,"New year, new chance to sign up for a quality ACA healthcare plan.

Before January 15, take some time to find a plan that works for you and #GetCovered in 2023 at https://t.co/YFvaIQsuwW."
2023-01-01 14:08:22+00:00,"Happy New Year, folks!

I'm so proud of everything we were able to accomplish in 2022, and I'm looking forward to keeping up this progress in 2023."
2023-01-01 03:13:28+00:00,"In just a few hours, 2022 will come to a close.

As we ring in the new year, please celebrate safely so we can start 2023 on a safe, healthy note. 🎆"
2022-12-31 22:13:58+00:00,Another year delivering for working families. https://t.co/crYcMfT9Wp
2022-12-31 17:10:05+00:00,"Every American has the right to breathe clean, unpolluted air.

For the last five decades, the Clean Air Act has helped us protect that right and deliver cleaner air for all Americans—but we're not done. We must keep working to ensure the next generation can enjoy this right."
2022-12-29 17:42:34+00:00,"Today, 132 years ago, members of the Lakota Tribe were horrifically massacred at the hands of the United States government at Wounded Knee. 

That moment in our nation’s history can never be taken back, but it falls on all of us to never let up our work to right this wrong."
2022-12-26 16:44:34+00:00,Wishing a happy and healthy Kwanzaa to all those celebrating across Illinois and around the globe.
2022-12-25 14:08:54+00:00,"Merry Christmas! Wishing joy, love and holiday cheer to all.🎄"
2022-12-22 18:42:51+00:00,"One in four married women struggle with infertility—a stat that doesn’t include the countless LGBTQ+ or partnerless couples who need just a little medical help to have a child.

Just days ago, Republicans blocked my bill to protect their right to become a parent through IVF. https://t.co/X5qkFhSD7t"
2022-12-22 14:24:27+00:00,"Our country and the world remain in awe of the bravery of President Zelenskyy and the Ukrainian people who are so effectively defending their homeland against Putin’s unjustified and unjustifiable attacks.

The United States remains with you.🇺🇦 https://t.co/lxJjj9Ys47"
2022-12-21 23:07:48+00:00,"With reports of a severe winter storm coming, I urge all Illinoisans to take precautions, travel safely and follow the guidance of your local officials.
 
Let's all get to our holiday destinations safe and sound."
2022-12-21 15:47:33+00:00,"It was an honor to work alongside @SenatorLeahy. His decades of service to the people of Vermont and our entire nation will long be remembered.

Cheers to your next chapter!
https://t.co/CN4qoCrsAh"
2022-12-20 22:47:38+00:00,"Yep, you're reading this right. The same Republicans who claim to “defend family values” just blocked my bill to protect the right to start a family through IVF.

And yes, it's the ultimate, nightmarish blend of hypocrisy and misogyny that you think it is."
2022-12-20 21:56:37+00:00,"Without the miracle of IVF, my two beautiful girls might not exist.

Tonight, I’m urging my colleagues to pass my Right to Build Families Act so we can protect IVF and every American’s right to choose how they build their own family. https://t.co/HR6GfaHPGJ"
2022-12-20 21:30:14+00:00,"Let's be clear: they're coming for our right to access IVF next.

Soon, I'm going to the floor to ask for unanimous consent to protect IVF by passing my Right to Build Families Act.

If Republicans truly cared about being ""pro-life,"" they wouldn't try to stop us from creating it."
2022-12-20 18:24:07+00:00,I worked so hard to include the All Station Accessibility Program—or my ASAP Act—in the Bipartisan Infrastructure Law and I couldn't be prouder that it's already helping make Illinois and our nation a more inclusive place for the disability community. https://t.co/FtFwhcAQXy
2022-12-19 20:51:33+00:00,"Reminder: you have until January 15 to sign up for healthcare coverage under the ACA for 2023. 
 
Visit https://t.co/Exlg5xdc1G to find a plan that's right for you."
2022-12-19 15:18:45+00:00,"Every American has a right to clean drinking water—and with these environmental justice provisions I led in the Water Resources Development Act, we will continue to protect that right and make disadvantaged communities a priority.

Next up, the President's desk. https://t.co/KHLPGOxVEy"
2022-12-18 21:48:46+00:00,"Amid the horrifying rise in anti-Semitism across the nation and globe, I hope this year's Festival of Lights is a happy one for all those who celebrate. In darkness, let us remember to bring in the light—hate has no place here.

Happy Hanukkah and Chag Sameach!"
2022-12-17 21:41:08+00:00,"The expanded Child Tax Credit in the Democrats' American Rescue Plan was a lifeline to so many families—including the families of our servicemembers and Veterans. 
 
We must bring it back."
2022-12-17 05:28:52+00:00,"Absolutely tragic. My heart goes out to these kids’ families and loved ones, and to the entire Juarez HS community. Tonight, I am more convinced than ever that while we’ve made important progress Congress, we must do more to end senseless and preventable gun violence like this."
2022-12-17 01:16:20+00:00,"Today I visited one of @fly2ohare new @MAMAVA pods, thinking of nursing parents who have to figure out how to feed their hungry baby in a busy airport. I’ve been that mom before.

I'm so proud that through my FAM Act, I can help make air travel more seamless for families. https://t.co/CXwm25rzlG"
2022-12-16 23:17:17+00:00,"Proud to have the support of Captain Sullenberger, the Allied Pilots Association and the Association of Flight Attendants-CWA on my EVAC Act. We must act to make flying as safe as we know it can be—and as safe as Americans deserve. https://t.co/QyTRHQRt4j"
2022-12-16 19:58:23+00:00,"I can’t remember the last time I was on a flight like that—and I’d bet you can’t either.

That's why I introduced my EVAC Act to require the FAA to finally establish an evacuation standard that takes into account the actual, real-life scenarios we all face every time we fly."
2022-12-16 19:58:22+00:00,"These FAA tests are ignoring:
 
👉Passengers like me who live with a disability
👉Seniors who might take longer to get down the aisle
👉Kids and infants
👉Those who don't speak English fluently
 
And they aren’t adequately considering the ever-decreasing size of seats. And more."
2022-12-16 19:58:22+00:00,"Right now, the FAA requires that passengers be able to evacuate an aircraft within 90 seconds. But the simulation tests that help set this standard were only conducted with 60 able-bodied adults.

60 able-bodied adults.

That’s just not the reality of flying in America today."
2022-12-16 19:01:04+00:00,"I’m heading to O’Hare Airport to speak about my EVAC Act with @CaptSully, fellow pilots and flight attendants who know how important it is to bring our aircraft evacuation standard up to date—especially this busy holiday season.

This simply cannot wait. We must get this right."
2022-12-16 17:42:35+00:00,"There’s a reason they say FAA regulations are written in blood…

Let’s break down why we need to update the FAA’s aircraft evacuation standard. My EVAC Act is a proactive solution so we can keep the flying public safe. https://t.co/hwVKZuXp4T"
2022-12-16 16:14:48+00:00,"NEWS: The Senate passed the FY2023 NDAA!

While this bill isn’t perfect, it’s a strong bipartisan bill that’s now heading to @POTUS’s desk, and I'm proud it includes a well-deserved pay raise and several of my provisions that send a message to our troops: we have their back. https://t.co/CbGS0CrBCr"
2022-12-16 15:01:30+00:00,"I applaud Prime Minister Kishida’s strong leadership amid challenging security dynamics in the region, and I look forward to working together to help make Japan’s bold National Security Strategy a reality. Here’s my full statement: https://t.co/8yqEwmaipJ"
2022-12-15 20:31:17+00:00,"NEWS: With Roe thrown out by the Supreme Court, I’m proud to introduce the Right to Build Families Act with @PattyMurray and @RepSusanWild to protect every American’s right to access IVF and other assisted reproductive technology—no matter where they live.
https://t.co/8SYpRhMn90"
2022-12-14 14:30:35+00:00,"Holding every single one of those little ones and their teachers in my heart today as we mark the 10th anniversary of Sandy Hook.

For these 26 lives and every victim of gun violence, we must ensure a tragedy like this never happens again. https://t.co/uH5yH6QCMw"
2022-12-13 23:41:19+00:00,"The men and women of the @USNationalGuard never fail to answer the call to serve and selflessly commit themselves to the motto of “Always Ready, Always There.”
 
Always proud to have served with this family in the Illinois Army National Guard.
 
Happy 386th birthday!"
2022-12-13 21:24:06+00:00,"Today, love wins. 🏳️‍🌈♥️

With the Respect for Marriage Act now signed into law, every American can rest assured that their marriage has the same protections as other marriages under federal law. Exactly as it should be."
2022-12-12 20:35:11+00:00,"🚨HURRY: there are just 3 days left to sign up for a plan under the ACA that begins on January 1, 2023! 

Start the new year prepared and #GetCovered at https://t.co/Exlg5xuNqg."
2022-12-10 17:00:26+00:00,"Everyone—regardless of where they’re born—deserves to live in an equal and just world free from discrimination against their gender, race, religion or sexual orientation.

This Human Rights Day and always, I'm committed to protecting and expanding basic human rights everywhere."
2022-12-09 23:09:12+00:00,Saddened to hear State Senator Scott Bennett has passed away—he was always always a kind and helpful friend to me. Thinking about his family and loved ones today.
2022-12-09 22:44:37+00:00,"Access to reproductive care shouldn't be limited by the state you're in.

I'm so proud of what these healthcare workers are doing in Carbondale to provide care for those who need it.

Every woman everywhere deserves access to full reproductive care.
https://t.co/ATaysl88B5"
2022-12-09 00:04:38+00:00,"This Latina Women’s Equal Pay Day is the last Equal Pay Day we'll mark this year. 

That means, as hard as Latinas work, it still takes them nearly a full extra year to earn what their white male counterparts earned last year.

Enough. All women deserve equal pay for equal work."
2022-12-08 21:58:25+00:00,"Today, I'm proud to announce my EVAC Act with @SenatorBaldwin to require the FAA to finally establish evacuation standards that consider not just seat size, pitch and configuration, but also carry-on bags and passengers of different heights, weights, ages and abilities."
2022-12-08 21:58:25+00:00,"Imagine being on a crowded flight when the worst-case scenario happens: the crew tells you that you have 90 seconds to evacuate—but how can more than 150 passengers actually safely evacuate in less time than it takes to brush your teeth?

The flying public deserves better. https://t.co/On3GvDSacP"
2022-12-08 21:35:44+00:00,So grateful to hear Brittney Griner is on her way back home. Thank you @POTUS and your administration for your work to release Brittney from Russian custody. We must continue these efforts to secure the release of Paul Whelan and all other Americans wrongfully detained.
2022-12-08 16:21:49+00:00,"BREAKING: The House just passed the Respect for Marriage Act—officially sending it to the President's desk! 🏳️‍🌈

Every American should be able to marry who they love and know their marriage will have the same protections as other marriages.

What a great day for love and equality."
2022-12-08 01:36:46+00:00,"Proud my colleagues and I officially advanced David Capozzi’s nomination to the Amtrak Board of Directors today! If confirmed, he'll serve in the designated disability advocate seat on the board that I helped create through the Bipartisan Infrastructure Law.

Let's get this done!"
2022-12-07 20:56:32+00:00,My statement after being diagnosed with COVID-19 today: https://t.co/wgv7JBhEYM
2022-12-07 15:00:57+00:00,"No American should ever forget the horrific attack on Pearl Harbor—a date that forever lives in infamy. On the 81st anniversary of that fateful day, let us remember the patriots who lost their lives in the line of duty to our nation and honor the Greatest Generation."
2022-12-06 21:00:36+00:00,"On this day in our nation's history, the 13th amendment was ratified—finally abolishing the enslavement of Black Americans.

But racial injustice did not end there. It persists in our broken criminal justice system, police brutality and more.

Real systemic change cannot wait."
2022-12-06 20:04:57+00:00,"NEWS: the Preventing PFAS Runoff at Airports Act that I helped author is heading to @POTUS' desk to be signed into law! 

We've known for decades that PFAS chemicals pose a threat to our health, and I'm proud this bill will help us do more to reduce the spread."
2022-12-05 22:14:36+00:00,"PSA: You only have 🚨10 days🚨 left to find an affordable health insurance plan that begins on January 1, 2023 during the ACA’s open enrollment period. 
 
#GetCovered at https://t.co/Exlg5xvlfO today."
2022-12-05 17:18:36+00:00,"Today, we remember Rosa Parks and all those who set in motion the Montgomery Bus Boycott 67 years ago. While their historic demonstration lasted 381 days, we've seen the ripples of their work for racial justice and equality for generations. Let’s never lose sight of their vision. https://t.co/YzqJCK2c8e"
2022-12-03 23:48:02+00:00,"Happy 204th birthday, Illinois!🥳

Beyond proud to represent my fellow Illinoisans in the best state in the nation where we lift each other up, protect our rights and ensure everyone has an equal chance to succeed. https://t.co/seETyJa0hA"
2022-12-03 18:35:37+00:00,"This International Day of Persons with Disabilities, I'm proud of my work to help expand equal access for folks with disabilities.

With the Bipartisan Infrastructure Law, my ASAP Act was signed into law and is now helping finally make America’s transit stations more accessible. https://t.co/4siXdKF8FZ"
2022-12-02 22:42:47+00:00,"Wonderful to welcome Representative-elect Nikki Budzinski to Congress yesterday! Looking forward to teaming up to help make life easier, safer and more affordable for Illinoisans. https://t.co/vz1ybXM3T6"
2022-12-02 15:00:58+00:00,"Watch us compare wounds and talk about our recoveries in the full @CBSSunday Morning segment below 👇
https://t.co/Z5i99ES98Y"
2022-12-02 15:00:57+00:00,"After Ukrainian Soldier Oleksandr Chaika lost his leg fighting Putin's unjustifiable war of choice against Ukraine, it was an honor to share this moment with him and promise him that he will—without a doubt—be able to do everything he wants to in life. https://t.co/Wx14955dWo"
2022-12-01 22:37:05+00:00,"I’m glad the Senate's deal includes a 24% raise and improved healthcare benefits for union rail workers, but I am profoundly disappointed that we were unable to provide them with adequate paid sick leave.

No one should have to choose between their health and their paycheck."
2022-12-01 15:30:39+00:00,"This #WorldAIDSDay, we've made great progress toward improving education and treatments. But there's still more to do—together, we must continue working to improve the lives of the 38 million folks around the world living with this virus and eliminate the stigma for good."
2022-11-30 16:38:23+00:00,"One year ago, President Biden signed my bipartisan Protecting Moms Who Served Act to help address our nation's maternal health crisis and ensure the pregnancy complications of our women Veterans—including women of color—are not ignored or overlooked. Our work is far from over. https://t.co/yFLDkuj7zM"
2022-11-29 23:40:11+00:00,Love is love. https://t.co/QMa7xL6fvR
2022-11-29 21:32:39+00:00,"Heartbreaking news.

It was an honor to work with Rep. McEachin to address environmental injustices across the country and help protect those communities. He will be missed. 

Sending my condolences to his family, friends, staff and constituents as they mourn this loss."
2022-11-28 22:02:06+00:00,"Right now, our nation's uninsured rate is at an all-time low. If you're not one of the millions insured under the ACA, you still have time! #GetCovered by visiting https://t.co/olWP6I7daM."
2022-11-26 21:36:29+00:00,"Small businesses in Illinois and around the country are the backbone of our economy. This Small Business Saturday, #ShopSmall! https://t.co/3T9sKs9ecz"
2022-11-25 14:04:28+00:00,"On International Day for the Elimination of Violence Against Women today, I'm proud we finally reauthorized the Violence Against Women Act this year to help protect women here at home. Our work continues until every woman across the globe can live a life free from violence."
2022-11-24 19:27:21+00:00,"Happy Thanksgiving, folks! Today I'm giving thanks for my family, for our servicemembers who sacrifice for our freedoms and for everyone who has worked so hard to help make the lives of working families better this year."
2022-11-22 23:46:07+00:00,"Democrats wrote the Inflation Reduction Act to save working families money by lowering energy and prescription drug costs and capping the cost of insulin, among other benefits.
 
This is a game-changer."
2022-11-22 18:14:20+00:00,"As technology becomes more integral to our lives, we must ensure it is accessible for the 61m Americans with disabilities—that includes federal websites.

Glad the DOJ heeded our bipartisan request for a robust accessibility report of these sites—I look forward to seeing it."
2022-11-21 17:27:06+00:00,"Wishing a happy birthday to my friend, @SenatorDurbin! 

Forever grateful for your mentorship and tireless work for the people of Illinois. https://t.co/MxVlhI53G7"
2022-11-20 22:58:45+00:00,"Five Americans went out for a night of dancing at an LGBTQ+ nightclub in Colorado Springs and never made it home—many more will never be the same.

This #TransDayofRemembrance, we cannot let this cycle of hate and gun violence in America continue.

We must act. Now."
2022-11-19 23:10:59+00:00,"The American people have spoken.

State by state, voters passed pro-choice initiatives and made it clear: the people want us to protect reproductive rights.

Now, it's time to deliver what the majority of Americans want and enshrine these rights into federal law."
2022-11-17 20:03:41+00:00,"From the Affordable Care Act to the Inflation Reduction Act, your efforts to get historic legislation over the finish line are nothing short of remarkable. I'm glad Congress and the people of San Francisco will continue to benefit from your service."
2022-11-17 20:03:41+00:00,"Thank you, @SpeakerPelosi, for your decades of leadership. You've broken glass ceilings and been a true role model for generations of women. Our party is better because of your leadership and service to our nation. https://t.co/KUPslBGB37"
2022-11-17 17:34:06+00:00,"The Republican plan to end inflation, folks."
2022-11-17 02:32:04+00:00,I’m with Dreamers. It is long past time we pass the Dream and Promise Act to end the uncertainty and provide DACA recipients with a pathway to citizenship.
2022-11-17 01:38:30+00:00,"In last year’s NDAA, I’m proud I secured a provision to increase paid parental leave for our troops.

Now, @RepHoulahan, @RepSpeier and I are urging DoD to implement my provision's full intent in their paid leave policy to provide military families with the support they deserve. https://t.co/9OzLZMKL9p"
2022-11-17 00:04:05+00:00,"Democrats are working to keep costs down this winter by providing support for things like the Low-Income Home Energy Assistance Program. 

See if your family is eligible by visiting ⬇️ https://t.co/kInXhTbvGE

https://t.co/daP7z1D2s3"
2022-11-16 19:46:57+00:00,"I'm honored to receive the Air Force Sergeants Association’s L. Mendel Rivers Award of Excellence. I’m proud of the work I’ve done to support our servicemembers, and I’ll keep doing everything I can to build on this progress. https://t.co/gvhzGmo4L6"
2022-11-16 17:19:39+00:00,Love is love. The Senate must take action and move forward on the Respect for Marriage Act to protect marriage equality for all.
2022-11-16 00:57:44+00:00,I will continue working with my colleagues to ensure the Iranian government is held accountable for the human rights abuses it is perpetrating against its people and that women everywhere are able to exercise their basic rights.
2022-11-16 00:57:44+00:00,"We stand behind the people of Iran—especially the women who are bravely and peacefully protesting for their rights. 

We cannot look away as the Iranian regime continues its campaign of intimidation and torture against its own citizens who want dignity and freedom."
2022-11-15 23:31:31+00:00,"And it’s long past time our transit systems live up to the promises enshrined in the ADA.
 
My ASAP Act is finally making sure our nation's transit stations are more accessible so Americans with disabilities can get to work, home and anywhere in between.
https://t.co/zaXcwsxmrD"
2022-11-15 23:31:30+00:00,"My Drinking Water and Wastewater Infrastructure Act is:
 
✅Creating good-paying jobs
✅Removing lead pipes
✅Updating aging sewer systems
✅Delivering clean water
✅Increasing environmental justice
 
AND it will save working families money on water bills.
https://t.co/gqqwqCHUWD"
2022-11-15 23:31:30+00:00,"One year ago, President Biden signed the Bipartisan Infrastructure Law—which included two of my bills that are helping us finally clean up our drinking water and wastewater systems and make our transit stations more accessible for all.

To say I'm proud is an understatement. https://t.co/7UbJ0KxwTN"
2022-11-15 21:30:38+00:00,"At this hour, my focus is on ensuring we know all the facts and that our nation does everything we can to immediately coordinate with Poland to determine how we can support our NATO ally."
2022-11-15 21:30:38+00:00,"If confirmed, reports that Russian missiles hit Poland and killed at least 2 people are extremely troubling. My heart goes out to the victims, their families and the entire Polish community in Illinois and across the world."
2022-11-15 16:14:52+00:00,"Bring your baby to work day! Such an honor to preside over this moment yesterday after bringing my baby girl Maile onto the Senate floor over 4 years ago.

Welcome to the club, Senator @ossoff! https://t.co/t7HD3nlNmE"
2022-11-15 02:00:04+00:00,"Deeply disturbed by this horrific act of anti-Semitism in Waukegan. My heart goes out to the families impacted—and the entire Jewish community.

Hate has absolutely no place here in Illinois or anywhere in America.
https://t.co/5McMAhg9gE"
2022-11-15 00:40:34+00:00,"Gun violence once again wreaked havoc on another school in America—claiming three lives, injuring two and changing a community forever at @UVA. I’m heartbroken for the victims and their loved ones, but we are not powerless.
 
We need to pass more commonsense gun safety reforms."
2022-11-14 21:40:19+00:00,"If you haven’t already, head over to https://t.co/YFvaIQt2mu to sign up for healthcare coverage during the ACA’s 2023 Open Enrollment period.
 
Don’t leave your health up to chance."
2022-11-12 14:45:50+00:00,"Because to me, true patriotism isn’t just measured by how we honor the sacrifices made by those in uniform on Veterans Day. It’s also how we honor them every other day of the year too. And that’s my mission in the Senate."
2022-11-12 14:45:50+00:00,"While I can’t fly combat missions anymore or help drag Soldiers from a burning Black Hawk, I can use my role serving in the U.S. Senate to help ensure our military is strong and our Veterans are taken care of when they return home."
2022-11-12 14:45:50+00:00,"From the moment I woke up, 11 days later in Walter Reed Hospital, I vowed to find a way to repay my buddies who brought me home as well as all those who’ve sacrificed so much for our great nation."
2022-11-12 14:45:49+00:00,"The blast cost me my legs, partial use of my right arm and nearly my life. My buddies thought I was dead—I was literally in pieces.

If it wasn’t for them, I wouldn’t have survived. They refused to leave me behind and risked their own lives to bring my body back to my family."
2022-11-12 14:45:49+00:00,I remember that day so clearly. I remember the rain coming down in the morning and what I had for lunch that afternoon. What I remember most is the scorching heat and deafening roar of the RPG that tore through the cockpit of the helicopter I was co-piloting.
2022-11-12 14:45:48+00:00,"Today is the day my buddies risked their own lives to save mine.

I live every day giving thanks for their heroism and renew my pledge every morning to live a life worthy of their selflessness."
2022-11-11 14:36:20+00:00,Happy Veterans Day! Today is a day of celebration—a moment to recognize and honor the service of every brave American who put on the uniform to keep our great nation safe. Our nation is in their debt. https://t.co/U7RAEDUrJL
2022-11-10 18:40:54+00:00,"For nearly two and a half centuries, U.S. Marines have bravely served our country with honor, courage and commitment—always striving to embody their motto of “Semper Fi."" We owe them all a debt of gratitude. 
 
Happy 247th, @USMC!"
2022-11-09 22:57:36+00:00,"The Republican ""plan"" for inflation: cut taxes for corporations, raise Rx drug prices and put Medicare and Social Security on the chopping block.
 
Whatever they say, there’s nothing in their ""plan"" to help working families keep more money in their pockets."
