Datetime,Text
2021-06-10 16:37:57+00:00,"To build back better, small businesses need us to increase access to capital and support proven programs like the Small Business Investment Company system.

Last Congress, I helped introduce a bill to provide more resources to SBICs. We must do more. https://t.co/zpFXaXo16j"
2021-06-10 01:34:40+00:00,"When Americans constantly wake up to headlines of mass shootings and our nation is one of the leading countries of gun violence deaths worldwide—every month is Gun Violence Awareness Month.

The Senate must act."
2021-06-09 22:10:45+00:00,"Imagine the water in your home being so dangerous, it could give your kids permanent brain damage. 

Too many don't need to imagine it—they're living it.
 
Let's get my Drinking Water and Wastewater Infrastructure Act to the President's desk to help secure clean water for all."
2021-06-09 18:14:59+00:00,Make no mistake—we'll continue to see the number of voter suppression bills in our states climb unless Congress acts. We can't sit idly by as the sacred right to vote is stripped from Black and Brown voters across the country.
2021-06-09 14:10:41+00:00,"15,000+ wheelchairs broken by airlines means thousands of lives robbed of their mobility, independence and dignity. 
 
We deserve the same respect and care as every other traveler. This cannot be the norm. https://t.co/KfEIfKrPaQ"
2021-06-08 22:04:20+00:00,"Now is the time to pass the Paycheck Fairness Act.

Equal pay for equal work can't wait."
2021-06-06 14:52:00+00:00,"The free world we live in today might not have existed without the brave troops who stormed Normandy's beaches on D-Day 77 years ago.

We will never forget their heroism and sacrifices. https://t.co/mGOH9UEKka"
2021-06-05 15:28:47+00:00,"Preserving our planet for future generations isn't enough. We can and must do more.
 
On #WorldEnvironmentDay, we cannot forget to prioritize environmental justice so we can help ensure that all of today's children can grow up in a safe, sustainable world."
2021-06-04 14:43:36+00:00,"Hadiya Pendleton was 15 when she was shot dead in Chicago.

We wear orange to honor her and all lives lost to gun violence.

To honor Black and Brown families who suffer disproportionately.

To honor students who don't feel safe in their classroom.

We must act. https://t.co/qEE5U0WSgq"
2021-06-03 20:33:46+00:00,"Hadiya Pendleton should be turning 24 tomorrow.

But like too many, her life was tragically cut short by gun violence.

@SenatorDurbin, @RepRobinKelly and I are calling for June 4 as National Gun Violence Awareness Day.

I encourage all to wear orange to honor those we've lost."
2021-06-03 15:41:39+00:00,"100 days from now, we'll mark 20 years since 9/11.
 
As the Admin looks to bring our troops home from Afghanistan, we must secure the safe return of Mark Frerichs—an Illinoisan and Veteran who was abducted in 2020.

Let’s #BringMarkHome."
2021-06-02 22:15:33+00:00,"Attention parents: getting your vaccine just got easier! 

Soon, you may be able to receive free child care while you get your shot. Sign up at https://t.co/4Hmb8dJOrL. https://t.co/0kjvb8fMk4"
2021-06-02 13:29:08+00:00,"Immigrants built this country—from laying the railroads from sea to shining sea, to starting businesses to defending our nation. This Immigrant Heritage Month, let's embrace each other's stories and call out discrimination when we see it.

Our diversity is our greatest strength."
2021-06-02 02:27:46+00:00,"100 years ago, white supremacists killed hundreds of thriving Black business owners and their families in Tulsa.

And too many Americans never learned about it in history books.

It's past time to break this cycle and bring Greenwood's full story to light."
2021-06-02 00:50:58+00:00,"Happy #Pride! A reminder to all that this month—and every month—we can choose love and acceptance over homophobia, transphobia, bigotry and hate."
2021-06-01 21:19:23+00:00,"80 years ago, Congresswoman Edith Nourse Rogers introduced the Women's Army Auxiliary Corps Act, paving the way for women to serve our country in uniform.

@JerryMoran, @RepKClark &amp; I introduced a resolution to honor the legacy of Rogers &amp; the WAAC https://t.co/39FlDXciny https://t.co/nNvJVeuBMN"
2021-06-01 17:25:20+00:00,"I’m proud to have secured several provisions in this bill to help address some of the most pressing challenges facing transportation systems in Illinois and across the country, including chronic highway congestion and declining airport infrastructure. https://t.co/h1by4lE9LI"
2021-05-31 13:31:30+00:00,"Memorial Day is a somber reminder that wars are not fought by faceless, nameless troops. They are fought by our neighbors, friends and loved ones. 

May we never stop working to repay those who never made it home and the families who have suffered this unimaginable loss."
2021-05-29 17:25:49+00:00,"Our local governments are hurting from COVID-19, but I’m pleased Illinois municipalities will receive critical funding as a result of the American Rescue Plan. It was great to meet with @NWMCLegislative mayors today to discuss the importance of this much-needed funding. https://t.co/3kfHaKLKrO"
2021-05-28 21:31:48+00:00,"To Democrats, working families come first.

That's what President Biden's budget proposal outlines.

Because we know when working families have what they need to succeed, our nation thrives."
2021-05-28 19:13:15+00:00,"With today’s announcement, AG Garland is sending a message that @TheJusticeDept will use all of its resources to ensure that the perpetrators of hate crimes against AANHPIs, the Jewish community and all Americans are swiftly brought to justice. https://t.co/Nal7Jyoshk"
2021-05-28 16:38:40+00:00,"Once again, when faced with a choice between the truth and Donald Trump’s Big Lie, Republicans are proving that they’d rather spread lies than defend our democracy."
2021-05-28 16:23:20+00:00,"It’s clear there is an urgent need for an independent, expert evaluation of the public health hazards caused by this site. I’m pleased @CDCEnvironment accepted our request and will begin a comprehensive evaluation of existing health risks for Chicagoans on the Southeast Side."
2021-05-28 15:17:25+00:00,"Let’s be clear: Birth control is healthcare. 

As more and more women join our military, this bill I introduced with @maziehirono, @RepUnderwood and @RepConorLamb is overdue. https://t.co/C2hEMxyRwq"
2021-05-27 21:11:01+00:00,"Drinking a lead-free glass of water should not be determined by your zip code.

If my Drinking Water and Wastewater Infrastructure Act got signed into law, we could replace our lead pipes and give people good-paying jobs to do it. Win-win."
2021-05-27 17:50:25+00:00,"Can we all just agree that firearms should be stored safely to keep them from ending up in the wrong hands?

To keep them from ending up in the hands of our children?

It's common sense, folks. Let's pass the Safe Gun Storage Act."
2021-05-27 15:00:30+00:00,"The United States ranks 13th in the world for infrastructure. If we want to stay competitive on the world stage, we need to invest in and rebuild our crumbling infrastructure.

The American Jobs Plan is that investment—a once-in-a-generation investment."
2021-05-27 01:36:40+00:00,San Jose deserves more than thoughts and prayers—they deserve 60 votes in the Senate to finally say enough and pass legislation to prevent gun violence.
2021-05-26 21:33:40+00:00,"It's no coincidence that students of color, English learners, LGTBQ+ students and students with disabilities bear the brunt of school expulsions and suspensions—shuffling these kids into the school-to-prison pipeline.

@usedgov must do more to stop this. https://t.co/cpCaHTx4LH"
2021-05-26 16:25:54+00:00,"Please watch and share—heartbreaking incidents like these must stop.

I know from personal experience that when an airline damages a wheelchair, it is more than a simple inconvenience. It was like taking my legs away from me again.

Every traveler deserves dignity and respect. https://t.co/w3bem3vkrL"
2021-05-26 01:40:19+00:00,"The rise in anti-Semitic attacks and discrimination against our fellow Jewish Americans is unacceptable and un-American. It must stop.
 
Whenever and wherever you see it—speak up and speak out.
 
Hate has no place here."
2021-05-25 23:15:42+00:00,"The minimum wage hasn't gone up in over a decade. 

$7.25/hour is no longer a livable wage.

On the anniversary of the Fair Minimum Wage Act, it's time to give our workers a raise."
2021-05-25 19:47:39+00:00,"On this day last year, we watched as George Floyd was killed under the knee of a police officer who had taken an oath to protect and serve.

We can't bring George back—but, at the very least, we can pass the Justice in Policing Act and push us closer to racial justice for all. https://t.co/GjXtGYX6jZ"
2021-05-24 23:24:40+00:00,"The Senate overwhelmingly passed my bipartisan Drinking Water and Wastewater Infrastructure Act to invest more than $35B to upgrade our aging pipes.
 
Let's work to quickly send it to @POTUS so everyone—including Black, Brown, and tribal communities—has access to clean water."
2021-05-24 14:27:18+00:00,"I've often said: Child care isn't a ""nice to have,"" it's a must-have. Let's meet this moment for working families and pass the American Families Plan to help ensure access to high-quality, affordable child care for all."
2021-05-23 16:22:52+00:00,"Remember folks, fully vaccinated people are now safe and free to do many activities without masks.
 
Get your shot today! Visit https://t.co/4Hmb8dJOrL to find a vaccination location near you."
2021-05-22 16:07:07+00:00,"Thank you, @JRosenworcel. With your leadership and my bipartisan Martha Wright-Reed Just and Reasonable Communications Act, we can make significant strides in the march towards #phonejustice for all."
2021-05-21 22:55:37+00:00,"Withdrawing our troops from Afghanistan without securing the safe return of Mark Frerichs would be an abject failure of our government to rescue an American citizen and Illinoisan who served his country in uniform.

Let's bring him home. https://t.co/UV2Fmxq957"
2021-05-21 18:25:55+00:00,"Don't hesitate—vaccinate. Visit https://t.co/4Hmb8dJOrL or text your zip code to 438829.
 
RT to help us save lives and beat this virus. #WeCanDoThis"
2021-05-21 13:41:10+00:00,The ADA was signed into law 30 years ago. It’s past time our nation’s public transportation systems live up to its promise. https://t.co/fs5U9sQRCM
2021-05-20 22:53:47+00:00,"Child care is not nice to have, it’s a must have. And ensuring child care providers can keep their doors open means making sure they have access to needed resources.
 
I'm proud to join @SenJackyRosen &amp; @SenJoniErnst in introducing the Small Business Child Care Investment Act."
2021-05-20 21:20:03+00:00,"After a year of hate and racist attacks against the AANHPI community, I’m immensely proud to have helped the COVID-19 Hate Crimes Act reach the President’s desk and watch President Biden sign it into law.

We’re not the “other” and hate has no place here. https://t.co/f84hfngRPU"
2021-05-20 15:14:12+00:00,"By passing my bill, the PROVE Act, along with the For The People Act and the John Lewis Voting Rights Act, we could make it easier for every American to access the ballot box—not harder."
2021-05-20 15:14:12+00:00,"28 years after the Motor Voter Act, which has helped Americans register their vehicles and get registered to vote all at the same time and in the same place, Republicans have introduced hundreds of voter suppression bills across the country.

Here's what we can do to stop them👇"
2021-05-19 01:51:45+00:00,"USPS NEWS: I talked with President Biden’s newest picks for the USPS Board of Governors.

Not only did I emphasize DeJoy’s disastrous leadership, but I also got their commitment to a full review of USPS leadership and policies.

It's time to build back a better Postal Service."
2021-05-19 01:05:03+00:00,"To truly Build Back Better, we must prioritize public transit accessibility so that every American can use our nation’s public transportation systems.

After our call today, I’m glad to confirm that @FTA_DOT Administrator Nominee Nuria Fernandez agrees. 
https://t.co/rMRkFIVazW"
2021-05-18 22:56:26+00:00,"Just seeing this news—thinking of these pilots today and sending my hopes for a swift and full recovery.
https://t.co/ytWNXEviiv"
2021-05-18 21:23:34+00:00,"Passing the COVID-19 Hate Crimes Act through Congress sends a strong and resolute message that our entire nation is committed to #StopAAPIHate.

I look forward to President Biden signing this legislation into law. https://t.co/Wjs0j4fDr6"
2021-05-18 19:59:20+00:00,"Democracy is not a given, it's something you have to work for. 

You have to defend, protect and strengthen it.

The best way we can do that right now is by passing the For The People Act to make sure voting is safe, secure and a right for all."
2021-05-18 13:56:47+00:00,"Happy birthday, @NatlHeadStart! For 56 years, you've made a difference in the lives of those who've needed help.
 
And during COVID-19, so many families have relied on Head Start for virtual learning, meal drop-offs and telehealth—thank you for always being there for them."
2021-05-18 02:03:06+00:00,"The right to make decisions about our own reproductive health—regardless of income or zip code—has been under attack for decades. Now, the Supreme Court has agreed to take up a case that could jeopardize those rights.
 
We must defend Roe v. Wade. https://t.co/0RysKMGPht"
2021-05-17 19:12:37+00:00,"It's been 67 years since Brown v. Board unanimously dismantled racial segregation in our schools, yet many kids are still denied equal resources, equal protections and equal opportunities.

With President Biden, we'll invest in the futures of every child."
2021-05-16 18:56:05+00:00,"In our time of need, caregivers are always there for us. But when it comes to what they need—too often, we've failed to show up.
 
Enough. The American Jobs Plan will invest, rebuild and transform our broken care system."
2021-05-15 15:15:16+00:00,"It is the courage, selflessness and diversity of our military that helps keep our country safe. 

On Armed Forces Day and every day—thank you for your service. https://t.co/xrqtfb2V0C"
2021-05-15 00:28:47+00:00,Another week where DeJoy should've been fired—but he hasn't.
2021-05-14 14:31:28+00:00,"Quality, accessible childcare is a necessity—not a luxury—for our military families.
 
I introduced a bill with @RepSpeier to tackle this critical issue facing military families all across the country. https://t.co/AajSCEzbSd"
2021-05-14 01:27:26+00:00,"They weren’t tourists. They were violent insurrectionists, incited by a sitting president and determined to tear down our democracy.
 
Rewriting the history of that day and touting the Big Lie is an insult to Officer Fanone's service to our nation. https://t.co/pXU60YfVUb"
2021-05-13 23:09:04+00:00,"Gyms are small businesses too and, like so many, they’ve been hit hard by this pandemic—losing 1.4 million jobs and billions of dollars.
 
I'm working across the aisle with Senator @JerryMoran to help them rebuild, reopen and recover. https://t.co/0HHT9uFQTX"
2021-05-13 21:37:54+00:00,"Our military’s recruitment, retention and overall readiness are harmed when a servicemember is forced to return to duty less than a month after the birth of their child.
 
I’m proud to be have introduced this important legislation with @RepSpeier. https://t.co/MDUOeYLbeS"
2021-05-13 20:41:27+00:00,It was so great to join @YMCA yesterday to discuss the importance of allyship with the #AAPI community. It's on everyone to call out hate and bigotry when we see it happening around us.
2021-05-13 18:00:56+00:00,"A recent Illinois report reinforces a deadly and unacceptable truth—Black moms are dying from pregnancy-related issues at tragically disproportionate rates. 
 
It's time we do better for all mothers.
 
It's time we pass the full MOMMA Act. https://t.co/vfHO46p0Jh"
2021-05-12 21:35:02+00:00,"So sorry to hear this sad news. Sending my best to you and your family during this difficult time, @SenAmyKlobuchar. May his memory be a blessing. https://t.co/ZvqxDBd9Us"
2021-05-12 19:54:34+00:00,Glad that U.S. Attorney John Lausch is doing well after being hospitalized over the weekend and sending my well-wishes to him and his family. https://t.co/aHjQ1chyqr
2021-05-12 17:13:26+00:00,There comes a point where thanking moms for all that they do is not enough. Moms deserve paid leave and child care—basic help we can finally give them by passing the American Families Plan.
2021-05-12 14:19:22+00:00,"TODAY: The @FCC is now accepting applications for the Emergency Broadband Benefit—a lifeline for eligible households most in need of reliable broadband during this pandemic.
 
Find out if you qualify now👇"
2021-05-12 01:22:00+00:00,"It gets better! This Thursday, Chicagoans 12 years and older can start getting their COVID shots at city-run vaccination sites. 

Call 312-746-4835 to make an appointment; walk-ins also available. https://t.co/VFf28BYtWd"
2021-05-12 01:19:05+00:00,"NEWS: The Pfizer COVID-19 vaccine is now approved for those 12 and older—the more people vaccinated, the quicker we can recover from this pandemic.
 
Make a plan to get you and your family vaccinated by visiting https://t.co/4Hmb8dJOrL."
2021-05-12 00:01:48+00:00,"This is great news! 1 million Americans now have coverage thanks to President Biden and Democrats’ leadership. 

If you need quality, affordable care, you can still #GetCovered through August 15 by visiting https://t.co/YFvaIQsuwW."
2021-05-11 22:21:15+00:00,"Too many young Americans live in areas that lack economic opportunity while struggling with all-too-common violence. It doesn’t have to be this way, but it won't get better unless we do something about it. Proud to join my colleagues in introducing this important legislation."
2021-05-11 21:22:31+00:00,"No mother should ever have to choose between staying in touch with an incarcerated loved one and paying the bills.
 
That’s one reason why I introduced bipartisan legislation with @senrobportman to ensure that prison phone rates are just and reasonable."
2021-05-11 00:11:36+00:00,Women's Health Week is a reminder of our work to support the health of every woman—including women of color who too often die from preventable illnesses because of medical racism. https://t.co/BC2ppUmcPx
2021-05-10 21:15:42+00:00,"As we kick off the second week of #APAHM, Senator @MazieHirono and I have a reminder for our fellow AAPI neighbors and all Americans working to stop AAPI hate:

We're with you. The cycle of discrimination against the AAPI community must end. https://t.co/T5sm12jc13"
2021-05-10 18:46:42+00:00,"I know what it’s like to go to bed hungry.

Since December, we’ve cut the number of families experiencing that pain by more than 40 percent.

That’s what happens when you focus economic policy on families—NOT corporate executives."
2021-05-10 16:16:42+00:00,"We’ve made great improvements, but we’re not yet on the other side of this pandemic. I’m proud of the work @MadisonCHD, @IL_Natl_Guard &amp; sites across IL are doing to ensure we’re getting shots in arms. I’ll keep working to ensure they have federal support.
https://t.co/PRKglOkLCY"
2021-05-10 13:47:14+00:00,"To be clear: The 361 voter suppression bills we see around the country are 361 attacks on the voting rights of Black, Brown and Latinx voters.

It seems worth reminding Republicans that voting is a right, not a privilege.

We won't be silent while they strip it away from so many."
2021-05-09 14:16:23+00:00,"I thank my lucky stars (and the miracle of IVF) that every day I get to wake up and be a mom to two beautiful girls.

Wishing every mom out there a very happy Mother’s Day💐 https://t.co/BXajWPEWN7"
2021-05-08 15:33:15+00:00,"It's not the ""American Billionaires Plan,"" it's the American Families Plan—a once-in-a-generation plan to meet this moment and help working families achieve economic security."
2021-05-07 20:19:32+00:00,"To me and these members of our Coast Guard—investing in infrastructure means investing in jobs, communities, businesses and waterways. Don't you agree? https://t.co/65KTWSDvT9"
2021-05-06 22:52:44+00:00,"This #NationalNursesDay, I'm so thankful for all of our nurses, including those in the AAPI community. After a year of rising anti-Asian hate, they've continued to risk their own health to care for the rest of us. 

They deserve more than our thanks. We must #StopAAPIHate."
2021-05-06 20:50:11+00:00,Either in or out of uniform—one of the best things we can do for our country is give back through national service. The @NewStarTweets @Americorps program is proving that over and over by supporting individuals with intellectual disabilities across Illinois. #ServiceShoutout
2021-05-06 19:36:00+00:00,"Our Kurdish partners stood shoulder-to-shoulder with U.S. Forces to stop the spread of ISIS in Syria and the surrounding region, but were abandoned by former President Trump.
 
We must restore trust &amp; confidence in our allies to achieve our national goals.https://t.co/jlMezQC4NS"
2021-05-05 20:14:04+00:00,"Republicans: 361 new voter suppression laws proposed in 47 states after unsubstantiated conspiracy theories of widespread voter fraud.
 
Also Republicans: 0 attempts to pass commonsense gun reform after multiple mass shootings and daily gun violence tragedies."
2021-05-05 01:16:36+00:00,"Six decades ago, brave patriots—in spite of the risk of violence—organized the first Freedom Ride into the segregated South to protest hateful and racist policies and demand equality.
 
We owe it to their sacrifices to continue our work for a more perfect Union. https://t.co/pXM4aHeFEF"
2021-05-04 22:33:40+00:00,"If it wasn't for my high school teacher, Mr. Nakamura, who helped feed me when we didn't know where our next meal would come from, I probably would've had to drop out. It may be #TeacherAppreciationDay, but not a day goes by that I'm not grateful for him.
https://t.co/lljcMk2osP"
2021-05-03 16:20:40+00:00,"Letting incarcerated Americans connect with their loved ones not only reduces recidivism, but is also the right thing to do. I applaud Acting-Chairwoman @JRosenworcelFCC for her commitment to promoting just and reasonable prison phone rates.

Our work for #PhoneJustice continues."
2021-05-02 14:40:56+00:00,"Thank you, @MazieHirono! While there are so many AAPI heroes to honor this #APAHM, I wouldn't be where I am today without my high school teacher: Mr. Nakamura, who saved my life and my future.

Proud to join @SenateDems to lift up AAPI voices. @SenStabenow, who inspires you? https://t.co/lljcMk2osP"
2021-05-01 20:07:49+00:00,"For the last five decades, @Amtrak has shuttled countless Americans from station to station across the country. And with the American Jobs Plan, we'll give Amtrak the investment it needs to be greener, safer, more accessible and help expand its rails from coast to coast."
2021-05-01 18:05:12+00:00,"The AAPI story is woven into the fabric of our nation's history. #APAHM reminds us of the incredible contributions of AAPI Americans, despite the racist bigotry they continue to endure today.

AAPIs are not the ""other.""

And together, we can break this cycle of discrimination."
2021-04-30 22:32:44+00:00,"This pandemic has hit American entrepreneurs hard. It was good discussing w/ @mHUBChicago, @1871Chicago &amp; @MATTERhealth CEOs how together, we can help ensure more entrepreneurs remain resilient and how we can help ensure people of all backgrounds have a seat at the table."
2021-04-30 21:58:50+00:00,"Far too many of our military families are experiencing hunger.
 
I’m working with @MarshaBlackburn on a bipartisan bill to help make sure our servicemembers and their families have enough to eat. https://t.co/Q2YPVyvvvg"
2021-04-30 19:32:21+00:00,"The military has failed to address the sexual assault crisis, letting victims down and harming our military’s readiness, recruitment and retention efforts.
 
I joined @gillibrandny in introducing a bipartisan bill that would help fix this. https://t.co/n5vNJ96VGj"
2021-04-30 19:08:59+00:00,".@RepCheri is a hard worker who has served as, and will continue to serve as, an excellent representative for her community.
 
I thank her for her leadership and know that we will miss her voice in the next Congress. https://t.co/NhzQbxjgv0"
2021-04-29 19:53:04+00:00,"After years of advocating for clean water, I'm proud to have led this bill and even more proud to see it get passed in the Senate.

Clean water is a right—and if #DWWIA becomes law, we'll be able to create jobs, remove lead pipes and help ensure that right for all. https://t.co/pxlGdrkYEk"
2021-04-29 16:24:45+00:00,"Proud to introduce nominee Candace Jackson-Akiwumi to @JudiciaryDems yesterday for a seat on the Seventh Circuit court. 
 
If confirmed, Jackson-Akiwumi will bring strong commitment to public service &amp; be the second Black woman to ever serve on that court.
https://t.co/Y5K4N0m94a"
2021-04-29 15:25:38+00:00,"Our water infrastructure is a crisis—but it’s a crisis we can solve. Today, we have the power to make the investments needed to help give every family access to the most basic human need: clean water.

I urge my colleagues to vote yes on #DWWIA. https://t.co/uHlejPJe2b"
2021-04-29 13:42:12+00:00,Today is a great day to pass #DWWIA and help secure clean water for all🚰
