Datetime,Text
2021-05-24 16:33:18+00:00,America’s parents and children deserve answers on why Joe Biden promised schools would open five days a week in the first 100 days of his administration and yet it seems teachers’ unions had more control over that decision than his own administration. https://t.co/H1aIkPhHpp
2021-05-24 14:34:15+00:00,"Getting answers to questions about what occurred at the Wuhan lab and gain of function research are of the utmost importance. I look forward to NIH’s cooperation and response to my letter.

https://t.co/Erlpv5LPPs"
2021-05-21 16:31:37+00:00,"Long suspected and now a viable theory. 

Did Covid leak from the Wuhan lab? 

Appreciate these members joining me in asking for information.
@RandPaul @SenatorLankford @SenRickScott @SenTomCotton @RogerMarshallMD @RepGallagher https://t.co/5dsbQfNTrF"
2021-05-21 01:44:00+00:00,"Reminder ⬇️

We're apprehending 6,000 people a day at the border.

That's 3 times the amount President Obama called a humanitarian crisis. https://t.co/iuHOWbg4a4"
2021-05-21 00:05:00+00:00,Democrats want to spend money and they will. https://t.co/xtJM6UC1Am
2021-05-20 23:34:06+00:00,"Did @POTUS Biden prematurely pressure Israel into a ceasefire as he negotiates with Hamas’ arms supplier, Iran, and radical leftist Democrats in Congress try to block weapons Israel needs to defend itself?  Whose side are they on? 
https://t.co/qq4QJL7SEK"
2021-05-20 21:48:29+00:00,"More than 20,000 Americans exercised 1st Amendment rights to march peacefully Jan. 6. USCP says 800 entered the Capitol illegally. I condemned the violence. @SenSchumer won’t admit it, but that’s not an armed insurrection and it was, by-and-large, peaceful."
2021-05-20 20:19:00+00:00,"With the radical elements in charge of our domestic and foreign policy, I worry there is a witch's brew of ingredients that could lead to stagflation. 

It is possible to snuff out a recovery. https://t.co/hN3QlKbuT3"
2021-05-20 19:13:11+00:00,What we are witnessing right now is the consequence of Biden’s weakness. https://t.co/lkCVddF7E4
2021-05-20 18:57:41+00:00,All but one Democrat just decided to waste approx $2 billion by voting against my amendment that would have honored existing contracts and built an additional 250 miles of border wall. How did border security become a partisan issue? https://t.co/5F42kF941g
2021-05-20 01:23:38+00:00,"Instead of honoring its commitment to ‘follow the science,’ these documents show the Biden administration is in lockstep with their union overlords to the detriment of American children. 

America’s parents and children deserve answers. 
https://t.co/vUT1MzGI7t"
2021-05-20 01:20:55+00:00,"This is completely sleazy and represents a counter-intelligence risk.

Why does the mainstream media refuse to cover Hunter Biden?

We warned about these entanglements back in September.

The media ignored it. https://t.co/hDKtOi7p39"
2021-05-19 19:23:50+00:00,"If @SpeakerPelosi picks the commissioners, she won’t be held accountable.

Ultimately she is responsible for securing the Capitol. https://t.co/upRVILOIWI"
2021-05-19 18:13:59+00:00,"""Russian Deputy Foreign Minister Sergei Ryabkov said waiving the sanctions would be seen as positive in Moscow, according to the Interfax news agency."""
2021-05-19 18:13:59+00:00,"""Kremlin spokesman Dmitry Peskov said he welcomed the U.S. media reports, saying, 'the very fact that such publications appeared is already quite positive.'"""
2021-05-19 18:00:02+00:00,"Biden continues to support our adversaries at the expense of our allies and security: 

https://t.co/fbaPXtpSri"
2021-05-19 17:20:33+00:00,"Robert Gates accurately described Biden’s past and predicted the future when he said, ""I think he has been wrong on nearly every major foreign policy and national security issue over the past four decades."" 

Now we see the disastrous consequences."
2021-05-19 16:16:04+00:00,"Great and @POTUS Biden is ordering Israel to stand down so that Hamas can rearm with the help of Iran. 

https://t.co/y79KU08IXC"
2021-05-19 02:40:03+00:00,"Proud to lead 20 of my Republican colleagues to ensure public access to government documents.
https://t.co/1AYMYRzN91"
2021-05-19 00:33:00+00:00,"Too many people have politicized the threats we face. 

We’re not keeping our eye on the things that really represent a threat to this nation. 

Right now, it is border security, and the Biden administration ignores that every day. https://t.co/HUeAt9ke4M"
2021-05-18 23:15:00+00:00,"6,000 apprehensions a day at the southwest border is an enormous threat. It is a crisis. https://t.co/m9i4EmqT40"
2021-05-18 21:27:06+00:00,"I condemn any act of violence. 

We must look, without politicizing it, at the full scope of threats we face as a nation — especially the border crisis, drug related crime, cyberattacks. https://t.co/hG6UTgOtPU"
2021-05-18 19:47:11+00:00,"50 Wisconsin chambers of commerce have joined Wisconsin's Republican lawmakers urging Gov. Evers to end the $300 unemployment benefit.

We are paying people not to work. We need to get government out of the way. @GovEvers needs to act on this immediately.

https://t.co/3DbOkN5sL6"
2021-05-18 19:11:09+00:00,"I’m sure @KenCuccinelli, Mark Morgan, and Tom Homan were shocked at DHS Secretary Mayorkas’ testimony last week.

They know @POTUS Biden created the current crisis and @SecMayorkas will never fix it.

https://t.co/8O8f6Ltn8J"
2021-05-18 16:29:29+00:00,"Proud to join this effort led by @SenRickScott 

Israel has every right to defend itself. 

The U.S. must continue to support our friend and ally as the Israelis defend themselves against Hamas’ violent terrorist attacks."
2021-05-17 23:55:00+00:00,"We need to get government out of the way, and let people start living productive lives again. https://t.co/LSbgYhLa0d"
2021-05-17 16:31:12+00:00,"The biggest problem businesses in Wisconsin face now is finding people willing to turn down government subsidies and go back to work. That's why I led Wisconsin's Republican lawmakers in asking @GovEvers to act on this immediately.

https://t.co/QWdTeYEOmH"
2021-05-15 21:31:51+00:00,This is the scene at the National Law Enforcement Officers Memorial this week. 394 names were added this year of officers who died in the line of duty. We pray for them and their families. #PeaceOfficersMemorialDay https://t.co/ID6C8Kuuh3
2021-05-15 15:41:23+00:00,Thank you to the finest among us — the men and women of our U.S. Armed Forces. We appreciate your service. #ArmedForcesDay https://t.co/80x0auvHa0
2021-05-14 15:35:29+00:00,"Join me in celebrating National Charter Schools Week! For 30 years, charter schools have delivered high-quality education and put their students first. #CharterSchoolsWeek https://t.co/4dsMBHrDUI"
2021-05-14 02:16:36+00:00,"Hopefully, the state of fear is receding, we will respect each other’s medical decisions, and we’ll recognize the danger to individual liberty that vaccine passports or other forms of coercion represent. 
https://t.co/jRhh1tZwA5"
2021-05-13 23:47:00+00:00,"Today's @CDCgov action on masks is well overdue.

The vaccine is highly effective.

So is natural immunity. https://t.co/KKLXmwLmvG"
2021-05-13 20:46:40+00:00,".@SecMayorkas testified 40% of children showing up at the border have a parent/guardian here in the US and over 90% have relatives here. 
I wanted to ask: Do you know how many of those sponsors are undocumented?
@HHSGov 7/2018-1/19 data shows 79% of sponsors were “without status” https://t.co/0EL9f5SJgS"
2021-05-13 17:58:41+00:00,"I wanted to ask @SecMayorkas: are you aware that in the name of more humane treatment, the Biden administration policies are incentivizing inhumanity and human depredations?"
2021-05-13 17:58:41+00:00,I wanted to ask @SecMayorkas: are you aware that human traffickers throw children out of the rafts when they are interdicted by law enforcement?
2021-05-13 17:58:41+00:00,"I wanted to ask @SecMayorkas: are you aware that a day after we visited the border, a 9-year-old girl drowned? Here’s the story... https://t.co/bPAYUSinsM"
2021-05-13 17:58:40+00:00,I wanted to ask @SecMayorkas : are you aware of Óscar Alberto Martínez Ramírez and his 2-year-old daughter Valeria and how they drowned? Here’s the picture... https://t.co/RHb8kiQIju
2021-05-13 17:58:39+00:00,"I wanted to ask @SecMayorkas: what percentage of unaccompanied children are 15 years of age or older? In other words, the prime age to be gang members or used by drugs cartels as traffickers."
2021-05-13 17:58:39+00:00,I wanted to ask @SecMayorkas: is he fully aware of how his policies created this crisis and are facilitating the multi-billion dollar business model of most evil people on this planet?
2021-05-13 17:58:39+00:00,I wanted to ask @SecMayorkas: do you understand the full scope in the way young girls are forced into the sex trade and young men are forced into involuntary servitude?
2021-05-13 17:58:38+00:00,I wanted to ask @SecMayorkas whether he knows how much the human traffickers charge their human prey and whether he is knowledgeable of how they pay off the debt?
2021-05-13 17:58:38+00:00,"I wanted to ask @SecMayorkas: is he aware of the kidnappings the beatings, the abuse, and additional ransoms demanded by human traffickers?"
2021-05-13 17:58:38+00:00,"I wanted to ask @SecMayorkas: is he aware of the fact that migrant girls are given birth control because they know a large percent are being raped during that dangerous journey they are incentivizing?
https://t.co/7CvroJ6tBy"
2021-05-13 17:58:37+00:00,"I wanted to ask @SecMayorkas: how are they verifying that a child belongs to adult? Are they doing DNA tests? And if so, what percentage of the “family units” are tested?"
2021-05-13 17:58:36+00:00,I wanted to ask @SecMayorkas: was he aware we heard testimony under my chairmanship that a child was sold for $84? https://t.co/TDiFsVhbRD
2021-05-13 17:58:36+00:00,I wanted to ask @SecMayorkas whether he was aware that human traffickers sell children to adults so they can exploit our asylum laws by posing as a family unit.
2021-05-13 17:54:47+00:00,"Unfortunately Chairman Peters didn’t allow a second round of questions during today's hearing. 

I was just getting started. I had many more questions that the American people deserve answers to..."
2021-05-13 17:52:52+00:00,First step in solving any problem is admitting you have one. @SecMayorkas and Chairman @SenGaryPeters were in a complete state of denial regarding the crisis on our Southern border. https://t.co/8zEP0KpFlE
2021-05-13 16:56:05+00:00,"Joining 43 of my Republican senate colleagues in urging @POTUS to stand with Israel.

The United States must hold Iran accountable for their support of terrorists. 
 https://t.co/DNdBlEmCue"
2021-05-13 15:19:42+00:00,"In March, I warned that Biden’s $1.9T “Covid Relief” bill could spark inflation. Recent CPI and PPI reports show that prediction was spot on. 

Rising prices and paying people not to work threaten the strong economic recovery that was underway before Biden screwed everything up."
2021-05-12 21:38:55+00:00,"I offered an amendment in committee today to complete the approx. 250 miles of border wall and not one Democrat voted to secure the border. 

Democrats have turned border security into a partisan issue.

It’s a real shame. https://t.co/M7dUAUKILp"
2021-05-12 21:27:01+00:00,"Where are Joe Biden and Kamala Harris on this crisis? 

They knew full well their polices would create this human depredation and inhumanity. #BidenBorderCrisis https://t.co/bk1JVUrER0"
2021-05-12 16:03:24+00:00,I believe government’s role is to help ensure transparency so that people have as much information as possible to make an informed decision for themselves. https://t.co/jVAve5k6nA
2021-05-12 16:03:24+00:00,"I strongly supported Operation Warp Speed, and celebrated its astonishingly rapid success. I have nothing against vaccines, have gotten annual flu shots since the 1970s, and am up-to-date with all other standard vaccinations."
2021-05-12 15:59:24+00:00,"We need to take the VAERS findings seriously and research what is going on. @washingtonpost writes that the senator “implied causality.” No, I did not. If @washingtonpost has evidence I did, they should show it. They don’t and can’t. Here are the facts: https://t.co/jVAve5BHMa"
2021-05-12 15:59:24+00:00,"I did not imply causality. As we already told @CNN last week, I am not suggesting the deaths were directly caused by the Covid-19 vaccine. https://t.co/ROhSrARqez"
2021-05-12 15:50:39+00:00,"The Washington Post points out “correlation is not necessarily causation.” Correct. As we pointed out to @CNN last week and to @washingtonpost this week, I never implied causation as it relates to the VAERS findings. View my full responses here: https://t.co/jVAve5BHMa"
2021-05-12 01:58:57+00:00,My role as a U.S. senator is to make sure the government is transparent and people have all the information needed to make their own health decisions. https://t.co/WOcsLIxGPA
2021-05-12 01:55:53+00:00,"We should respect everyone’s freedom and liberty and their ability to choose whether to get vaccinated or not.

This should not be a controversial issue. https://t.co/zJCVjkIBeQ"
2021-05-11 13:12:54+00:00,Our gratitude to law enforcement in Wisconsin and throughout the nation. We appreciate you. #NationalPoliceWeek https://t.co/vRW3MGcgCT
2021-05-10 23:06:00+00:00,The border was under control until President Biden dismantled everything that worked. #BidenBorderCrisis https://t.co/TrQCRKNqDp
2021-05-10 21:00:28+00:00,"The media completely dismissed our report. That's part of our problem, we do not have an unbiased media. 

For the most part we have advocates for the democrat, extreme left-wing of the American political spectrum and it’s really hurting this country. https://t.co/YJVIGnOORI"
2021-05-10 20:21:07+00:00,Joining Larry Kudlow on @FoxBusiness now.  Tune in!
2021-05-08 13:48:27+00:00,"Here, @CNN deceives viewers, claiming it’s “entirely false” there’s any link between deaths and the vaccine.
 
I didn’t say the vaccine caused deaths. I only noted the government’s own public list of vaccine “adverse events” cited those deaths, and I suggested investigation."
2021-05-08 01:01:38+00:00,"Biden finally addressed the American public and he pleaded with Americans, 'have faith in government'. 

I'm sorry, I just don't. 

I have faith in the American people... Not government.
https://t.co/GvooSPnFuF"
2021-05-07 16:00:35+00:00,".@POTUS’s reckless, out of control spending and proposed tax increases will hamper the economy, spark inflation, and hurt American workers,businesses &amp; families. He should stop mortgaging our children’s future, get government out of the way, and let people live productive lives."
2021-05-07 16:00:35+00:00,The economy was roaring back to life before Biden became President. The biggest problem businesses face now is finding people willing to turn down government subsidies and go back to work. #JobsReport
2021-05-06 18:56:06+00:00,"As we come together today on this #NationalDayofPrayer, let us continue to keep our brave service members, first responders, and all hardworking Americans who rise to the challenge each and every day in our thoughts and prayers. https://t.co/OfJ2CBiUsP"
2021-05-06 14:00:00+00:00,"When you see the unequal application of justice and the law, that should frighten every American. @seanhannity @FoxNews https://t.co/k4sZlXUbC3"
2021-05-05 21:14:42+00:00,"Our country is $28 trillion in debt and headed to beyond $30 trillion.

We don't have an unlimited checking account.

We don't need the kind of spending the Biden administration is looking for. @WISN12News https://t.co/pOzdXvCOPV"
2021-05-05 20:47:58+00:00,"Once again the Biden administration is lying to the public about the crisis it created at the border.  

This graph on weekly apprehensions proves their dishonesty.  

Will the biased media challenge their false narrative? 
Don’t hold your breath. https://t.co/rSuGl2mJTd"
2021-05-04 15:23:33+00:00,"Instead of creating more opportunities, it will kill people’s jobs, increase their taxes, and further implement radical leftists’ agenda. 

Happy to have @VP visit Milwaukee, but she really ought to inspect the crisis President Biden created at the border."
2021-05-04 15:23:33+00:00,"More than 70% of @POTUS Biden’s so-called 'infrastructure plan’ will be spent on programs few would even consider infrastructure. 

It should be interesting to see how Vice President Harris tries to justify this $2.25 trillion spending boondoggle."
2021-05-04 03:11:32+00:00,"I always felt the Aug 6, 2020 FBI briefing was a set up, and now I know it was.  

I’ve asked who directed that it be given and what the underlying intelligence was for the unnecessary and useless briefing.  

The deep state hasn’t told me - not holding my breath they will now. https://t.co/0mdQS9CPvL"
2021-05-03 15:05:00+00:00,"Mainstream media should have long ago outed sources that lied to them about the false “Russia colluded with Trump campaign” narrative (hoax).  

Will they do it now?  

Don’t hold your breath. 

The dishonesty in much of MSM is impossible to overstate."
2021-05-03 14:49:03+00:00,".@WSJ  continues:

“The problem with unidentified sources is that they aren’t accountable for spreading false information. But the Post, Times and NBC ought to be furious for being misled, if that’s what happened, and should expose who did the misleading.”"
2021-05-03 14:49:03+00:00,".@WSJ in exposing @washingtonpost  has hit the nail on the head:

“the larger issue is whether Democrat leakers are again working with the press to smear Republicans with false claims of collusion with Russia.”"
2021-05-03 14:49:03+00:00,".@WSJ on the latest @washingtonpost smear:

""The leak about Mr. Johnson is an extension of fictitious claims Democrats have made for months to undermine his report last year on Hunter Biden’s foreign business dealings.”  

https://t.co/Hs5DLA7NRc"
2021-05-02 21:49:12+00:00,I truly hope that everyone at some point in their life gets to know someone like Pastor Smith.  He was the spiritual leader of the Joseph Project and will be sorely missed. I spoke with @VickiMcKenna  on WISN earlier this week on his legacy. https://t.co/mHNZnvcQds https://t.co/6rmZOPb0Lm
2021-04-30 20:21:37+00:00,Where was the media’s concern when my report revealed that then-Vice President Biden was made aware that “Hunter Biden’s position on Burisma’s board enabled Russian disinformation efforts and risked undermining U.S. policy in Ukraine”?
2021-04-30 20:21:37+00:00,It claims my report found Hunter Biden’s role with Burisma “did not influence his father’s work.” The report “Obama administration knew that Hunter Biden’s position on Burisma’s board was problematic and did interfere in the efficient execution of policy with respect to Ukraine.”
2021-04-30 20:21:37+00:00,"Andrii Telizhenko, the Democrats’ personification of Russian disinformation, met with Obama administration officials, and worked for a Democrat lobbying firm. Why did @washingtonpost not inform readers of Telizhenko’s Democrat connections? See Section 9 https://t.co/obf1Lougv6"
2021-04-30 20:21:36+00:00,The @washingtonpost article left out a few key facts:
2021-04-29 20:34:53+00:00,"He believed the answers did not come from government, but from renewed faith and strengthened families. Milwaukee, Wisconsin, and America has lost a true champion and a very good man.
https://t.co/tRcHaWjkXb"
2021-04-29 20:34:53+00:00,"The Jospeh Project helped connect people to jobs, but the real insight was recognizing the transformational power of work, faith and community. I admired the way Pastor Smith connected with people, supported them no matter the day or hour, and offered tough love when necessary. https://t.co/mKjZTSM3Js"
2021-04-29 20:34:51+00:00,"Pastor Smith was the spiritual leader and true force behind the Joseph Project. Together we saw the need and opportunity to transform lives, one person at a time. https://t.co/bcnLxt0YGw"
2021-04-29 17:05:00+00:00,"100 Days of Radical, Partisan Agenda: “Biden is the most radical left-wing president in US history, period”

I agree. America will suffer. 
https://t.co/DTxVvjd5en"
2021-04-29 17:05:00+00:00,"100 Days of the Biden made crisis at the border. 
On average, over 5,900 migrants apprehended PER DAY the last 28 days. That’s a large caravan every single day, with no end in sight and Politico forbids calling it a crisis. 

What a humanitarian disaster.  https://t.co/MVqtwm1wBg https://t.co/guqzuW4f43"
2021-04-29 17:04:58+00:00,"100 Days of Media Collusion: Washington Post shuts down presidential fact-checking database after 100 days of Biden. 
https://t.co/EVZ1Pz4pDk"
2021-04-29 17:04:58+00:00,"100 Days of Division:  Biden gives up on ‘unity’ during his first 100 days.
 https://t.co/nwghC1rnCR"
2021-04-29 02:30:38+00:00,My statement on President Biden's #JointAddress https://t.co/Hk2cTc1SFL
2021-04-29 02:20:27+00:00,"I’ve seen the crisis firsthand, despite the administration’s attempt to censor us during our trip to the border. Americans have the right to know what is happening. https://t.co/FrKezwbuff"
2021-04-29 02:17:30+00:00,"Biden and Harris created the border crisis, are fully aware of the cruelty of human traffickers, and know their policies are facilitating the multibillion-dollar business model of some of the most evil people on the planet. #JointAddress https://t.co/sVi5OlJ7Dd"
2021-04-29 01:47:37+00:00,"We are $28 trillion in debt before Biden’s $1.9 trillion Covid relief, $2.2 trillion “infrastructure” bill and, now, his latest $1.8 trillion boondoggle. 

We are continuing to mortgage our children’s future. 

It’s immoral and will bankrupt our country. https://t.co/htfbkoFupn"
2021-04-27 18:06:45+00:00,"Pastor Jerome Smith has been called home by his Heavenly Father.  So many lives, including mine, were enriched by knowing and loving such a good person.  He will be sorely missed by his family and friends. Please provide them comfort with your prayers. https://t.co/1XnxV3NGIO"
2021-04-27 00:22:54+00:00,"How dishonest, @JournalSentinel.
 
My comments: “I was just on a plane and I wore a mask the entire time. … So I’m not opposed to masks. … We really should follow the science.”
 
Their headline: Ron Johnson disputes scientific consensus on the effectiveness of masks."
2021-04-27 00:07:00+00:00,"This preprint study out of Israel offers encouraging news regarding effectiveness of both vaccines and prior Covid infection at preventing reinfection, hospitalization, serious illness and death. 

As we learn more, guidelines should be re-evaluated. https://t.co/Xj5vADp7qa"
2021-04-26 23:17:30+00:00,"The Joseph Project has helped people like Ty, who after a decade in prison found people willing to help him. It’s too bad that wasn’t included in this story. https://t.co/FSP72Sa80e"
2021-04-26 23:17:30+00:00,I encourage visiting https://t.co/yaLF8DdP0B so you can see for yourself how this program has made a difference. https://t.co/cDkxyQlioY
2021-04-26 23:17:28+00:00,"Since 2015, the Joseph Project has played a pivotal role in communities throughout Wisconsin, making the connection between people who are genuinely seeking opportunity and the job opportunities that exist around the state. https://t.co/UMXj0zY3RZ"
2021-04-26 23:17:26+00:00,It is unfortunate that @sbauerAP and @TomBeaumont decided not to include the Joseph Project in their latest attempt to push a false narrative. https://t.co/LZZRzt4f0H
2021-04-26 22:24:33+00:00,"Obviously the pandemic created an emergency. But unlike Dr. Fauci, I also focused on the human toll of the shutdowns — the isolation and economic devastation. We all want the suffering to end. I’m glad millions have been vaccinated, but also respect people’s choice not to be."
2021-04-26 19:41:48+00:00,"NIH just announced it will now study early treatment for Covid. Why did it take a year and more than 570,000 lost lives for Drs. Fauci and Collins to finally embrace this obvious and common-sense approach? https://t.co/sGelzbjkvE"
2021-04-26 19:10:11+00:00,COMING UP: Looking forward to connecting with constituents for a telephone town hall at 3pm CT. You can also listen live here. https://t.co/uvzPHTTCY2
2021-04-25 19:46:49+00:00,Censorship is out of control. Big Tech oligarchs have become way too powerful. https://t.co/2lgLoAJQh2
2021-04-24 20:38:05+00:00,"It's #NationalParkWeek! Happy to co-sponsor this resolution to encourage us all to get outdoors and #FindYourPark. 

Here's the park finder for Wisconsin: https://t.co/EcqnzAYXxI https://t.co/MkiP0TZOta"
2021-04-23 17:05:41+00:00,Statement from Sen. Johnson: https://t.co/QWKH6FigGN
2021-04-23 01:08:00+00:00,Another trillion dollar plan coming from the Biden administration. Biden's reckless spending is already showing signs of causing harm. https://t.co/ER15jOV22d
2021-04-22 23:02:07+00:00,"It's obvious what the Biden administration is doing at the border. Awarding huge contracts to move migrants to other places so people can't see what we saw in Donna, Texas. Without pictures, there will not be a story. https://t.co/dceZrYZ1kZ"
2021-04-22 22:17:06+00:00,"Once again the lapdog liberal media is helping Biden cover up his administration’s failures on the border. 

My chart shows this is a crisis. https://t.co/i5EZN92btY"
2021-04-22 17:26:32+00:00,I hosted today’s Republican senator lunch group and sharing a menu full of the many wonderful tastes of Wisconsin. Hope everyone enjoyed! https://t.co/BMi0RBx59u
