Datetime,Text
2021-09-24 17:06:28+00:00,"Please watch MN @RepMortensen's town hall with nurses. These are frontline professionals that provide a valuable perspective on Covid, early treatment, vaccine injuries and mandates. Must see video!!
 
https://t.co/O5ZrA9rB0p"
2021-09-24 14:31:15+00:00,The men and women of Border Patrol working tirelessly to handle Biden’s border crisis deserve so much better.
2021-09-24 14:31:15+00:00,"Biden is disgraceful. Instead of maintaining the policies that worked and giving Border Patrol the resources they need to deal with the humanitarian and national security crisis he created, he is blaming them for a fake controversy created by the radical left and complicit media."
2021-09-23 20:31:26+00:00,Great to meet with the @BadgerVB team. Good luck in your upcoming game against Maryland. #OnWisconsin https://t.co/ocfqm1A6Fr
2021-09-23 16:23:26+00:00,"Here is the latest consequence of the Biden administration’s incompetence. 

This is precisely why I have asked, and continue to ask, the administration about their vetting process and repeatedly raised the issue regarding Ft. McCoy.

https://t.co/Lx5SvKhIIO"
2021-09-23 16:18:04+00:00,Iowa County ➡️ Our mobile office will be in Dodgeville Friday afternoon. If you need help with a federal issue please stop by. https://t.co/l1lk6sFBlt https://t.co/ndW1muTqGX
2021-09-23 15:15:00+00:00,"It’s great Politico is finally admitting they were wrong. 

What came before Tony Bobulinski, what came before Hunter Biden’s laptop, was Sen. Grassley’s and my report (released one year ago today)
https://t.co/ZLbuqDumuA"
2021-09-23 14:05:17+00:00,"It's a pretty simple question @SecMayorkas:

Of the approximately 1.3 million apprehensions, how many people have been returned, how many people have been detained, and how many people have been dispersed into the U.S.?
https://t.co/IoMWGmvNXc"
2021-09-22 22:07:18+00:00,"I asked @FBI Dir Wray why he hasn’t responded to Senator @ChuckGrassley and my May 3 request to explain the FBI’s unsolicited defensive briefing to us that was then leaked to the media to smear us. 

He couldn’t, or wouldn’t explain. 

Dir Wray needs to be held accountable. https://t.co/6zCMwuTZOM"
2021-09-22 19:16:09+00:00,".@DHSgov employs 240,000 people. Has @SecMayorkas not assigned anyone the task of keeping track of and reporting the numbers associated with the border crisis created by @POTUS?
 
Hard, if not impossible, to believe. https://t.co/LwULcS6c56"
2021-09-22 18:17:39+00:00,I’ll be hosting a telephone town hall at 4pm CT. You can listen live here: https://t.co/TyoPVAYHiO https://t.co/ocpfrEdC2y
2021-09-22 18:01:38+00:00,".@DHSgov employs 240,000 people. Has @SecMayorkas not assigned anyone the task of keeping track of and reporting the numbers associated with the border crisis created by @POTUS? 

Hard, if not impossible, to believe.

https://t.co/AUEUF8nSeg"
2021-09-22 16:39:58+00:00,"I asked FBI Dir Wray to explain why the FBI told SSCI in Feb, 2018 (when he was Director) that Steele dossier was credible when they already knew in Jan 2017 that it contained Russian disinformation. 

He couldn’t, or wouldn’t explain. FBI remains unaccountable. https://t.co/4hQgHrfxD9"
2021-09-21 22:54:37+00:00,"Such wonderful news that so many prayers were answered, and State Senator Andre Jacque left the hospital today. He and his family remain in all our prayers for a full recovery."
2021-09-21 21:40:00+00:00,"This should be a bombshell report.

A letter from recently retired U.S. border patrol chief warns Congress is getting factually incorrect information.

To say the border is closed is a lie.

This administration is denying reality and it's dangerous to our nation. https://t.co/wshoDoWsNA"
2021-09-21 21:14:54+00:00,Calling the Biden administration incompetent is being kind. Their failures are caused by their policy decisions. https://t.co/DfKyj9YHlL
2021-09-21 19:31:56+00:00,"On Oct. 12, 2018, I wrote FBI Dir Wray asking for all communications between FBI and indicted Clinton campaign attorney Michael Sussman. 

Dir Wray completely and arrogantly ignored the legitimate oversight request. Apparently, he’s above Congressional oversight. https://t.co/tpQXxkKpNf"
2021-09-21 18:53:56+00:00,"FBI Dir. Wray ought to read the entire Michael Sussman indictment. 

If he would, he’d understand why half of America is outraged. 

Everyone should read it. It details the corruption of the Clinton campaign and how the Russia hoax was hatched. https://t.co/SleLCBr7jW"
2021-09-21 16:48:12+00:00,".@SecMayorkas said they’re executing their plan on the border. 

At least this is one truthful statement. 

Their plan is open borders and their plan is working and putting our nation in peril. https://t.co/KojODf4zEJ"
2021-09-21 15:53:48+00:00,"Why won’t DHS @SecMayorkas say how many of the 1.3 million apprehended have been returned and how many have been dispersed into the U.S.? 

Americans should be concerned and outraged. https://t.co/cG5j7B4Nfu"
2021-09-21 15:36:08+00:00,"1.3 million apprehensions YTD, over 6,700 per day for the last two months and @SecMayorkas still claims the border is closed. He is completely delusional, as is his boss. https://t.co/8X1F3FkrYN"
2021-09-21 13:49:36+00:00,"This career, non-partisan civil servant worked tirelessly to secure our borders. That he felt compelled to write this letter should concern every American. I hope the Biden administration and Congress will heed his fervent warning.

https://t.co/pxMlXnN2rq"
2021-09-20 17:26:21+00:00,Now the censors at Facebook are targeting @BjornLomborg for telling the truth. Sad that Orwell’s “1984” is coming to fruition in 2021. Where does this end?
2021-09-20 17:16:35+00:00,Our mobile office will be in Lafayette County tomorrow afternoon.  Staff will be there to help with federal issues. https://t.co/Em46nbTTGf https://t.co/eMlVMs8U8t
2021-09-18 23:13:14+00:00,"The best of America on display in Port Washington today. Community gathers to honor WWII veteran Joe Demler. He barely survived a Nazi prison camp, returned home and worked 37 years at this post office. We must never forget the service and sacrifice of our service men and women. https://t.co/pjVnzcWXBH"
2021-09-17 21:17:55+00:00,"The American public have a right to know the crisis that is happening on our borders. 
The suppression of the media’s ability to tell that story is deeply troubling.
https://t.co/OKzPX07F0R"
2021-09-17 20:25:18+00:00,"High school students from across Wisconsin can attend Academy Day tomorrow in Oshkosh to get more information about attending @WestPoint_USMA @NavalAcademy @AF_Academy @USCGAcademy @UsmmaO
https://t.co/hLBnLPSE9O https://t.co/3u2BhRPHMf"
2021-09-17 00:20:57+00:00,"The border crisis grows, and the Biden administration and mainstream media remain in a total state of denial. 

God help us."
2021-09-16 20:36:27+00:00,Fiscally responsible? Fully paid for? President Biden truly is delusional. Even Pelosi admitted only some will be covered and that means growth-killing tax increases.
2021-09-16 19:06:18+00:00,"Border apprehensions averaged 6,888/day in July and 6,738/day in August. 

Graph shows the ugly reality.  

Still haven’t heard Biden or mainstream media call it a crisis.  

Are they corrupt or delusional? 

Probably both. https://t.co/BoC6SIWuTv"
2021-09-16 16:24:29+00:00,"It's shocking that Dr. Fauci does not have a firm grasp on the effectiveness of natural immunity. Hopefully the @CDCgov, @US_FDA  and @NIAIDNews will answer these important questions.
https://t.co/YyBBFYd1n5"
2021-09-16 13:16:41+00:00,"If they are truly “following the science,” including @US_FDA’s own experts who have issues with boosters, more scientists should be at odds with @POTUS’ vaccine mandates. 

https://t.co/immNFsZkFe"
2021-09-15 17:45:02+00:00,"This administration is detached from reality. From the crisis at the southern border to the debacle in Afghanistan, Biden IS the root cause. His mounting policy failures are the result of his delusional beliefs.

https://t.co/nw7yI8xf5w"
2021-09-15 02:31:37+00:00,"Why does the story the Biden administration spins to the American people repeatedly get contradicted by public reports?  
 
https://t.co/j1VYJTCpQ4"
2021-09-15 02:31:36+00:00,"During his testimony today @SecBlinken said much of US military equipment left behind was made inoperable. 

News reports show photos and video indicating not all equipment was rendered inoperable."
2021-09-15 02:26:18+00:00,"...America has a responsibility to protect those who worked with the military and saved American lives. 

We also need to protect the homeland.  
 
@SecBlinken did not provide any specific information about the vetting process. https://t.co/42qU3deoQE"
2021-09-15 02:16:18+00:00,We need to know how Afghan refugees are being vetted. As I said at Ft. McCoy the majority of those coming here want the same thing we want: freedom and opportunity to raise families.
2021-09-15 00:55:53+00:00,I joined @marcorubio and 23 of our colleagues in a letter to @secdef demanding answers on American military equipment left behind in Afghanistan which has already fallen into the hands of the Taliban and their terrorist allies. https://t.co/lKT50nF17C
2021-09-15 00:51:27+00:00,I asked @secblinken &amp; @secdef to provide answers to an incident involving an U.S. military official preventing American citizens &amp; Afghan allies from evacuating Kabul.This administration owes the American people answers about its failures in Afghanistan. https://t.co/uukWkomCUX
2021-09-14 17:50:00+00:00,Listen to what @SecBlinken had to say in response to my question about leaving sophisticated U.S. military equipment in the hands of the Taliban. https://t.co/85zQfAAv2m
2021-09-14 17:23:54+00:00,"If you were just to read @SecBlinken's testimony you would think the withdrawal from Afghanistan is a smashing success. 

It's that detachment from reality that is most concerning. 

President Biden's policies are one rolling disaster after another. https://t.co/YPAtAmLsaM"
2021-09-14 02:24:07+00:00,"Sadly, we are already seeing the consequences of forced government mandates and continued politicization of COVID-19 by the Biden administration. No one should be pressured, coerced, or fear reprisal for refusing treatment.

https://t.co/Ogg13RGFnI"
2021-09-11 14:41:51+00:00,"When I think of September 11th I think of firefighters, first responders, police walking up the stairs into danger to save others. In these tragedies we always seem to see and witness the absolute best of humanity and the American character. https://t.co/LgaH1v1xhv"
2021-09-10 01:39:17+00:00,It is all about freedom and personal choice. https://t.co/GEYWVCllvu
2021-09-08 21:44:17+00:00,"Labor shortages, increased taxes and vaccine mandates are some of the many concerns business leaders shared with me today at a roundtable with the Independent Business Association of Wisconsin. https://t.co/1gQIm86E0B"
2021-09-08 21:39:07+00:00,Met with the Waukesha County Conservative Business Coalition this morning. I’m hearing loud and clear there is great concern for the future of our country. Biden and the Democrats’ policies are harmful to American workers and families. https://t.co/8a8SlASOXm
2021-09-08 14:51:35+00:00,"Outstanding performance by these champions! Congratulations to the Wisconsinites on the team: John Boie, Nate Hinze, Matt Lesperance and Jacob Williams."
2021-09-07 15:06:52+00:00,"When I hear @POTUS declare this Afghanistan debacle an ""extraordinary success"" it not only shows he’s detached from reality, it also calls into question everything he's telling the American people.
https://t.co/s0Fkd9FPEU"
2021-09-03 23:42:33+00:00,Here's the link where you can submit your stories. https://t.co/vUvQyqP8cG
2021-09-03 23:40:39+00:00,"I appreciate the bravery of these nurses in Minnesota sharing their stories with @RepMortensen. 

No one should be pressured, coerced, or fear reprisal for refusing treatment, including the Covid-19 vaccine. 
https://t.co/08M4CarOEs"
2021-09-03 23:33:42+00:00,"Nurses, doctors and other healthcare workers are reaching out to me with heartbreaking stories about vaccine mandates. 

Read their stories and see why I believe these mandates are an attack on healthcare freedom. https://t.co/vUvQyqP8cG https://t.co/FsokMHUV8p"
2021-09-03 18:56:39+00:00,"This is one of many excellent questions that the Covid gods refuse to answer. Apparently, they don’t believe the people that pay their salaries deserve to have the information they need to make informed decisions. A very sad state of affairs."
2021-08-31 21:23:50+00:00,This was a failure. It’s jaw dropping to see the fantasy world that the president and this administration is living in. https://t.co/Hx3cQ6VUZy
2021-08-31 13:57:57+00:00,Congratulations to Wisconsin’s own Joe Delagrave of Prairie du Chien for winning the silver medal in Wheelchair Rugby for @TeamUSA @usawchrugby!
2021-08-30 01:06:31+00:00,"This didn’t have to happen. This type of withdrawal was incredibly incompetent, so incredibly botched. We are in a terrible situation where we’re relying on the Taliban to successfully conclude this withdrawal. https://t.co/JHR2UYEmwo"
2021-08-27 02:26:35+00:00,As I said at Ft. McCoy we’re hearing a different story than the Biden administration is telling the American people. This is disturbing news.
2021-08-26 18:53:46+00:00,"Reports of terrorist attacks in Kabul are horrific and heartbreaking. God bless our fallen service members, their families, the military &amp; innocent civilians still in harm’s way. Our troops are the finest among us. I continue to pray for their safety and those trying to evacuate."
2021-08-26 01:48:44+00:00,"Why is the Biden administration relying on the Taliban for safe evacuation? U.S. citizens and Afghan allies are at their mercy, going through their checkpoints. It is a travesty, a disaster, utter incompetence on the part of this administration. https://t.co/naxrmsfUmP"
2021-08-26 01:05:00+00:00,"Those at Ft. McCoy had no idea this was going to be their mission until 10 days ago. When Biden said “we planned for every contingency,” is this what he meant? https://t.co/K0FtbgEjTv"
2021-08-26 00:51:44+00:00,"Afghans who helped us and are in danger deserve our help and integration into America. Due to lack of planning and disorganization, President Biden and his incompetence has made the jobs of men and women of the military, the finest among us, much harder. https://t.co/2CbdWJrXj2"
2021-08-25 13:37:26+00:00,We are hearing disturbing reports that unvetted refugees are being flown into the US. Fewer SIV holders and American citizens on flights. Looking forward to being briefed at Fort McCoy today.
2021-08-24 02:00:06+00:00,"I have advocated for early treatment of Covid, never a veterinarian grade drug. Any suggestion otherwise is a grotesque lie. That @NIH, @CDCgov, and @US_FDA didn’t help develop early treatments is one reason why a growing number of Americans no longer trust them."
2021-08-23 21:52:36+00:00,"Kenosha County Sheriff David Beth and I reflect on what happened in Kenosha one year ago today and how it shocked the country. Governor Evers should have immediately provided sufficient resources to end the riots. Instead, he incited rioters, leading to three nights of violence. https://t.co/XIl0ShdAjX"
2021-08-23 20:35:47+00:00,"On this one year anniversary of the riots that thrust Kenosha into the national spotlight, I sat down with a Kenosha business owner who watched as his furniture store burned to the ground. Our conversation in my latest podcast: https://t.co/NNLz7COWfI https://t.co/cG3r3wDI5A"
2021-08-22 15:41:53+00:00,"Health agencies do not feel like they have to be honest with Congress and transparent with the American people. 

I’ve written a letter with Sen. @RandPaul demanding unredacted emails about the origins of COVID-19 and safety issues at the Wuhan lab.

https://t.co/0IU45VR87b"
2021-08-21 23:08:59+00:00,"Veterans like @JasonChurchWI who served in Afghanistan and on my staff say they served because they believe America is special. 

""Be the Americans that I wanted to fight for."" https://t.co/EgSvEhz3F0"
2021-08-21 21:32:04+00:00,"This is a disaster, and it’s a disaster brought about by a really bad decision and just incompetence.
&gt; https://t.co/LbhO3czBmo"
2021-08-20 19:25:08+00:00,"The extent to which @POTUS is denying reality is highly concerning. He and the incompetents in his administration have been living in a fantasy world regarding the border crisis and now the disaster in Afghanistan, both tragic results of their policy failures."
2021-08-20 14:07:31+00:00,"Dr. Kory, with other medical professionals, had the courage and compassion to risk their lives treating Covid patients. Their reward: vilification, termination, censorship &amp; lawsuits. We still need early treatment. Time for @NIH to stop dragging its feet. 
https://t.co/BURlLwR6jI"
2021-08-19 21:50:07+00:00,.@SenMikeLee and I will be submitting a detailed comment to Biden’s proposed open border regulation. It is shocking that any president would violate his oath of office and threaten U.S. sovereignty in this manner. Biden’s reckless action must be stopped.
2021-08-19 20:29:17+00:00,".@GovEvers incited Kenosha rioters, issuing grossly irresponsible statements before knowing the facts. He compounded his incitement by refusing to send sufficient number of troops to end rioting. The press refuses to hold him accountable for his actions. Hopefully, WI voters will"
2021-08-19 18:59:35+00:00,"So now Biden’s self-inflicted Afghanistan disaster will exacerbate Biden’s self-inflicted border disaster. How will America survive another three and a half years of his incompetence and policy debacles? 

https://t.co/SlPAkglwBn"
2021-08-19 15:14:26+00:00,".@POTUS new asylum policy is a huge step toward open borders. This lawless act is another example of Biden failing to uphold his oath to “faithfully execute” and “preserve, protect, and defend the Constitution.” 

One more Biden-caused disaster.

https://t.co/icUJidTK9L"
2021-08-18 21:01:37+00:00,"The unmitigated disaster we’ve seen in Afghanistan is only the most recent debacle created by Biden and his team of incompetents. 

Our nation, and the men and women who honorably serve and sacrifice for it, deserve far better.
https://t.co/oZP4uXeEni"
2021-08-18 20:27:50+00:00,"Appreciate this truth telling from @MarkBellingShow:
""The story Gannett is using to slime Johnson is fundamentally dishonest. That MJS and its outstate clones would use it to distort Ron Johnson’s record says a lot more about them than it does Johnson.”
https://t.co/seHEM9Ttaz"
2021-08-16 23:45:05+00:00,"President Biden claims to stand squarely behind his decision, but then blames others for a situation he inherited. 

@POTUS Biden is the root cause of this debacle. https://t.co/hxSuCt0XwB"
2021-08-16 18:50:00+00:00,https://t.co/02jHVnjcQU
2021-08-16 18:25:41+00:00,https://t.co/pdfvZf9YQk
2021-08-14 16:49:10+00:00,".@JasonChurchWI, an extraordinary young man who lost both legs in Afghanistan and worked in my Senate office, posted this on Facebook. It doesn’t have to end this way. Once again, Biden’s feckless leadership and poor judgement are the root cause of this disaster. https://t.co/F620U0dtBj"
2021-08-13 16:13:52+00:00,"As Wisconsin waits for a retraction and apology from the propagandist @journalsentinel for yet another defamatory and false hit piece on me, @NRO offers a well-reasoned story on taxes and tax reform.
https://t.co/w3Y2n1y1LB"
2021-08-13 02:57:14+00:00,"Border Patrol officers, overwhelmed by Biden’s border crisis, are beginning to speak out. 

When will Biden admit there’s a crisis and that he’s the root cause and reverse his disastrous policies? 

When will Senate Democrats vote to finish the wall?"
2021-08-13 01:12:02+00:00,"MJS headline: “Republican senator's backdoor deal-making” is a total and complete lie. This isn’t journalism, it’s propaganda by a liberal and biased media. If MJS had an ounce of integrity, they’d immediately retract the editorial and offer an apology. I’m not holding my breath."
2021-08-12 00:25:00+00:00,"Why are gas prices going up?
Ask Democrats. 
Their policies make no sense.
It's one disaster after another. https://t.co/nkb7tWuLEO"
2021-08-11 01:25:58+00:00,"46 Republicans have signed my letter letting Senate Democrats and the American public know that we will not vote to increase the debt ceiling. 

This is a problem created by Democrat spending and they need to take responsibility.
https://t.co/YqoQHmlCbd"
2021-08-10 21:08:19+00:00,@SteveDaines Mortgaging Children’s Future
2021-08-10 16:55:23+00:00,"My statement on $1.2 trillion ""infrastructure bill."" https://t.co/0KO5fbhw6C"
2021-08-10 03:20:11+00:00,"If the Jan. 6 committee were anything more than a partisan sham, it would examine why the U.S. Capitol Police leadership won’t discuss the security measures in place that day. 

But the USCP won’t.

My letter &amp; their response⬇️
https://t.co/4RXfQdV34p https://t.co/o41GzcsVMi"
2021-08-10 02:52:50+00:00,"Tonight, the Senate passed my resolution designating July 2021 as National Sarcoma Awareness Month. 

It is the first resolution of its kind to pass the Senate and will go a long way to raise awareness for the Americans who've struggled with the life-threatening disease sarcoma."
2021-08-10 01:40:38+00:00,Second page of letter https://t.co/zfOYw2ZViV
2021-08-09 23:53:00+00:00,"The Democrats proposed $5.5 TRILLION tax &amp; spending spree is reckless.

You tax success, you’re going to get less of it.

We can’t tax our way out of this.

When will we get serious about controlling out-of-control spending? https://t.co/NDNh4F2z4a"
2021-08-09 21:40:57+00:00,"$250 billion of deficit spending is included in the “infrastructure bill” and people just shrug. 

We were all told that this thing was completely paid for.

They’re not being honest with you. https://t.co/be9oLeQsul"
2021-08-09 14:16:02+00:00,"Unusual not to have press outside the secure Senate briefing on disaster in Afghanistan. Press has no interest in growing list of Biden failures, from Hunter corruption to the border crisis, foreign policy weakness and out-of-control deficit spending."
2021-08-08 14:58:57+00:00,Congratulations to Wisconsin’s own Molly Seidel of Hartland for winning the bronze medal in the marathon for @TeamUSA! #TokyoOlympics
2021-08-07 20:30:28+00:00,The message Biden is sending to China is weakness. You don’t make the US competitive by burdening it with trillions of dollars of debt and wasting billions on a down payment for the Green New Deal.
2021-08-07 19:43:59+00:00,"You should ask Dr. Makary:

https://t.co/QQTuNI67Bn"
2021-08-06 17:10:00+00:00,"As I said on the Senate floor this week, this administration is in a complete state of denial regarding the crisis on the border. 

President Biden is the root cause of the border crisis.
https://t.co/fDaVn4a7Av"
2021-08-06 16:15:20+00:00,"The Biden administration is lawless, just like the Obama administration:

Open borders
Ignoring the Supreme Court
Ignoring the Constitution
Not faithfully executing laws

https://t.co/fCeRixzBnP"
2021-08-05 22:02:54+00:00,"Why are @NIH, @CDCgov, @US_FDA and the Biden Administration ignoring natural immunity?
 
Why aren’t we testing for antibodies before vaccination or imposing vaccine mandates?
 
What happened to health privacy and personal freedom?
 
https://t.co/yYcLY57oC1"
2021-08-05 21:16:00+00:00,"The overpopulation of wolves in Wisconsin has harmed the livelihood of our farmers, ranchers &amp; loggers. 

The fact that the 7-day hunt was finished in less than 3 days underscores the recovery of the wolf population &amp; severity of their overpopulation.
https://t.co/c2rCzCd6bI"
2021-08-05 21:12:21+00:00,"CBO now says the bipartisan infrastructure bill will add $256 billion to our debt (I’m shocked). 

Will enough Republican senators still help Schumer, Pelosi, and Sanders further mortgage our children’s future? 

https://t.co/VHWhCHFjxs"
2021-08-05 19:31:00+00:00,"Enjoyed talking with @jimmyfailla about Wisconsin hosting @EAA for world's largest air show, the crisis at the southern border, and the Democrats’ reckless #TaxAndSpendSpree 
https://t.co/ewGTXJ1c3E"
2021-08-05 17:29:28+00:00,"Great conversation with @clayandbuck about the state of fear perpetuated by the Democrats, and the lack of transparency from the mainstream media and Big Tech.  https://t.co/zjmx8icYJz"
2021-08-05 16:41:49+00:00,"Great to have you back! Enjoy the #WIStateFair, Wisconsin!"
2021-08-05 16:10:09+00:00,"16 months and 612,386 deaths too late, Dr. Fauci is finally thinking early treatment of Covid is worth pursuing? 

I guess better late than never, but how many lives could have been saved?
https://t.co/ajdFO1zZV3"
2021-08-05 15:21:31+00:00,"Nine years ago today, Oak Creek’s Sikh temple was the site of a deadly targeted attack. 

Words can never do justice to the tragedy endured that day, but I encourage Wisconsinites to join with me in taking a moment to remember those lost and their families. #RememberOakCreek"
2021-08-05 11:57:40+00:00,"Like his Democrat predecessor, @POTUS Biden is running a lawless administration. Open borders, Big Tech collusion, flouting the Constitution and ignoring SCOTUS. This is NOT how you heal and unify America. 

https://t.co/5FYXL0HlgI"
2021-08-05 03:12:34+00:00,The American people have a right to know what Dr. Fauci might have been funding when it comes to gain-of-function. https://t.co/kUFRzjEuCV
