Datetime,Text
2021-07-09 21:26:15+00:00,"BREAKING 🚨 The Trump-era holdovers bent on destroying Social Security, Andrew Saul and David Black, are OUT.

Seniors and people with disabilities are finally safe from their path of destruction.
https://t.co/Fwocy56K3T"
2021-07-09 19:07:05+00:00,".@RonWyden and I wrote the law that @AmbassadorTai is now using to enforce workers' rights.

Together, we're finally creating better trade policy that puts workers first.
https://t.co/VAqux2rsfZ"
2021-07-09 19:07:05+00:00,"This is historic.

By raising labor standards in the countries we trade with, the Biden Administration is cracking down on the corporate business model that moves jobs overseas.
https://t.co/lVSJ1fA252"
2021-07-08 20:04:17+00:00,"Every worker should be free to join a union.
 
I stand in solidarity with the workers at Defenders of Wildlife organizing with @OPEIU, and I’m calling on their CEO to respect their right to organize. @defenders_staff @OPEIULocal2 https://t.co/sbTFEndQn3"
2021-07-08 14:54:40+00:00,"Last week, I held a roundtable in Cincinnati with Ohio moms and community leaders.

They told their stories about the difference the Child Tax Credit will make in their lives.
 
Hear what they had to say 👇 https://t.co/GrYYveKVvg"
2021-07-07 14:43:15+00:00,"This is the first time I’m sharing my photos from January 6th.

I took these exactly six months ago - the morning after the insurrection. 

This is what I saw in the Capitol. https://t.co/1atviIbBwa"
2021-07-06 20:02:20+00:00,"For the first time in decades, we are starting to see workers get some real bargaining power.
 
Employers are getting the memo: pay workers more and treat them with dignity.
https://t.co/JDeIYLdUK6"
2021-07-04 16:28:47+00:00,"Happy 4th of July, Ohio. Wishing you and yours a safe and joyous Independence Day.

Thank you to all our servicemembers, veterans, and military families who have sacrificed so much for our country's freedom. https://t.co/57YINyvhHO"
2021-07-03 21:21:54+00:00,We in Cleveland beg to differ. https://t.co/ALhR6tBajl
2021-07-02 16:11:44+00:00,"This was not a “prank,” it was an act of racism toward a Black officer. 

Racism and hate are unacceptable in Ohio law enforcement, or anywhere in our state.
https://t.co/3rY2otiQun"
2021-07-01 16:01:00+00:00,"Congratulations, @Jaden_Reports – a well-deserved honor for one of Ohio’s brightest young reporters."
2021-07-01 13:00:01+00:00,"Incredibly powerful - please watch.

Pastor Greg Hennemen of @4AllPeople4 tells me what he sees every day serving people on the South Side of Columbus:

""Everybody wants a safe place to live. Everybody wants their family to be healthy. Everybody wants dignity and respect."" https://t.co/DJRPFWMN7B"
2021-06-30 17:43:25+00:00,"The moms I spoke with in Columbus today all agree:

The monthly Child Tax Credit payments are going to help them keep up with the cost of raising children.

“It’s a lot of stress taken off our backs.” https://t.co/B3VWcX8pB2"
2021-06-30 15:02:00+00:00,"On behalf of readers in Ohio and around the country, thank you to @dansewell, who is retiring after more than four decades in journalism.
https://t.co/vsaUMU0LiG"
2021-06-30 14:17:17+00:00,Read more about her life here: https://t.co/yuaqXtpwas
2021-06-30 13:53:58+00:00,"Please join me in wishing a happy 105th birthday to Miss Elsie Steward Young, a civil rights icon who changed Ohio's history forever.

In the 1950s, Miss Elsie and a group of mothers fought to integrate Hillsboro schools so their children could have equal access to education. https://t.co/Feq6KD7uJZ"
2021-06-29 23:07:40+00:00,"Great to visit Dayton's @wbiinnovates, which has some of the country's most innovative technology and manufacturing talent.

I'm proud that Congress passed bipartisan legislation this month to help the Miami Valley and Ohio compete around the world."
2021-06-24 23:17:11+00:00,"I introduced legislation that would curb stock buybacks and create a worker dividend - 

so if giant corporations want to transfer wealth to Wall Street, workers would get a share of the pie.
https://t.co/YVBaYCiGhS"
2021-06-24 23:17:11+00:00,"More stock buybacks from Wall Street.
 
Imagine if megabanks invested this money in workers and small businesses instead of enriching themselves.
https://t.co/Clys80mx2Y"
2021-06-24 02:47:20+00:00,"Natoma Canfield and I met when President Obama came to Ohio during the push to pass the ACA.

We wouldn't have expanded health coverage for millions without Ohioans like Ms. Canfield sharing their stories.

My thoughts are with Ms. Canfield's family.
https://t.co/glhjNqXW37"
2021-06-23 22:24:10+00:00,Workers everywhere deserve a voice at the table. I stand in solidarity with the Worthington Library workers organizing with @OFTadvocate @AFTunion.
2021-06-22 19:13:32+00:00,"Every American should have equal freedom to vote.
 
Today, I’m voting to advance the #ForThePeople Act."
2021-06-22 18:00:51+00:00,"You can watch my full interview with @chrislhayes here:
https://t.co/yJE5MX8CWZ"
2021-06-22 17:59:15+00:00,"We are finally recognizing that raising a child IS real work that deserves to be rewarded. With the monthly Child Tax Credit payments beginning July 15, 92% of Ohio families are eligible to receive up to $300/month per child.

My interview with @chrislhayes on @allinwithchris: https://t.co/vl7O3zbmQG"
2021-06-21 19:29:21+00:00,"SPREAD THE WORD 📣 Starting July 15, most families will start getting automatic monthly #ChildTaxCredit payments of up to $300/month per child.

To learn more, just head to https://t.co/N51oldwz0D. https://t.co/bRX5RSkTYS"
2021-06-21 16:42:57+00:00,"Worker power isn’t a problem - it’s the point.
https://t.co/b0Nh5lD7oz"
2021-06-21 13:22:14+00:00,Going live with @SenatorBennet for Child Tax Credit Awareness Day in ten minutes. Tune in!
2021-06-19 16:55:25+00:00,"As we celebrate #Juneteenth, I’m reminded of my favorite quote from Dr. Martin Luther King:

“Progress never rolls in on the wheels of inevitability.”

It rolls in because we continue the fight to dismantle the evil legacy of slavery and systemic racism. https://t.co/PsRYQR0K8S"
2021-06-18 16:38:16+00:00,"Looking forward to joining @SecFudge in our home state to honor Juneteenth and talk about how we can help more Black families buy homes.

Starting soon ➡ https://t.co/ytRv5P0PKd"
2021-06-17 22:39:01+00:00,"I stand in solidarity with the MSNBC workers forming a union with @WGAEast, and I'm glad to see journalists like @JoyAnnReid and @chrislhayes showing their support.

MSNBC should move quickly to recognize this union.
https://t.co/Es3LnP9j80"
2021-06-17 21:24:11+00:00,"Thank you President Biden, and thank you to everyone who worked for years to make this happen.

As @POTUS said: “This day doesn't just celebrate the past. It calls for action today."""
2021-06-17 14:46:52+00:00,"Millions of Americans – everyone with a preexisting condition – can finally breathe a sigh of relief:

the ACA is here to stay.
https://t.co/byDYHwbIdZ"
2021-06-16 23:18:10+00:00,Read this thread - it’s proof that the American Rescue Plan is rebuilding our economy.
2021-06-16 18:05:02+00:00,"Read more about the SSI Restoration Act here:
https://t.co/6cIDHW18WF"
2021-06-16 17:49:09+00:00,"SSI is critical social insurance that should be there for all of us if we need it. Yet the eight million seniors and people with disabilities who rely on it often live in poverty.

Today, I'm reintroducing legislation to ensure they can live with dignity. #DemolishDisabledPoverty https://t.co/HcYOPYgp96"
2021-06-15 20:15:01+00:00,"You know I wouldn’t miss it. @SenBooker, are you on board for Child Tax Credit Awareness Day?"
2021-06-14 19:36:40+00:00,"NEW: Thanks to the #AmericanRescuePlan, families can receive up to $300/month per child, starting July 15.

If your family didn’t file in 2019 or 2020, sign up with the new #ChildTaxCredit portal below:
https://t.co/Q0YmySMi9r"
2021-06-14 16:01:28+00:00,Excited to join my friends @staceyabrams and @RepPressley tonight - let's pass the #ForThePeopleAct.
2021-06-11 20:05:04+00:00,"Corporate landlords backed by private equity firm Pretium Partners have sought to evict over a thousand people during the pandemic – and disturbing reports indicate higher eviction rates in majority-Black counties.

I’m demanding answers.
https://t.co/hw2V9LOKYV"
2021-06-09 22:58:30+00:00,"Glad @SenWarren convened today's subcommittee hearing on a central bank digital currency.
 
Every American should have control over their money. A digital dollar can work with my plan for No-Fee Accounts so our banking system works as well for workers as it does for Wall Street. https://t.co/COq7T6n4qC"
2021-06-09 18:36:15+00:00,Incredibly proud of the work we do on the @SenateBanking and Housing Committee - take a look.
2021-06-09 15:22:50+00:00,"Great news - @FirstSolar will build its newest manufacturing plant in Wood County, adding 500 solar jobs in Ohio and DOUBLING the number of panels made in America. ☀️
 
Northwest Ohio will continue to lead the next generation of manufacturing.
https://t.co/XSkUUoAfOz"
2021-06-08 23:23:55+00:00,"This is huge. The Senate just passed a once-in-a-generation investment to help the U.S. better compete with China, and it includes a few of my bipartisan provisions to bolster our workers and manufacturing. 

Read more 👇"
2021-06-08 19:46:46+00:00,"Roe v. Wade is the law of the land, but that hasn't stopped politicians in statehouses across the country from restricting women’s freedom to make their own health care decisions.

We need to pass the Women's Health Protection Act and protect reproductive rights nationwide. #WHPA"
2021-06-08 17:06:56+00:00,"More evidence to support what we already knew - too many workers pay more in taxes than our country's wealthiest billionaires.
 
Billionaires need to start paying their fair share for the infrastructure they’ve relied on to be successful.
https://t.co/GQlYYw8vVZ"
2021-06-04 21:17:02+00:00,"This reprehensible display of antisemitism has no place in Ohio. I am heartened to see the University of Toledo community standing in solidarity with Jewish students, and I encourage all Ohioans to continue fighting against hate and injustice. https://t.co/imAAB7doo0"
2021-06-04 16:39:08+00:00,"Today, @AmbassadorTai &amp; I heard directly from Ohioans about what a worker-centered trade policy looks like to them. To stop the business model of moving production overseas from Ohio, we must raise labor standards in every country we trade with – and ensure they're enforced. https://t.co/Hj48sYrxy0"
2021-06-04 14:04:49+00:00,"On National Gun Violence Awareness Day, we #WearOrange in solidarity with the victims, survivors, loved ones, and communities hurt by gun violence. It’s long past time for Congress to stand up to the gun lobby and pass commonsense gun safety laws. https://t.co/7UVU5VMLJp"
2021-06-03 14:58:49+00:00,"This is what's possible when people have a government on their side: real results.
https://t.co/CbyAT31bxI"
2021-06-03 13:03:49+00:00,"When a child dies in foster care, the system has failed.

It failed Ma’Khia Bryant.
 
On behalf of Ma'Khia's parents, @RepBeatty and I are calling for a federal investigation into the events leading up to their daughter’s death. https://t.co/FUHhKP20jK"
2021-06-02 16:55:53+00:00,"This morning, saw the cooperation between volunteers, staff, and @OHNationalGuard at @CleFoodBank - all working together to serve over 2,000 Ohio families at their weekly food distribution drives.

Food assistance is crucial to Ohioans in this time of need. https://t.co/wlNZwm297h"
2021-06-01 20:13:50+00:00,"Today's actions are a step toward investing in the Black and brown communities that have been exploited and discriminated against for too long. On the 100th anniversary of the #TulsaMassacre, we know we can’t change our past – but we can build a better future."
2021-06-01 17:01:04+00:00,"Joined community members in Toledo today to talk infrastructure - and how without the #AmericanJobsPlan, it’ll take thirty years to replace the city’s 3,000 lead pipe lines that provide families’ water.

The children of Toledo can’t wait thirty years. https://t.co/CpilEmLRyV"
2021-06-01 15:25:08+00:00,"June is #PrideMonth – a time to celebrate the LGBTQ+ community and commit to continuing the year-round fight for equality for all. I hope all Americans will join me in recognizing the bravery and diversity of our LGBTQ+ family, friends, neighbors, and colleagues. https://t.co/vB56Te4zsq"
2021-05-31 16:40:17+00:00,"On #MemorialDay, we remember all the Ohioans who fought under our flag in far-off lands, who left families and missed birthdays, who sacrificed their health, and even their lives – all in service to the country they loved.

Today, we honor their memory."
2021-05-28 14:27:43+00:00,"Read more about my bill with @SenAlexPadilla here:
https://t.co/KUmXs0n1Vo"
2021-05-28 13:39:57+00:00,"As global temperatures rise, workers from Ohio to California are increasingly exposed to dangerous heat.

On #NationalHeatAwarenessDay, I'm proud to sponsor legislation with @SenAlexPadilla to protect workers from heat stress on the job.

Every worker deserves a safe workplace."
2021-05-27 19:30:56+00:00,"Watch my highlights from the #WallStreetOversight hearing on my YouTube channel:
https://t.co/uxyzQ1txFE"
2021-05-26 20:50:19+00:00,"Just awful. Transit workers have had to endure so much this past year - and now, this mass shooting.

Please keep the @VTA transit workers and victims in your thoughts, and keep demanding better gun safety laws.
https://t.co/hn6dWBzsc6"
2021-05-26 14:45:21+00:00,"A few decades ago, a majority of Wall Street capital funded the REAL economy – wages, machinery, research.
 
Not anymore.

Instead of investing in businesses that create real jobs all over the country, companies spend billions buying back stocks and handing out CEO bonuses. https://t.co/87ZKnCceuM"
2021-05-26 14:02:13+00:00,"For the first time ever, @SenateBanking will hear from the CEOs of the nation's six biggest banks - 

and I'm going to hold them accountable for perpetuating a Wall Street System built on profits at everyone else's expense. Tune in. #WallStreetOversight
https://t.co/ECezkTlkEN"
2021-05-26 13:21:19+00:00,"Starting at 10AM 🕚 Watch the #WallStreetOversight hearing live at @SenateBanking. 
https://t.co/HtJ2nRMDAa"
2021-05-25 19:41:18+00:00,"A year ago today, the world learned George Floyd's name.

We must honor his memory by passing meaningful reforms - reforms that protect Black and brown communities and hold law enforcement accountable for misconduct.

That starts with the George Floyd Justice in Policing Act."
2021-05-25 14:55:44+00:00,"Fed Vice Chair Quarles' job is to check Wall Street's power and hold the biggest banks accountable. But as far as I can tell, he doesn't view standing up to Wall Street as part of his job.

If we want an economy that reflects our values, we can’t let Wall Street write the rules. https://t.co/4p7mbvoTmY"
2021-05-24 19:49:40+00:00,"On Wednesday, the CEOs of the six biggest banks are testifying at @SenateBanking's #WallStreetOversight hearing.
 
It's our job to hold Wall Street accountable for putting profits over people - as Chairman, I'm going to make sure they know we’re watching. https://t.co/Oa7RIeiHAN"
2021-05-24 16:09:29+00:00,"GREAT NEWS: Peloton to build its first U.S. factory in Ohio and create over 2,000 skilled manufacturing jobs in Wood County.

I'm thrilled to see this investment in American manufacturing come to Ohio - we have the most productive workers in the world."
2021-05-21 14:00:01+00:00,https://t.co/DM5gfY8d1q
2021-05-21 00:05:16+00:00,Read more here 👇
2021-05-21 00:01:53+00:00,"Bitcoin’s value fluctuates at the drop of a tweet. Yesterday, it plummeted 30%.
 
This kind of market volatility is not what our economy needs. If risky crypto companies want to become banks, they shouldn’t get to play by a different set of rules.
https://t.co/qRptyQYiBn"
2021-05-20 14:29:55+00:00,"President Biden called the American Jobs Plan ""a blueprint to rebuild blue-collar America"".
 
He's right.
 
We need bold action to rebuild our infrastructure, protect our communities from climate disasters, and put Americans to work in good-paying jobs. https://t.co/OJlOfMb5LJ"
2021-05-19 16:40:14+00:00,"Want to learn more about the Child Tax Credit's NEW monthly direct payments? 

Tune in to my weekly Facebook Live at 12:45PM. 

STARTING SOON 🕐
https://t.co/BIa90b6qqQ"
2021-05-17 18:33:42+00:00,"Glad to see U.S. Trade Rep @AmbassadorTai standing up for ALL workers with the Brown-@RonWyden USMCA labor enforcement tool.
 
This is how we curb the global race-to-the-bottom on workers’ rights that moves our jobs overseas.
https://t.co/VAqux2rsfZ"
2021-05-17 14:40:20+00:00,"Find out how much money you could get from the #ChildTaxCredit here:
https://t.co/UVWx1ZjVb2"
2021-05-17 14:40:20+00:00,"#TaxDay News - NEW #ChildTaxCredit monthly payments will begin July 15.

Your family could receive up to $300/month per child.

Today's the deadline to file your taxes and secure these benefits for your family. 👇
https://t.co/JTHPqRpgpl
https://t.co/qynUmIwrGh"
2021-05-14 17:52:44+00:00,"My heart goes out to you and your family, @RepBeatty. Sending my condolences, and remembering a devoted Ohio leader today."
2021-05-14 00:01:17+00:00,"Stripping Ohioans of this $300/week they earned is an insult.
 
People want to go to work at good jobs where they have dignity, are paid a living wage, and can take care of their families.
 
Instead of taking away this lifeline, create good jobs.
https://t.co/e1wmxUUMGd"
2021-05-13 18:45:06+00:00,"Great news from @CDCgov: If you're fully vaccinated, you no longer need to wear a mask (in most cases).
 
Get vaccinated and get life back to normal."
2021-05-13 16:33:59+00:00,"Claiming the Child Tax Credit is as simple as filing your taxes, but many families don't know about this benefit.

Share this video and help spread the word:
https://t.co/n0zMXug9QT"
2021-05-13 16:33:58+00:00,"#ChildTaxCredit Alert 📣 File your taxes before May 17 to receive your monthly payments from the American Rescue Plan.

Many Ohio families could receive up to $300/month per child.

File your taxes for free 👇
https://t.co/uFUueUAlhm https://t.co/ERHuShp41B"
2021-05-12 23:47:03+00:00,"Israeli violence against Palestinians protesting the #SheikhJarrah evictions, the assault on Al-Aqsa worshipers during Ramadan, and Hamas’s indiscriminate rocket attacks are ALL unacceptable.
 
Escalatory violence is not the answer and will not end in peace - just dead civilians."
2021-05-12 23:47:02+00:00,"The horrific events unfolding in Israel, Gaza and the West Bank are heartbreaking.
 
The Administration and regional partners need to make de-escalation a priority before more lives are lost."
2021-05-12 19:16:15+00:00,"Great news. 40 good union jobs are coming to Bryan, Ohio thanks to the #AmericanRescuePlan's pensions solution:

""The multi-employer pension crisis has been a roadblock to any expansion at Spangler for several years,"" said Bill Martin, Spangler president.
https://t.co/FtJeyewGFP"
2021-05-12 14:56:55+00:00,"Nurses are our frontline healthcare heroes, and they need more support than just our gratitude.

Today on #InternationalNursesDay, I'm reintroducing my #SafeStaffing bill to keep nurses adequately staffed and patients safe. https://t.co/k5LPA8l053"
2021-05-11 20:20:33+00:00,"Don’t forget - the Restaurant Revitalization Fund is open NOW.

Restaurant owners, apply today:
https://t.co/eXD9EE7b66"
2021-05-11 20:20:00+00:00,"I sat down last week with Frankie DiCarlantonio, owner of Scaffidi's Restaurant in Steubenville.

He told me how much federal dollars from PPP and the #AmericanRescuePlan have helped restaurants like his stay afloat.

I'm proud to have fought for and secured this funding. https://t.co/VjRgWk0jS1"
2021-05-10 19:41:04+00:00,"I stand in solidarity with these workers in their fight for the Dignity of Work.

Read more about my labor enforcement provision with @RonWyden here:
https://t.co/agL6KL5C9S"
2021-05-10 19:41:04+00:00,"The Brown-@RonWyden mechanism was designed for cases just like this – to remedy violations of workers’ rights.

When corporations are forced to pay workers a living wage and treat them with dignity, we take away the incentive for them to move jobs abroad.
https://t.co/sZwtU2rizu"
2021-05-10 16:26:46+00:00,"Last week, I talked to Ohioans from Cincinnati to Youngstown about why they’re choosing to get vaccinated. 

Their answers were clear: 

To protect themselves, to protect their loved ones, and to show their friends it’s safe.

Get the shot:
https://t.co/m8Od2PsDqJ https://t.co/M3prHdgjOv"
2021-05-09 14:22:18+00:00,"To every mother who’s become a full-time caregiver and teacher due to COVID-19,

Thank you, and Happy #MothersDay.

Let’s honor these women by recognizing that caregiving IS work. https://t.co/qN8YRGE4c9"
2021-05-07 22:56:05+00:00,"Thanks, @howardwilkinson. In honor of this weekend’s Ohio Cup, here’s a trivia question for fellow baseball fans:

Who was the first Ohio-born player to have a hit in the inaugural interleague series between the two teams?
https://t.co/ERpKJJDFPJ"
2021-05-07 14:16:39+00:00,"When Congress passed the American Rescue Plan, we gave families the resources they need to put food on the table.

Now let's do the same with the American Families Plan – and permanently expand the earned income and child tax credits.
https://t.co/JZH9wdXvBh"
2021-05-06 16:54:51+00:00,"The faster we get shots in arms all over the world, the faster we are ALL protected.

I'm glad the President is taking this step that many of us have been calling for.
https://t.co/sRkmKR2eYk"
2021-05-05 23:41:29+00:00,"A pleasure to stop by @mrsmithscoffee in Sandusky, which just celebrated its 13th anniversary and weathered the pandemic with the help of PPP funding.

And more help is here – the Restaurant Revitalization Fund is open NOW. Restaurant owners, apply today: https://t.co/UWRAQFTF0l https://t.co/lO4IhxVp5S"
2021-05-05 20:07:00+00:00,"Yesterday, I met with GE-Savant workers in Bucyrus whose jobs are being shipped overseas.
 
They all told me the same thing:
 
""We just want to work.""
 
I will fight like hell to keep jobs in Ohio. https://t.co/yj56VBzdoC"
2021-05-05 13:47:58+00:00,"Got to see the impressive work our healthcare workers are doing at the Celeste Center's drive-thru vaccination site.
 
Dr. Roberts, Columbus Health Commissioner, said it best:
 
30% vaccination across Ohio just isn't going to cut it. Roll up your sleeves, and get your vaccine. https://t.co/eOE0dXM0ud"
2021-05-04 19:36:21+00:00,"Yesterday my office heard from Ohio workers at @CWALocal4340 about how the #PROAct would help empower them on the job. 

It's time to invest in our country’s greatest asset - American workers. https://t.co/FvK8mWtKId"
2021-05-04 14:00:52+00:00,"Listen to these workers. They know the costs of letting Wall Street run our economy.

And they know we owe it to the people of this country to create a system where hard work pays off – one that centers the #DignityOfWork."
2021-05-03 18:54:51+00:00,"Visited the mass vaccination clinic at @CLE_State’s Wolstein Center today to see the great teamwork between our local, state, and federal partners.
 
Thanks to @OHNationalGuard, @fema, OEMA, CSU, and the American Rescue Plan for getting shots in the arms of over 230,000 Ohioans. https://t.co/JKyenmAiFP"
2021-04-30 18:17:43+00:00,"An honor to sit down with @VP Harris and Cincinnati leaders today to talk about what investing in transit means for Ohio:

Good jobs, young talent, and thriving cities. https://t.co/b1xSddnBgH"
2021-04-30 16:33:59+00:00,"LIVE NOW: I'm joining @VP Harris in Cincinnati to talk about why we need to invest in Ohio's infrastructure and public transit.

Tune in.
https://t.co/cT8jbAaam9"
2021-04-29 15:32:54+00:00,"Powerful special interests - CEOs and corporate elites and their allies - have set up a system where they get paid at everyone else’s expense.

Of course they want to hang onto that power - it’s time for us to stop letting them. https://t.co/MkQxjMfrLU"
2021-04-29 03:02:59+00:00,"Tonight we heard President Biden deliver a message of hope to the American people.

In the first 100 days, we took bold action to help Ohioans recover.

Now we work to build on that success, with historic investments in the people who make this country work."
2021-04-29 01:14:16+00:00,"President Biden's #AmericanFamilyPlan recognizes that caregiving IS work.
 
That's a huge step towards rebuilding an economy that makes hard work pay off for everyone."
2021-04-28 22:26:50+00:00,"Watch my full floor speech on my YouTube channel:
https://t.co/vuzQQvjNsI"
2021-04-28 22:26:14+00:00,"Today, we mark #WorkersMemorialDay and honor all the workers - far too many - who have laid down their lives on the job during the pandemic.

Corporate America keeps treating its workers as expendable. We have to create a better system - one centered on the Dignity of Work. https://t.co/zXDWxWiNgD"
2021-04-28 21:00:01+00:00,"This is what paying workers a living wage looks like.
 
Time for Congress to pass this for ALL workers. #FightFor15
https://t.co/RGrpO1c634"
2021-04-28 19:00:01+00:00,"In January, I urged President Biden to appoint someone to oversee the government’s Buy American efforts.

I'm glad the President is keeping his promise to put  American jobs first by appointing Celeste Drake as the first Made in America Director.
https://t.co/aWA2AgXnX4"
