Datetime,Text
2022-01-12 20:16:36+00:00,"An important distinction––this is NOT the same as reducing/eliminating overdraft fees, which Capital One and BOA have done––and @WellsFargo knows it. This doesn't go far enough."
2022-01-12 15:52:09+00:00,"When the Senate passed USICA in June, we committed to investing in American manufacturing and addressing the semiconductor shortage.

That was 217 days ago.

@senrobportman and I agree––it's time to get this bill across the finish line. https://t.co/nxLuAFaZbx"
2022-01-11 18:02:18+00:00,"Let's cut through the economists' lingo––when people talk about “cooling off” the economy, what they really mean is making it harder for people to find jobs and stopping paychecks from growing.

Somehow, this “cooling off” never extends to corporate profits or executives’ pay. https://t.co/KCoHQ3NnvS"
2022-01-10 21:15:00+00:00,"Wonderful news – Ramy Shaath is free. My office met several times with his family based near Cincinnati, and I worked with @RepRoKhanna to lead 50+ Congressional colleagues in a letter to President Al-Sisi urging Ramy's release.

Wishing Ramy and his family a happy reunion."
2022-01-10 20:14:26+00:00,"I like my coffee union strong. ✊ I stand with these workers in Cleveland organizing with @CMRJB, and I urge @Starbucks to voluntarily recognize the union."
2022-01-07 20:28:56+00:00,"Parents–children ages 12-15 are now approved for boosters.

The best way to protect our kids as they head back to school is to get them boosted."
2022-01-07 14:44:50+00:00,"When we passed the American Rescue Plan, we promised the Child Tax Credit would put money in people's pockets and lift children out of poverty.
 
Promise kept.
https://t.co/rggL3uo1pd"
2022-01-06 18:44:10+00:00,https://t.co/lJfVk2Satt
2022-01-06 17:17:59+00:00,"You can watch my full floor speech on my YouTube channel:

https://t.co/7RjBkrE2GS"
2022-01-06 17:10:43+00:00,"One year ago, domestic terrorists destroyed.

Black and brown custodians cleaned up.
 
Union workers rebuilt.

Today, I'm introducing a resolution honoring the Capitol janitorial and maintenance staff for their bravery and service on January 6th. https://t.co/fWVNsO2fJT"
2022-01-05 17:38:25+00:00,"Great news - the economy added 807,000 jobs in December, more than doubling expectations.
 
Our economy is roaring back.
https://t.co/ldXkGPLSZ2"
2022-01-04 17:55:46+00:00,"We must extend the Child Tax Credit.
https://t.co/KJXb4dGZpZ"
2022-01-03 21:27:17+00:00,"As we approach January 6, nothing is more urgent than protecting our elections from partisan interference.
 
I will fight to pass legislation that protects the integrity of every American's vote."
2021-12-31 20:31:40+00:00,"As we look back on 2021, I'm thankful for all the healthcare workers saving lives in Ohio and across the nation.

To all our nurses, doctors, and public health officials – thank you. https://t.co/a4oLMjHNgN"
2021-12-29 03:33:03+00:00,"Harry Reid was one of the most effective leaders for working people in our country’s history.

He was a legend and a dear friend, and he understood the dignity of work in his bones.

Connie and I send our sympathy to Landra, the Reid family, and the people of Nevada."
2021-12-26 23:43:52+00:00,"While you’re here, take a peek at what we accomplished in 2021."
2021-12-26 17:07:46+00:00,What should Congress pass in 2022?
2021-12-25 18:10:13+00:00,"From my family to yours, Merry Christmas to all who celebrate.

Wishing everybody a safe, blessed holiday.🎅 https://t.co/BgGsDxqoci"
2021-12-23 15:02:36+00:00,"There’s no way we could recap the whole year in two minutes. 

To get a full picture of what we’ve accomplished this year for Ohioans, read this👇
https://t.co/CCHQLhymSw"
2021-12-23 15:00:00+00:00,"After another year of fighting for the Dignity of Work, here's my 2021 in review.

How'd I do? https://t.co/4BpYuyjYW3"
2021-12-22 18:44:37+00:00,"Good News: the Biden Administration is extending the student loan payment pause until May 1.

I stand with my colleagues calling on President Biden to take the next step and #CancelStudentDebt.
https://t.co/3iH3ew5Dlx"
2021-12-21 18:03:13+00:00,Solidarity with our @BCTGM brothers and sisters––this is a contract that honors the Dignity of Work. ✊
2021-12-17 15:05:55+00:00,"It’s not too late to protect older and vulnerable loved ones this Christmas.

Get boosted TODAY."
2021-12-16 20:57:44+00:00,"Wonderful news – I'm grateful that all of these Ohioans will be home just in time for the holidays.
 
Wishing them a safe and speedy return.
https://t.co/7I0vFoYq23"
2021-12-16 16:00:04+00:00,"Today, my colleagues and I stand in solidarity with workers at The Public Interest Network organizing with @OPEIU. ✊

An organization dedicated to progress for working people must respect its own workers’ right to organize.

We urge TPIN’s CEO to quickly recognize the union. https://t.co/8IInDbcHaG"
2021-12-15 18:38:03+00:00,"This is the right move by SEC Chair Gensler.
 
The first step to workers getting their fair share is learning how much corporate executives are spending on themselves and large shareholders––
 
instead of investing in wages.
https://t.co/XQithb1Ma3"
2021-12-15 16:43:01+00:00,"PARENTS - Check your bank accounts today.
 
Thanks to Democrats passing the American Rescue Plan, millions of families will get Child Tax Credit tax cuts just in time for the holidays."
2021-12-14 21:09:31+00:00,".@jbouie gets it right here––for work to have dignity, we need to empower workers. That starts with having strong unions."
2021-12-14 16:30:21+00:00,"Stablecoins and crypto markets aren’t actually an alternative to our banking system.

They’re a mirror of the same broken system––with even less accountability, and no rules at all. https://t.co/EvWwuFh886"
2021-12-14 00:49:53+00:00,"Absolutely horrific. Workers may have lost their lives in Kentucky because the company refused to let them take shelter.
 
Corporations putting profit over people's lives should not be happening in America in 2021.
https://t.co/HbsDoGCVii"
2021-12-13 23:38:04+00:00,"@RepRoKhanna @RepRaulGrijalva Glad to have your support, @RepRoKhanna. 🙌"
2021-12-13 22:36:11+00:00,"My #StockBuybackAccountabilityAct is simple:
 
A 2% tax on ALL stock buybacks, to make corporations think harder about whether lining their executives’ pockets is really the best use of their record profits.
https://t.co/cJIn71AeGv"
2021-12-13 19:26:27+00:00,"Instead of worshipping executives who routinely line their own pockets at everyone else's expense, let's honor the workers who create wealth for their companies.

Workers like Gracie Heldman.
https://t.co/Hi4PHRYe4l"
2021-12-13 19:26:26+00:00,"Here's how workers described working conditions at Tesla's Fremont factory:
 
“I’ve seen people pass out, hit the floor like a pancake and smash their face open. They just send us to work around him while he’s still lying on the floor.”
https://t.co/TC4sRcOZb7"
2021-12-13 19:26:25+00:00,A billionaire who has been found guilty of illegal union-busting by @NLRB should probably not be @TIME's Person of the Year.
2021-12-10 21:03:21+00:00,"Everyone deserves the right to live with dignity.

On #HumanRightsDay, we recommit   to fight for justice and equality for all – from our own backyards to every corner of the globe."
2021-12-09 20:12:05+00:00,"For years, I fought with @SenatorBennet and @SenBooker to expand the Child Tax Credit.
 
Under the Biden Administration, we made it happen.
 
The next step: passing #BuildBackBetter to keep the monthly tax cuts going."
2021-12-09 19:21:02+00:00,"When workers have a voice in their workplace, businesses do better. @starbucks should see this as a victory for the whole company."
2021-12-09 19:21:02+00:00,"This is what we can achieve when we empower workers in the economy. Congratulations, @SBWorkersUnited ✊
https://t.co/Qo4HJHhrMw"
2021-12-07 23:35:36+00:00,"Dr. Omarova was one of the most qualified nominees ever for this job.
 
But because she wasn't in Wall Street's pocket, corporate interests and their allies in Congress waged a relentless smear campaign reminiscent of red scare McCarthyism.
https://t.co/Eje5pdUzex"
2021-12-07 20:40:31+00:00,"This is the American Rescue Plan in action, supporting Ohio's first responders.

Democrats passed it without a single vote from Republicans."
2021-12-07 16:59:34+00:00,"A stop in Youngstown wouldn’t be complete without seeing my friend Mayor Tito Brown.

We discussed how the American Rescue Plan and the bipartisan infrastructure package will improve the lives of Youngstown residents. https://t.co/XpaDrw6Jtg"
2021-12-06 20:33:52+00:00,"Thanks to #SaveOurStages and the American Rescue Plan, nearly 400 venues in every corner of our state received funding to get through the pandemic. 

Now, many are opening their doors again."
2021-12-06 20:32:24+00:00,"Ohioans – what are your favorite arts and music venues in Ohio, and why?"
2021-12-04 00:18:47+00:00,"The scourge of human trafficking touches every corner of Ohio and our nation.
 
The Biden Administration is taking decisive action.
https://t.co/lymBVfsFWy"
2021-12-03 21:20:57+00:00,"Here’s something that should have gotten way more attention last week:

Thanks to President Biden, over 300,000 workers are getting a raise starting January 30.
https://t.co/fEx7MoaXJq"
2021-12-01 19:38:30+00:00,"The FDA has authorized booster shots for everyone 18+.

Ohioans, book your appointment here:
https://t.co/dSwNi6Try9"
2021-12-01 19:36:52+00:00,"Don't wait. If you're concerned about Omicron, get vaccinated.

If you're already vaccinated, get boosted."
2021-12-01 18:00:01+00:00,"For decades, the U.S. has led the global fight against HIV/AIDS.
 
Programs like @PEPFAR &amp; @GlobalFund have literally saved millions of lives around the world.
 
While COVID-19 has made this work harder, today we recommit ourselves to ending AIDS for good. #WorldAidsDay2021"
2021-11-30 21:47:31+00:00,"This is devastating. It’s shameful that we have done nothing to even try to prevent this deadly gun violence in our country.
 
My heart goes out to the victims, their families, and the entire Oxford community.
https://t.co/tHaL6QmHKE"
2021-11-30 18:25:57+00:00,"Let’s be clear:

Prices are high because corporations are raising them – so they can keep paying themselves with ever-larger executive bonuses and stock buybacks. https://t.co/cJIn71AeGv"
2021-11-30 15:53:20+00:00,"Corporations and their allies in Congress want you to believe that we have to choose between high wages and low prices.

That’s a false choice.
 
We can have an economy where you earn a living wage AND you can afford childcare, healthcare, education, housing, groceries."
2021-11-30 02:18:27+00:00,"Last week, I asked Ohioans on social media to share their favorite local businesses to support for #SmallBusinessSaturday – the response was overwhelming.

Today, I shared some of those stories on the Senate floor. https://t.co/GtszQg4DbT"
2021-11-29 00:23:54+00:00,"Wishing a happy start to Hanukkah to everyone celebrating in Ohio and across the country tonight.

Chag Sameach."
2021-11-25 17:03:04+00:00,"Let’s all show our gratitude for the workers making sacrifices today so that others can enjoy their Thanksgiving meals.

Have a blessed Thanksgiving, Ohio."
2021-11-24 21:31:47+00:00,"The guilty verdicts for Ahmaud Arbery’s killers will not heal his family’s or his community’s pain, but it does bring justice.

We must continue to fight for justice system reform and gun safety reform."
2021-11-23 18:49:16+00:00,"I worked to make sure the infrastructure bill will help Ohio communities upgrade their transit systems.
 
That’s going to help regional transit authorities like @TARTA_Toledo invest in expanding service, and it’s going to get them funding to buy new pollution-free buses. https://t.co/JoKskDXNtx"
2021-11-23 15:56:56+00:00,Well done. @POTUS is taking action to lower gas prices for American families.
2021-11-22 17:00:00+00:00,"“This increase in infrastructure investment has been drastically needed for a long time.

It will enable Montgomery County to continue improvements to local bridges and roads,” Montgomery County Engineer Paul Gruner said.
https://t.co/K9MkFEnf7R"
2021-11-22 14:42:24+00:00,"Dr. Lael Brainard has spent her life fighting for an economy where workers share in the prosperity they create.

As Vice Chair of the Fed, she'll stand up to Wall Street and empower workers, small businesses, and communities."
2021-11-22 14:38:15+00:00,"Fed Chair Powell has led our economy through a historic pandemic. Under his &amp; @POTUS's leadership, unemployment has fallen and workers are gaining power.

They’ll continue to steer our recovery in the right direction – toward an economy that empowers workers and their families."
2021-11-19 20:10:52+00:00,This is not justice. It’s long past time for justice system reform and gun safety reform.
2021-11-19 15:56:17+00:00,"BREAKING🚨 The House just passed #BuildBackBetter – a big step towards bringing down the costs of housing, child care, and health care. 

Now it’s the Senate’s turn. Let’s get this done."
2021-11-18 21:34:47+00:00,"The John Deere Strike is over, and @UAW workers have won a contract that honors the Dignity Work. This is exactly why we need strong unions. #PassThePROAct"
2021-11-18 19:02:45+00:00,"Professor Omarova escaped brutal communist oppression, became an American citizen, and spent her career fighting to give more Americans the opportunities she was denied behind the Iron Curtain.

This is absolutely disgraceful."
2021-11-18 17:56:55+00:00,@petersagal https://t.co/kuAayjmcWn
2021-11-18 15:19:24+00:00,"Professor Saule Omarova is one of the most qualified nominees we've EVER had to be Comptroller of the Currency.

Yet Senate Republicans have turned an accomplished woman into a Marxist boogeyman.

This is what happens when Trumpism meets McCarthyism. https://t.co/kuAayjDNNV"
2021-11-17 22:08:24+00:00,"The fix here is simple:

Ban Members of Congress from trading stocks. Pass my Ban Conflicted Trading Act. 
https://t.co/sGuwtypyrC"
2021-11-17 20:52:28+00:00,"Just got out of a briefing with @SecYellen–

We are one step closer to cracking down on overseas tax havens.

This is huge for keeping jobs in the U.S. and putting American workers first."
2021-11-17 18:24:23+00:00,"November's Child Tax Credit tax cut arrived on Monday.

How is it helping your family?"
2021-11-17 14:38:56+00:00,"Jobs. Infrastructure. Safer drinking water.

A big win for Ohio. https://t.co/ewAtGdBfyj"
2021-11-16 18:34:18+00:00,".@iamjohnoliver hits the nail on the head on why we need to pass the #PROAct–

It will give workers a fighting chance by going after the bad corporate actors that bust unions.
https://t.co/vkY4IlM9hI"
2021-11-16 15:35:40+00:00,"Presidents of both parties have promised infrastructure. 

President Biden got it done."
2021-11-15 15:28:46+00:00,"I fought to make sure the Bipartisan Infrastructure bill has the strongest Buy America rules ever passed.

That’s going to mean more work for steel made in America, like here at McDonald Steel in the Mahoning Valley. https://t.co/uDoBONBkVy"
2021-11-11 16:05:43+00:00,"Today is a day to come together as Americans and celebrate the deep respect we hold for our veterans.

To all who have worn the uniform and served our country, thank you. #VeteransDay https://t.co/BMy11XvlJn"
2021-11-11 00:56:36+00:00,"This morning, I toured the Port of Ashtabula, which handles key commodities like iron ore.

Ports like this will receive much-needed investments once President Biden signs the Bipartisan Infrastructure Plan, creating Ohio jobs and speeding up our supply chain. https://t.co/IqaS83LSOo"
2021-11-10 21:57:02+00:00,"There’s a simple way to help bring down many costs for families:

corporations and CEOs could stop hoarding profits for themselves.
https://t.co/JBfm8DgBrd"
2021-11-09 23:58:58+00:00,"@SenatorBennet Thank you, @SenatorBennet. I’m proud of all the work we’ve done together, especially on these tax credits for working families. 🙌"
2021-11-08 22:54:39+00:00,"Everything we're doing with #BuildBackBetter is about bringing costs down.

Housing, child care, health care – those are three of the biggest items in any family’s budget.

Build Back Better tackles all of them. https://t.co/gtVx5M6zU3"
2021-11-08 18:42:37+00:00,"This morning, I joined @steelworkers Local 3057 on the picket line in Shelby as they fight for a fair contract with ArcelorMittal.
 
ALL workers have the right to stand up for fair benefits and hours. ✊ https://t.co/8L23vfTJSr"
2021-11-06 21:05:41+00:00,"This is it.
 
When President Biden signs the bipartisan infrastructure bill, we will deliver a historic win for Ohio communities - 
 
Infrastructure. Jobs. Clean water. 
https://t.co/ijBkt25D6P"
2021-11-05 19:15:04+00:00,"More than half a million jobs created. Wages are up nearly 5%.

This is what it means to put workers at the center of our economic recovery.
https://t.co/HXcO5EKXUM"
2021-11-04 15:56:04+00:00,"Happy #Diwali.

Wishing all Ohioans and Americans who observe a safe and joyous Festival of Lights. https://t.co/snhIRj3nzt"
2021-11-03 21:56:49+00:00,"@RepCasten @RepAndyLevin 🙌 Glad to have you on board, @RepCasten."
2021-11-03 19:30:00+00:00,"OHIO PARENTS – Children ages 5 to 11 can now get a COVID-19 vaccine. 

It’s the best way to protect your children and your family.

Find a provider near you:
https://t.co/93GB2VrgtM"
2021-11-03 17:33:12+00:00,"Today, I will vote to pass the John Lewis Voting Rights Act.

Nothing is more important to our democracy than protecting every person's right to vote. https://t.co/98DMcAgBOC"
2021-11-01 19:00:00+00:00,"Any attempts to take away people's reproductive rights must be stopped.
 
Choice is a constitutionally-protected right."
2021-11-01 15:57:52+00:00,"If you need assistance signing up or have any questions, check here to find local help:
https://t.co/cD9PvsEgQz"
2021-11-01 15:57:23+00:00,"TODAY – ACA open enrollment is open through Jan 15

Thanks to Democrats passing the American Rescue Plan, millions more people are eligible for lower cost coverage.

Head to https://t.co/e3ChIsB3Sb to find quality, affordable health care and to see if a cheaper plan is available."
2021-11-01 15:52:15+00:00,"@JOtteWHIO A well-earned retirement for a legendary journalist. Thank you for all that you've done for Ohioans, Jim."
2021-10-29 20:15:04+00:00,"Did somebody say ""Happy Birthday""? 
 
Glad I could join you in Cleveland today on your birthday, @SecFudge – thank you for always fighting on the side of workers and families. https://t.co/zJl9c1hEkr"
2021-10-28 22:09:27+00:00,"I stand in solidarity with 10,000 @unitehere hospitality workers across the country fighting to save their jobs –
 
including workers at the HardRock Casino in Cincinnati, who are ratifying their contract today with @UHMWJB. ✊"
2021-10-28 18:27:47+00:00,"Together, the #BuildBackBetter framework and the Bipartisan Infrastructure Plan will invest in workers and rebuild our middle class.

Let's get this done."
2021-10-28 16:42:23+00:00,"The @CFPB empowers people to stand up to big banks and powerful corporations.
 
No wonder my Republican colleagues keep attacking it. https://t.co/OIlSgEpvw8"
2021-10-27 23:05:35+00:00,This is what the most pro-union Administration in a generation looks like. @SecMartyWalsh
2021-10-27 17:43:01+00:00,"Members of Congress and Federal Reserve officials should be BANNED from trading stocks.

Retweet if you agree."
2021-10-27 14:50:49+00:00,"Going LIVE with @gillibrandny at 12:45PM to talk about our twin bills banning Members of Congress and Federal Reserve officials from trading stocks.

Tune in right here on Facebook ➡️ https://t.co/uV9wiNXax3"
2021-10-25 17:52:50+00:00,"Great to join you this morning, @SecMartyWalsh.

The #BuildBackBetter agenda is all about putting workers - not Wall Street - at the center of our economy."
2021-10-25 14:33:59+00:00,"Hard work should pay off for everyone - whether you’re on salary, working for tips, or raising children.
 
That’s the Dignity of Work."
2021-10-24 13:52:18+00:00,"It's #WorldPolioDay.
 
Before the polio vaccine, more than 15,000 American children were paralyzed every year from polio. Parents lived in fear.
 
Now, thanks to a successful mass vaccination program, the U.S. is completely polio-free.
 
History is clear – vaccines work."
2021-10-20 22:52:53+00:00,"Say it with me:
 
Housing IS infrastructure – period. https://t.co/yVUnVp6B76"
2021-10-20 18:20:30+00:00,"I’m live now with @RepMaxineWaters and housing advocates to make one thing clear:

We MUST invest in housing in the #BuildBackBetter package. #HousingIsInfrastructure https://t.co/dAtqvLDry2"
2021-10-19 21:44:59+00:00,"Reality check:

Parents are going back to work – not leaving it – because of the Child Tax Credit.

When parents can afford child care, they can afford to go back to work.

That's exactly what the Child Tax Credit is doing. https://t.co/SB4LDMemjM"
2021-10-18 19:48:46+00:00,"Today, Lake County's transit agency @Laketran launched Ohio's first-ever majority electric bus fleet – a model for the entire country.

With the Bipartisan Infrastructure Plan, I'm working to get Laketran the resources they need to expand this fleet and expand services. https://t.co/YqEEiad1xh"
2021-10-18 16:51:35+00:00,"Secretary Colin Powell lived his life in service to our country – as a veteran, as a statesman, and through his work with America's Promise.

Sending my condolences to his wife Alma and his family.
https://t.co/rpWvi3rDrs"
2021-10-15 19:00:00+00:00,"The data is clear – the #ChildTaxCredit payments are helping Ohio families keep up with the cost of raising children.

We can't let it expire.
https://t.co/aAvCFrTmHW"
2021-10-15 17:00:11+00:00,"Parents – check your bank accounts TODAY for another round of #ChildTaxCredit payments, thanks to the American Rescue Plan."
2021-10-15 14:19:18+00:00,"A pleasure to talk with workers at @AkronZoo – and meet Thistle the tenrec.
 
The American Rescue Plan's investments in the Paycheck Protection Program helped Akron Zoo keep its workers and survive the pandemic without a single layoff."
2021-10-13 20:26:39+00:00,"Here are some of my staff's picks for #HispanicHeritageMonth from around the state:

📍Katalina's in Columbus
📍De Los Angeles Bakery &amp; Taqueria in Amherst
📍El Camino in Athens"
2021-10-13 20:26:39+00:00,"As we recognize #HispanicHeritageMonth, I want to hear about your favorite Latino-owned small businesses in Ohio.

Let's get this thread going 🧵"
2021-10-13 16:57:52+00:00,"Pictured behind me is West Main Street in Norwalk, Ohio. For years, the city has been fixing the 118-year-old cast-iron water line that runs below it.

Now, thanks to the American Rescue Plan, Norwalk can use nearly $800,000 in funds to fully replace the line for its residents. https://t.co/HwojMbXtiP"
2021-10-12 20:10:24+00:00,"The American Rescue Plan we passed this spring was a lifeline for venues and arts organizations like Dayton Performing Arts Alliance.

With funds from the Rescue Plan's Shuttered Venue Operator Grants, @DPAA_org  was able to reopen for its new season last week. https://t.co/VkepdCWiOS"
2021-10-12 16:02:04+00:00,"Read more about how the American Energy Worker Opportunity Act, my bill with @SenBobCasey and @SenWhitehouse, will #EmpowerEnergyWorkers.👇
https://t.co/cUqoG1EF7Q"
2021-10-12 16:02:04+00:00,"Glad to receive @IrontonTribune's support for our bill to #EmpowerEnergyWorkers:

""It is imperative that regions that have had their economies centered around coal be prepared and given resources[...]

One of these is Appalachia."" https://t.co/UZBlmaPHcG"
2021-10-08 20:06:45+00:00,"False. Instead of listening to conservative academics using extreme hypotheticals, try listening to the REAL hardworking Ohio parents who are using this tax cut to afford child care and go to work."
2021-10-07 19:27:56+00:00,"@SenWhitehouse @SenBobCasey Proud to work with you on this bill, Senator. 🙌🙌"
2021-10-07 18:42:10+00:00,"A great breakdown of our new bill to #EmpowerEnergyWorkers👇 Thanks, @SenBobCasey."
2021-10-07 17:38:29+00:00,@SenatorBaldwin @SenBobCasey @SenWhitehouse 🙌🙌
2021-10-07 17:24:49+00:00,"The American Energy Worker Opportunity Act would provide eligible workers with wage supplements, health care benefits, and education and training funds as we grow the renewable energy sector.

Read more about our bill to #EmpowerEnergyWorkers here ⤵
https://t.co/cUqoG1EF7Q"
2021-10-07 17:23:55+00:00,"America's energy sector is changing – we can’t leave workers behind.
 
I’m introducing legislation with my colleagues to #EmpowerEnergyWorkers as we transition toward renewable energy. https://t.co/93em0mhcYA"
2021-10-07 13:21:27+00:00,"“Now, for a limited period of time, borrowers may receive credit for past payments made on loans that would otherwise not qualify for PSLF.""
 
For more information, read this thread from @usedgov:
https://t.co/m9aGbVGTSR"
2021-10-06 21:28:28+00:00,"Before today, I thought we'd rightly relegated red scare McCarthyism to the dustbin of history.

OCC nominee Saule Omarova is an American citizen who fled communist repression –

This is nothing more than character assassination.
https://t.co/1LBJuLvFfH"
2021-10-01 17:22:55+00:00,We should be rewarding – not punishing – these workers who want to earn a little additional income to provide for themselves and their families. My SSI Restoration Act will allow Ohioans to work and save for the future without facing penalties. #DemolishDisabledPoverty
